statement,statement_r,hash,behavior,everyday,figure_of_speech,judgment,opinion,reasoning,awareness,consensus,commonsensicality
Rainfall influences regional climates.,Rainfall influences regional climates.,5d4ceb35d1,0,1,0,0,0,0,0.9998013585511182,0.9991864593768831,0.9994938616774439
Rainforests play a key role in carbon sequestration.,Rainforests play a key role in carbon sequestration.,aa1c104d90,0,1,0,0,0,0,0.999996975248929,0.9999808597155901,0.9999889174497955
Ramadan is a holy month in Islam.,Ramadan is a holy month in Islam.,2ccecb74c7,1,1,0,1,0,0,0.999999991504041,0.9999999802221958,0.9999999858631184
Rational critique drives improvement.,Rational critique drives improvement.,faaf2d6c88,1,0,0,1,1,0,0.9999990729720645,0.9999957291969377,0.9999974010831035
Rational debate fosters progress.,Rational debate fosters progress.,6e49f749ac,1,0,0,1,1,0,0.9999998796369334,0.99999925784424,0.9999995687405384
Rational discourse resolves dilemmas.,Rational discourse resolves dilemmas.,85dc971228,1,0,0,1,1,0,0.9162867241821667,0.9102024102522834,0.9132395002587095
Rational exploration seeks truth.,Rational exploration seeks truth.,774cebe0bf,1,0,0,1,1,0,0.998984471670541,0.9999331954413619,0.9994587209854267
Rational methods solve issues.,Rational methods solve issues.,c97610e99c,1,1,0,1,1,0,0.9982478557584344,0.9982784826209837,0.9982631690722544
Rational models explain patterns.,Rational models explain patterns.,35cb1d53d5,0,1,0,1,0,0,0.9841336697214913,0.9998397517966159,0.9919556260584587
Rational review enhances policies.,Rational review enhances policies.,f840b21b71,1,1,0,1,1,0,0.9972838775523085,0.999660784887629,0.9984716239281509
Read books to expand knowledge.,Read books to expand knowledge.,447256e11f,1,1,0,1,1,0,0.9999999873138119,0.9999998710325243,0.9999999291731664
Reading bedtime stories strengthens family bonds.,Reading bedtime stories strengthens family bonds.,3b2a47b77e,1,1,0,1,1,0,0.9999999970495004,0.9999999113620259,0.9999999542057623
Reading before bed aids sleep.,Reading before bed aids sleep.,85d5aefc82,0,1,0,1,0,0,0.9999997931558269,0.9999937860212438,0.9999967895840246
Reading expands the mind.,Reading expands the mind.,a8fa1ddac7,0,1,0,1,1,0,0.9999999236293915,0.9999996906231092,0.9999998071262436
Reading inspires imagination.,Reading inspires imagination.,e91bd15f02,1,1,0,1,1,0,0.9999999999999992,0.9999999217772733,0.9999999608886355
Reading sacred texts offers wisdom.,Reading sacred texts offers wisdom.,0d9a9a4c30,1,0,0,1,1,0,0.9997764556295169,0.9999721511973251,0.9998742986257247
Reasoned negotiations achieve fair agreements.,Reasoned negotiations achieve fair agreements.,9798239179,1,1,0,1,1,0,0.9989256136842349,0.9974962366514504,0.9982106693202417
Recognizing biases refines judgment.,Recognizing biases refines judgment.,fd06ed7f81,1,0,0,1,1,1,0.9999946771006007,0.9999996027522594,0.9999971399233973
Recognizing patterns aids logical deduction.,Recognizing patterns aids logical deduction.,4219b08409,0,1,0,1,0,0,0.9999998745402753,0.9999994220085338,0.9999996482743789
Recycle to protect the planet.,Recycle to protect the planet.,9ac9ed5d81,0,1,0,0,1,0,0.9999995161435146,0.9999993450498852,0.9999994305966962
Recycling protects the environment.,Recycling protects the environment.,245b893958,0,1,0,0,0,0,0.999999877399445,0.9999996494300706,0.9999997634147513
Reflection deepens understanding.,Reflection deepens understanding.,5b1e2996ed,0,0,0,1,1,0,0.9999999498252836,0.9999994899243083,0.9999997198747695
Regular check-ups are important.,Regular check-ups are important.,0f4f48a71f,0,1,0,1,0,0,0.9999999711563976,0.9999998710325216,0.9999999210944583
Regular exercise releases endorphins.,Regular exercise releases endorphins.,c82563075c,0,1,0,0,0,0,0.9999985064230322,0.9999897549104249,0.9999941306571549
Regular flossing prevents gum disease.,Regular flossing prevents gum disease.,1e918032c4,0,1,0,0,0,0,0.999993771575538,0.9999721512155733,0.9999829613371246
Regular flossing supports dental health.,Regular flossing supports dental health.,c2a5d1b93d,0,1,0,0,0,0,0.9999999908424896,0.9999998710325225,0.9999999309375043
Regular physical exams detect issues early.,Regular physical exams detect issues early.,92156c2ed8,0,1,0,1,0,0,0.9999998673632106,0.9999999525555109,0.9999999099593598
Regularly updating passwords enhances security.,Regularly updating passwords enhances security.,c00782db2e,0,1,0,1,0,0,0.9999999473022079,0.9999992578441428,0.9999996025731159
Relational databases organize data efficiently.,Relational databases organize data efficiently.,5f96f18b6c,0,1,0,0,0,0,0.9998727657603027,0.9998751962152972,0.9998739809870615
Reliability builds trust.,Reliability builds trust.,5e56e4c944,1,1,0,1,1,0,0.9999999980146618,0.9999999825461506,0.9999999902804062
Reliable data builds strong arguments.,Reliable data builds strong arguments.,1c48b622a8,1,0,0,1,1,0,0.9999994754119119,0.9999977140023691,0.9999985947067527
Reliable friends are invaluable.,Reliable friends are invaluable.,4800555d4a,1,1,0,1,1,0,0.9999999331233176,0.9999996906236857,0.9999998118734943
Reliable sources provide accurate data.,Reliable sources provide accurate data.,20e64b12b5,0,1,0,0,0,0,0.9999906832297522,0.9999410449412137,0.9999658637774774
Religious teachings encourage kindness.,Religious teachings encourage kindness.,b872891132,1,1,0,1,1,0,0.9999994106777734,0.999999422008532,0.9999994163431527
Religious vows often involve lifelong commitments.,Religious vows often involve lifelong commitments.,8eb629bf5a,1,1,0,1,1,0,0.9999999342548579,0.9999991590280471,0.9999995466413774
Reliving happy memories boosts morale.,Reliving happy memories boosts morale.,bfd18701f7,1,1,0,1,1,0,0.9999999849018191,0.9999997873685775,0.9999998861351934
Renaissance art emphasized realism and humanism.,Renaissance art emphasized realism and humanism.,d46e363128,1,1,0,1,1,0,0.9999984830402084,0.9999998538607011,0.9999991684502199
Renewable energies are eco-friendly alternatives.,Renewable energies are eco-friendly alternatives.,2d9819110e,0,1,0,0,0,0,0.9999999758136349,0.9999996906231363,0.9999998332183754
Respect others’ opinions.,Respect others’ opinions.,65d5516a1c,1,1,0,1,1,0,0.9999992151358521,0.9999920211044642,0.9999956181136889
Responding promptly is courteous.,Responding promptly is courteous.,0622508895,1,1,0,1,1,1,0.9999996541256276,0.9999998123534163,0.9999997332395189
Responsible pet ownership enhances animal welfare.,Responsible pet ownership enhances animal welfare.,fc6790150e,1,1,0,1,1,1,0.9999999609236797,0.9999997590574824,0.999999859990576
Resting is like recharging your life battery.,Resting is like recharging your life battery.,3b8255419d,0,1,0,1,1,0,0.9999998647157801,0.9999993450498332,0.9999996048827728
Revisiting educational content solidifies knowledge.,Revisiting educational content solidifies knowledge.,b561b50082,1,0,0,1,1,0,0.9999999288644034,0.9999998344024827,0.9999998816334419
Riding a bike is good exercise.,Riding a bike is good exercise.,0cce53de5e,0,1,0,1,0,0,0.9999999759101482,0.9999999673919138,0.9999999716510309
Rigorous methods enhance studies.,Rigorous methods enhance studies.,755d0c0662,0,1,0,1,0,0,0.9999995037983824,0.9999957291969825,0.9999976164959016
Rio de Janeiro is famous for its carnival.,Rio de Janeiro is famous for its carnival.,f707943465,0,1,0,1,0,0,0.9999999944945528,0.999999967391916,0.9999999809432343
Rivers carve valleys.,Rivers carve valleys.,6b08cb9275,0,1,0,0,0,0,0.9999989415469865,0.999985093511958,0.999992017505501
Rivers flow to the sea.,Rivers flow to the sea.,567a165139,0,1,0,0,0,0,0.9999365092076353,0.9997358091649082,0.9998361541503833
Rivers nourish surrounding ecosystems.,Rivers nourish surrounding ecosystems.,a5681668c5,0,1,0,0,0,0,0.9999999372228767,0.9999996027522452,0.999999769987547
Robotics automates complex tasks.,Robotics automates complex tasks.,ce4c23733f,0,1,0,1,0,0,0.9999985455608689,0.9999987763922559,0.9999986609765558
Romania's Carpathian Mountains are mystical.,Romania's Carpathian Mountains are mystical.,7dc0a5b0d0,0,1,0,0,1,0,0.9941978305443366,0.9764954978131322,0.9853069092735156
Rome is rich with ancient history.,Rome is rich with ancient history.,63d26aac2b,1,0,0,1,1,0,0.9999999159181635,0.9999998861865952,0.9999999010523792
Rosa Parks' actions sparked the Montgomery Bus Boycott.,Rosa Parks' actions sparked the Montgomery Bus Boycott.,3a86b7968b,0,1,0,1,1,0,0.999999932716807,0.9999994899243274,0.9999997113205427
Running clears your mental fog.,Running clears your mental fog.,0a69abe2fc,0,1,0,1,0,0,0.9999821378445128,0.9998184170042917,0.9999002740735039
Russia's Siberian wilderness is immense.,Russia's Siberian wilderness is immense.,1ae8370f0b,0,1,0,0,1,0,0.9999998509956837,0.999999257843569,0.9999995544195823
Safety first.,Safety first.,1357ff9751,1,1,0,1,1,0,0.9999997344023059,0.9999987763922279,0.9999992553971522
Safety protocols prevent accidents.,Safety protocols prevent accidents.,c83d697dc5,0,1,0,1,0,0,0.9999994506597046,0.9999977140021622,0.9999985823305564
Salvador Dalí was known for his surrealist works.,Salvador Dalí was known for his surrealist works.,bef6152b05,1,0,0,1,1,0,0.9999999938847287,0.9999999217772728,0.999999957831
Sand dunes are windy.,Sand dunes are windy.,9cdde1fad9,0,1,0,0,0,0,0.9999999994854453,0.9967862444662394,0.9983918288694766
Save for a rainy day.,Save for a rainy day.,81e1d7c7f7,0,1,0,1,1,0,0.9999998839554644,0.9999998861866045,0.9999998850710344
Saving money ensures financial security.,Saving money ensures financial security.,aa49e9a0dd,1,1,0,1,0,0,0.9999988111573639,0.9999929586408023,0.9999958848948016
Saying good morning builds rapport.,Saying good morning builds rapport.,0e68f17355,1,1,0,1,1,1,0.9999983841566672,0.999999422008524,0.999998903082461
Saying sorry mends relationships.,Saying sorry mends relationships.,39924058fb,1,1,0,1,1,1,0.9993013125839015,0.9947069399926539,0.9970014798238643
Scalars measure magnitude only.,Scalars measure magnitude only.,7c8a172ec7,0,1,0,0,0,0,0.6793182263831976,0.999440789980816,0.8239771506691128
Scenic drives relax the mind.,Scenic drives relax the mind.,11bf73c8ed,0,1,0,1,1,0,0.9999990180046067,0.9999977140002855,0.9999983660022336
Science builds on empirical facts.,Science builds on empirical facts.,4e3a02a3ac,1,0,0,1,0,0,0.999997156340357,0.999998219662933,0.9999976880015037
Scotland has iconic castles.,Scotland has iconic castles.,6309d92bc7,0,1,0,1,0,0,0.9999960471263794,0.9999831087473137,0.9999895779159211
Sculpting requires precision and skill.,Sculpting requires precision and skill.,fbd257b400,0,1,0,1,0,0,0.9999998178594498,0.9999999864069276,0.9999999021331851
Sculptors shape materials into forms.,Sculptors shape materials into forms.,40191449ec,0,1,0,0,0,0,0.999999989917621,0.9999999113620406,0.99999995063983
Sculpture can memorialize history.,Sculpture can memorialize history.,2c3e359579,0,0,0,1,1,0,0.9999999620721292,0.9999999390800753,0.9999999505761021
Self-driving cars rely on advanced sensor technology.,Self-driving cars rely on advanced sensor technology.,f35ad558b0,0,1,0,0,0,0,0.9999999883304185,0.9999999462383599,0.999999967284389
Sequences follow specific patterns.,Sequences follow specific patterns.,b674381987,0,1,0,0,0,0,0.9999362082965023,0.9999909587370183,0.9999635831420453
Serbia’s Danube River vistas are expansive.,Serbia’s Danube River vistas are expansive.,f183a156ac,0,1,0,0,0,0,0.9638408049264654,0.8562589103134945,0.9084587372809052
Set operations explore relationships between groups.,Set operations explore relationships between groups.,5ba66f7393,1,1,0,1,0,0,0.6249321548093837,0.9901339738290378,0.7866171608952849
Setting intentions directs focus.,Setting intentions directs focus.,f89192ca32,1,0,0,1,1,0,0.9999909377144576,0.999995729196558,0.999993333452638
Shakespeare wrote timeless plays and sonnets.,Shakespeare wrote timeless plays and sonnets.,5cf7868aaf,1,1,0,1,1,0,0.9999996401506293,0.9999979826119666,0.9999988113809545
Shakespeare's works are timeless treasures.,Shakespeare's works are timeless treasures.,ce6925f6a7,1,0,0,1,1,0,0.9999952980724908,0.9999721511929575,0.9999837245657508
Shamanic journeys often involve trance states.,Shamanic journeys often involve trance states.,f7b05d6bd0,0,1,0,1,1,0,0.9978220724293774,0.9999808597344526,0.9989008828957666
Shamanism involves communication with spirits.,Shamanism involves communication with spirits.,c2164ce28a,1,1,0,1,1,0,0.9999995626492394,0.9999991590273695,0.9999993608382841
Shared experiences build bonds.,Shared experiences build bonds.,1b775d587b,1,1,0,1,1,1,0.9999999763066609,0.9999998995602105,0.999999937933435
Shared experiences create memories.,Shared experiences create memories.,7bf5bc90f7,1,1,0,1,1,1,0.9999997136538897,0.9999987763932044,0.9999992450234373
Shared goals promote unity.,Shared goals promote unity.,2d95d917be,1,1,0,1,1,0,0.9999999335630563,0.9999997269763967,0.9999998302697212
Sharing is caring.,Sharing is caring.,596f33db6e,1,1,0,1,1,0,0.9999997931530006,0.99999295864061,0.9999963758909665
Sharing meals connects people.,Sharing meals connects people.,1840550ca3,1,1,0,1,1,0,0.99999998705397,0.999999834402481,0.9999999107282226
Sharing meals creates bonds.,Sharing meals creates bonds.,f149b4408f,1,1,0,1,1,0,0.9999998366205235,0.9999992578442667,0.9999995472323532
Sharing spreads joy.,Sharing spreads joy.,fc89c1d637,1,1,0,1,1,1,0.9999977853535058,0.9999897549107042,0.999993770124044
Sharing strengthens community ties.,Sharing strengthens community ties.,d30bde1700,1,1,0,1,1,0,0.9999999009052267,0.9999995498593144,0.9999997253822551
Shelves should be dusted regularly to maintain cleanliness.,Shelves should be dusted regularly to maintain cleanliness.,a1f4555f9d,0,1,0,1,0,0,0.9999999762990848,0.9999997590570476,0.9999998676780603
Shinto shrines are found throughout Japan.,Shinto shrines are found throughout Japan.,2826f6ca35,0,1,0,1,0,0,0.9999696296359695,0.9999966738941741,0.9999831516736463
"Shintoism focuses on kami, or spiritual beings.","Shintoism focuses on kami, or spiritual beings.",2f66e4db56,1,1,0,1,1,0,0.9999961312862623,0.9999937860206078,0.9999949586527476
Shintoism involves purification rituals.,Shintoism involves purification rituals.,9cc06bf321,1,1,0,1,0,0,0.8670368709404773,0.9999957291964021,0.9311461582352629
Shooting for the stars; aiming high.,Shooting for the stars; aiming high.,f5a7b12829,0,0,0,1,1,0,0.9999493944408188,0.9995644602700328,0.9997569088291328
Short summaries aid comprehension.,Short summaries aid comprehension.,bc20c85a54,1,1,0,1,0,0,0.9999999752957676,0.9999992578442805,0.9999996165699596
Show gratitude often.,Show gratitude often.,504ca10089,1,1,0,1,1,0,0.9999994400478747,0.9999974096232151,0.9999984248350295
Showering daily promotes hygiene.,Showering daily promotes hygiene.,cff3ade64d,0,1,0,0,0,0,0.9999975160651811,0.9999897549100274,0.9999936354800747
Sikhism emphasizes service and equality.,Sikhism emphasizes service and equality.,5f80e8904d,1,1,0,1,1,0,0.9999997216236564,0.9999997269758389,0.9999997242997477
Sikhs are known for their distinct turbans.,Sikhs are known for their distinct turbans.,f175b74698,0,1,0,0,0,0,0.9999996661181888,0.9999970647215363,0.9999983654190167
Silence is golden.,Silence is golden.,20cc041331,1,0,0,1,1,0,0.9983344570426056,0.9989555117233464,0.9986449361039414
Silence speaks volumes.,Silence speaks volumes.,0cc7aa5335,1,1,0,1,1,0,0.9999960141864751,0.9999754234730017,0.9999857187767405
Simple living brings contentment.,Simple living brings contentment.,08a9ad7818,1,0,0,1,1,0,0.993416050921176,0.9995644601432623,0.9964855135106967
Singing boosts mood.,Singing boosts mood.,9e102ea541,0,1,0,1,1,0,0.9999999999996876,0.9999984288566898,0.9999992144278801
Singing releases stress.,Singing releases stress.,d41cfe2b67,0,1,0,1,1,0,0.9999912156966698,0.9999831087649514,0.9999871622225952
Sketching improves observation skills.,Sketching improves observation skills.,4940f98fca,0,1,0,1,0,0,0.9999993129707183,0.9999994220085031,0.9999993674896093
Sleep restores mental clarity.,Sleep restores mental clarity.,363f6558e5,0,1,0,1,0,0,0.9999999738306002,0.9999998344024814,0.9999999041165384
Slow and steady wins the race.,Slow and steady wins the race.,fb0be48404,1,0,0,1,1,0,0.9999996563676805,0.9999937860210528,0.999996721190059
Small talk builds connections.,Small talk builds connections.,c51cd294dd,1,1,0,1,1,1,0.9999997452724063,0.9999999390800789,0.9999998421762379
Smart grids optimize energy distribution.,Smart grids optimize energy distribution.,6f0c408942,0,1,0,0,0,0,0.9997413711416301,0.9999897549104537,0.9998655553131929
Smart home devices offer convenience.,Smart home devices offer convenience.,daf0c2ceb0,0,1,0,1,0,0,0.999999803162823,0.9999998344024841,0.9999998187826534
Smartphones revolutionized communication.,Smartphones revolutionized communication.,b877d8da34,0,1,0,1,0,0,0.9999998613724386,0.999999345049887,0.9999996032111295
Smiles often signal friendliness.,Smiles often signal friendliness.,f9293e0e7f,1,1,0,1,1,1,0.9999999918479786,0.9999999673919147,0.9999999796199466
Smiling boosts immune function.,Smiling boosts immune function.,e5d38570c3,0,1,0,1,0,0,0.9472229721102098,0.7977942306044654,0.8693037571790081
Snow falls in winter.,Snow falls in winter.,52a8c8c05d,0,1,0,0,0,0,0.9999971481258305,0.9999945161813703,0.9999958321527345
Snowfall creates a serene atmosphere.,Snowfall creates a serene atmosphere.,bf4d2485f9,0,1,0,0,0,0,0.9999793827474989,0.9998585800708422,0.9999189795848619
Snowflakes are unique crystals.,Snowflakes are unique crystals.,7701033bcd,0,1,0,0,0,0,0.9999981172189074,0.9999883907981989,0.9999932539967277
Social dancing combines exercise and socialization.,Social dancing combines exercise and socialization.,5fff4b5ef5,0,1,0,1,0,0,0.9999999758136282,0.9999996906230981,0.999999833218353
Social equity promotes fairness.,Social equity promotes fairness.,64f2fef1f3,1,0,0,1,1,0,0.9999964825275738,0.9999783112720833,0.9999873968585536
Social interactions enrich life.,Social interactions enrich life.,123dfa1ed7,1,1,0,1,1,0,0.9999998918282684,0.9999995498592753,0.9999997208437573
Social norms guide behavior.,Social norms guide behavior.,7734ec8770,1,1,0,1,1,0,0.9999999790840152,0.9999998710325203,0.9999999250582663
Socialization develops interpersonal skills.,Socialization develops interpersonal skills.,cdfe2ca617,1,1,0,1,0,0,0.9999999137731527,0.9999992578448893,0.9999995858089672
Societal progress relies on equitable distribution of resources.,Societal progress relies on equitable distribution of resources.,76e2310177,0,0,0,1,1,0,0.9991290133429097,0.9998397518758635,0.9994843194331521
Society values punctuality.,Society values punctuality.,f3e7f5a086,1,1,0,1,1,0,0.9999979292189821,0.9999966738907888,0.9999973015546885
Socrates developed the Socratic method.,Socrates developed the Socratic method.,65c484f46f,1,1,0,1,1,0,0.9996662041222962,0.9999937860209018,0.9998299816555806
Socrates' method involves asking probing questions.,Socrates' method involves asking probing questions.,4495c45e12,1,1,0,1,1,0,0.9999788609632037,0.9999987763922963,0.9999888186281713
Socratic questioning promotes deep understanding.,Socratic questioning promotes deep understanding.,6b3266e564,1,0,0,1,1,0,0.999993307707932,0.9999989201699384,0.9999961139349978
Soft fabrics feel comforting.,Soft fabrics feel comforting.,42f7eb8b0d,0,1,0,1,1,0,0.999999327712942,0.99999623102495,0.9999977793677474
Soft lighting creates a calming ambiance.,Soft lighting creates a calming ambiance.,b7150badf5,0,1,0,1,0,0,0.999999968279401,0.9999990470531693,0.9999995076661791
Solar energy is sustainable.,Solar energy is sustainable.,de82c0c8c1,0,1,0,0,0,0,0.9999999022921616,0.9999970647216895,0.999998483505919
Spain's Costa del Sol has golden beaches.,Spain's Costa del Sol has golden beaches.,5ef7c5b0b0,0,1,0,0,0,0,0.9992103119960151,0.9932086171732937,0.996204944899822
"Spare the rod, spoil the child.","Spare the rod, spoil the child.",53aef8e8dd,1,0,0,1,1,1,0.9999693041520331,0.9998585800450832,0.9999139405659477
Spending time outdoors lifts the spirits.,Spending time outdoors lifts the spirits.,b9a86e2928,0,1,0,1,1,0,0.9999996755270546,0.9999986134707287,0.9999991444987506
Spill the beans means reveal a secret.,Spill the beans means reveal a secret.,c4e6146402,1,0,0,1,1,1,0.9999999999999979,0.9999998344024872,0.9999999172012392
Springtime brings new growth.,Springtime brings new growth.,84ef5622f1,0,1,0,1,1,0,0.9999999919797088,0.9999997269758629,0.9999998594777771
Sputnik's launch began the space age.,Sputnik's launch began the space age.,f91e1ca320,0,1,0,0,0,0,0.9999819063951056,0.9999243009010865,0.9999531032332776
Sri Lanka is known for its tea plantations.,Sri Lanka is known for its tea plantations.,4404f036ef,0,1,0,0,0,0,0.7057921506531377,0.999972151197492,0.8401026694320894
Stargazing can be awe-inspiring.,Stargazing can be awe-inspiring.,f50cfe17dc,0,1,0,1,1,0,0.9999999690016391,0.9999999113620339,0.9999999401818361
Stars are born in nebulae.,Stars are born in nebulae.,00c40d2d3a,0,1,0,0,0,0,0.6224990381641896,0.9998397517927611,0.7889228630286461
Stars fill the night sky.,Stars fill the night sky.,3e5aab6605,0,1,0,1,0,0,0.9999999998783612,0.9995644600890192,0.9997822062666616
Staying active enhances longevity.,Staying active enhances longevity.,415b1a29ef,0,1,0,0,0,0,0.9999999830210491,0.9999994220085333,0.9999997025147518
Steer clear of negative influences.,Steer clear of negative influences.,32de268916,1,1,0,1,1,0,0.9999999431445745,0.999999422009088,0.9999996825767973
Stephen Hawking made significant contributions to theoretical physics.,Stephen Hawking made significant contributions to theoretical physics.,f93feb7580,0,1,0,1,0,0,0.9999999820140497,0.9999998861865934,0.9999999341003204
Stirred up a hornet's nest; created a commotion.,Stirred up a hornet's nest; created a commotion.,2d1318f0ef,0,0,0,1,0,0,0.9995758987794541,0.9967862450020298,0.9981800973466166
Stonehenge is an ancient wonder.,Stonehenge is an ancient wonder.,297e13ba21,0,0,0,0,0,0,0.999677657399895,0.9986590509722093,0.999168224383212
Stop and smell the roses.,Stop and smell the roses.,049aad1aa9,0,1,0,1,1,0,0.9999947633274179,0.9999992578434971,0.9999970105829324
Stories shape cultures.,Stories shape cultures.,f459728975,1,0,0,1,1,0,0.9999999663978235,0.9999999217772719,0.9999999440875474
Storytelling captures imagination.,Storytelling captures imagination.,8d7856b254,1,1,0,1,1,0,0.9999997979087857,0.9999991590272349,0.9999994784679593
Street art reflects urban life.,Street art reflects urban life.,0f1f519f31,0,1,0,1,1,0,0.9999996135569202,0.9999982196614071,0.9999989166089208
Stretching improves flexibility.,Stretching improves flexibility.,4c85acf009,0,1,0,0,0,0,0.9999999719521341,0.9999997873685673,0.9999998796603464
Stretching prevents muscle cramps.,Stretching prevents muscle cramps.,dd801a8b7a,0,1,0,0,0,0,0.9327491611881248,0.7480630970976274,0.8353174404581786
Strong friendships often weather storms.,Strong friendships often weather storms.,4386a27a15,1,1,0,1,1,1,0.9999999327168052,0.9999994899243101,0.9999997113205331
Structure in arguments aids comprehension.,Structure in arguments aids comprehension.,d2f4824948,1,1,0,1,0,0,0.9999995949652445,0.9999996027522332,0.9999995988587388
Structured analyses refine processes.,Structured analyses refine processes.,a8eef07363,0,1,0,1,0,0,0.5003355035908758,0.9986590512896134,0.7068695631745471
Structured frameworks guide learning.,Structured frameworks guide learning.,61db23d076,1,1,0,1,0,0,0.9999999999979359,0.9999920211124129,0.9999960105472165
Structured inquiry clarifies questions.,Structured inquiry clarifies questions.,0b74434367,1,1,0,1,1,0,0.9982313113212711,0.9958752956863962,0.9970526076017704
Structured planning anticipates needs.,Structured planning anticipates needs.,03224fe916,1,1,0,1,0,0,0.9999117868279699,0.9999684432329605,0.9999401146291976
Structured preparations ensure readiness.,Structured preparations ensure readiness.,0cb7d12b80,1,1,0,1,0,0,0.9999986847436281,0.9999982196612273,0.9999984522024006
Structured review enhances teaching.,Structured review enhances teaching.,bf135710cc,1,1,0,1,1,0,0.9999874947494587,0.9999142220893318,0.9999508577482519
Structured steps guide action.,Structured steps guide action.,661a938075,1,1,0,1,1,0,0.9999749422771657,0.9998751963239195,0.9999250680567925
Study habits influence academic success.,Study habits influence academic success.,7eddf511b1,1,1,0,1,1,0,0.9999999977021466,0.9999999309686868,0.9999999643354162
Sunlight boosts Vitamin D.,Sunlight boosts Vitamin D.,ed47b708c4,0,1,0,0,0,0,0.9999999548138312,0.9999996027529877,0.999999778783394
Sunscreen prevents sunburn.,Sunscreen prevents sunburn.,4d05a68e10,0,1,0,0,0,0,0.9999999780322771,0.9999996906231408,0.9999998343276986
Sunscreen protects against UV rays.,Sunscreen protects against UV rays.,232042b8f4,0,1,0,0,0,0,0.9999999938847293,0.9999999217772728,0.9999999578310004
Sweden’s archipelago is extensive.,Sweden’s archipelago is extensive.,6bbc920a08,0,1,0,0,0,0,0.6792635267962653,0.9996607846603462,0.8240346535117978
Swimming engages multiple muscle groups.,Swimming engages multiple muscle groups.,9f5df2f22c,0,1,0,0,0,0,0.9999999909118118,0.9999996906231172,0.9999998407674532
Symbolism adds depth to literature.,Symbolism adds depth to literature.,31f8135958,1,0,0,1,1,0,0.9999978079351973,0.9999997269758736,0.9999987674550751
Symmetry reflects balanced proportions.,Symmetry reflects balanced proportions.,cbb08f7888,0,0,0,0,0,0,0.9999994377381971,0.999983108763378,0.9999912732174578
Symphonies blend diverse instruments.,Symphonies blend diverse instruments.,f4dd3d8314,0,1,0,1,1,0,0.9999999511091273,0.9999996906231354,0.9999998208661228
Symphonies comprise multiple movements.,Symphonies comprise multiple movements.,613880b175,0,1,0,1,0,0,0.9999047290986204,0.9999966738909891,0.999950700438022
Symphonies create dynamic musical narratives.,Symphonies create dynamic musical narratives.,15b0ee929d,0,1,0,1,1,0,0.999912548146215,0.9999142220786581,0.9999133851120863
