statement,source
"Earth is the third planet from the Sun.

Getting sufficient sleep improves overall health.",gpt-4o design point
Earth revolves around the Sun once a year.,gpt-4o design point
Earth rotates on its axis once every 24 hours.,gpt-4o design point
Earth's atmosphere contains layers of gases.,gpt-4o design point
Earth's rotation causes day and night.,gpt-4o design point
Earthquakes are caused by tectonic plate movements.,gpt-4o design point
Earth’s crust is diverse.,gpt-4o design point
Earth’s gravity keeps us grounded.,gpt-4o design point
Earth’s gravity pulls objects toward its center.,gpt-4o design point
Easier said than done.,gpt-4o design point
Eat a balanced diet to stay healthy.,gpt-4o design point
Eat like a horse.,gpt-4o design point
Eat plenty of fruits and vegetables.,gpt-4o design point
Eat plenty of fruits to stay healthy.,gpt-4o design point
Eating a balanced breakfast kick-starts your day.,gpt-4o design point
Eating a balanced diet promotes health.,gpt-4o design point
Eating a balanced diet promotes overall health.,gpt-4o design point
Eating a balanced diet promotes overall wellness.,gpt-4o design point
Eating a balanced diet supports a healthy body.,gpt-4o design point
Eating a balanced diet supports general well-being.,gpt-4o design point
Eating a balanced diet supports good health.,gpt-4o design point
Eating a balanced diet supports health.,gpt-4o design point
Eating a balanced diet supports overall health.,gpt-4o design point
Eating a balanced diet supports overall well-being.,gpt-4o design point
Eating a balanced diet supports physical health.,gpt-4o design point
Eating a balanced diet supports physical well-being.,gpt-4o design point
Eating a balanced diet sustains energy levels.,gpt-4o design point
Eating a nutritious breakfast jump-starts your day.,gpt-4o design point
Eating a nutritious breakfast provides energy for the day.,gpt-4o design point
Eating a variety of foods ensures balanced nutrition.,gpt-4o design point
Eating a variety of foods ensures nutrient intake.,gpt-4o design point
Eating balanced meals promotes good health.,gpt-4o design point
Eating balanced meals supports a healthy body.,gpt-4o design point
Eating balanced meals supports overall health.,gpt-4o design point
Eating balanced meals sustains wellness.,gpt-4o design point
Eating breakfast boosts energy levels.,gpt-4o design point
Eating breakfast boosts metabolism.,gpt-4o design point
Eating breakfast boosts morning energy levels.,gpt-4o design point
Eating breakfast boosts morning energy.,gpt-4o design point
Eating breakfast is crucial for energy.,gpt-4o design point
Eating breakfast is essential for energy.,gpt-4o design point
Eating breakfast jump-starts metabolism and energy.,gpt-4o design point
Eating breakfast jump-starts your day.,gpt-4o design point
Eating breakfast jump-starts your metabolism.,gpt-4o design point
Eating breakfast jumpstarts metabolism and energy.,gpt-4o design point
Eating breakfast jumpstarts your metabolism.,gpt-4o design point
Eating breakfast kick-starts your day.,gpt-4o design point
Eating breakfast kick-starts your metabolism.,gpt-4o design point
Eating breakfast kickstarts metabolism.,gpt-4o design point
Eating breakfast maintains energy levels.,gpt-4o design point
Eating breakfast provides morning energy.,gpt-4o design point
Eating fish supports brain health.,gpt-4o design point
Eating fresh food supports overall health.,gpt-4o design point
Eating fresh fruit provides natural sugars and vitamins.,gpt-4o design point
Eating fresh fruit supports a balanced diet.,gpt-4o design point
Eating fresh fruit supports overall health.,gpt-4o design point
Eating fresh fruits and vegetables is essential for health.,gpt-4o design point
Eating fresh fruits and vegetables is healthy.,gpt-4o design point
Eating fresh fruits and vegetables promotes good health.,gpt-4o design point
Eating fresh fruits boosts immune function.,gpt-4o design point
Eating fresh fruits boosts immune system.,gpt-4o design point
Eating fresh fruits boosts your immune system.,gpt-4o design point
Eating fresh fruits is essential for health.,gpt-4o design point
Eating fresh fruits provides essential vitamins and minerals.,gpt-4o design point
Eating fresh fruits provides essential vitamins.,gpt-4o design point
Eating fresh fruits supplies essential vitamins.,gpt-4o design point
Eating fresh fruits supports immune function.,gpt-4o design point
Eating fresh fruits supports overall health.,gpt-4o design point
Eating fresh snacks promotes better health.,gpt-4o design point
Eating fresh vegetables supports overall health.,gpt-4o design point
Eating fresh vegetables supports overall well-being.,gpt-4o design point
Eating freshly prepared meals is more satisfying.,gpt-4o design point
Eating fruits and vegetables boosts immunity.,gpt-4o design point
Eating fruits and vegetables is essential for health.,gpt-4o design point
Eating fruits and vegetables provides essential nutrients.,gpt-4o design point
Eating fruits and vegetables supports overall health.,gpt-4o design point
Eating fruits boosts the immune system.,gpt-4o design point
Eating fruits keeps you healthy.,gpt-4o design point
Eating fruits provides essential vitamins.,gpt-4o design point
Eating home-cooked meals is healthier.,gpt-4o design point
Eating nuts provides healthy fats and protein.,gpt-4o design point
Eating slowly aids digestion.,gpt-4o design point
Eating slowly helps with digestion and fullness.,gpt-4o design point
Eating smaller meals more frequently can sustain energy.,gpt-4o design point
Eating vegetables aids digestion.,gpt-4o design point
Eating vegetables daily is important.,gpt-4o design point
Eating vegetables daily supports good health.,gpt-4o design point
Eating vegetables every day is important.,gpt-4o design point
Eating vegetables is crucial for health.,gpt-4o design point
Eating vegetables provides essential nutrients.,gpt-4o design point
Eating vegetables supports a balanced diet.,gpt-4o design point
Eating vegetables supports a healthy body.,gpt-4o design point
Eating vegetables supports good health.,gpt-4o design point
Eating vegetables supports physical well-being.,gpt-4o design point
Eating whole foods boosts energy levels.,gpt-4o design point
Eating whole foods boosts energy.,gpt-4o design point
Eating whole foods supports overall health.,gpt-4o design point
Eating whole foods supports overall wellness.,gpt-4o design point
Eating whole grains supports digestion.,gpt-4o design point
Ecosystems rely on balanced interactions.,gpt-4o design point
Ecuador's Galápagos Islands are unique.,gpt-4o design point
Educated guesses help make predictions.,gpt-4o design point
Educating oneself about other cultures fosters understanding.,gpt-4o design point
Education broadens horizons.,gpt-4o design point
Education broadens one's horizons.,gpt-4o design point
Education broadens perspectives.,gpt-4o design point
Education broadens your horizons.,gpt-4o design point
Education empowers individuals and communities.,gpt-4o design point
Education enriches the mind.,gpt-4o design point
Education expands individual potential.,gpt-4o design point
Education expands one’s horizons.,gpt-4o design point
Education fosters critical thinking.,gpt-4o design point
Education is the passport to the future.,gpt-4o design point
Education provides the foundation for future opportunities.,gpt-4o design point
Educational pursuits enrich the mind.,gpt-4o design point
Educational pursuits foster intellectual growth and critical thinking.,gpt-4o design point
Effective algorithms enhance computational efficiency.,gpt-4o design point
Effective collaboration requires clear goals.,gpt-4o design point
Effective communication bridges gaps.,gpt-4o design point
Effective communication builds connection.,gpt-4o design point
Effective communication builds rapport.,gpt-4o design point
Effective communication builds strong connections.,gpt-4o design point
Effective communication builds strong relationships.,gpt-4o design point
Effective communication builds strong teams.,gpt-4o design point
Effective communication builds stronger communities.,gpt-4o design point
Effective communication builds stronger connections.,gpt-4o design point
Effective communication builds stronger relationships.,gpt-4o design point
Effective communication builds trust and understanding in relationships.,gpt-4o design point
Effective communication builds trust and understanding.,gpt-4o design point
Effective communication builds trust in relationships.,gpt-4o design point
Effective communication builds trust.,gpt-4o design point
Effective communication enhances collaboration.,gpt-4o design point
Effective communication enhances mutual understanding.,gpt-4o design point
Effective communication fosters strong relationships.,gpt-4o design point
Effective communication fosters understanding.,gpt-4o design point
Effective communication improves health outcomes.,gpt-4o design point
Effective communication prevents conflicts.,gpt-4o design point
Effective communication prevents misunderstandings.,gpt-4o design point
Effective communication resolves conflicts.,gpt-4o design point
Effective communication strengthens friendships.,gpt-4o design point
Effective communication strengthens relationships.,gpt-4o design point
Effective discussions resolve conflicts.,gpt-4o design point
Effective evaluations improve practice.,gpt-4o design point
Effective governance ensures public trust and accountability.,gpt-4o design point
Effective listening builds trust.,gpt-4o design point
Effective listening promotes understanding.,gpt-4o design point
Effective listening strengthens relationships.,gpt-4o design point
Effective networking promotes career growth.,gpt-4o design point
Effective planning facilitates success.,gpt-4o design point
Effective planning guides success.,gpt-4o design point
Effective planning guides successful outcomes.,gpt-4o design point
Effective planning improves outcomes.,gpt-4o design point
Effective planning predicts success.,gpt-4o design point
Effective planning prevents issues.,gpt-4o design point
Effective planning prevents poor outcomes.,gpt-4o design point
Effective planning prevents poor performance.,gpt-4o design point
Effective planning prevents potential issues.,gpt-4o design point
Effective planning prevents problems.,gpt-4o design point
Effective planning yields successful outcomes.,gpt-4o design point
Effective policies shape technology adoption.,gpt-4o design point
Effective routines bolster productivity.,gpt-4o design point
Effective strategies lead to successful outcomes.,gpt-4o design point
Effective stress management enhances health.,gpt-4o design point
Effective study habits improve learning outcomes.,gpt-4o design point
Effective teamwork achieves better results.,gpt-4o design point
Effective teamwork achieves collective goals and shared success.,gpt-4o design point
Effective teamwork achieves collective goals.,gpt-4o design point
Effective teamwork achieves common goals.,gpt-4o design point
Effective teamwork achieves shared goals.,gpt-4o design point
Effective teamwork drives success.,gpt-4o design point
Effective teamwork leads to better outcomes.,gpt-4o design point
Effective teamwork meets collective goals.,gpt-4o design point
Effective teamwork promotes success.,gpt-4o design point
Effective teamwork reaches shared goals.,gpt-4o design point
Effective teamwork requires clear communication.,gpt-4o design point
Effectively managing time improves productivity.,gpt-4o design point
Efficiency drives technological progress.,gpt-4o design point
Efficient algorithms enhance problem-solving.,gpt-4o design point
Efficient algorithms enhance software performance.,gpt-4o design point
Efficient algorithms optimize performance.,gpt-4o design point
Efficient algorithms solve problems faster.,gpt-4o design point
Efficient time management reduces stress levels.,gpt-4o design point
Efficient workflows increase output.,gpt-4o design point
Egalitarian principles promote social harmony.,gpt-4o design point
Egypt is known for its ancient pyramids.,gpt-4o design point
Egypt is known for its pyramids.,gpt-4o design point
Egypt's Nile River supports rich agriculture.,gpt-4o design point
Egypt's Nile Valley is historically rich.,gpt-4o design point
Egypt's pyramids are ancient marvels.,gpt-4o design point
Egyptian pyramids are historic marvels.,gpt-4o design point
Einstein's theory of relativity is a cornerstone of modern physics.,gpt-4o design point
Either/or conditions lead to a true outcome if one is true.,gpt-4o design point
Electric cars reduce carbon emissions.,gpt-4o design point
Electric vehicles promote environmental sustainability.,gpt-4o design point
"Electric vehicles reduce carbon emissions.

Taking walks daily improves overall wellness.",gpt-4o design point
Electricity is a primary source of energy for modern civilization.,gpt-4o design point
Electricity powers modern conveniences.,gpt-4o design point
Electricity powers modern technology.,gpt-4o design point
Electricity powers our daily lives.,gpt-4o design point
Electrons carry a negative charge.,gpt-4o design point
Electrons orbit the nucleus of an atom.,gpt-4o design point
"Electrons orbit the nucleus of an atom.

Complimenting others can make their day.",gpt-4o design point
Embracing diversity enriches community life and promotes inclusivity.,gpt-4o design point
Embracing diversity enriches community life.,gpt-4o design point
Embracing diversity fosters social harmony.,gpt-4o design point
Emotional support fosters strong relationships.,gpt-4o design point
Emotional support improves mental well-being.,gpt-4o design point
Emotional support strengthens relationships.,gpt-4o design point
Empathetic listening fosters bonds.,gpt-4o design point
Empathy and communication foster strong relationships.,gpt-4o design point
Empathy bridges differences and connects us.,gpt-4o design point
Empathy bridges differences.,gpt-4o design point
Empathy bridges gaps between people.,gpt-4o design point
Empathy bridges gaps in human connections.,gpt-4o design point
Empathy bridges social differences.,gpt-4o design point
Empathy bridges social divides and deepens connections.,gpt-4o design point
Empathy bridges social divides.,gpt-4o design point
Empathy bridges social gaps and connects us.,gpt-4o design point
Empathy bridges social gaps.,gpt-4o design point
Empathy deepens connections.,gpt-4o design point
Empathy enhances emotional intelligence.,gpt-4o design point
Empathy enhances human connections.,gpt-4o design point
Empathy enhances interpersonal connections.,gpt-4o design point
Empathy enhances interpersonal relationships.,gpt-4o design point
Empathy fosters better interpersonal relationships.,gpt-4o design point
Empathy fosters connection.,gpt-4o design point
Empathy fosters deep connections.,gpt-4o design point
Empathy fosters deeper connections.,gpt-4o design point
Empathy fosters deeper social connections.,gpt-4o design point
Empathy fosters strong social connections.,gpt-4o design point
Empathy fosters understanding and connection.,gpt-4o design point
Empathy is crucial in human interactions.,gpt-4o design point
Empathy is the foundation of good relationships.,gpt-4o design point
Empathy nurtures compassion and understanding.,gpt-4o design point
Empathy nurtures deep connections.,gpt-4o design point
Empathy nurtures deeper connections.,gpt-4o design point
Empathy nurtures understanding.,gpt-4o design point
Empathy promotes social harmony.,gpt-4o design point
Empathy promotes understanding.,gpt-4o design point
Empathy strengthens bonds.,gpt-4o design point
Empathy strengthens social bonds and mutual understanding.,gpt-4o design point
Empathy strengthens social bonds.,gpt-4o design point
Empathy strengthens social connections.,gpt-4o design point
Empirical data informs sound conclusions.,gpt-4o design point
Empirical data supports scientific conclusions.,gpt-4o design point
Empirical data supports valid conclusions.,gpt-4o design point
Empirical evidence confirms scientific hypotheses.,gpt-4o design point
Empirical evidence substantiates scientific claims.,gpt-4o design point
Empirical evidence supports scientific hypotheses.,gpt-4o design point
Empirical evidence supports scientific theories.,gpt-4o design point
Empirical research validates scientific theories.,gpt-4o design point
Encourage others often.,gpt-4o design point
Encourage others to achieve their potential.,gpt-4o design point
Encourage others; it helps them succeed.,gpt-4o design point
Encouragement boosts morale and inspires continued effort.,gpt-4o design point
Encouragement boosts morale and motivation.,gpt-4o design point
Encouragement boosts morale and self-esteem.,gpt-4o design point
Encouragement boosts self-esteem and motivation.,gpt-4o design point
Encouragement boosts self-esteem.,gpt-4o design point
Encouragement breeds confidence and motivation.,gpt-4o design point
Encouragement builds confidence.,gpt-4o design point
Encouragement builds self-confidence.,gpt-4o design point
Encouragement builds self-esteem.,gpt-4o design point
Encouragement fosters a positive environment.,gpt-4o design point
Encouragement fosters creativity.,gpt-4o design point
Encouragement fosters perseverance.,gpt-4o design point
Encouragement fosters personal growth.,gpt-4o design point
Encouragement fosters positivity.,gpt-4o design point
Encouragement fosters resilience and perseverance.,gpt-4o design point
Encouragement fosters resilience.,gpt-4o design point
Encouragement fuels motivation.,gpt-4o design point
Encouragement fuels perseverance.,gpt-4o design point
Encouragement increases motivation and effort.,gpt-4o design point
Encouragement inspires action.,gpt-4o design point
Encouragement inspires confidence and action.,gpt-4o design point
Encouragement inspires confidence.,gpt-4o design point
Encouragement inspires perseverance.,gpt-4o design point
Encouragement is a powerful motivator.,gpt-4o design point
Encouragement is like a spark that can light a fire.,gpt-4o design point
Encouragement keeps the spirit alive.,gpt-4o design point
Encouragement lifts spirits and inspires actions.,gpt-4o design point
Encouragement motivates continued effort.,gpt-4o design point
Encouragement motivates continuous effort.,gpt-4o design point
Encouragement motivates others to succeed.,gpt-4o design point
Encouragement nurtures talent.,gpt-4o design point
Encouragement strengthens personal resolve.,gpt-4o design point
Encouragement strengthens relationships.,gpt-4o design point
Encouragement sustains motivation and perseverance.,gpt-4o design point
Encouraging children promotes confidence.,gpt-4o design point
Encouraging collaboration achieves great results.,gpt-4o design point
Encouraging collaboration achieves greater results.,gpt-4o design point
Encouraging collaboration achieves shared goals.,gpt-4o design point
Encouraging collaboration enhances teamwork.,gpt-4o design point
Encouraging collaboration fosters teamwork.,gpt-4o design point
Encouraging cooperation fosters teamwork.,gpt-4o design point
Encouraging creativity fosters innovation.,gpt-4o design point
Encouraging creativity promotes innovation.,gpt-4o design point
Encouraging creativity sparks innovation.,gpt-4o design point
Encouraging critical thinking enhances learning.,gpt-4o design point
Encouraging dialogue fosters cooperation.,gpt-4o design point
Encouraging effort fosters achievement.,gpt-4o design point
Encouraging effort leads to achievements.,gpt-4o design point
Encouraging efforts lead to remarkable achievements.,gpt-4o design point
Encouraging exercise supports a healthy lifestyle.,gpt-4o design point
Encouraging experimentation fosters innovation.,gpt-4o design point
Encouraging experimenting fosters innovation.,gpt-4o design point
Encouraging fitness challenges build camaraderie.,gpt-4o design point
Encouraging growth fosters long-term success.,gpt-4o design point
Encouraging lane swimming boosts cardiovascular fitness.,gpt-4o design point
Encouraging others boosts their confidence.,gpt-4o design point
Encouraging others brings fulfillment.,gpt-4o design point
Encouraging others brings out their best qualities.,gpt-4o design point
Encouraging others can boost their confidence.,gpt-4o design point
Encouraging others can uplift their spirits.,gpt-4o design point
Encouraging others creates a positive atmosphere.,gpt-4o design point
Encouraging others creates a positive environment.,gpt-4o design point
Encouraging others creates a supportive atmosphere.,gpt-4o design point
Encouraging others fosters a positive atmosphere.,gpt-4o design point
Encouraging others fosters a positive environment.,gpt-4o design point
Encouraging others fosters community spirit.,gpt-4o design point
Encouraging others fosters growth.,gpt-4o design point
Encouraging others fosters positivity.,gpt-4o design point
Encouraging others inspires confidence and action.,gpt-4o design point
Encouraging others inspires confidence.,gpt-4o design point
Encouraging others promotes positivity.,gpt-4o design point
Encouraging others spreads positivity.,gpt-4o design point
Encouraging others uplifts the soul.,gpt-4o design point
Encouraging participation builds communal strength.,gpt-4o design point
Encouraging participation builds community spirit.,gpt-4o design point
Encouraging participation builds community.,gpt-4o design point
Encouraging participation builds inclusiveness.,gpt-4o design point
Encouraging participation builds strong communities.,gpt-4o design point
Encouraging participation fosters engagement.,gpt-4o design point
Encouraging participation fosters inclusivity.,gpt-4o design point
Encouraging participation promotes inclusiveness and community spirit.,gpt-4o design point
Encouraging participation promotes inclusiveness.,gpt-4o design point
Encouraging participation promotes inclusivity.,gpt-4o design point
Encouraging physical activity promotes wellness.,gpt-4o design point
Encouraging positive behavior builds self-esteem.,gpt-4o design point
Encouraging positive behavior promotes social harmony.,gpt-4o design point
Encouraging positive behaviors fosters strong relationships.,gpt-4o design point
Encouraging positivity spreads joy.,gpt-4o design point
Encouraging progress fuels perseverance.,gpt-4o design point
Encouraging someone shows you care.,gpt-4o design point
Encouraging talents leads to personal growth.,gpt-4o design point
Encouraging teamwork achieves better results.,gpt-4o design point
Encouraging teamwork achieves collective goals.,gpt-4o design point
Encouraging teamwork achieves common goals.,gpt-4o design point
Encouraging teamwork achieves goals.,gpt-4o design point
Encouraging teamwork achieves shared goals.,gpt-4o design point
Encouraging teamwork fosters shared goals.,gpt-4o design point
Encouraging teamwork fosters shared success.,gpt-4o design point
Encouraging teamwork leads to better outcomes.,gpt-4o design point
Encouraging teamwork leads to better results.,gpt-4o design point
Encouraging teamwork leads to shared success.,gpt-4o design point
Encouraging teamwork promotes collective success.,gpt-4o design point
Encouraging teamwork promotes shared success.,gpt-4o design point
Encouraging transparency builds trust.,gpt-4o design point
Encouraging walks in nature boosts mental well-being.,gpt-4o design point
Encouraging words are like sunshine to the heart.,gpt-4o design point
Encouraging words boost confidence and morale.,gpt-4o design point
Encouraging words boost confidence.,gpt-4o design point
Encouraging words boost self-esteem and motivation.,gpt-4o design point
Encouraging words build confidence.,gpt-4o design point
Encouraging words build self-confidence.,gpt-4o design point
Encouraging words build self-esteem and confidence.,gpt-4o design point
Encouraging words build self-esteem.,gpt-4o design point
Encouraging words can boost someone's confidence.,gpt-4o design point
Encouraging words can boost someone’s confidence.,gpt-4o design point
Encouraging words can inspire action and confidence.,gpt-4o design point
Encouraging words can inspire confidence.,gpt-4o design point
Encouraging words can inspire greatness.,gpt-4o design point
Encouraging words can inspire hope.,gpt-4o design point
Encouraging words can inspire others.,gpt-4o design point
Encouraging words can lift someone's spirits.,gpt-4o design point
Encouraging words can lift spirits.,gpt-4o design point
Encouraging words can make a significant difference in someone's life.,gpt-4o design point
Encouraging words can make someone's day better.,gpt-4o design point
Encouraging words can motivate others.,gpt-4o design point
Encouraging words can spark motivation.,gpt-4o design point
Encouraging words can transform someone's day.,gpt-4o design point
Encouraging words can uplift and motivate.,gpt-4o design point
Encouraging words can uplift someone's day.,gpt-4o design point
Encouraging words can uplift someone's mood.,gpt-4o design point
Encouraging words can uplift someone’s mood.,gpt-4o design point
Encouraging words elevate spirits.,gpt-4o design point
Encouraging words foster growth.,gpt-4o design point
Encouraging words fuel positivity.,gpt-4o design point
Encouraging words inspire action and confidence.,gpt-4o design point
Encouraging words inspire action.,gpt-4o design point
Encouraging words inspire and motivate.,gpt-4o design point
Encouraging words inspire and uplift.,gpt-4o design point
Encouraging words inspire confidence and action.,gpt-4o design point
Encouraging words inspire confidence in others.,gpt-4o design point
Encouraging words inspire confidence.,gpt-4o design point
Encouraging words inspire continued effort.,gpt-4o design point
Encouraging words inspire continuous effort.,gpt-4o design point
Encouraging words inspire growth.,gpt-4o design point
Encouraging words inspire others to achieve.,gpt-4o design point
Encouraging words inspire perseverance.,gpt-4o design point
Encouraging words inspire positive actions.,gpt-4o design point
