statement,source
"""A cloud with a silver lining"" means finding the good in a bad situation.",gpt-4o design point
"""A friend in need is a friend indeed""; true friends shine in adversity.",gpt-4o design point
"""A hand up, not a handout""; Empowering others is more lasting.",gpt-4o design point
"""A healthy mind in a healthy body""; Mental and physical health are interconnected.",gpt-4o design point
"""A journey of a thousand miles begins with a single step"" implies starting is important.",gpt-4o design point
"""A penny saved is a penny earned""; Saving is essential.",gpt-4o design point
"""A piece of cake"" means something very easy.",gpt-4o design point
"""A river of tears"" means heavy crying.",gpt-4o design point
"""A sea of troubles"" suggests overwhelming difficulties.",gpt-4o design point
"""A stitch in time saves nine"" emphasizes prompt action.",gpt-4o design point
"""A stitch in time saves nine"" encourages prompt action.",gpt-4o design point
"""A walk in the park"" signifies something easy and relaxing.",gpt-4o design point
"""A watched pot never boils""; Patience can be trying.",gpt-4o design point
"""A world of possibilities"" indicates vast potential.",gpt-4o design point
"""Actions speak louder than words"" is a common saying.",gpt-4o design point
"""Actions speak louder than words"" promotes integrity.",gpt-4o design point
"""Actions speak louder than words"" stresses deeds over words.",gpt-4o design point
"""All the world's a stage"" is a famous metaphor.",gpt-4o design point
"""All the world’s a stage"" means life is like a play.",gpt-4o design point
"""All work and no play makes Jack a dull boy""; Balance is key.",gpt-4o design point
"""An apple a day keeps the doctor away"" promotes healthy eating.",gpt-4o design point
"""An apple a day keeps the doctor away"" suggests good nutrition.",gpt-4o design point
"""An apple a day keeps the doctor away.""",gpt-4o design point
"""An ocean of possibilities"" suggests numerous opportunities.",gpt-4o design point
"""An ounce of prevention is worth a pound of cure""; Better to be proactive.",gpt-4o design point
"""Beauty is in the eye of the beholder""; Perceptions vary.",gpt-4o design point
"""Better late than never""; It’s never too late to start.",gpt-4o design point
"""Better safe than sorry""; Caution prevents regrets.",gpt-4o design point
"""Birds of a feather flock together"" highlights similarity.",gpt-4o design point
"""Birds of a feather flock together""; Similar people gravitate toward each other.",gpt-4o design point
"""Bite the bullet"" means to endure something difficult.",gpt-4o design point
"""Bite the bullet"" means to endure something painful.",gpt-4o design point
"""Biting the bullet"" means facing something difficult.",gpt-4o design point
"""Break a leg"" means good luck in theater.",gpt-4o design point
"""Break the ice"" means to initiate conversation.",gpt-4o design point
"""Break the ice"" means to start a conversation.",gpt-4o design point
"""Breaking the ice"" can ease discomfort in new social settings.",gpt-4o design point
"""Breaking the ice"" eases social tension.",gpt-4o design point
"""Breaking the ice"" means starting a conversation.",gpt-4o design point
"""Breaking the ice"" means to start a conversation.",gpt-4o design point
"""Bright-eyed and bushy-tailed"" signifies being energetic and lively.",gpt-4o design point
"""Burning the midnight oil"" means working late into the night.",gpt-4o design point
"""Burning the midnight oil"" means working late.",gpt-4o design point
"""Bursting with health"" describes someone very healthy.",gpt-4o design point
"""Bursting with health"" signifies being very healthy.",gpt-4o design point
"""Cold hands, warm heart""; caring actions are what matter.",gpt-4o design point
"""Do unto others as you would have them do unto you""; Golden Rule.",gpt-4o design point
"""Don't bite off more than you can chew""; Know your limits.",gpt-4o design point
"""Don’t judge a book by its cover"" means appearances can be deceptive.",gpt-4o design point
"""Every cloud has a silver lining"" reassures optimism.",gpt-4o design point
"""Every cloud has a silver lining""; Always look for the positive.",gpt-4o design point
"""Fit as a fiddle"" means in good health.",gpt-4o design point
"""Full of beans"" describes someone energetic and lively.",gpt-4o design point
"""Go the extra mile"" means to make extra effort.",gpt-4o design point
"""Good things come to those who wait""; Patience has its rewards.",gpt-4o design point
"""Healthy as a horse"" means very healthy.",gpt-4o design point
"""Healthy as an ox"" means very strong and healthy.",gpt-4o design point
"""Heart of a lion"" means having great courage.",gpt-4o design point
"""Heart of gold"" describes someone very kind.",gpt-4o design point
"""Hit the nail on the head"" means to be exactly right.",gpt-4o design point
"""Hit the nail on the head"" means to be precisely correct.",gpt-4o design point
"""I think, therefore I am"" reflects self-awareness.",gpt-4o design point
"""In the pink"" means in very good health.",gpt-4o design point
"""It's raining cats and dogs"" means it's raining heavily.",gpt-4o design point
"""It's the thought that counts""; Intentions matter.",gpt-4o design point
"""It’s raining cats and dogs"" means it’s raining heavily.",gpt-4o design point
"""Knowledge is power"" emphasizes the importance of learning.",gpt-4o design point
"""Knowledge is power"" emphasizes the value of knowledge.",gpt-4o design point
"""Laughter is the best medicine"" encourages positivity.",gpt-4o design point
"""Let the cat out of the bag"" means to reveal a secret.",gpt-4o design point
"""Like a fish out of water"" means feeling out of place.",gpt-4o design point
"""Old habits die hard"" suggests change is difficult.",gpt-4o design point
"""Old habits die hard""; Change takes time.",gpt-4o design point
"""On cloud nine"" means being very happy.",gpt-4o design point
"""Piece of cake"" means something very easy.",gpt-4o design point
"""Practice makes perfect"" emphasizes the importance of regular practice.",gpt-4o design point
"""Practice makes perfect"" is a common adage.",gpt-4o design point
"""Raining cats and dogs"" is a figure of speech.",gpt-4o design point
"""Right as rain"" means perfectly healthy.",gpt-4o design point
"""Rome wasn't built in a day"" highlights the value of patience.",gpt-4o design point
"""Rome wasn't built in a day"" implies persistence.",gpt-4o design point
"""Rome wasn't built in a day""; Patience pays off.",gpt-4o design point
"""Slow and steady wins the race"" conveys patience.",gpt-4o design point
"""Spill the beans"" means revealing a secret.",gpt-4o design point
"""Spill the beans"" means to reveal a secret.",gpt-4o design point
"""Take it one step at a time""; Progress is often gradual.",gpt-4o design point
"""The ball is in your court"" means it's your responsibility.",gpt-4o design point
"""The early bird catches the worm"" promotes being proactive.",gpt-4o design point
"""The early bird catches the worm"" suggests early action leads to success.",gpt-4o design point
"""The early bird catches the worm"" suggests early action.",gpt-4o design point
"""The only thing I know is that I know nothing"" fosters open-mindedness.",gpt-4o design point
"""The pen is mightier than the sword"" signifies the power of words.",gpt-4o design point
"""The pen is mightier than the sword"" signifies words' power.",gpt-4o design point
"""The pen is mightier than the sword""; Words have power.",gpt-4o design point
"""The picture of health"" describes someone who looks very healthy.",gpt-4o design point
"""The sands of time"" describe the passage of time.",gpt-4o design point
"""The unexamined life is not worth living"" emphasizes self-reflection.",gpt-4o design point
"""The winds of change"" implies significant change coming.",gpt-4o design point
"""The world is a stage"" implies life is theatrical.",gpt-4o design point
"""The world is your oyster""; Opportunities await you.",gpt-4o design point
"""Time flies when you're having fun"" resonates with many.",gpt-4o design point
"""Time flies when you're having fun"" rings true often.",gpt-4o design point
"""Time flies"" means time passes quickly.",gpt-4o design point
"""Time is a thief"" suggests time goes by quickly.",gpt-4o design point
"""Time is money"" emphasizes time’s value.",gpt-4o design point
"""Time is money"" is a well-known metaphor.",gpt-4o design point
"""Time is money"" means time is valuable.",gpt-4o design point
"""To be full of vim and vigor"" means to be lively and energetic.",gpt-4o design point
"""Two heads are better than one""; Collaboration breeds innovation.",gpt-4o design point
"""Under the weather"" means feeling ill.",gpt-4o design point
"""Variety is the spice of life""; Embrace diversity and change.",gpt-4o design point
"""Variety is the spice of life.""",gpt-4o design point
"""Walk a mile in someone else's shoes"" means to understand others' perspectives.",gpt-4o design point
"""What goes around, comes around""; Karma is inescapable.",gpt-4o design point
"""When pigs fly"" means something impossible.",gpt-4o design point
"""Words are the keys to the hearts of others"" indicates the power of language.",gpt-4o design point
"""You are what you eat"" relates diet to health.",gpt-4o design point
"""You are what you eat""; Nutrition reflects in health.",gpt-4o design point
"""You can't please everyone""; Focus on the important ones.",gpt-4o design point
'Rome wasn’t built in a day' suggests patience.,gpt-4o design point
2 + 2 = 4.,gpt-4o design point
3D printing revolutionizes manufacturing processes.,gpt-4o design point
"3D printing revolutionizes manufacturing processes.

Celebrating achievements fosters positivity.",gpt-4o design point
A balanced breakfast improves daily energy levels.,gpt-4o design point
A balanced diet includes a variety of nutrients.,gpt-4o design point
"A balanced diet includes all essential nutrients.

Helping a neighbor builds community bonds.",gpt-4o design point
A balanced diet includes all food groups.,gpt-4o design point
A balanced diet includes diverse food groups.,gpt-4o design point
"A balanced diet includes proteins, fats, and carbohydrates.",gpt-4o design point
A balanced diet includes various food groups.,gpt-4o design point
A balanced diet includes various nutrients.,gpt-4o design point
A balanced diet is crucial for health.,gpt-4o design point
A balanced diet maintains overall health.,gpt-4o design point
A balanced diet promotes overall wellness.,gpt-4o design point
A balanced diet supports a healthy lifestyle.,gpt-4o design point
A balanced diet supports bodily functions.,gpt-4o design point
A balanced diet supports immune function.,gpt-4o design point
A balanced diet supports long-term health.,gpt-4o design point
A balanced diet supports overall health.,gpt-4o design point
A balanced diet supports overall well-being.,gpt-4o design point
A balanced diet supports overall wellness.,gpt-4o design point
A balanced diet supports physical health.,gpt-4o design point
A balanced diet sustains energy.,gpt-4o design point
A barking dog seldom bites.,gpt-4o design point
A bird in the hand is worth two in the bush.,gpt-4o design point
A bird in the hand.,gpt-4o design point
A blanket keeps you warm.,gpt-4o design point
A book a day keeps ignorance away.,gpt-4o design point
A book contains pages of information.,gpt-4o design point
A broken clock is right twice a day.,gpt-4o design point
A calm demeanor eases stressful situations.,gpt-4o design point
A calm environment nurtures peace of mind.,gpt-4o design point
A chain is only as strong as its weakest link.,gpt-4o design point
A cheerful disposition is contagious.,gpt-4o design point
A cheerful heart is good medicine.,gpt-4o design point
A clean diet supports healthy living.,gpt-4o design point
A clean environment promotes good health.,gpt-4o design point
A clean space enhances mental clarity.,gpt-4o design point
A clean space invites calm.,gpt-4o design point
A clear conscience is a soft pillow.,gpt-4o design point
A clear desk promotes productivity.,gpt-4o design point
A clear goal sets the path.,gpt-4o design point
A clear mind leads to better decisions.,gpt-4o design point
A clear mind makes better decisions.,gpt-4o design point
A clear night reveals numerous stars in the sky.,gpt-4o design point
A clear sky is like a blank canvas.,gpt-4o design point
A clear workspace boosts productivity.,gpt-4o design point
A cluttered desk reflects a cluttered mind.,gpt-4o design point
A cluttered space can increase stress.,gpt-4o design point
A cluttered space equals a cluttered mind.,gpt-4o design point
A cold breeze feels refreshing.,gpt-4o design point
A conclusion follows logically from the premises.,gpt-4o design point
A conclusion follows logically if premises are true.,gpt-4o design point
A conclusion follows logically if the premises are true.,gpt-4o design point
A consistent exercise routine supports cardiovascular health.,gpt-4o design point
A consistent sleep routine improves health.,gpt-4o design point
A consistent sleep schedule boosts cognitive performance.,gpt-4o design point
A consistent sleep schedule offers health benefits.,gpt-4o design point
A cozy home feels like a safe haven.,gpt-4o design point
A diamond in the rough.,gpt-4o design point
A dime a dozen means common.,gpt-4o design point
A diverse team brings more perspectives.,gpt-4o design point
A friend in need is a friend indeed.,gpt-4o design point
A gentle word turns away wrath.,gpt-4o design point
A gentler approach often wins the day.,gpt-4o design point
A good book is a friend.,gpt-4o design point
A good book is a great friend.,gpt-4o design point
A good book is a loyal friend.,gpt-4o design point
A good book is like a loyal companion.,gpt-4o design point
A good book offers mental stimulation.,gpt-4o design point
A good conversation can be deeply fulfilling.,gpt-4o design point
A good conversation is like a breath of fresh air.,gpt-4o design point
A good conversation is like food for the soul.,gpt-4o design point
A good conversation uplifts spirits.,gpt-4o design point
A good deed often goes a long way.,gpt-4o design point
A good diet supports bodily functions.,gpt-4o design point
A good education is a foundation for a better future.,gpt-4o design point
A good friend is priceless.,gpt-4o design point
A good laugh is good medicine.,gpt-4o design point
A good laugh is like a light workout.,gpt-4o design point
A good mattress improves sleep quality.,gpt-4o design point
A good meal is nourishing for the soul.,gpt-4o design point
A good meal nourishes both body and soul.,gpt-4o design point
A good night's sleep improves cognitive function.,gpt-4o design point
A good night's sleep improves mental clarity.,gpt-4o design point
A good night's sleep is crucial for health.,gpt-4o design point
A good night's sleep is essential.,gpt-4o design point
A good night's sleep is refreshing.,gpt-4o design point
A good night's sleep is rejuvenating.,gpt-4o design point
A good night's sleep rejuvenates the mind and body.,gpt-4o design point
A good night's sleep supports cognitive function.,gpt-4o design point
A good night's sleep supports overall well-being.,gpt-4o design point
A good night’s sleep boosts brainpower.,gpt-4o design point
A good night’s sleep improves mental clarity.,gpt-4o design point
A good night’s sleep is essential.,gpt-4o design point
A good night’s sleep is key to overall health.,gpt-4o design point
A good night’s sleep rejuvenates you.,gpt-4o design point
A good night’s sleep rejuvenates.,gpt-4o design point
A good reputation is invaluable.,gpt-4o design point
A good reputation is valuable.,gpt-4o design point
A good workout boosts mood.,gpt-4o design point
A great workout is energizing.,gpt-4o design point
A handshake can seal a deal.,gpt-4o design point
A handshake can signify agreement.,gpt-4o design point
A handshake is a common greeting.,gpt-4o design point
A handshake often signifies agreement.,gpt-4o design point
A happy heart spreads joy.,gpt-4o design point
A healthy body hosts a healthy mind.,gpt-4o design point
A healthy breakfast jumpstarts metabolism.,gpt-4o design point
A healthy diet boosts energy levels.,gpt-4o design point
A healthy diet promotes overall health.,gpt-4o design point
A healthy diet supports good health.,gpt-4o design point
A healthy diet supports immune function.,gpt-4o design point
A healthy diet supports immunity.,gpt-4o design point
A healthy diet sustains physical and mental well-being.,gpt-4o design point
A heartfelt compliment can change someone's perspective.,gpt-4o design point
A heartfelt hug can offer immense comfort.,gpt-4o design point
A hearty breakfast fuels your day.,gpt-4o design point
A heavy heart signifies deep sadness.,gpt-4o design point
A high salt diet is unhealthy.,gpt-4o design point
A hot bath relaxes muscles.,gpt-4o design point
A hot shower can relieve muscle tension.,gpt-4o design point
A house divided against itself cannot stand.,gpt-4o design point
A house is not a home.,gpt-4o design point
A hug can convey a thousand words.,gpt-4o design point
A hug can mend a heart.,gpt-4o design point
A hug can offer comfort.,gpt-4o design point
A hug can offer immense comfort.,gpt-4o design point
A hug can provide immense comfort.,gpt-4o design point
A hug can warm your heart.,gpt-4o design point
A hypothesis must be testable and falsifiable.,gpt-4o design point
A hypothesis must be testable for scientific validity.,gpt-4o design point
A hypothesis must be testable to be valid.,gpt-4o design point
A hypothesis must be testable.,gpt-4o design point
A journey of a thousand miles begins with a single step.,gpt-4o design point
A joyful heart is more important than riches.,gpt-4o design point
A kind heart attracts goodwill.,gpt-4o design point
A kind word can change a day.,gpt-4o design point
A kind word can change someone's day.,gpt-4o design point
A kind word can change someone's entire day.,gpt-4o design point
A kind word can change someone’s entire day.,gpt-4o design point
A kind word can make someone's day.,gpt-4o design point
A kind word can turn a bad day around.,gpt-4o design point
A leopard can't change its spots.,gpt-4o design point
A lion is known as the king of the jungle.,gpt-4o design point
A little kindness goes a long way.,gpt-4o design point
"A number divided by one equals the number itself.

Staying organized reduces stress.",gpt-4o design point
"A number multiplied by zero always equals zero.

Regular physical activity enhances lifespan.",gpt-4o design point
A nutritious breakfast energizes you for the day.,gpt-4o design point
A nutritious breakfast energizes you.,gpt-4o design point
A nutritious breakfast fuels your day.,gpt-4o design point
A nutritious breakfast jump-starts your day.,gpt-4o design point
A nutritious breakfast jumpstarts your day.,gpt-4o design point
A nutritious breakfast kick-starts your day.,gpt-4o design point
A nutritious breakfast kick-starts your metabolism.,gpt-4o design point
A nutritious breakfast kickstarts your day.,gpt-4o design point
A nutritious diet anchors your health.,gpt-4o design point
A nutritious diet supports overall health.,gpt-4o design point
A nutritious diet sustains health.,gpt-4o design point
A pat on the back boosts morale.,gpt-4o design point
A pat on the back reinforces positive behavior.,gpt-4o design point
A peaceful home nurtures the soul.,gpt-4o design point
A penny for your thoughts encourages sharing ideas.,gpt-4o design point
A penny for your thoughts.,gpt-4o design point
A penny saved is a penny earned.,gpt-4o design point
A picture is worth a thousand words means visuals can convey complex ideas.,gpt-4o design point
A picture is worth a thousand words.,gpt-4o design point
A picture is worth a thousand words; visuals can convey complex ideas.,gpt-4o design point
A piece of cake means something very easy.,gpt-4o design point
A place for everything and everything in its place.,gpt-4o design point
A place for everything.,gpt-4o design point
A positive attitude attracts positive outcomes.,gpt-4o design point
A positive attitude attracts positivity.,gpt-4o design point
A positive attitude brings positive outcomes.,gpt-4o design point
A positive attitude improves mental health.,gpt-4o design point
A positive attitude leads to positive experiences.,gpt-4o design point
A positive environment boosts productivity.,gpt-4o design point
A positive mindset attracts positive experiences.,gpt-4o design point
A positive mindset attracts positive health outcomes.,gpt-4o design point
A positive mindset attracts positive outcomes.,gpt-4o design point
A positive mindset attracts positivity.,gpt-4o design point
A positive mindset encourages constructive actions.,gpt-4o design point
A positive mindset encourages resilience.,gpt-4o design point
A positive outlook attracts positivity.,gpt-4o design point
A positive outlook brings positive outcomes.,gpt-4o design point
A positive reputation is valuable in any group.,gpt-4o design point
A proof by contradiction demonstrates that the negation of a statement leads to a contradiction.,gpt-4o design point
A rainbow appears after the rain.,gpt-4o design point
A rainbow often appears after it rains.,gpt-4o design point
A rich man is never content.,gpt-4o design point
A right angle is exactly 90 degrees.,gpt-4o design point
A rising tide lifts all boats.,gpt-4o design point
A river's flow is soothing.,gpt-4o design point
A rolling stone gathers no moss.,gpt-4o design point
A serene environment enhances relaxation.,gpt-4o design point
A set is a collection of distinct objects.,gpt-4o design point
A simple thank you can mean a lot.,gpt-4o design point
A slice of heaven describes something delightful.,gpt-4o design point
A small act of kindness has big impacts.,gpt-4o design point
A smile can break the ice.,gpt-4o design point
A smile can bridge differences.,gpt-4o design point
A smile can brighten someone's day.,gpt-4o design point
A smile can brighten someone's mood.,gpt-4o design point
A smile can brighten someone’s day.,gpt-4o design point
A smile can lift someone's spirits.,gpt-4o design point
A smile can make someone's day better.,gpt-4o design point
A smile can make someone's day.,gpt-4o design point
A smile is contagious.,gpt-4o design point
A square has four equal sides.,gpt-4o design point
A stich in time saves nine.,gpt-4o design point
A stitch in time saves nine.,gpt-4o design point
A strong argument is logically sound.,gpt-4o design point
A strong handshake shows confidence.,gpt-4o design point
A thank-you note shows appreciation.,gpt-4o design point
A thankful heart is a happy heart.,gpt-4o design point
A thoughtful gesture can change someone's outlook.,gpt-4o design point
A tidy desk encourages productivity.,gpt-4o design point
A tidy desk enhances focus.,gpt-4o design point
A tidy desk enhances productivity.,gpt-4o design point
A tidy desk fosters productivity.,gpt-4o design point
A tidy desk improves productivity.,gpt-4o design point
A tidy desk inspires productivity.,gpt-4o design point
A tidy environment reduces stress.,gpt-4o design point
A tidy home boosts relaxation.,gpt-4o design point
A tidy home encourages relaxation.,gpt-4o design point
A tidy home feels more relaxing.,gpt-4o design point
A tidy home feels welcoming.,gpt-4o design point
A tidy home is a happy home.,gpt-4o design point
A tidy home promotes peace of mind.,gpt-4o design point
A tidy home reduces stress and anxiety.,gpt-4o design point
A tidy home reduces stress.,gpt-4o design point
A tidy home welcomes relaxation.,gpt-4o design point
A tidy room feels welcoming.,gpt-4o design point
A tidy space can reduce stress.,gpt-4o design point
A tidy space invites a calm mind.,gpt-4o design point
A tidy space invites calm.,gpt-4o design point
A tidy space promotes calmness.,gpt-4o design point
A tidy space promotes peace of mind.,gpt-4o design point
A tidy space promotes relaxation.,gpt-4o design point
A tidy space reduces stress and enhances focus.,gpt-4o design point
A tidy space reduces stress.,gpt-4o design point
A touch of irony often makes conversations interesting.,gpt-4o design point
A triangle has three sides and three angles.,gpt-4o design point
A triangle's exterior angle equals the sum of the opposite interior angles.,gpt-4o design point
A triangle’s angles sum up to 180 degrees.,gpt-4o design point
A vaccine prevents the spread of infectious diseases.,gpt-4o design point
A valid argument has true premises and a true conclusion.,gpt-4o design point
A valid argument must be logically consistent.,gpt-4o design point
A valid argument must have true premises and a true conclusion.,gpt-4o design point
A walk after meals aids digestion.,gpt-4o design point
A walk in nature can soothe the soul.,gpt-4o design point
A walk in nature soothes the soul.,gpt-4o design point
A walk in the park is refreshing.,gpt-4o design point
A walk in the park is relaxing.,gpt-4o design point
A walk in the park refreshes the mind.,gpt-4o design point
A warm bath relaxes the muscles.,gpt-4o design point
A warm coat keeps you comfortable.,gpt-4o design point
A warm greeting sets a positive tone.,gpt-4o design point
A warm shower can relieve muscle tension.,gpt-4o design point
A warm smile can brighten someone's day.,gpt-4o design point
A warm smile invites friendliness.,gpt-4o design point
A warm smile is the universal language of kindness.,gpt-4o design point
"A warm, sunny day uplifts the spirits.",gpt-4o design point
A watched pot never boils.,gpt-4o design point
A waterfall's sound is soothing.,gpt-4o design point
A welcoming attitude invites friendship.,gpt-4o design point
A well-balanced diet supports overall health and wellness.,gpt-4o design point
A well-organized space promotes focus.,gpt-4o design point
A year on Earth consists of about 365.25 days.,gpt-4o design point
AI algorithms require quality data input.,gpt-4o design point
