content,count,nlp_score,statement,committer,elicitation
Microalgae serve as biofuel sources.,1,Microalgae serve as biofuel sources.,মাইক্রোঅ্যালগা বায়োফুয়েল উত্স হিসাবে কাজ করে।,Nakh,Amazon Translate
Microbes can adapt to survive in extreme environments.,1,Microbes can adapt to survive in extreme environments.,মাইক্রোবগুলি চরম পরিবেশে বেঁচে থাকার জন্য খাপ,Nakh,Amazon Translate
Microbes can cause disease or play beneficial ecosystem roles.,1,Microbes can cause disease or play beneficial ecosystem roles.,জীবাণুগুলি রোগ সৃষ্টি করতে পারে বা উপকারী বাস্তুতন্ত্রের ভূ,Nakh,Amazon Translate
Microbial communities stabilize ecosystems by recycling nutrients and decomposing waste.,1,Microbial communities stabilize ecosystems by recycling nutrients and decomposing waste.,মাইক্রোবিয়াল সম্প্রদায়গুলি পুষ্টি পুনর্ব্যবহার করে এবং বর্জ্য পচন করে বা,Nakh,Amazon Translate
Microbial fuel cells generate electricity from organic matter.,1,Microbial fuel cells generate electricity from organic matter.,মাইক্রোবিয়াল ফুয়েল কোষগুলি জৈব পদার্থ থেকে বিদ্য,Nakh,Amazon Translate
Microbiology examines microscopic organisms.,1,Microbiology examines microscopic organisms.,মাইক্রোবায়োলজি মাইক্রোস্কোপিক জীব,Nakh,Amazon Translate
Microfluidics controls small-scale fluid manipulation for analysis.,1,Microfluidics controls small-scale fluid manipulation for analysis.,মাইক্রোফ্লুইডিক্স বিশ্লেষণের জন্য ছোট আকারের তরল ম্যানিপুলেশন,Nakh,Amazon Translate
Microorganisms are living entities too small to be visible unaided.,1,Microorganisms are living entities too small to be visible unaided.,অণুজীবগুলি এমন জীবিত সত্তা যা সাহায্যহীন দৃশ্যমান হতে খুব ছোট।,Nakh,Amazon Translate
Microorganisms drift in air currents.,1,Microorganisms drift in air currents.,অণুজীবগুলি বায়ু স্রোতে চলে যায়,Nakh,Amazon Translate
Microprocessors control complex systems.,1,Microprocessors control complex systems.,মাইক্রোপ্রসেসর জটিল সিস্টেম নিয়ন্ত্রণ,Nakh,Amazon Translate
Microprocessors execute instructions in computing systems.,1,Microprocessors execute instructions in computing systems.,মাইক্রোপ্রসেসর কম্পিউটিং সিস্টেমে নির্দেশাবলী,Nakh,Amazon Translate
Microscopes magnify small objects for detailed examination.,1,Microscopes magnify small objects for detailed examination.,মাইক্রোস্কোপগুলি বিস্তারিত পরীক্ষার জন্য ছোট বস্তুকে বড় করে,Nakh,Amazon Translate
Microsensors detect environmental changes at tiny scales.,1,Microsensors detect environmental changes at tiny scales.,মাইক্রোসেন্সরগুলি ছোট স্কেলে পরিবেশগত পরিবর্তনগুলি,Nakh,Amazon Translate
Milan is a major fashion hub in Italy.,1,Milan is a major fashion hub in Italy.,মিলান ইতালির একটি প্রধান ফ্যাশন হাব।,Nakh,Amazon Translate
Mindfulness meditation fosters present-moment awareness and stress reduction.,1,Mindfulness meditation fosters present-moment awareness and stress reduction.,মাইন্ডফুলনেস মেডিটেশন বর্তমান-মুহূর্তের সচেতনতা এবং মানসিক,Nakh,Amazon Translate
Minerals have specific chemical structures and properties.,1,Minerals have specific chemical structures and properties.,খনিজগুলির নির্দিষ্ট রাসায়নিক গঠন এবং বৈশিষ্ট্য,Nakh,Amazon Translate
Mitochondria are found in nearly all eukaryotic cells.,1,Mitochondria are found in nearly all eukaryotic cells.,মাইটোকন্ড্রিয়া প্রায় সমস্ত ইউক্যারিওটিক কোষে পাওয়া যায়।,Nakh,Amazon Translate
Mitochondria are known as the powerhouse of the cell.,1,Mitochondria are known as the powerhouse of the cell.,মাইটোকন্ড্রিয়া কোষের পাওয়ারহাউস হিসাবে পরিচিত।,Nakh,Amazon Translate
Mitosis produces genetically identical daughter cells.,1,Mitosis produces genetically identical daughter cells.,মাইটোসিস জিনগতভাবে অভিন্ন কন্যা কোষ তৈরি করে।,Nakh,Amazon Translate
Mobile technology enhances connectivity.,1,Mobile technology enhances connectivity.,মোবাইল প্রযুক্তি সংযোগ বাড়ায়।,Nakh,Amazon Translate
Moderate physical activity helps maintain a healthy weight.,1,Moderate physical activity helps maintain a healthy weight.,মাঝারি শারীরিক ক্রিয়াকলাপ একটি স্বাস্থ্যকর ওজন,Nakh,Amazon Translate
Mohandas Gandhi famously led the Salt March in 1930 against British salt laws.,1,Mohandas Gandhi famously led the Salt March in 1930 against British salt laws.,মোহানদাস গান্ধী ১৯৩০ সালে ব্রিটিশ লবণ আইনের বিরুদ্ধে লবণ মার্চের নেতৃত্ব দি,Nakh,Amazon Translate
Molecular biology studies interactions within cells.,1,Molecular biology studies interactions within cells.,আণবিক জীববিজ্ঞান কোষের মধ্যে মিথস্ক্রিয়া,Nakh,Amazon Translate
Molecular interactions determine chemical and physical properties.,1,Molecular interactions determine chemical and physical properties.,আণবিক মিথস্ক্রিয়া রাসায়নিক এবং শারীরিক,Nakh,Amazon Translate
Molecular weight is the sum of atomic masses in a molecule.,1,Molecular weight is the sum of atomic masses in a molecule.,আণবিক ওজন একটি অণুর পারমাণবিক ভরের যোগফল।,Nakh,Amazon Translate
Momentum keeps objects moving unless acted upon naturally.,1,Momentum keeps objects moving unless acted upon naturally.,প্রাকৃতিকভাবে কাজ না করা পর্যন্ত মোমেন্টাম বস্তুগুলিকে চল,Nakh,Amazon Translate
Monaco is the world's second smallest country.,1,Monaco is the world's second smallest country.,মোনাকো বিশ্বের দ্বিতীয় ক্ষুদ্রতম দেশ।,Nakh,Amazon Translate
"Money talks, but it doesn't always tell the truth.",1,"Money talks, but it doesn't always tell the truth.","টাকা কথা বলে, তবে এটি সবসময় সত্য বলে না।",Nakh,Amazon Translate
Mont Blanc is the highest mountain in the Alps.,1,Mont Blanc is the highest mountain in the Alps.,মন্ট ব্লাঙ্ক আল্পসের সর্বোচ্চ পর্বত।,Nakh,Amazon Translate
Morning sunlight exposure stabilizes circadian rhythms and improves sleep.,1,Morning sunlight exposure stabilizes circadian rhythms and improves sleep.,সকালের সূর্যের আলোর সংস্পর্শ সার্কেডিয়ান ছন্দ স্থিতিশীল করে এবং ঘু,Nakh,Amazon Translate
Morocco lies on the northwestern edge of Africa.,1,Morocco lies on the northwestern edge of Africa.,মরক্কো আফ্রিকার উত্তর-পশ্চিম প্রান্তে অবস্থিত,Nakh,Amazon Translate
Most fish breathe underwater using gills.,1,Most fish breathe underwater using gills.,বেশিরভাগ মাছ গিলস ব্যবহার করে পানির নিচের দিকে,Nakh,Amazon Translate
Mostar is famed for its Ottoman-era bridge.,1,Mostar is famed for its Ottoman-era bridge.,মোস্টার তার অটোমান যুগের সেতুর জন্য বিখ্যাত।,Nakh,Amazon Translate
Motion capture records human movement.,1,Motion capture records human movement.,মোশন ক্যাপচার মানব চলাচল রেকর্ড,Nakh,Amazon Translate
Mount Etna is Europe's most active volcano.,1,Mount Etna is Europe's most active volcano.,মাউন্ট এটনা ইউরোপের সবচেয়ে সক্রিয় আগ্নেয়গিরি।,Nakh,Amazon Translate
Mount Everest is the tallest peak on Earth.,1,Mount Everest is the tallest peak on Earth.,মাউন্ট এভারেস্ট পৃথিবীর সবচেয়ে উঁচু শিখর।,Nakh,Amazon Translate
Mount Fuji is one of Japan's most iconic landmarks.,1,Mount Fuji is one of Japan's most iconic landmarks.,মাউন্ট ফুজি জাপানের অন্যতম আইকনিক ল্যান্ডমার্ক।,Nakh,Amazon Translate
Mount Kilimanjaro is Africa's highest point.,1,Mount Kilimanjaro is Africa's highest point.,মাউন্ট কিলিমঞ্জারো আফ্রিকার সর্বোচ্চ পয়েন্ট।,Nakh,Amazon Translate
"Mount St. Helens is an active stratovolcano in Washington, USA.",1,"Mount St. Helens is an active stratovolcano in Washington, USA.",মাউন্ট সেন্ট হেলেন্স মার্কিন যুক্তরাষ্ট্রের ওয়াশিংটনের একটি সক্রিয় স্ট্র্যাটোভোলকানো,Nakh,Amazon Translate
Mountains keep watch over time's unyielding passage forward.,1,Mountains keep watch over time's unyielding passage forward.,পর্বতমালা সময়ের অলঙ্কিত পথের দিকে নজর রাখে।,Nakh,Amazon Translate
"Mountains stand vigil, guarding the secrets of ancient earth.",1,"Mountains stand vigil, guarding the secrets of ancient earth.",পর্বতমালা প্রাচীন পৃথিবীর গোপনীয়তা রক্ষা করে নজর রাখে।,Nakh,Amazon Translate
Mozart was a prolific composer of the Classical era born in 1756.,1,Mozart was a prolific composer of the Classical era born in 1756.,মোজার্ট 1756 সালে জন্মগ্রহণকারী শাস্ত্রীয় যুগের একজন প্রচুর সুরকার ছিলেন।,Nakh,Amazon Translate
Munich is known for its Oktoberfest beer festival.,1,Munich is known for its Oktoberfest beer festival.,মিউনিখ তার অক্টোবারফেস্ট বিয়ার উত্সবের জন্য পরিচিত।,Nakh,Amazon Translate
Muscles contract to produce movement in animals.,1,Muscles contract to produce movement in animals.,প্রাণীদের মধ্যে চলাচল তৈরি করতে পেশী সংকুচিত হয়।,Nakh,Amazon Translate
Music echoes the heart's eternal serenade through ethereal sounds.,1,Music echoes the heart's eternal serenade through ethereal sounds.,সংগীত আহিরাগত শব্দের মাধ্যমে হৃদয়ের চিরন্তন সেরেনেডকে প্রতিবেদন করে।,Nakh,Amazon Translate
Nagoya is Japan's third largest incorporated city.,1,Nagoya is Japan's third largest incorporated city.,নাগোয়া জাপানের তৃতীয় বৃহত্তম সংযুক্ত শহর।,Nakh,Amazon Translate
Nairobi is Kenya's capital city.,1,Nairobi is Kenya's capital city.,নাইরোবি কেনিয়ার রাজধানী।,Nakh,Amazon Translate
Nanoenergetics develops high-energy materials.,1,Nanoenergetics develops high-energy materials.,ন্যানোএনার্জিটিক্স উচ্চ শক্তি উপকরণ বিকাশ করে।,Nakh,Amazon Translate
Nanomachines operate at the nanoscale for various applications.,1,Nanomachines operate at the nanoscale for various applications.,ন্যানোমেশিনগুলি বিভিন্ন অ্যাপ্লিকেশনের জন্য ন্যানোস্কেলে কাজ করে।,Nakh,Amazon Translate
Nanomaterials offer unique attributes.,1,Nanomaterials offer unique attributes.,ন্যানোমেটেরিয়ালগুলি অনন্য বৈশিষ্ট্য সরবরাহ করে।,Nakh,Amazon Translate
Nanomedicine applies nanoscale technology in healthcare.,1,Nanomedicine applies nanoscale technology in healthcare.,ন্যানোমেডিসিন স্বাস্থ্যসেবা ক্ষেত্রে ন্যানোস্কেল প্রযুক্তি প্রয়োগ করে।,Nakh,Amazon Translate
Nanosensors detect environmental changes at molecular levels.,1,Nanosensors detect environmental changes at molecular levels.,ন্যানোসেন্সরগুলি আণবিক স্তরে পরিবেশগত পরিবর্তন সনাক্ত করে।,Nakh,Amazon Translate
Nanotechnology manipulates matter at an atomic level.,1,Nanotechnology manipulates matter at an atomic level.,ন্যানো প্রযুক্তি পারমাণবিক স্তরে পদার্থকে ম্যানিপুলেট করে।,Nakh,Amazon Translate
Nanotechnology manipulates matter at the nanometer scale.,1,Nanotechnology manipulates matter at the nanometer scale.,ন্যানো প্রযুক্তি ন্যানোমিটার স্কেলে পদার্থকে ম্যানিপুলেট করে।,Nakh,Amazon Translate
Napoleon Bonaparte crowned himself Emperor of France in 1804.,1,Napoleon Bonaparte crowned himself Emperor of France in 1804.,নেপোলিয়ন বোনাপার্ট ১৮০৪ সালে নিজেকে ফ্রান্সের সম্রাট মুকুট করেন।,Nakh,Amazon Translate
Napoleon Bonaparte was exiled to the island of Saint Helena after his defeat.,1,Napoleon Bonaparte was exiled to the island of Saint Helena after his defeat.,নেপোলিয়ন বোনাপার্টকে পরাজয়ের পর সেন্ট হেলেনা দ্বীপে নির্বাসিত হন।,Nakh,Amazon Translate
Natural gas is a common fuel source.,1,Natural gas is a common fuel source.,প্রাকৃতিক গ্যাস একটি সাধারণ জ্বালানী উৎস।,Nakh,Amazon Translate
Natural language processing interprets and generates human language.,1,Natural language processing interprets and generates human language.,প্রাকৃতিক ভাষা প্রক্রিয়াকরণ মানব ভাষা ব্যাখ্যা করে এবং তৈরি করে।,Nakh,Amazon Translate
Natural processes shape Earth's surface and climate.,1,Natural processes shape Earth's surface and climate.,প্রাকৃতিক প্রক্রিয়াগুলি পৃথিবীর পৃষ্ঠ এবং জলবায়ুকে,Nakh,Amazon Translate
Natural selection drives the evolution of species.,1,Natural selection drives the evolution of species.,প্রাকৃতিক নির্বাচন প্রজাতির বিবর্তনকে চালিত করে।,Nakh,Amazon Translate
Natural selection enhances species' survival and reproduction.,1,Natural selection enhances species' survival and reproduction.,প্রাকৃতিক নির্বাচন প্রজাতির বেঁচে থাকা এবং প্রজনন বাড়া,Nakh,Amazon Translate
"Natural selection involves survival through adaptation, not strongest dominance.",1,"Natural selection involves survival through adaptation, not strongest dominance.","প্রাকৃতিক নির্বাচনের সাথে অভিযোজনের মাধ্যমে বেঁচে থাকা জড়িত, শক্তি",Nakh,Amazon Translate
"Nature abhors a vacuum, indicating equilibrium's restoration pressure.",1,"Nature abhors a vacuum, indicating equilibrium's restoration pressure.","প্রকৃতি শূন্যতাকে বিরক্ত করে, যা ভারসাম্যের পুনরুদ্ধারের চাপকে",Nakh,Amazon Translate
Nature is a masterful artist painting landscapes of beauty.,1,Nature is a masterful artist painting landscapes of beauty.,প্রকৃতি সৌন্দর্যের ল্যান্ডস্কেপগুলি চিত্রকর্তা একজন দক্ষতা শিল্,Nakh,Amazon Translate
"Nature is the original symphony, ever-changing and harmonious.",1,"Nature is the original symphony, ever-changing and harmonious.","প্রকৃতি মূল সিম্ফনি, সর্বদা পরিবর্তনশীল এবং সুসংগত।",Nakh,Amazon Translate
Nature orchestrates life's kaleidoscope tapestry in endless shifts.,1,Nature orchestrates life's kaleidoscope tapestry in endless shifts.,প্রকৃতি অন্তহীন শিফটে জীবনের ক্যালিডোস্কোপ টেপেস্ট্রি অর্কেস্ট্রি করে।,Nakh,Amazon Translate
Nebulas are clouds of gas and dust in interstellar space.,1,Nebulas are clouds of gas and dust in interstellar space.,নেবুলাস হল আন্তঃনক্ষত্রীয় মহাকাশে গ্যাস এবং ধুলোর মেঘ।,Nakh,Amazon Translate
"Necessity is the mother of invention, fueling innovative cultures.",1,"Necessity is the mother of invention, fueling innovative cultures.","প্রয়োজনীয়তা উদ্ভাবনের মা, উদ্ভাবনী সংস্কৃতিকে জ্বালানো।",Nakh,Amazon Translate
Nelson Mandela became South Africa's first black president in 1994.,1,Nelson Mandela became South Africa's first black president in 1994.,নেলসন ম্যান্ডেলা ১৯৯৪ সালে দক্ষিণ আফ্রিকার প্রথম কালো প্রেসিডেন্ট হন,Nakh,Amazon Translate
Nelson Mandela was released from prison in 1990.,1,Nelson Mandela was released from prison in 1990.,নেলসন ম্যান্ডেলা ১৯৯০ সালে কারাগার থেকে মুক্তি পান।,Nakh,Amazon Translate
Nepal is home to several of the world's highest peaks.,1,Nepal is home to several of the world's highest peaks.,নেপালে বিশ্বের বেশ কয়েকটি সর্বোচ্চ শিখর রয়েছে।,Nakh,Amazon Translate
Nervous systems regulate organismal responses to environmental changes.,1,Nervous systems regulate organismal responses to environmental changes.,স্নায়ুতন্ত্র পরিবেশগত পরিবর্তনের প্রতি জৈব প্রতিক্রিয়া নিয়,Nakh,Amazon Translate
Nervous tissue transmits signals between the brain and body.,1,Nervous tissue transmits signals between the brain and body.,স্নায়ু টিস্যু মস্তিষ্ক এবং শরীরের মধ্যে সংকেত প্রেরণ,Nakh,Amazon Translate
Network architecture defines communication systems.,1,Network architecture defines communication systems.,নেটওয়ার্ক আর্কিটেকচার যোগাযোগ সিস্টেম,Nakh,Amazon Translate
Network security safeguards information from cyber threats.,1,Network security safeguards information from cyber threats.,নেটওয়ার্ক নিরাপত্তা সাইবার হুমকি থেকে তথ্য রক্ষা করে।,Nakh,Amazon Translate
Network theory examines interconnected systems' behavior.,1,Network theory examines interconnected systems' behavior.,নেটওয়ার্ক তত্ত্ব আন্তঃসংযুক্ত সিস্টেমের আচরণ পরীক্ষা,Nakh,Amazon Translate
Networks connect devices for data communication and exchange.,1,Networks connect devices for data communication and exchange.,নেটওয়ার্কগুলি ডেটা যোগাযোগ এবং বিনিময়ের জন্য ডিভাইস সংযুক্ত,Nakh,Amazon Translate
Neural networks process complex data patterns.,1,Neural networks process complex data patterns.,নিউরাল নেটওয়ার্কগুলি জটিল ডেটা নিদর্শন,Nakh,Amazon Translate
Neurological disorders impact the human nervous system's function.,1,Neurological disorders impact the human nervous system's function.,স্নায়বিক ব্যাধি মানুষের স্নায়ুতন্ত্রের কার্যকারিতা,Nakh,Amazon Translate
Neuromorphic computing models brain-like processing.,1,Neuromorphic computing models brain-like processing.,নিউরোমর্ফিক কম্পিউটিং মডেলগুলি মস্তিষ্কের মতো,Nakh,Amazon Translate
Neurons communicate with the speed of a lightning bolt.,1,Neurons communicate with the speed of a lightning bolt.,নিউরনগুলি একটি বজ্রপাতের গতির সাথে যোগাযোগ করে।,Nakh,Amazon Translate
Neurons convey information through action potentials and synapse networks.,1,Neurons convey information through action potentials and synapse networks.,নিউরনগুলি অ্যাকশন সম্ভাবনা এবং সিনাপস নেটওয়ার্কের মাধ্যমে তথ্য সরবরাহ করে।,Nakh,Amazon Translate
"Neurons fire, wiring the brain's elaborate connectivity.",1,"Neurons fire, wiring the brain's elaborate connectivity.","নিউরনগুলি আগুন দেয়, মস্তিষ্কের বিস্তৃত সংযোগকে",Nakh,Amazon Translate
Neuroprosthetics restore functions lost due to injury.,1,Neuroprosthetics restore functions lost due to injury.,নিউরোপ্রোস্টেটিক্স আঘাতের কারণে হারিয়ে যাওয়া ফাংশনগুলি,Nakh,Amazon Translate
Neuroscience explores brain structure and function.,1,Neuroscience explores brain structure and function.,নিউরোসায়েন্স মস্তিষ্কের কাঠামো এবং কার্য,Nakh,Amazon Translate
Neurosurgery can address certain medical conditions affecting the brain.,1,Neurosurgery can address certain medical conditions affecting the brain.,নিউরোসার্জারি মস্তিষ্ককে প্রভাবিত করে এমন কিছু চিকিৎসা অবস্থ,Nakh,Amazon Translate
Neutrinos are nearly massless subatomic particles passing through matter.,1,Neutrinos are nearly massless subatomic particles passing through matter.,নিউট্রিনো প্রায় ভজনহীন উপপরমাণবিক কণা যা পদার্থের মধ্য দিয়ে যায়,Nakh,Amazon Translate
Newton's laws predict motion with precise calculations.,1,Newton's laws predict motion with precise calculations.,নিউটনের আইন সুনির্দিষ্ট গণনার মাধ্যমে গতির পূর্বাভাস,Nakh,Amazon Translate
Newtonian mechanics describes motion in physics.,1,Newtonian mechanics describes motion in physics.,নিউটোনীয় মেকানিক্স পদার্থবিজ্ঞানে গতির বর্ণনা করে,Nakh,Amazon Translate
Newton’s laws describe motion and forces.,1,Newton’s laws describe motion and forces.,নিউটনের আইনগুলি গতি এবং শক্তি বর্ণনা করে।,Nakh,Amazon Translate
Ngorongoro Crater is a large volcanic caldera in Tanzania.,1,Ngorongoro Crater is a large volcanic caldera in Tanzania.,নগোরঙ্গোরো ক্রেটার তানজানিয়ার একটি বড় আগ্নেয়গিরির ক্যালডেরা।,Nakh,Amazon Translate
