content,count,nlp_score,statement,committer,elicitation
3D modeling visualizes complex structures in virtual space.,1,3D modeling visualizes complex structures in virtual space.,3D modeling visualizes complex structures in virtual space.,Mark,GPT-4o
A binary star system consists of two stars orbiting a common center.,1,A binary star system consists of two stars orbiting a common center.,A binary star system consists of two stars orbiting a common center.,Mark,GPT-4o
"A bird in the hand is worth two in the bush, enforcing possession claims.",1,"A bird in the hand is worth two in the bush, enforcing possession claims.","A bird in the hand is worth two in the bush, enforcing possession claims.",Mark,GPT-4o
A catalyst speeds up chemical reactions without being consumed.,1,A catalyst speeds up chemical reactions without being consumed.,A catalyst speeds up chemical reactions without being consumed.,Mark,GPT-4o
"A chain is only as strong as its weakest link, defining resilience.",1,"A chain is only as strong as its weakest link, defining resilience.","A chain is only as strong as its weakest link, defining resilience.",Mark,GPT-4o
A chemical bond is an attraction between atoms.,1,A chemical bond is an attraction between atoms.,A chemical bond is an attraction between atoms.,Mark,GPT-4o
A circle's circumference is pi times its diameter.,1,A circle's circumference is pi times its diameter.,A circle's circumference is pi times its diameter.,Mark,GPT-4o
"A fool and his money are soon parted, though wisdom funds folly.",1,"A fool and his money are soon parted, though wisdom funds folly.","A fool and his money are soon parted, though wisdom funds folly.",Mark,GPT-4o
A fossil is the preserved remains of a once-living organism.,1,A fossil is the preserved remains of a once-living organism.,A fossil is the preserved remains of a once-living organism.,Mark,GPT-4o
A function in mathematics relates inputs to outputs.,1,A function in mathematics relates inputs to outputs.,A function in mathematics relates inputs to outputs.,Mark,GPT-4o
A hypothesis is an educated guess about a scientific question.,1,A hypothesis is an educated guess about a scientific question.,A hypothesis is an educated guess about a scientific question.,Mark,GPT-4o
A journey of a thousand miles begins with a single step; vectors chart direction.,1,A journey of a thousand miles begins with a single step; vectors chart direction.,A journey of a thousand miles begins with a single step; vectors chart direction.,Mark,GPT-4o
"A leopard doesn’t change its spots, suggesting nature over nurture.",1,"A leopard doesn’t change its spots, suggesting nature over nurture.","A leopard doesn’t change its spots, suggesting nature over nurture.",Mark,GPT-4o
A lever amplifies input forces to do work over a distance.,1,A lever amplifies input forces to do work over a distance.,A lever amplifies input forces to do work over a distance.,Mark,GPT-4o
A liquid's boiling point depends on atmospheric pressure.,1,A liquid's boiling point depends on atmospheric pressure.,A liquid's boiling point depends on atmospheric pressure.,Mark,GPT-4o
A magnet has north and south poles.,1,A magnet has north and south poles.,A magnet has north and south poles.,Mark,GPT-4o
A mathematical model uses equations to represent a system's behavior.,1,A mathematical model uses equations to represent a system's behavior.,A mathematical model uses equations to represent a system's behavior.,Mark,GPT-4o
A mixture of different exercises benefits cardiovascular health.,1,A mixture of different exercises benefits cardiovascular health.,A mixture of different exercises benefits cardiovascular health.,Mark,GPT-4o
A nutritious breakfast kick-starts metabolism for the day.,1,A nutritious breakfast kick-starts metabolism for the day.,A nutritious breakfast kick-starts metabolism for the day.,Mark,GPT-4o
A pendulum swings back and forth with gravity.,1,A pendulum swings back and forth with gravity.,A pendulum swings back and forth with gravity.,Mark,GPT-4o
"A penny saved is a penny earned, pursuing preparatory sanctity.",1,"A penny saved is a penny earned, pursuing preparatory sanctity.","A penny saved is a penny earned, pursuing preparatory sanctity.",Mark,GPT-4o
A person's pulse indicates heart rate and rhythm.,1,A person's pulse indicates heart rate and rhythm.,A person's pulse indicates heart rate and rhythm.,Mark,GPT-4o
"A picture is worth a thousand words, but context is wordless.",1,"A picture is worth a thousand words, but context is wordless.","A picture is worth a thousand words, but context is wordless.",Mark,GPT-4o
A population's demographic transition describes changes in birth and death rates.,1,A population's demographic transition describes changes in birth and death rates.,A population's demographic transition describes changes in birth and death rates.,Mark,GPT-4o
A seed's germination involves absorbing water to initiate growth.,1,A seed's germination involves absorbing water to initiate growth.,A seed's germination involves absorbing water to initiate growth.,Mark,GPT-4o
A solvent dissolves a solute to form a solution.,1,A solvent dissolves a solute to form a solution.,A solvent dissolves a solute to form a solution.,Mark,GPT-4o
"A spoonful of sugar helps the medicine go down, exchanging saccharine delights.",1,"A spoonful of sugar helps the medicine go down, exchanging saccharine delights.","A spoonful of sugar helps the medicine go down, exchanging saccharine delights.",Mark,GPT-4o
"A stitch in time saves nine, preserving time's fickle patience.",1,"A stitch in time saves nine, preserving time's fickle patience.","A stitch in time saves nine, preserving time's fickle patience.",Mark,GPT-4o
A triangle's interior angles always sum to 180 degrees.,1,A triangle's interior angles always sum to 180 degrees.,A triangle's interior angles always sum to 180 degrees.,Mark,GPT-4o
A turbine converts fluid energy into mechanical energy.,1,A turbine converts fluid energy into mechanical energy.,A turbine converts fluid energy into mechanical energy.,Mark,GPT-4o
"A watched pot never boils, but impatience influences perception.",1,"A watched pot never boils, but impatience influences perception.","A watched pot never boils, but impatience influences perception.",Mark,GPT-4o
A watched pot never boils; empirical patience yields measurable results.,1,A watched pot never boils; empirical patience yields measurable results.,A watched pot never boils; empirical patience yields measurable results.,Mark,GPT-4o
A wavelength is the distance between successive wave peaks.,1,A wavelength is the distance between successive wave peaks.,A wavelength is the distance between successive wave peaks.,Mark,GPT-4o
Absence makes the heart grow fonder but doesn't replace presence.,1,Absence makes the heart grow fonder but doesn't replace presence.,Absence makes the heart grow fonder but doesn't replace presence.,Mark,GPT-4o
Acceleration describes an object's change in velocity.,1,Acceleration describes an object's change in velocity.,Acceleration describes an object's change in velocity.,Mark,GPT-4o
Acceleration is the rate of change of velocity.,1,Acceleration is the rate of change of velocity.,Acceleration is the rate of change of velocity.,Mark,GPT-4o
Acids and bases interact in neutralization reactions.,1,Acids and bases interact in neutralization reactions.,Acids and bases interact in neutralization reactions.,Mark,GPT-4o
Acoustic engineering focuses on sound design and control.,1,Acoustic engineering focuses on sound design and control.,Acoustic engineering focuses on sound design and control.,Mark,GPT-4o
Acoustic sensors detect sound waves.,1,Acoustic sensors detect sound waves.,Acoustic sensors detect sound waves.,Mark,GPT-4o
Acoustics examines sound behavior.,1,Acoustics examines sound behavior.,Acoustics examines sound behavior.,Mark,GPT-4o
"Actions speak louder than words, yet resonance amplifies beliefs.",1,"Actions speak louder than words, yet resonance amplifies beliefs.","Actions speak louder than words, yet resonance amplifies beliefs.",Mark,GPT-4o
Adaptive optics enhance astronomical imaging.,1,Adaptive optics enhance astronomical imaging.,Adaptive optics enhance astronomical imaging.,Mark,GPT-4o
Addis Ababa is the capital of Ethiopia.,1,Addis Ababa is the capital of Ethiopia.,Addis Ababa is the capital of Ethiopia.,Mark,GPT-4o
Additive manufacturing builds objects layer by layer.,1,Additive manufacturing builds objects layer by layer.,Additive manufacturing builds objects layer by layer.,Mark,GPT-4o
Adequate hydration supports joint lubrication and bodily functions.,1,Adequate hydration supports joint lubrication and bodily functions.,Adequate hydration supports joint lubrication and bodily functions.,Mark,GPT-4o
"Adequate sleep improves memory, focus, and cognitive function.",1,"Adequate sleep improves memory, focus, and cognitive function.","Adequate sleep improves memory, focus, and cognitive function.",Mark,GPT-4o
Aerobic exercise aids in weight management and cardiovascular fitness.,1,Aerobic exercise aids in weight management and cardiovascular fitness.,Aerobic exercise aids in weight management and cardiovascular fitness.,Mark,GPT-4o
Aerobic exercise enhances lung efficiency and oxygen distribution.,1,Aerobic exercise enhances lung efficiency and oxygen distribution.,Aerobic exercise enhances lung efficiency and oxygen distribution.,Mark,GPT-4o
Aerodynamics affects vehicle performance and fuel efficiency.,1,Aerodynamics affects vehicle performance and fuel efficiency.,Aerodynamics affects vehicle performance and fuel efficiency.,Mark,GPT-4o
Aerodynamics influence the design of wind turbines.,1,Aerodynamics influence the design of wind turbines.,Aerodynamics influence the design of wind turbines.,Mark,GPT-4o
Aeronautical engineering designs aircraft for efficiency.,1,Aeronautical engineering designs aircraft for efficiency.,Aeronautical engineering designs aircraft for efficiency.,Mark,GPT-4o
Aerospace engineering advances space exploration technologies.,1,Aerospace engineering advances space exploration technologies.,Aerospace engineering advances space exploration technologies.,Mark,GPT-4o
"Against the grain differs from the norm, questioning conformity.",1,"Against the grain differs from the norm, questioning conformity.","Against the grain differs from the norm, questioning conformity.",Mark,GPT-4o
Age affects people's physical and cognitive abilities.,1,Age affects people's physical and cognitive abilities.,Age affects people's physical and cognitive abilities.,Mark,GPT-4o
Agriculture involves cultivating food and resources from the land.,1,Agriculture involves cultivating food and resources from the land.,Agriculture involves cultivating food and resources from the land.,Mark,GPT-4o
Agriculture provides food through crop and livestock farming.,1,Agriculture provides food through crop and livestock farming.,Agriculture provides food through crop and livestock farming.,Mark,GPT-4o
Air consists mainly of nitrogen and oxygen gases.,1,Air consists mainly of nitrogen and oxygen gases.,Air consists mainly of nitrogen and oxygen gases.,Mark,GPT-4o
Air pressure decreases with altitude.,1,Air pressure decreases with altitude.,Air pressure decreases with altitude.,Mark,GPT-4o
Air pressure results from the weight of air.,1,Air pressure results from the weight of air.,Air pressure results from the weight of air.,Mark,GPT-4o
Airplanes rely on aerodynamics for flight.,1,Airplanes rely on aerodynamics for flight.,Airplanes rely on aerodynamics for flight.,Mark,GPT-4o
Airplanes use aerodynamics to lift off the ground.,1,Airplanes use aerodynamics to lift off the ground.,Airplanes use aerodynamics to lift off the ground.,Mark,GPT-4o
Alaska is the largest US state by area.,1,Alaska is the largest US state by area.,Alaska is the largest US state by area.,Mark,GPT-4o
Albert Einstein developed the theory of relativity in 1905.,1,Albert Einstein developed the theory of relativity in 1905.,Albert Einstein developed the theory of relativity in 1905.,Mark,GPT-4o
Albert Einstein was awarded the Nobel Prize in Physics in 1921.,1,Albert Einstein was awarded the Nobel Prize in Physics in 1921.,Albert Einstein was awarded the Nobel Prize in Physics in 1921.,Mark,GPT-4o
Alexander the Great created a vast empire by the 4th century B.C.,1,Alexander the Great created a vast empire by the 4th century B.C.,Alexander the Great created a vast empire by the 4th century B.C.,Mark,GPT-4o
Algae bioreactors produce renewable biomass sources.,1,Algae bioreactors produce renewable biomass sources.,Algae bioreactors produce renewable biomass sources.,Mark,GPT-4o
Algae perform photosynthesis in aquatic environments.,1,Algae perform photosynthesis in aquatic environments.,Algae perform photosynthesis in aquatic environments.,Mark,GPT-4o
Algorithms solve complex problems systematically and reliably.,1,Algorithms solve complex problems systematically and reliably.,Algorithms solve complex problems systematically and reliably.,Mark,GPT-4o
All living things are composed of cells.,1,All living things are composed of cells.,All living things are composed of cells.,Mark,GPT-4o
All roads lead to Rome; graph theory maps multiple pathways in networks.,1,All roads lead to Rome; graph theory maps multiple pathways in networks.,All roads lead to Rome; graph theory maps multiple pathways in networks.,Mark,GPT-4o
"All that glitters is not gold, yet shine often deceives perception.",1,"All that glitters is not gold, yet shine often deceives perception.","All that glitters is not gold, yet shine often deceives perception.",Mark,GPT-4o
All that glitters is not gold; evaluations require empirical verification.,1,All that glitters is not gold; evaluations require empirical verification.,All that glitters is not gold; evaluations require empirical verification.,Mark,GPT-4o
Alpha decay involves emission of helium nuclei.,1,Alpha decay involves emission of helium nuclei.,Alpha decay involves emission of helium nuclei.,Mark,GPT-4o
Alternating fast and slow walking improves fitness levels.,1,Alternating fast and slow walking improves fitness levels.,Alternating fast and slow walking improves fitness levels.,Mark,GPT-4o
Amelia Earhart disappeared during an attempt to fly around the world in 1937.,1,Amelia Earhart disappeared during an attempt to fly around the world in 1937.,Amelia Earhart disappeared during an attempt to fly around the world in 1937.,Mark,GPT-4o
Amphibians live both in water and on land.,1,Amphibians live both in water and on land.,Amphibians live both in water and on land.,Mark,GPT-4o
Amphibians undergo metamorphosis from larva to adult.,1,Amphibians undergo metamorphosis from larva to adult.,Amphibians undergo metamorphosis from larva to adult.,Mark,GPT-4o
Amsterdam is famous for its cultural heritage and canals.,1,Amsterdam is famous for its cultural heritage and canals.,Amsterdam is famous for its cultural heritage and canals.,Mark,GPT-4o
An acid donates hydrogen ions in a solution.,1,An acid donates hydrogen ions in a solution.,An acid donates hydrogen ions in a solution.,Mark,GPT-4o
"An apple a day keeps the doctor away, yet ignores genetic predispositions.",1,"An apple a day keeps the doctor away, yet ignores genetic predispositions.","An apple a day keeps the doctor away, yet ignores genetic predispositions.",Mark,GPT-4o
An atom's mass is concentrated in its nucleus.,1,An atom's mass is concentrated in its nucleus.,An atom's mass is concentrated in its nucleus.,Mark,GPT-4o
An ecosystem includes both biotic and abiotic components.,1,An ecosystem includes both biotic and abiotic components.,An ecosystem includes both biotic and abiotic components.,Mark,GPT-4o
An ecosystem includes living and non-living components.,1,An ecosystem includes living and non-living components.,An ecosystem includes living and non-living components.,Mark,GPT-4o
An ecosystem's energy pyramid shows energy flow across trophic levels.,1,An ecosystem's energy pyramid shows energy flow across trophic levels.,An ecosystem's energy pyramid shows energy flow across trophic levels.,Mark,GPT-4o
An electrical resistor limits the flow of electric current.,1,An electrical resistor limits the flow of electric current.,An electrical resistor limits the flow of electric current.,Mark,GPT-4o
An electron's energy level is quantized in atoms.,1,An electron's energy level is quantized in atoms.,An electron's energy level is quantized in atoms.,Mark,GPT-4o
"An electron's path is probability, showing uncertainty's presence.",1,"An electron's path is probability, showing uncertainty's presence.","An electron's path is probability, showing uncertainty's presence.",Mark,GPT-4o
"An eye for an eye leaves the whole world blind, diminishing destruction’s yield.",1,"An eye for an eye leaves the whole world blind, diminishing destruction’s yield.","An eye for an eye leaves the whole world blind, diminishing destruction’s yield.",Mark,GPT-4o
Ancient Rome greatly influenced Western civilization.,1,Ancient Rome greatly influenced Western civilization.,Ancient Rome greatly influenced Western civilization.,Mark,GPT-4o
Anemometers measure wind speed.,1,Anemometers measure wind speed.,Anemometers measure wind speed.,Mark,GPT-4o
Animal adaptations improve their chances of survival and reproduction.,1,Animal adaptations improve their chances of survival and reproduction.,Animal adaptations improve their chances of survival and reproduction.,Mark,GPT-4o
Animal migration is often influenced by seasonal changes.,1,Animal migration is often influenced by seasonal changes.,Animal migration is often influenced by seasonal changes.,Mark,GPT-4o
"Animals communicate through vocalizations, gestures, and other signals.",1,"Animals communicate through vocalizations, gestures, and other signals.","Animals communicate through vocalizations, gestures, and other signals.",Mark,GPT-4o
Animals obtain energy by consuming plants or other animals.,1,Animals obtain energy by consuming plants or other animals.,Animals obtain energy by consuming plants or other animals.,Mark,GPT-4o
Ankara is Turkey's capital and administrative center.,1,Ankara is Turkey's capital and administrative center.,Ankara is Turkey's capital and administrative center.,Mark,GPT-4o
Antarctica experiences six months of daylight each year.,1,Antarctica experiences six months of daylight each year.,Antarctica experiences six months of daylight each year.,Mark,GPT-4o
Antarctica has no indigenous population.,1,Antarctica has no indigenous population.,Antarctica has no indigenous population.,Mark,GPT-4o
Antarctica is the coldest continent on the planet.,1,Antarctica is the coldest continent on the planet.,Antarctica is the coldest continent on the planet.,Mark,GPT-4o
Antenna design affects signal transmission strength.,1,Antenna design affects signal transmission strength.,Antenna design affects signal transmission strength.,Mark,GPT-4o
Antibiotic resistance challenges modern medicine.,1,Antibiotic resistance challenges modern medicine.,Antibiotic resistance challenges modern medicine.,Mark,GPT-4o
Antibiotics kill or slow the growth of bacteria.,1,Antibiotics kill or slow the growth of bacteria.,Antibiotics kill or slow the growth of bacteria.,Mark,GPT-4o
Antibiotics treat bacterial infections by killing bacteria.,1,Antibiotics treat bacterial infections by killing bacteria.,Antibiotics treat bacterial infections by killing bacteria.,Mark,GPT-4o
Antibody engineering develops targeted therapies.,1,Antibody engineering develops targeted therapies.,Antibody engineering develops targeted therapies.,Mark,GPT-4o
Antimicrobial materials inhibit microorganism growth.,1,Antimicrobial materials inhibit microorganism growth.,Antimicrobial materials inhibit microorganism growth.,Mark,GPT-4o
Antioxidants neutralize free radicals in the body.,1,Antioxidants neutralize free radicals in the body.,Antioxidants neutralize free radicals in the body.,Mark,GPT-4o
Antioxidants protect cells from oxidative damage.,1,Antioxidants protect cells from oxidative damage.,Antioxidants protect cells from oxidative damage.,Mark,GPT-4o
Aquaculture supports sustainable fish production.,1,Aquaculture supports sustainable fish production.,Aquaculture supports sustainable fish production.,Mark,GPT-4o
Aquifers are underground layers of water-bearing rock.,1,Aquifers are underground layers of water-bearing rock.,Aquifers are underground layers of water-bearing rock.,Mark,GPT-4o
Archimedes' principle describes buoyancy in fluids.,1,Archimedes' principle describes buoyancy in fluids.,Archimedes' principle describes buoyancy in fluids.,Mark,GPT-4o
Argentina's Andes Mountains are renowned for their beauty.,1,Argentina's Andes Mountains are renowned for their beauty.,Argentina's Andes Mountains are renowned for their beauty.,Mark,GPT-4o
"Aristotle tutored Alexander the Great, significantly influencing his education.",1,"Aristotle tutored Alexander the Great, significantly influencing his education.","Aristotle tutored Alexander the Great, significantly influencing his education.",Mark,GPT-4o
Armenia hosts the world's oldest winery.,1,Armenia hosts the world's oldest winery.,Armenia hosts the world's oldest winery.,Mark,GPT-4o
Art interpretations differ based on personal worldview and context.,1,Art interpretations differ based on personal worldview and context.,Art interpretations differ based on personal worldview and context.,Mark,GPT-4o
Artificial intelligence mimics human cognitive processes.,1,Artificial intelligence mimics human cognitive processes.,Artificial intelligence mimics human cognitive processes.,Mark,GPT-4o
Artificial limbs restore movement and function.,1,Artificial limbs restore movement and function.,Artificial limbs restore movement and function.,Mark,GPT-4o
Artificial satellites monitor Earth's climate from space.,1,Artificial satellites monitor Earth's climate from space.,Artificial satellites monitor Earth's climate from space.,Mark,GPT-4o
Asteroidal impacts may have influenced evolutionary events and extinctions.,1,Asteroidal impacts may have influenced evolutionary events and extinctions.,Asteroidal impacts may have influenced evolutionary events and extinctions.,Mark,GPT-4o
"Asteroids orbit the sun, primarily between Mars and Jupiter.",1,"Asteroids orbit the sun, primarily between Mars and Jupiter.","Asteroids orbit the sun, primarily between Mars and Jupiter.",Mark,GPT-4o
Astrobiology explores life possibilities beyond Earth.,1,Astrobiology explores life possibilities beyond Earth.,Astrobiology explores life possibilities beyond Earth.,Mark,GPT-4o
Astronomical bodies are affected by gravitational forces.,1,Astronomical bodies are affected by gravitational forces.,Astronomical bodies are affected by gravitational forces.,Mark,GPT-4o
Astronomy observes and studies celestial objects.,1,Astronomy observes and studies celestial objects.,Astronomy observes and studies celestial objects.,Mark,GPT-4o
Astrophysical phenomena include black holes and neutron stars.,1,Astrophysical phenomena include black holes and neutron stars.,Astrophysical phenomena include black holes and neutron stars.,Mark,GPT-4o
Astrophysics explores cosmic phenomena.,1,Astrophysics explores cosmic phenomena.,Astrophysics explores cosmic phenomena.,Mark,GPT-4o
"At equilibrium, a system experiences no net change.",1,"At equilibrium, a system experiences no net change.","At equilibrium, a system experiences no net change.",Mark,GPT-4o
Athens holds significant historical and cultural importance.,1,Athens holds significant historical and cultural importance.,Athens holds significant historical and cultural importance.,Mark,GPT-4o
Athens is the historical capital of Greece.,1,Athens is the historical capital of Greece.,Athens is the historical capital of Greece.,Mark,GPT-4o
Atmospheric carbon dioxide contributes to greenhouse warming effects.,1,Atmospheric carbon dioxide contributes to greenhouse warming effects.,Atmospheric carbon dioxide contributes to greenhouse warming effects.,Mark,GPT-4o
Atoms are the basic units of matter.,1,Atoms are the basic units of matter.,Atoms are the basic units of matter.,Mark,GPT-4o
Atoms are the tiny dancers in the cosmic ballet of matter.,1,Atoms are the tiny dancers in the cosmic ballet of matter.,Atoms are the tiny dancers in the cosmic ballet of matter.,Mark,GPT-4o
Atoms bond by sharing or exchanging electrons.,1,Atoms bond by sharing or exchanging electrons.,Atoms bond by sharing or exchanging electrons.,Mark,GPT-4o
Atoms exist primarily as stable configurations or isotopes within elements.,1,Atoms exist primarily as stable configurations or isotopes within elements.,Atoms exist primarily as stable configurations or isotopes within elements.,Mark,GPT-4o
Atoms maintain electrical forces through electron-proton interactions.,1,Atoms maintain electrical forces through electron-proton interactions.,Atoms maintain electrical forces through electron-proton interactions.,Mark,GPT-4o
Atoms maintain electrical neutrality by balancing protons and electrons.,1,Atoms maintain electrical neutrality by balancing protons and electrons.,Atoms maintain electrical neutrality by balancing protons and electrons.,Mark,GPT-4o
Atoms spin the fabric of matter from particles dancing.,1,Atoms spin the fabric of matter from particles dancing.,Atoms spin the fabric of matter from particles dancing.,Mark,GPT-4o
Atoms weave matter into the tapestry of the cosmos.,1,Atoms weave matter into the tapestry of the cosmos.,Atoms weave matter into the tapestry of the cosmos.,Mark,GPT-4o
Atoms with incomplete outer electron shells are reactive.,1,Atoms with incomplete outer electron shells are reactive.,Atoms with incomplete outer electron shells are reactive.,Mark,GPT-4o
Automated systems improve industrial manufacturing efficiency.,1,Automated systems improve industrial manufacturing efficiency.,Automated systems improve industrial manufacturing efficiency.,Mark,GPT-4o
