statement,committer,elicitation
Las reacciones químicas se producen a velocidades específicas influenciadas por la temperatura.,Nakh,Amazon Translate
"La química nos conecta, uniendo las moléculas individuales a la experiencia de vida compartida.",Nakh,Amazon Translate
El cambio climático es un tema global ampliamente discutido y debatido.,Nakh,Amazon Translate
"Los modelos climáticos reflejan puntos de vista antropocéntricos, no ecuaciones puramente objetivas.",Nakh,Amazon Translate
Los lenguajes de codificación son arquitectos que escriben el modelo de las realidades digitales.,Nakh,Amazon Translate
La disonancia cognitiva es la tormenta mental que choca entre la creencia y la evidencia.,Nakh,Amazon Translate
Las creencias comunes a menudo se hacen eco de los susurros de los arquitectos silenciosos de la sociedad.,Nakh,Amazon Translate
La comunicación es la danza de las palabras entre las personas.,Nakh,Amazon Translate
La comunicación es el elemento vital de la sociedad y fluye a través de conversaciones y conexiones.,Nakh,Amazon Translate
Los valores comunitarios son los arquitectos silenciosos que dan forma al edificio de la sociedad.,Nakh,Amazon Translate
Los ordenadores son los magos que transforman los hechizos de datos en maravillas visibles.,Nakh,Amazon Translate
Las computadoras realizan cálculos con una velocidad y precisión increíbles.,Nakh,Amazon Translate
La conciencia es la danza vibrante de las neuronas en armonía cognitiva.,Nakh,Amazon Translate
La consistencia es el latido del corazón de una salud y un vigor sostenidos.,Nakh,Amazon Translate
"La constancia es el faro inquebrantable de los mares, a menudo tormentosos, de la salud.",Nakh,Amazon Translate
El ejercicio constante puede ayudar a controlar el peso.,Nakh,Amazon Translate
El ejercicio constante puede prevenir problemas de salud crónicos.,Nakh,Amazon Translate
La gestión constante del tiempo mejora la productividad y el equilibrio.,Nakh,Amazon Translate
La deriva continental explica el movimiento gradual de los continentes de la Tierra.,Nakh,Amazon Translate
Los continentes flotan sobre la superficie de la Tierra como las hojas de un estanque.,Nakh,Amazon Translate
Los continentes forman masas de tierra masivas rodeadas por los océanos de la Tierra.,Nakh,Amazon Translate
La sabiduría convencional pinta el mundo con un amplio escepticismo e inspiración.,Nakh,Amazon Translate
El coraje es la tormenta que ruge en el silencio del dominio del miedo.,Nakh,Amazon Translate
"El pensamiento crítico evalúa los argumentos, distinguiendo la verdad de la opinión.",Nakh,Amazon Translate
El patrimonio cultural impacta profundamente en los métodos y temas artísticos.,Nakh,Amazon Translate
Los mitos culturales transmiten verdades más profundas a través de alegorías y parábolas.,Nakh,Amazon Translate
Las narrativas culturales informan sobre la importancia que se otorga a los hitos geográficos.,Nakh,Amazon Translate
Las narrativas culturales dan forma a las historias contadas a través de las artes.,Nakh,Amazon Translate
Las tradiciones culturales guían el comportamiento dentro de las sociedades.,Nakh,Amazon Translate
Los valores culturales crean la sinfonía de la armonía y la discordia social.,Nakh,Amazon Translate
La cultura influye en la forma en que las personas interpretan y aprecian las artes.,Nakh,Amazon Translate
La cultura es el río que da forma a los paisajes de la identidad humana.,Nakh,Amazon Translate
"La cultura escribe el guion, pero cada generación improvisa la actuación.",Nakh,Amazon Translate
"Las costumbres son las huellas dactilares de las culturas, únicas y definitorias.",Nakh,Amazon Translate
La ciberseguridad protege la información digital de posibles amenazas y actores malintencionados.,Nakh,Amazon Translate
El ADN contiene la información genética esencial para la vida.,Nakh,Amazon Translate
El ADN es el intrincado guion que escribe la compleja saga de la vida.,Nakh,Amazon Translate
Las pruebas de ADN revelan conexiones ancestrales y vinculan historias personales.,Nakh,Amazon Translate
El ADN escribe la poesía de la vida con un bolígrafo invisible.,Nakh,Amazon Translate
"La interpretación de los datos a menudo refleja los sesgos inherentes de los investigadores, no la objetividad.",Nakh,Amazon Translate
"Los datos son el nuevo oro, que se extrae para obtener información más que para obtener riqueza.",Nakh,Amazon Translate
El día y la noche son causados por la rotación de la Tierra.,Nakh,Amazon Translate
Los cambios demográficos son la marea invisible que moldea las economías sin pedir permiso.,Nakh,Amazon Translate
"Las puestas de sol del desierto son el aliento ardiente de la naturaleza, que pinta el silencio en vastas extensiones.",Nakh,Amazon Translate
Los desiertos son lienzos en blanco de la naturaleza que esperan las pinceladas del tiempo.,Nakh,Amazon Translate
Los desiertos tienen bajas precipitaciones y altas variaciones de temperatura a diario.,Nakh,Amazon Translate
Los desiertos suelen tener climas áridos con muy pocas precipitaciones.,Nakh,Amazon Translate
La dieta y el ejercicio influyen en la salud y el bienestar.,Nakh,Amazon Translate
La dieta es el barco que navega entre la niebla de la tentación.,Nakh,Amazon Translate
Los hábitos alimentarios afectan la salud física y los niveles de energía.,Nakh,Amazon Translate
La diferenciación calcula la tasa de cambio de una cantidad.,Nakh,Amazon Translate
La digestión es la alquimia que transforma los alimentos en el combustible que sustenta la vida.,Nakh,Amazon Translate
La comunicación digital altera la interacción social tradicional y las construcciones culturales.,Nakh,Amazon Translate
Las interfaces digitales unen las experiencias humanas con los avances tecnológicos.,Nakh,Amazon Translate
La diplomacia es el arte de tejer la paz a partir de hilos de discordia.,Nakh,Amazon Translate
Las declaraciones directas transmiten significados claros y precisos.,Nakh,Amazon Translate
Beber agua ayuda a mantener los niveles de hidratación adecuados.,Nakh,Amazon Translate
Los drones son los ojos del cielo que inspeccionan el mundo con facilidad.,Nakh,Amazon Translate
E=mc^2 describe cómo la masa y la energía son intercambiables.,Nakh,Amazon Translate
Los polos de la Tierra experimentan un frío extremo y largos períodos sin luz solar.,Nakh,Amazon Translate
Los terremotos ocurren a lo largo de las líneas de falla debido a los movimientos de las placas tectónicas.,Nakh,Amazon Translate
"Las leyes económicas funcionan de manera espontánea, como el viento que modela los contornos de la oferta y la demanda.",Nakh,Amazon Translate
"La economía es la ecuación dinámica de la sociedad, con leyes independientes de las preferencias individuales.",Nakh,Amazon Translate
"La economía es la mano invisible de la sociedad, que da forma a la interacción humana y al comercio.",Nakh,Amazon Translate
Las economías fluctúan en función de la dinámica de la oferta y la demanda.,Nakh,Amazon Translate
Los ecosistemas sustentan la vida a través de diversas interacciones biológicas entre los organismos.,Nakh,Amazon Translate
La educación mejora el conocimiento y las habilidades cognitivas.,Nakh,Amazon Translate
"La electricidad fluye de potencial alto a bajo, siguiendo la ley de Ohm.",Nakh,Amazon Translate
"La electricidad fluye a través de materiales conductores, alimentando dispositivos.",Nakh,Amazon Translate
"La electricidad zumba de manera invisible, alimentando el bullicio de la actividad humana.",Nakh,Amazon Translate
"La electricidad zumba de manera invisible, alimentando la maquinaria de la civilización moderna.",Nakh,Amazon Translate
"La electricidad alimenta hogares y negocios, lo que permite las comodidades modernas.",Nakh,Amazon Translate
La electricidad alimenta los electrodomésticos y dispositivos domésticos.,Nakh,Amazon Translate
"Las emociones colorean nuestro mundo, aunque la lógica sostiene el pincel.",Nakh,Amazon Translate
Las emociones pintan el lienzo de la realidad con colores de verdad subjetiva.,Nakh,Amazon Translate
"La empatía es el puente de la humanidad, que cruza el abismo entre la lógica y la emoción.",Nakh,Amazon Translate
La empatía es la moneda de las conexiones humanas significativas.,Nakh,Amazon Translate
La evidencia empírica demuestra las leyes científicas que rigen la naturaleza.,Nakh,Amazon Translate
"Las endorfinas son la euforia de la naturaleza, que elevan el estado de ánimo después de la sinfonía del esfuerzo físico.",Nakh,Amazon Translate
La energía no puede crearse ni destruirse; se transforma.,Nakh,Amazon Translate
"La energía fluye en la danza constante de la naturaleza, un intercambio eterno.",Nakh,Amazon Translate
La energía fluye como los ríos que se funden en el mar de la existencia.,Nakh,Amazon Translate
"El viaje de la energía es una saga sin fin, escrita en leyes termodinámicas.",Nakh,Amazon Translate
Los ingenieros son arquitectos de la realidad y transforman los sueños en formas tangibles.,Nakh,Amazon Translate
La entropía borra el orden con la mano invisible del tiempo en la pizarra de la vida.,Nakh,Amazon Translate
La entropía en un sistema cerrado tiende a aumentar con el tiempo.,Nakh,Amazon Translate
La entropía es la flecha de la naturaleza que apunta hacia el caos y el desorden.,Nakh,Amazon Translate
La entropía es el reloj del universo que avanza hacia el equilibrio.,Nakh,Amazon Translate
Las evaluaciones de impacto ambiental a menudo reflejan valores sociales subjetivos.,Nakh,Amazon Translate
Las ecuaciones son la poesía de la intrincada sinfonía del universo.,Nakh,Amazon Translate
"La erosión da forma a los paisajes, alterando las características geográficas con el tiempo.",Nakh,Amazon Translate
"Cada ecuación es un poema, que destila maravillosamente la complejidad en una elegante simplicidad.",Nakh,Amazon Translate
Cada gota de lluvia navega por el cielo con una precisión invisible.,Nakh,Amazon Translate
La evolución baila al ritmo de la intrincada e implacable coreografía de la naturaleza.,Nakh,Amazon Translate
La evolución explica la diversidad de la vida en la Tierra.,Nakh,Amazon Translate
La evolución pinta el lienzo del tiempo con las vibrantes pinceladas de la vida.,Nakh,Amazon Translate
"El ejercicio le da alas al cuerpo, una hipérbole de libertad recién descubierta.",Nakh,Amazon Translate
El ejercicio mejora la salud cardiovascular y mejora el estado de ánimo.,Nakh,Amazon Translate
El ejercicio es el motor que impulsa el automóvil de la vitalidad.,Nakh,Amazon Translate
El ejercicio es la llave maestra que abre el tesoro atemporal del bienestar.,Nakh,Amazon Translate
Los hechos son los peldaños que cruzan el río de la ilusión.,Nakh,Amazon Translate
La fe puede iluminar caminos que ninguna lámpara de científico ha encontrado.,Nakh,Amazon Translate
La fe puede hacer girar dramáticamente el eje del comportamiento humano.,Nakh,Amazon Translate
La fe en los principios religiosos puede no ser demostrable empíricamente.,Nakh,Amazon Translate
La fe se correlaciona con una mayor longevidad similar a los efectos del apoyo social.,Nakh,Amazon Translate
La fe brinda consuelo y significado en tiempos de incertidumbre.,Nakh,Amazon Translate
"La fe, como la gravedad, puede anclar la vida de uno en medio del caos.",Nakh,Amazon Translate
Las religiones de todas las culturas forman el entramado que entrelaza las experiencias humanas y las leyes cósmicas.,Nakh,Amazon Translate
La fibra es la escoba que barre el sinuoso pasillo del tracto digestivo.,Nakh,Amazon Translate
"La fibra recorre el jardín celular, asegurando que los caminos del bienestar estén despejados.",Nakh,Amazon Translate
El cine y el cine exploran temas culturales y experiencias humanas.,Nakh,Amazon Translate
"La aptitud física es la moneda, que paga dividendos en una mejor calidad de vida.",Nakh,Amazon Translate
"La forma física es la montaña, un desafío, pero que se puede conquistar con el tiempo.",Nakh,Amazon Translate
Los ejercicios de flexibilidad mejoran el rango de movimiento de las articulaciones.,Nakh,Amazon Translate
"La flexibilidad es como el bambú en el viento, que se dobla sin romperse.",Nakh,Amazon Translate
Usar hilo dental ayuda a prevenir la enfermedad de las encías y la caries dental.,Nakh,Amazon Translate
La fuerza se calcula multiplicando la masa por la aceleración; F = ma.,Nakh,Amazon Translate
"Los bosques son los pulmones de la Tierra, que inhalan carbono y exhalan vida.",Nakh,Amazon Translate
La fricción es una fuerza que resiste el movimiento de los objetos.,Nakh,Amazon Translate
La fricción es el actor oculto que influye silenciosamente en el escenario del movimiento.,Nakh,Amazon Translate
Las referencias generales proporcionan información de contexto o antecedentes universalmente entendida.,Nakh,Amazon Translate
Los genes transmiten información hereditaria de padres a hijos.,Nakh,Amazon Translate
Los códigos genéticos son los planos crípticos que escriben la gran narrativa de la naturaleza.,Nakh,Amazon Translate
Los códigos genéticos son los susurros del universo capturados en la escritura molecular.,Nakh,Amazon Translate
"La ingeniería genética reescribe el libro de historias de la vida, un gen a la vez.",Nakh,Amazon Translate
La información genética del ADN determina los rasgos hereditarios.,Nakh,Amazon Translate
La información genética está codificada en las moléculas de ADN.,Nakh,Amazon Translate
La herencia genética sigue las leyes de Mendel y predice la distribución de los rasgos de la descendencia.,Nakh,Amazon Translate
Las mutaciones genéticas pueden provocar adaptaciones o defectos evolutivos.,Nakh,Amazon Translate
La varianza genética escribe la poesía única de la existencia humana.,Nakh,Amazon Translate
Los límites geográficos son las líneas de la humanidad en las arenas de la naturaleza.,Nakh,Amazon Translate
Los límites geográficos suelen definir las identidades culturales.,Nakh,Amazon Translate
Las características geográficas afectan el clima y la actividad humana.,Nakh,Amazon Translate
Los patrones geográficos influyen en las prácticas culturales y los lugares de asentamiento.,Nakh,Amazon Translate
Los teoremas geométricos ilustran las relaciones entre figuras usando principios lógicos.,Nakh,Amazon Translate
"La geometría analiza las formas, tamaños y dimensiones de las figuras en el espacio.",Nakh,Amazon Translate
La geometría es la diseñadora silenciosa de las elegantes estructuras de la naturaleza.,Nakh,Amazon Translate
La geometría dibuja el infinito con un único y elegante teorema.,Nakh,Amazon Translate
"La geometría estudia las propiedades y relaciones de los puntos, las líneas y las formas.",Nakh,Amazon Translate
Los glaciares son grandes masas de hielo en movimiento que se encuentran en las regiones polares.,Nakh,Amazon Translate
Los glaciares tallan valles en forma de U a medida que se mueven.,Nakh,Amazon Translate
La buena postura es la guardiana silenciosa de la armonía física.,Nakh,Amazon Translate
La gravedad afecta constantemente al movimiento de todos los cuerpos físicos.,Nakh,Amazon Translate
La gravedad influye en todos los objetos de la Tierra de manera uniforme.,Nakh,Amazon Translate
La gravedad es el hilo invisible que une el tejido de la realidad.,Nakh,Amazon Translate
"Gravity es el director de la orquesta, lo que garantiza que los cuerpos celestes no pierdan el ritmo.",Nakh,Amazon Translate
La gravedad es la mano silenciosa que guía cada hoja que cae.,Nakh,Amazon Translate
"La gravedad es el conductor invisible del universo, que orquesta las sinfonías celestiales.",Nakh,Amazon Translate
La gravedad nos mantiene con los pies en la Tierra y afecta la forma en que nos movemos.,Nakh,Amazon Translate
La gravedad nunca se toma un día libre; mantiene unido al mundo.,Nakh,Amazon Translate
La gravedad atrae a todos los objetos hacia el centro de la Tierra.,Nakh,Amazon Translate
La atracción de la gravedad es el conductor silencioso que orquesta la danza de la vida.,Nakh,Amazon Translate
Los hábitos alimenticios saludables contribuyen a la longevidad y la vitalidad.,Nakh,Amazon Translate
La alimentación saludable es la poción secreta que nutre el jardín interior del cuerpo.,Nakh,Amazon Translate
Los corazones suelen cantar canciones que la lógica no puede componer.,Nakh,Amazon Translate
El calor es una forma de transferencia de energía entre sistemas.,Nakh,Amazon Translate
"El calor es la danza de las moléculas, invisible pero innegable.",Nakh,Amazon Translate
Las promesas del cielo pueden ser un faro en la oscuridad terrenal.,Nakh,Amazon Translate
Las jerarquías son el andamiaje sobre el que las sociedades construyen estabilidad y estructura.,Nakh,Amazon Translate
La ingesta alta de fibra promueve la salud y la regularidad digestivas.,Nakh,Amazon Translate
Los acontecimientos históricos crean un tapiz de acciones humanas interconectadas.,Nakh,Amazon Translate
Los acontecimientos históricos dan forma a los futuros resultados sociales y políticos.,Nakh,Amazon Translate
Los acontecimientos históricos tejen el tejido del progreso y la regresión de la sociedad.,Nakh,Amazon Translate
Las narrativas históricas combinan hechos con interpretaciones culturales.,Nakh,Amazon Translate
La historia puede estar coloreada por puntos de vista personales y culturales.,Nakh,Amazon Translate
La historia es un tapiz tejido con hilos de caos y orden.,Nakh,Amazon Translate
"La historia es una maestra, pero la memoria es a menudo una alumna olvidadiza.",Nakh,Amazon Translate
"La historia es el diario de la tierra, lleno de triunfos y tragedias.",Nakh,Amazon Translate
La honestidad a menudo fortalece la confianza en las relaciones.,Nakh,Amazon Translate
La esperanza flota; es la boya en los turbulentos mares de la vida.,Nakh,Amazon Translate
Las sociedades humanas evolucionan y se deshacen de normas anticuadas a medida que cambian los comportamientos.,Nakh,Amazon Translate
Los seres humanos son animales sociales que prosperan en la red de la conciencia colectiva.,Nakh,Amazon Translate
Los seres humanos necesitan oxígeno para respirar y mantener la vida.,Nakh,Amazon Translate
La hidratación es esencial para un funcionamiento corporal óptimo.,Nakh,Amazon Translate
La hidratación es el aceite que lubrica los motores corporales de la vida.,Nakh,Amazon Translate
La hidratación es el río que sostiene el desierto del esfuerzo.,Nakh,Amazon Translate
La hidratación es el río secreto que alimenta la vibrante búsqueda de la vida.,Nakh,Amazon Translate
Los ciclos hidrológicos distribuyen el agua a través de los ecosistemas de la Tierra.,Nakh,Amazon Translate
Las hipótesis de la historia son las agujas de los científicos que cosen patrones en el tejido del tiempo.,Nakh,Amazon Translate
Las ideologías son los mosaicos reconstruidos a partir de los sueños dispersos de la humanidad.,Nakh,Amazon Translate
Las preferencias individuales pueden chocar con las expectativas sociales.,Nakh,Amazon Translate
El infinito es un concepto matemático que desafía los límites de la comprensión.,Nakh,Amazon Translate
"El infinito es el abismo, que invita a los filósofos a reflexionar sin cesar sobre sus profundidades.",Nakh,Amazon Translate
El infinito es el enigmático horizonte que los matemáticos persiguen sin cesar.,Nakh,Amazon Translate
La tecnología de la información redefine la privacidad personal y las normas culturales compartidas.,Nakh,Amazon Translate
"Las islas paradisíacas son los jardines secretos de la Tierra, donde los sueños se mezclan con la realidad.",Nakh,Amazon Translate
Las islas son los solitarios centinelas de la Tierra que vigilan océanos infinitos.,Nakh,Amazon Translate
El juicio es la lente que sombrea la forma en que la sociedad ve su propio reflejo.,Nakh,Amazon Translate
Los juicios sobre la inteligencia suelen implicar criterios subjetivos.,Nakh,Amazon Translate
Los juicios reflejan los valores personales y las normas sociales.,Nakh,Amazon Translate
"La justicia es la brújula, aunque su aguja oscila con vientos subjetivos.",Nakh,Amazon Translate
La amabilidad es el hilo invisible que une a la humanidad.,Nakh,Amazon Translate
El lenguaje transmite pensamientos e ideas en las interacciones humanas.,Nakh,Amazon Translate
El lenguaje facilita la comunicación y la comprensión entre las personas.,Nakh,Amazon Translate
El lenguaje es el pegamento que une los ladrillos de la interacción y la comprensión humanas.,Nakh,Amazon Translate
Las leyes de la física describen las interacciones entre movimiento y energía.,Nakh,Amazon Translate
"Las leyes de la física dictan la sinfonía del universo, desde los átomos hasta las galaxias.",Nakh,Amazon Translate
"La vida es un río que fluye, guiado por la mano invisible de la naturaleza.",Nakh,Amazon Translate
"La luz viaja a un límite de velocidad cósmico, lo que ilumina la curiosidad humana.",Nakh,Amazon Translate
La luz viaja a una velocidad de 299.792 kilómetros por segundo.,Nakh,Amazon Translate
Las condiciones de iluminación afectan a la visibilidad y pueden influir en el estado de ánimo.,Nakh,Amazon Translate
"Al igual que la gravedad, la creencia nos lleva a comprensiones y conexiones más profundas.",Nakh,Amazon Translate
Limitar la ingesta de azúcar puede prevenir el aumento de peso y la diabetes.,Nakh,Amazon Translate
El lenguaje literal transmite un significado directo sin ambigüedad.,Nakh,Amazon Translate
La lógica reúne el rompecabezas de la razón para revelar la verdad.,Nakh,Amazon Translate
La lógica ayuda a sacar conclusiones mediante un análisis razonado.,Nakh,Amazon Translate
La lógica ayuda a organizar los pensamientos y analizar las situaciones de manera objetiva.,Nakh,Amazon Translate
La lógica es el corazón de las estructuras y demostraciones matemáticas.,Nakh,Amazon Translate
La lógica es el faro en el tormentoso mar de confusión.,Nakh,Amazon Translate
La lógica es el mapa que traza los vastos mares del conocimiento.,Nakh,Amazon Translate
La lógica es la escalera que sube a la cima de la comprensión.,Nakh,Amazon Translate
"La lógica allana el camino hacia la comprensión, más allá de los puntos de vista personales.",Nakh,Amazon Translate
Las conclusiones lógicas son los arquitectos que diseñan el andamiaje de la verdad.,Nakh,Amazon Translate
Las líneas de longitud se extienden verticalmente y conectan los polos norte y sur.,Nakh,Amazon Translate
La longitud mide qué tan lejos está un punto al este o al oeste del primer meridiano.,Nakh,Amazon Translate
El amor es el pegamento que une los corazones fracturados de la humanidad.,Nakh,Amazon Translate
Los pulmones son los fuelles que alimentan el fuego de los procesos metabólicos.,Nakh,Amazon Translate
"Los campos magnéticos influyen en las partículas cargadas, creando fuerzas observables en la naturaleza.",Nakh,Amazon Translate
"El magnetismo atrae y repele, una fuerza invisible que moldea los límites de la realidad.",Nakh,Amazon Translate
El magnetismo atrae metales como el hierro hacia los imanes.,Nakh,Amazon Translate
El magnetismo provoca atracción y repulsión entre los materiales magnéticos.,Nakh,Amazon Translate
El magnetismo es la danza invisible que atrae partículas de hierro en patrones misteriosos.,Nakh,Amazon Translate
Muchos encuentran consuelo en las prácticas religiosas en medio de las incertidumbres de la vida.,Nakh,Amazon Translate
Muchas personas encuentran un propósito a través de su fe religiosa.,Nakh,Amazon Translate
Las matemáticas son el navegador silencioso que traza el camino hacia el descubrimiento.,Nakh,Amazon Translate
Las constantes matemáticas expresan magnitudes definidas dentro de las ecuaciones.,Nakh,Amazon Translate
"Los modelos matemáticos proporcionan marcos, no hechos, que dan forma a las interpretaciones subjetivas.",Nakh,Amazon Translate
"Las pruebas matemáticas son las murallas de la fortaleza, que protegen el castillo de la verdad.",Nakh,Amazon Translate
Los teoremas matemáticos revelan verdades que van más allá de la experiencia individual.,Nakh,Amazon Translate
Las matemáticas descifran el código secreto del universo y desentrañan un sinfín de misterios.,Nakh,Amazon Translate
"Las matemáticas decodifican los mensajes crípticos del universo, revelando patrones ocultos.",Nakh,Amazon Translate
Las matemáticas describen las relaciones entre los números a través de expresiones lógicas.,Nakh,Amazon Translate
Las matemáticas son las arquitectas de los cimientos invisibles de la realidad.,Nakh,Amazon Translate
Las matemáticas son la brújula que revela las verdades ocultas en los laberintos cósmicos.,Nakh,Amazon Translate
Las matemáticas son la lente que aclara el caos del rompecabezas cósmico.,Nakh,Amazon Translate
Las matemáticas se utilizan a diario para calcular presupuestos y gastos.,Nakh,Amazon Translate
Las matemáticas proporcionan un marco para entender las estructuras lógicas.,Nakh,Amazon Translate
Las matemáticas proporcionan herramientas para resolver problemas del mundo real.,Nakh,Amazon Translate
Las matemáticas revelan patrones y estructuras en el mundo natural.,Nakh,Amazon Translate
Las matemáticas resuelven ecuaciones cuadráticas usando la fórmula cuadrática.,Nakh,Amazon Translate
"Las matemáticas revelan patrones que escapan a nuestro alcance sensorial, como estrellas ocultas al amanecer.",Nakh,Amazon Translate
Las matemáticas revelan verdades universales que trascienden las experiencias individuales.,Nakh,Amazon Translate
Las matemáticas susurran verdades más allá del alcance de las lenguas humanas.,Nakh,Amazon Translate
Las matemáticas susurran verdades universales y traducen la gramática oculta de la existencia en comprensión.,Nakh,Amazon Translate
Matemáticas: el cincel del filósofo que esculpe el mármol del orden cósmico.,Nakh,Amazon Translate
La multiplicación de matrices sigue reglas aritméticas específicas.,Nakh,Amazon Translate
