content,count,nlp_score,statement,committer,elicitation
The Assyrian Empire was known for its military prowess and innovation.,1,The Assyrian Empire was known for its military prowess and innovation.,আসিরিয়ান সাম্রাজ্য তার সামরিক দক্ষতা এবং উদ্ভাবনের জন্য পরিচিত ছিল।,Nakh,Amazon Translate
The Atacama Desert is the driest place on Earth.,1,The Atacama Desert is the driest place on Earth.,আটাকামা মরুভূমি পৃথিবীর সবচেয়ে শুষ্ক জায়গা।,Nakh,Amazon Translate
The Baltic Sea connects with the North Sea.,1,The Baltic Sea connects with the North Sea.,বাল্টিক সাগর উত্তর সাগরের সাথে সংযোগ স্থাপন করে।,Nakh,Amazon Translate
"The Baltic States include Estonia, Latvia, and Lithuania.",1,"The Baltic States include Estonia, Latvia, and Lithuania.","বাল্টিক রাজ্যের মধ্যে রয়েছে এস্তোনিয়া, লাটভিয়া এবং লিথুয়ানিয়া",Nakh,Amazon Translate
The Barents Sea is part of the Arctic Ocean.,1,The Barents Sea is part of the Arctic Ocean.,বারেন্টস সাগর আর্কটিক মহাসাগরের অংশ।,Nakh,Amazon Translate
The Battle of Waterloo in 1815 marked the end of Napoleon's rule.,1,The Battle of Waterloo in 1815 marked the end of Napoleon's rule.,১৮১৫ সালে ওয়াটারলুর যুদ্ধ নেপোলিয়নের শাসনের সমাপ্তি চিহ্নিত করে।,Nakh,Amazon Translate
The Bay of Pigs invasion was a failed US-backed mission in Cuba in 1961.,1,The Bay of Pigs invasion was a failed US-backed mission in Cuba in 1961.,বে অফ পিগস আক্রমণ ১৯৬১ সালে কিউবায় যুক্তরাষ্ট্র সমর্থিত একটি ব্যর্থ মিশন ছিল।,Nakh,Amazon Translate
The Bering Strait separates Russia and Alaska.,1,The Bering Strait separates Russia and Alaska.,বেরিং স্ট্রেইট রাশিয়া এবং আলাস্কা পৃথক করে।,Nakh,Amazon Translate
The Berlin Airlift was conducted in 1948-1949 to supply West Berlin.,1,The Berlin Airlift was conducted in 1948-1949 to supply West Berlin.,বার্লিন এয়ারলিফট ১৯৪৮-১৯৪৯ সালে পশ্চিম বার্লিন সরবরাহের জন্য পরিচালিত হয়,Nakh,Amazon Translate
The Berlin Conference regulated the colonization of Africa in 1884-1885.,1,The Berlin Conference regulated the colonization of Africa in 1884-1885.,বার্লিন সম্মেলন ১৮৮৪-১৮৮৫ সালে আফ্রিকার উপনিবেশকে নিয়ন্ত্রণ করে।,Nakh,Amazon Translate
The Berlin Wall served as a symbol of Cold War division.,1,The Berlin Wall served as a symbol of Cold War division.,বার্লিন প্রাচীর শীতল যুদ্ধের বিভাগের প্রতীক হিসেবে কাজ করেছে।,Nakh,Amazon Translate
The Bernoulli effect explains fluid pressure changes.,1,The Bernoulli effect explains fluid pressure changes.,বার্নুলি প্রভাব তরল চাপের পরিবর্তনগুলি ব্যাখ্যা করে।,Nakh,Amazon Translate
The Black Death pandemic swept through Europe in the 14th century.,1,The Black Death pandemic swept through Europe in the 14th century.,ব্ল্যাক ডেথ মহামারী ১৪শ শতাব্দীতে ইউরোপ জুড়ে পড়,Nakh,Amazon Translate
The Black Forest is in southwestern Germany.,1,The Black Forest is in southwestern Germany.,ব্ল্যাক ফরেস্ট দক্ষিণ-পশ্চিম জার্মানিতে।,Nakh,Amazon Translate
The Black Sea is bordered by six countries.,1,The Black Sea is bordered by six countries.,কালো সাগর ছয়টি দেশের সীমান্ত।,Nakh,Amazon Translate
The Blue Mountains are a UNESCO World Heritage Site.,1,The Blue Mountains are a UNESCO World Heritage Site.,নীল পর্বতমালা ইউনেস্কোর বিশ্ব ঐতিহ্য স্থান।,Nakh,Amazon Translate
The Bosporus Strait divides Europe and Asia.,1,The Bosporus Strait divides Europe and Asia.,বসপোরাস স্ট্রেইট ইউরোপ এবং এশিয়াকে বিভক্ত করে।,Nakh,Amazon Translate
"The Boston Massacre occurred on March 5, 1770.",1,"The Boston Massacre occurred on March 5, 1770.",১৭৭০ সালের ৫ মার্চ বোস্টন গণহত্যা ঘটে।,Nakh,Amazon Translate
The Boston Tea Party in 1773 was a protest against British taxation.,1,The Boston Tea Party in 1773 was a protest against British taxation.,১৭৭৩ সালে বোস্টন টি পার্টি ব্রিটিশ করের বিরুদ্ধে প্রতিবাদ ছিল।,Nakh,Amazon Translate
The Byzantine Empire fell with the conquest of Constantinople in 1453.,1,The Byzantine Empire fell with the conquest of Constantinople in 1453.,১৪৫৩ সালে কনস্ট্যান্টিনোপল বিজয়ের সাথে বাইজেন্টাইন সাম্রাজ্য,Nakh,Amazon Translate
The Calvin Coolidge administration presided over 1920s prosperity in the United States.,1,The Calvin Coolidge administration presided over 1920s prosperity in the United States.,ক্যালভিন কুলিজ প্রশাসন যুক্তরাষ্ট্রে ১৯২০-এর দশকের সমৃদ্ধিতে সভাপতি নেন।,Nakh,Amazon Translate
The Cambrian explosion was a period of rapid evolution and diversification.,1,The Cambrian explosion was a period of rapid evolution and diversification.,ক্যাম্ব্রিয়ান বিস্ফোরণ দ্রুত বিবর্তন এবং বৈচিত্র্যের একটি সময়কাল ছিল।,Nakh,Amazon Translate
The Canaries are located off the northwest coast of Africa.,1,The Canaries are located off the northwest coast of Africa.,ক্যানারি আফ্রিকার উত্তর-পশ্চিম উপকূলে অবস্থিত।,Nakh,Amazon Translate
The Canary Islands are part of Spain.,1,The Canary Islands are part of Spain.,ক্যানারি দ্বীপপুঞ্জ স্পেনের অংশ।,Nakh,Amazon Translate
The Cape of Good Hope was a key trading point.,1,The Cape of Good Hope was a key trading point.,কেপ অফ গুড হোপ ছিল একটি মূল ট্রেডিং পয়েন্ট।,Nakh,Amazon Translate
The Caribbean Sea is famous for its stunning beaches.,1,The Caribbean Sea is famous for its stunning beaches.,ক্যারিবিয়ান সাগর তার অত্যাশ্চর্যজনক সৈকতের জন্য,Nakh,Amazon Translate
The Caucasus Mountains divide Europe and Asia.,1,The Caucasus Mountains divide Europe and Asia.,ককেসাস পর্বতমালা ইউরোপ ও এশিয়াকে ভাগ করে,Nakh,Amazon Translate
The Caucasus region hosts many different ethnic groups.,1,The Caucasus region hosts many different ethnic groups.,ককেসাস অঞ্চল বিভিন্ন জাতিগত গোষ্ঠীর আয়োজন করে।,Nakh,Amazon Translate
The Code of Hammurabi is one of the earliest sets of written laws.,1,The Code of Hammurabi is one of the earliest sets of written laws.,হম্মুরাবির কোড লিখিত আইনের প্রাথমিক সেটগুলির মধ্যে একটি।,Nakh,Amazon Translate
The Colorado River carved the Grand Canyon.,1,The Colorado River carved the Grand Canyon.,কলোরাডো নদী গ্র্যান্ড ক্যানিয়ন খোদাই করে,Nakh,Amazon Translate
The Concordat of 1801 normalized relations between Napoleonic France and the Catholic Church.,1,The Concordat of 1801 normalized relations between Napoleonic France and the Catholic Church.,১৮০১ সালের কনকর্ডাট নেপোলিয়নিক ফ্রান্স এবং ক্যাথলিক চার্চের মধ্যে সম্পর্ককে স্বাভাবিক করে তোলে।,Nakh,Amazon Translate
The Continental Congress convened in 1774 as a response to British policies.,1,The Continental Congress convened in 1774 as a response to British policies.,ব্রিটিশ নীতিগুলির প্রতিক্রিয়া হিসাবে 1774 সালে কন্টিনেন্টাল কংগ্রেস আহ্বান,Nakh,Amazon Translate
The Cook Islands are in free association with New Zealand.,1,The Cook Islands are in free association with New Zealand.,কুক দ্বীপপুঞ্জ নিউজিল্যান্ডের সাথে মুক্ত সহযোগিতায় রয়েছে।,Nakh,Amazon Translate
The Crimea is a peninsula in the Black Sea.,1,The Crimea is a peninsula in the Black Sea.,ক্রিমিয়া কালো সাগরের একটি উপদ্বীপ।,Nakh,Amazon Translate
The DASH diet can help manage blood pressure effectively.,1,The DASH diet can help manage blood pressure effectively.,DASH ডায়েট কার্যকরভাবে রক্তচাপ পরিচালনা করতে সহায়তা করতে পারে।,Nakh,Amazon Translate
The Dead Sea Scrolls are ancient Jewish texts discovered in the Qumran Caves.,1,The Dead Sea Scrolls are ancient Jewish texts discovered in the Qumran Caves.,মৃত সাগর স্ক্রলগুলি কুমরান গুহায় আবিষ্কৃত প্রাচীন ইহুদি গ্রন্থ।,Nakh,Amazon Translate
The Dolomites are a mountain range in northeastern Italy.,1,The Dolomites are a mountain range in northeastern Italy.,ডলোমাইটগুলি উত্তর-পূর্ব ইতালির একটি পর্বতশ্রেণী।,Nakh,Amazon Translate
The Dolomites are part of the Southern Limestone Alps.,1,The Dolomites are part of the Southern Limestone Alps.,ডলোমাইটগুলি দক্ষিণ চুনাপাথর আল্পসের অংশ।,Nakh,Amazon Translate
The Doppler effect causes a change in wave frequency.,1,The Doppler effect causes a change in wave frequency.,ডপলার প্রভাব তরঙ্গ ফ্রিকোয়েন্সিতে পরিবর্তন ঘটায়।,Nakh,Amazon Translate
The Earth orbits the Sun in one year.,1,The Earth orbits the Sun in one year.,পৃথিবী এক বছরে সূর্যের চক্র করে।,Nakh,Amazon Translate
The Earth rotates on an axis for a day.,1,The Earth rotates on an axis for a day.,পৃথিবী এক দিনের জন্য একটি অক্ষের উপর ঘূর্ণন করে।,Nakh,Amazon Translate
The Earth's core generates a magnetic field.,1,The Earth's core generates a magnetic field.,পৃথিবীর কোর একটি চৌম্বকীয় ক্ষেত্র তৈরি করে।,Nakh,Amazon Translate
The Earth's crust is divided into tectonic plates.,1,The Earth's crust is divided into tectonic plates.,পৃথিবীর ক্রাস্ট টেকটোনিক প্লেটে বিভক্ত।,Nakh,Amazon Translate
The Earth's magnetic field protects against solar wind.,1,The Earth's magnetic field protects against solar wind.,পৃথিবীর চৌম্বকীয় ক্ষেত্র সৌর বাতাস থেকে রক্ষা করে।,Nakh,Amazon Translate
The Earth's rotation causes day and night.,1,The Earth's rotation causes day and night.,পৃথিবীর ঘূর্ণন দিনরাত সৃষ্টি করে।,Nakh,Amazon Translate
The Edict of Milan in 313 AD granted religious tolerance throughout the Roman Empire.,1,The Edict of Milan in 313 AD granted religious tolerance throughout the Roman Empire.,313 খ্রিস্টাব্দে মিলানের নির্দেশ পুরো রোমান সাম্রাজ্যে ধর্মীয় সহনশীলতা দে,Nakh,Amazon Translate
The English Channel separates the UK from mainland Europe.,1,The English Channel separates the UK from mainland Europe.,ইংলিশ চ্যানেল যুক্তরাজ্যকে মূল ভূখণ্ড ইউরোপ,Nakh,Amazon Translate
The English Civil War was fought from 1642 to 1651.,1,The English Civil War was fought from 1642 to 1651.,ইংরেজ গৃহযুদ্ধ ১৬৪২ থেকে ১৬৫১ সাল পর্যন্ত সংঘটিত হয়।,Nakh,Amazon Translate
The Equator divides Earth into northern and southern hemispheres.,1,The Equator divides Earth into northern and southern hemispheres.,ভূখণ্ড পৃথিবীকে উত্তর ও দক্ষিণ গোলার্ধে বিভক্ত করে।,Nakh,Amazon Translate
The Falkland Islands are a British Overseas Territory.,1,The Falkland Islands are a British Overseas Territory.,ফকল্যান্ড দ্বীপপুঞ্জ একটি ব্রিটিশ বিদেশী অঞ্চল।,Nakh,Amazon Translate
The Falklands War took place in 1982 between Argentina and the UK.,1,The Falklands War took place in 1982 between Argentina and the UK.,ফকল্যান্ডস যুদ্ধ ১৯৮২ সালে আর্জেন্টিনা এবং যুক্তরাজ্যের মধ্যে সংঘটিত হয়েছিল।,Nakh,Amazon Translate
The Fibonacci sequence appears in natural patterns like flower petals.,1,The Fibonacci sequence appears in natural patterns like flower petals.,ফিবোনাচি ক্রম ফুলের পাপড়ি মতো প্রাকৃতিক নিদর্শনে উপস্থিত,Nakh,Amazon Translate
The Fibonacci sequence appears in nature often.,1,The Fibonacci sequence appears in nature often.,ফিবোনাচি ক্রম প্রায়ই প্রকৃতিতে উপস্থিত হয়।,Nakh,Amazon Translate
The First Crusade began in 1096 aiming to reclaim Jerusalem from Muslim control.,1,The First Crusade began in 1096 aiming to reclaim Jerusalem from Muslim control.,প্রথম ক্রুসেড শুরু হয়েছিল ১০৯৬ সালে মুসলিম নিয়ন্ত্রণ থেকে জেরুজালেমকে পুনরুদ্ধার করার লক্ষ্যে।,Nakh,Amazon Translate
The Fjords of Norway draw thousands of tourists.,1,The Fjords of Norway draw thousands of tourists.,নরওয়ের ফজর্ডগুলি হাজার হাজার পর্যটককে আকর্ষণ করে।,Nakh,Amazon Translate
The Florida Keys are a coral cay archipelago.,1,The Florida Keys are a coral cay archipelago.,ফ্লোরিডা কীস একটি প্রবাল কেই দ্বীপপুঞ্জ।,Nakh,Amazon Translate
The French Revolution inspired human rights movements globally.,1,The French Revolution inspired human rights movements globally.,ফরাসি বিপ্লব বিশ্বব্যাপী মানবাধিকার আন্দোলনকে,Nakh,Amazon Translate
The French Revolution led to the rise of Napoleon Bonaparte.,1,The French Revolution led to the rise of Napoleon Bonaparte.,ফরাসি বিপ্লবের ফলে নেপোলিয়ন বোনাপার্টের উত্থান ঘটে।,Nakh,Amazon Translate
The Galápagos Islands inspired Darwin's theory of evolution.,1,The Galápagos Islands inspired Darwin's theory of evolution.,গালাপাগোস দ্বীপপুঞ্জ ডারউইনের বিবর্তন তত্ত্বকে অনুপ্রাণিত করেছিল।,Nakh,Amazon Translate
The Ganges River is sacred to Hindus.,1,The Ganges River is sacred to Hindus.,গঙ্গা নদী হিন্দুদের কাছে পবিত্র।,Nakh,Amazon Translate
The Ganges flows through India and Bangladesh.,1,The Ganges flows through India and Bangladesh.,গঙ্গা ভারত ও বাংলাদেশের মধ্য দিয়ে প্রবাহিত হয়,Nakh,Amazon Translate
The Gobi Desert spans China and Mongolia.,1,The Gobi Desert spans China and Mongolia.,গোবি মরুভূমি চীন ও মঙ্গোলিয়ায় বিস্তৃত।,Nakh,Amazon Translate
The Golden Ratio appears frequently in natural and human designs.,1,The Golden Ratio appears frequently in natural and human designs.,সোনার অনুপাত প্রাকৃতিক এবং মানব ডিজাইনে প্রায়শই উপস্থিত হয়।,Nakh,Amazon Translate
"The Grand Canyon is located in Arizona, USA.",1,"The Grand Canyon is located in Arizona, USA.",গ্র্যান্ড ক্যানিয়ন যুক্তরাষ্ট্রের অ্যারিজোনায় অবস্থিত।,Nakh,Amazon Translate
The Great Barrier Reef is the largest coral reef system.,1,The Great Barrier Reef is the largest coral reef system.,গ্রেট ব্যারিয়ার রিফ হল বৃহত্তম প্রবাল রিফ সিস্টেম।,Nakh,Amazon Translate
"The Great Chicago Fire happened in 1871, leading to massive rebuilding.",1,"The Great Chicago Fire happened in 1871, leading to massive rebuilding.","১৮৭১ সালে গ্রেট শিকাগো ফায়ার ঘটেছিল, যার ফলে ব্যাপক পুনর্নির্মা",Nakh,Amazon Translate
"The Great Wall of China is over 13,000 miles long.",1,"The Great Wall of China is over 13,000 miles long.","চীনের মহাপ্রাচীর দীর্ঘ ১৩,০০০ মাইলরও বেশি।",Nakh,Amazon Translate
The Great Wall of China was built to protect against invasions.,1,The Great Wall of China was built to protect against invasions.,চীনের গ্রেট ওয়াল নির্মিত হয়েছিল আক্রমণ থেকে রক্ষা করার জন্য।,Nakh,Amazon Translate
The Guiana Highlands are in northern South America.,1,The Guiana Highlands are in northern South America.,গিয়ানা উচ্চভূমি উত্তর দক্ষিণ আমেরিকায় অবস্থিত।,Nakh,Amazon Translate
"The Gutenberg Bible was printed around 1455, starting a new print era.",1,"The Gutenberg Bible was printed around 1455, starting a new print era.","গুটেনবার্গ বাইবেল ১৪৫৫ সালের দিকে মুদ্রিত হয়েছিল, যার ফলে একটি নতুন মুদ্রণ যুগ শুরু হয়।",Nakh,Amazon Translate
The Gutenberg Printing Press was invented in the 15th century.,1,The Gutenberg Printing Press was invented in the 15th century.,গুটেনবার্গ প্রিন্টিং প্রেস ১৫শ শতাব্দীতে আবিষ্কার করা হয়েছিল।,Nakh,Amazon Translate
The Himalayas separate the Indian subcontinent from Asia.,1,The Himalayas separate the Indian subcontinent from Asia.,হিমালয় ভারতীয় উপমহাদেশকে এশিয়া থেকে পৃথক করে।,Nakh,Amazon Translate
"The Hindenburg disaster occurred in 1937, marking the end of airship travel.",1,"The Hindenburg disaster occurred in 1937, marking the end of airship travel.","১৯৩৭ সালে হিন্ডেনবার্গ দুর্যোগ ঘটেছিল, যা বিমানজাহাজ ভ্রমণের সমাপ্তি ঘটেছে।",Nakh,Amazon Translate
"The Hittites were among the first to work iron, improving weaponry and tools.",1,"The Hittites were among the first to work iron, improving weaponry and tools.","হিটাইটরা প্রথম লোহার কাজ করেছিলেন, অস্ত্র এবং সরঞ্জামগুলি উন্নত করেছিলেন।",Nakh,Amazon Translate
The Hubble Space Telescope has provided crucial data on distant galaxies.,1,The Hubble Space Telescope has provided crucial data on distant galaxies.,হাবল স্পেস টেলিস্কোপ দূরবর্তী ছায়াপথ সম্পর্কে গুরুত্বপূর্ণ তথ্য সরবরাহ করেছে।,Nakh,Amazon Translate
The Hubble Space Telescope observes distant astronomical phenomena.,1,The Hubble Space Telescope observes distant astronomical phenomena.,হাবল মহাকাশ টেলিস্কোপ দূরবর্তী জ্যোতির্বিজ্ঞান,Nakh,Amazon Translate
The Hubble constant relates to the universe's expansion rate.,1,The Hubble constant relates to the universe's expansion rate.,হাবল কনস্ট্যান্ট মহাবিশ্বের সম্প্রসারণের হারের সাথে সম্পর্কিত।,Nakh,Amazon Translate
The Iberian Peninsula includes Spain and Portugal.,1,The Iberian Peninsula includes Spain and Portugal.,আইবেরিয়ান উপদ্বীপের মধ্যে রয়েছে স্পেন এবং পর্তুগাল।,Nakh,Amazon Translate
The Iberian Peninsula was controlled by the Moors from the 8th to the 15th century.,1,The Iberian Peninsula was controlled by the Moors from the 8th to the 15th century.,আইবেরিয়ান উপদ্বীপ অষ্টম থেকে ১৫শ শতাব্দী পর্যন্ত মুরদের দ্বারা নিয়ন্ত্রিত ছিল।,Nakh,Amazon Translate
The Industrial Revolution began in Great Britain in the late 1700s.,1,The Industrial Revolution began in Great Britain in the late 1700s.,১৭০০ এর দশকের শেষের দিকে গ্রেট ব্রিটেনে শিল্প বিপ্লব শুরু হয়েছিল।,Nakh,Amazon Translate
The International Space Station (ISS) orbits Earth as a research facility.,1,The International Space Station (ISS) orbits Earth as a research facility.,আন্তর্জাতিক মহাকাশ স্টেশন (আইএসএস) একটি গবেষণা সুবিধা হিসাবে পৃথিবীর কক্ষপথ,Nakh,Amazon Translate
The Irish Potato Famine occurred from 1845 to 1852 resulting in mass starvation.,1,The Irish Potato Famine occurred from 1845 to 1852 resulting in mass starvation.,১৮৪৫ থেকে ১৮৫২ সাল পর্যন্ত আইরিশ আলুর দুর্ভিক্ষ ঘটে যার ফলে ব্যাপক অক্ষুধার,Nakh,Amazon Translate
The Irish Sea separates Great Britain from Ireland.,1,The Irish Sea separates Great Britain from Ireland.,আইরিশ সমুদ্র গ্রেট ব্রিটেনকে আয়ারল্যান্ড থেকে,Nakh,Amazon Translate
The Isle of Man is located in the Irish Sea.,1,The Isle of Man is located in the Irish Sea.,আইল অফ ম্যান আইরিশ সাগরে অবস্থিত।,Nakh,Amazon Translate
The Isles of Scilly are an archipelago off England's coast.,1,The Isles of Scilly are an archipelago off England's coast.,স্কিলি দ্বীপপুঞ্জ ইংল্যান্ডের উপকূলের একটি দ্বীপপুঞ্জ।,Nakh,Amazon Translate
The Italian Riviera is known for its picturesque views.,1,The Italian Riviera is known for its picturesque views.,ইতালিয়ান রিভিয়েরা তার মনোরম দৃশ্যের জন্য পরিচিত।,Nakh,Amazon Translate
The Jordan River flows into the Dead Sea.,1,The Jordan River flows into the Dead Sea.,জর্দান নদী মৃত সাগরে প্রবাহিত হয়।,Nakh,Amazon Translate
The Kalahari Desert spans several African nations.,1,The Kalahari Desert spans several African nations.,কালাহারি মরুভূমি বেশ কয়েকটি আফ্রিকান দেশ জুড়ে,Nakh,Amazon Translate
