content,count,nlp_score,statement,committer,elicitation
Electrical currents are measured in amperes.,1,Electrical currents are measured in amperes.,Electrical currents are measured in amperes.,Mark,GPT-4o
"Electrical energy is transformed in batteries, generators, and motors.",1,"Electrical energy is transformed in batteries, generators, and motors.","Electrical energy is transformed in batteries, generators, and motors.",Mark,GPT-4o
Electrical engineering drives technological innovation.,1,Electrical engineering drives technological innovation.,Electrical engineering drives technological innovation.,Mark,GPT-4o
Electricity can be generated from renewable and nonrenewable sources.,1,Electricity can be generated from renewable and nonrenewable sources.,Electricity can be generated from renewable and nonrenewable sources.,Mark,GPT-4o
Electricity flows from areas of high potential to low potential.,1,Electricity flows from areas of high potential to low potential.,Electricity flows from areas of high potential to low potential.,Mark,GPT-4o
Electricity flows through conductors due to electron movement.,1,Electricity flows through conductors due to electron movement.,Electricity flows through conductors due to electron movement.,Mark,GPT-4o
Electricity is generated by converting mechanical energy.,1,Electricity is generated by converting mechanical energy.,Electricity is generated by converting mechanical energy.,Mark,GPT-4o
Electricity powers many modern-day devices.,1,Electricity powers many modern-day devices.,Electricity powers many modern-day devices.,Mark,GPT-4o
Electrocatalysts facilitate chemical reactions.,1,Electrocatalysts facilitate chemical reactions.,Electrocatalysts facilitate chemical reactions.,Mark,GPT-4o
Electroencephalography measures electrical brain activity.,1,Electroencephalography measures electrical brain activity.,Electroencephalography measures electrical brain activity.,Mark,GPT-4o
Electrolysis uses electricity to drive chemical reactions.,1,Electrolysis uses electricity to drive chemical reactions.,Electrolysis uses electricity to drive chemical reactions.,Mark,GPT-4o
Electromagnetic radiation spans from radio waves to gamma rays.,1,Electromagnetic radiation spans from radio waves to gamma rays.,Electromagnetic radiation spans from radio waves to gamma rays.,Mark,GPT-4o
"Electromagnetic spectrum includes visible, ultraviolet, and infrared light.",1,"Electromagnetic spectrum includes visible, ultraviolet, and infrared light.","Electromagnetic spectrum includes visible, ultraviolet, and infrared light.",Mark,GPT-4o
Electromagnetic waves carry broadcast signals.,1,Electromagnetic waves carry broadcast signals.,Electromagnetic waves carry broadcast signals.,Mark,GPT-4o
Electromagnetism describes the interaction of electric and magnetic fields.,1,Electromagnetism describes the interaction of electric and magnetic fields.,Electromagnetism describes the interaction of electric and magnetic fields.,Mark,GPT-4o
Electromagnetism unifies electrical and magnetic phenomena.,1,Electromagnetism unifies electrical and magnetic phenomena.,Electromagnetism unifies electrical and magnetic phenomena.,Mark,GPT-4o
Electronegativity describes an atom's tendency to attract electrons.,1,Electronegativity describes an atom's tendency to attract electrons.,Electronegativity describes an atom's tendency to attract electrons.,Mark,GPT-4o
Electronic circuits control device functionality.,1,Electronic circuits control device functionality.,Electronic circuits control device functionality.,Mark,GPT-4o
Electronics revolutionize modern life.,1,Electronics revolutionize modern life.,Electronics revolutionize modern life.,Mark,GPT-4o
Electrons are negatively charged particles.,1,Electrons are negatively charged particles.,Electrons are negatively charged particles.,Mark,GPT-4o
Electrons carry a negative electric charge.,1,Electrons carry a negative electric charge.,Electrons carry a negative electric charge.,Mark,GPT-4o
Electrons dance around the nucleus like planets orbiting a sun.,1,Electrons dance around the nucleus like planets orbiting a sun.,Electrons dance around the nucleus like planets orbiting a sun.,Mark,GPT-4o
Electrons flow in electrical circuits.,1,Electrons flow in electrical circuits.,Electrons flow in electrical circuits.,Mark,GPT-4o
"Electrons gain energy, causing atoms to emit light.",1,"Electrons gain energy, causing atoms to emit light.","Electrons gain energy, causing atoms to emit light.",Mark,GPT-4o
Electrons orbit the nucleus in probability clouds.,1,Electrons orbit the nucleus in probability clouds.,Electrons orbit the nucleus in probability clouds.,Mark,GPT-4o
Electrostatics studies stationary electric charges.,1,Electrostatics studies stationary electric charges.,Electrostatics studies stationary electric charges.,Mark,GPT-4o
Elizabeth II became queen of the United Kingdom in 1952.,1,Elizabeth II became queen of the United Kingdom in 1952.,Elizabeth II became queen of the United Kingdom in 1952.,Mark,GPT-4o
Emotional experiences can trigger the release of endorphins.,1,Emotional experiences can trigger the release of endorphins.,Emotional experiences can trigger the release of endorphins.,Mark,GPT-4o
Emotions can alter heart rate and breathing patterns.,1,Emotions can alter heart rate and breathing patterns.,Emotions can alter heart rate and breathing patterns.,Mark,GPT-4o
"Energy cannot be created or destroyed, only transformed.",1,"Energy cannot be created or destroyed, only transformed.","Energy cannot be created or destroyed, only transformed.",Mark,GPT-4o
Energy flows like a river through the fields of reality.,1,Energy flows like a river through the fields of reality.,Energy flows like a river through the fields of reality.,Mark,GPT-4o
Energy flows through ecosystems like blood in veins.,1,Energy flows through ecosystems like blood in veins.,Energy flows through ecosystems like blood in veins.,Mark,GPT-4o
Energy flows through the veins of the cosmos orchestrally.,1,Energy flows through the veins of the cosmos orchestrally.,Energy flows through the veins of the cosmos orchestrally.,Mark,GPT-4o
"Energy flows where attention goes, focusing manifestation's power.",1,"Energy flows where attention goes, focusing manifestation's power.","Energy flows where attention goes, focusing manifestation's power.",Mark,GPT-4o
Energy in ecosystems flows from producers to consumers to decomposers.,1,Energy in ecosystems flows from producers to consumers to decomposers.,Energy in ecosystems flows from producers to consumers to decomposers.,Mark,GPT-4o
Energy is conserved in isolated systems.,1,Energy is conserved in isolated systems.,Energy is conserved in isolated systems.,Mark,GPT-4o
Energy is required for physical and chemical changes.,1,Energy is required for physical and chemical changes.,Energy is required for physical and chemical changes.,Mark,GPT-4o
Energy storage stabilizes renewable generation.,1,Energy storage stabilizes renewable generation.,Energy storage stabilizes renewable generation.,Mark,GPT-4o
Energy-efficient HVAC systems optimize indoor climates.,1,Energy-efficient HVAC systems optimize indoor climates.,Energy-efficient HVAC systems optimize indoor climates.,Mark,GPT-4o
Energy-efficient buildings reduce carbon footprints.,1,Energy-efficient buildings reduce carbon footprints.,Energy-efficient buildings reduce carbon footprints.,Mark,GPT-4o
Engagement in hobbies provides mental stimulation and stress relief.,1,Engagement in hobbies provides mental stimulation and stress relief.,Engagement in hobbies provides mental stimulation and stress relief.,Mark,GPT-4o
Engaging in strength exercises boosts metabolism and energy levels.,1,Engaging in strength exercises boosts metabolism and energy levels.,Engaging in strength exercises boosts metabolism and energy levels.,Mark,GPT-4o
"Entropy abhors order, unfolding chaos in nature's design.",1,"Entropy abhors order, unfolding chaos in nature's design.","Entropy abhors order, unfolding chaos in nature's design.",Mark,GPT-4o
Entropy in thermodynamics measures system disorder and energy dispersion.,1,Entropy in thermodynamics measures system disorder and energy dispersion.,Entropy in thermodynamics measures system disorder and energy dispersion.,Mark,GPT-4o
"Entropy increases, leading systems toward greater disorder naturally.",1,"Entropy increases, leading systems toward greater disorder naturally.","Entropy increases, leading systems toward greater disorder naturally.",Mark,GPT-4o
Entropy is a measure of disorder in a system.,1,Entropy is a measure of disorder in a system.,Entropy is a measure of disorder in a system.,Mark,GPT-4o
Entropy is life's reminder of the inevitable march to disorder.,1,Entropy is life's reminder of the inevitable march to disorder.,Entropy is life's reminder of the inevitable march to disorder.,Mark,GPT-4o
Entropy is the storyteller recording the universe's changing phases.,1,Entropy is the storyteller recording the universe's changing phases.,Entropy is the storyteller recording the universe's changing phases.,Mark,GPT-4o
Entropy whispers the story of change in stillness.,1,Entropy whispers the story of change in stillness.,Entropy whispers the story of change in stillness.,Mark,GPT-4o
Environmental engineering tackles waste management and pollution.,1,Environmental engineering tackles waste management and pollution.,Environmental engineering tackles waste management and pollution.,Mark,GPT-4o
Environmental monitoring tracks ecosystem health and changes.,1,Environmental monitoring tracks ecosystem health and changes.,Environmental monitoring tracks ecosystem health and changes.,Mark,GPT-4o
Environmental policy guides sustainable development.,1,Environmental policy guides sustainable development.,Environmental policy guides sustainable development.,Mark,GPT-4o
Environmental remediation restores contaminated sites.,1,Environmental remediation restores contaminated sites.,Environmental remediation restores contaminated sites.,Mark,GPT-4o
Environmental science addresses ecosystem challenges.,1,Environmental science addresses ecosystem challenges.,Environmental science addresses ecosystem challenges.,Mark,GPT-4o
Enzymes catalyze biochemical reactions in living cells.,1,Enzymes catalyze biochemical reactions in living cells.,Enzymes catalyze biochemical reactions in living cells.,Mark,GPT-4o
Enzymes speed up chemical reactions in biological systems.,1,Enzymes speed up chemical reactions in biological systems.,Enzymes speed up chemical reactions in biological systems.,Mark,GPT-4o
Epidermis is the outermost layer of human skin.,1,Epidermis is the outermost layer of human skin.,Epidermis is the outermost layer of human skin.,Mark,GPT-4o
Epigenetics explores how environment influences gene expression.,1,Epigenetics explores how environment influences gene expression.,Epigenetics explores how environment influences gene expression.,Mark,GPT-4o
Epigenetics studies heritable phenotype changes.,1,Epigenetics studies heritable phenotype changes.,Epigenetics studies heritable phenotype changes.,Mark,GPT-4o
Erbil is the capital of the Kurdistan Region.,1,Erbil is the capital of the Kurdistan Region.,Erbil is the capital of the Kurdistan Region.,Mark,GPT-4o
Ergonomics improves product user interface and comfort.,1,Ergonomics improves product user interface and comfort.,Ergonomics improves product user interface and comfort.,Mark,GPT-4o
Ernest Shackleton led the ill-fated Endurance expedition to Antarctica in 1914.,1,Ernest Shackleton led the ill-fated Endurance expedition to Antarctica in 1914.,Ernest Shackleton led the ill-fated Endurance expedition to Antarctica in 1914.,Mark,GPT-4o
Erosion changes landscapes by wearing down mountains and forming valleys.,1,Erosion changes landscapes by wearing down mountains and forming valleys.,Erosion changes landscapes by wearing down mountains and forming valleys.,Mark,GPT-4o
Erosion processes shape landscapes through removal and transport of material.,1,Erosion processes shape landscapes through removal and transport of material.,Erosion processes shape landscapes through removal and transport of material.,Mark,GPT-4o
Erosion shapes landforms by wearing away rock and soil.,1,Erosion shapes landforms by wearing away rock and soil.,Erosion shapes landforms by wearing away rock and soil.,Mark,GPT-4o
Erosion shapes landscapes over geological time.,1,Erosion shapes landscapes over geological time.,Erosion shapes landscapes over geological time.,Mark,GPT-4o
Eukaryotic cells have a defined nucleus and organelles.,1,Eukaryotic cells have a defined nucleus and organelles.,Eukaryotic cells have a defined nucleus and organelles.,Mark,GPT-4o
Evaporation of sweat aids in human thermoregulation.,1,Evaporation of sweat aids in human thermoregulation.,Evaporation of sweat aids in human thermoregulation.,Mark,GPT-4o
"Every cloud has a silver lining, emphasizing optimism in adversity.",1,"Every cloud has a silver lining, emphasizing optimism in adversity.","Every cloud has a silver lining, emphasizing optimism in adversity.",Mark,GPT-4o
"Every dog has its day, yet duration is debated constantly.",1,"Every dog has its day, yet duration is debated constantly.","Every dog has its day, yet duration is debated constantly.",Mark,GPT-4o
"Every rose has its thorn, but beauty justifies pain differently.",1,"Every rose has its thorn, but beauty justifies pain differently.","Every rose has its thorn, but beauty justifies pain differently.",Mark,GPT-4o
Evolution explains how species adapt and diversify over time.,1,Evolution explains how species adapt and diversify over time.,Evolution explains how species adapt and diversify over time.,Mark,GPT-4o
Evolution explains the diversity and adaptation of living organisms.,1,Evolution explains the diversity and adaptation of living organisms.,Evolution explains the diversity and adaptation of living organisms.,Mark,GPT-4o
Evolution favors adaptability over mere survival instincts.,1,Evolution favors adaptability over mere survival instincts.,Evolution favors adaptability over mere survival instincts.,Mark,GPT-4o
Evolution sculpts life with the patience of an ancient artist.,1,Evolution sculpts life with the patience of an ancient artist.,Evolution sculpts life with the patience of an ancient artist.,Mark,GPT-4o
Evolution shapes the form of life's grand tapestry.,1,Evolution shapes the form of life's grand tapestry.,Evolution shapes the form of life's grand tapestry.,Mark,GPT-4o
Excessive ultraviolet light exposure can damage living tissue.,1,Excessive ultraviolet light exposure can damage living tissue.,Excessive ultraviolet light exposure can damage living tissue.,Mark,GPT-4o
Exercising outdoors can improve mood and reduce stress.,1,Exercising outdoors can improve mood and reduce stress.,Exercising outdoors can improve mood and reduce stress.,Mark,GPT-4o
Exercising regularly improves cardiovascular and muscular health.,1,Exercising regularly improves cardiovascular and muscular health.,Exercising regularly improves cardiovascular and muscular health.,Mark,GPT-4o
Exoplanet studies expand understanding of the universe.,1,Exoplanet studies expand understanding of the universe.,Exoplanet studies expand understanding of the universe.,Mark,GPT-4o
Exponential functions describe rapid growth behaviors.,1,Exponential functions describe rapid growth behaviors.,Exponential functions describe rapid growth behaviors.,Mark,GPT-4o
Extinct species are known through fossil records.,1,Extinct species are known through fossil records.,Extinct species are known through fossil records.,Mark,GPT-4o
Extinct species provide insight into Earth's prehistoric past.,1,Extinct species provide insight into Earth's prehistoric past.,Extinct species provide insight into Earth's prehistoric past.,Mark,GPT-4o
Eyebrows help prevent sweat from entering the eyes.,1,Eyebrows help prevent sweat from entering the eyes.,Eyebrows help prevent sweat from entering the eyes.,Mark,GPT-4o
Eyes detect light through specialized photoreceptor cells.,1,Eyes detect light through specialized photoreceptor cells.,Eyes detect light through specialized photoreceptor cells.,Mark,GPT-4o
Faith can provide comfort during challenging times.,1,Faith can provide comfort during challenging times.,Faith can provide comfort during challenging times.,Mark,GPT-4o
"Famous for its architecture, Barcelona is Spain's second-largest city.",1,"Famous for its architecture, Barcelona is Spain's second-largest city.","Famous for its architecture, Barcelona is Spain's second-largest city.",Mark,GPT-4o
Fashion trends often originate from cultural influences and preferences.,1,Fashion trends often originate from cultural influences and preferences.,Fashion trends often originate from cultural influences and preferences.,Mark,GPT-4o
Fermat's Last Theorem was proven in 1994.,1,Fermat's Last Theorem was proven in 1994.,Fermat's Last Theorem was proven in 1994.,Mark,GPT-4o
Fermentation produces biological products.,1,Fermentation produces biological products.,Fermentation produces biological products.,Mark,GPT-4o
Fiber optic networks offer high-speed data communication.,1,Fiber optic networks offer high-speed data communication.,Fiber optic networks offer high-speed data communication.,Mark,GPT-4o
Fiji consists of more than 300 islands.,1,Fiji consists of more than 300 islands.,Fiji consists of more than 300 islands.,Mark,GPT-4o
"Fiji's culture is a vibrant blend of indigenous, Indian, and European influences.",1,"Fiji's culture is a vibrant blend of indigenous, Indian, and European influences.","Fiji's culture is a vibrant blend of indigenous, Indian, and European influences.",Mark,GPT-4o
Fingernails and hair are composed of keratin protein.,1,Fingernails and hair are composed of keratin protein.,Fingernails and hair are composed of keratin protein.,Mark,GPT-4o
Fingerprints provide a tactile feedback during object manipulation.,1,Fingerprints provide a tactile feedback during object manipulation.,Fingerprints provide a tactile feedback during object manipulation.,Mark,GPT-4o
Fire is a chemical reaction that releases light and heat.,1,Fire is a chemical reaction that releases light and heat.,Fire is a chemical reaction that releases light and heat.,Mark,GPT-4o
Fish use gills to extract oxygen from water.,1,Fish use gills to extract oxygen from water.,Fish use gills to extract oxygen from water.,Mark,GPT-4o
Florence Nightingale founded modern nursing practices in the 19th century.,1,Florence Nightingale founded modern nursing practices in the 19th century.,Florence Nightingale founded modern nursing practices in the 19th century.,Mark,GPT-4o
"Florence, Italy, was the cradle of the Renaissance cultural movement.",1,"Florence, Italy, was the cradle of the Renaissance cultural movement.","Florence, Italy, was the cradle of the Renaissance cultural movement.",Mark,GPT-4o
"Flowing water erodes rock, demonstrating persistence's power.",1,"Flowing water erodes rock, demonstrating persistence's power.","Flowing water erodes rock, demonstrating persistence's power.",Mark,GPT-4o
Fluctuations in hormone levels impact mood and energy.,1,Fluctuations in hormone levels impact mood and energy.,Fluctuations in hormone levels impact mood and energy.,Mark,GPT-4o
Fluid dynamics studies flow behavior in gases and liquids.,1,Fluid dynamics studies flow behavior in gases and liquids.,Fluid dynamics studies flow behavior in gases and liquids.,Mark,GPT-4o
Fluorescence is light emission following electromagnetic absorption.,1,Fluorescence is light emission following electromagnetic absorption.,Fluorescence is light emission following electromagnetic absorption.,Mark,GPT-4o
Food technology improves processing and preservation techniques.,1,Food technology improves processing and preservation techniques.,Food technology improves processing and preservation techniques.,Mark,GPT-4o
"Force equals mass times acceleration, as described by Newton's Second Law.",1,"Force equals mass times acceleration, as described by Newton's Second Law.","Force equals mass times acceleration, as described by Newton's Second Law.",Mark,GPT-4o
Forces cause changes in the velocity of objects.,1,Forces cause changes in the velocity of objects.,Forces cause changes in the velocity of objects.,Mark,GPT-4o
Forensic science applies scientific methods in legal investigations.,1,Forensic science applies scientific methods in legal investigations.,Forensic science applies scientific methods in legal investigations.,Mark,GPT-4o
Fortune favors the bold in many traditional narratives.,1,Fortune favors the bold in many traditional narratives.,Fortune favors the bold in many traditional narratives.,Mark,GPT-4o
"Fortune favors the bold, aligning with risk-taking entrepreneurship.",1,"Fortune favors the bold, aligning with risk-taking entrepreneurship.","Fortune favors the bold, aligning with risk-taking entrepreneurship.",Mark,GPT-4o
"Fortune favors the bold, though fate defies calculations.",1,"Fortune favors the bold, though fate defies calculations.","Fortune favors the bold, though fate defies calculations.",Mark,GPT-4o
"Fortune favors the brave, but caution has its rewards.",1,"Fortune favors the brave, but caution has its rewards.","Fortune favors the brave, but caution has its rewards.",Mark,GPT-4o
Fossil fuel combustion contributes significantly to atmospheric CO2 levels.,1,Fossil fuel combustion contributes significantly to atmospheric CO2 levels.,Fossil fuel combustion contributes significantly to atmospheric CO2 levels.,Mark,GPT-4o
Fossil fuels are formed from ancient organic matter.,1,Fossil fuels are formed from ancient organic matter.,Fossil fuels are formed from ancient organic matter.,Mark,GPT-4o
Fossil fuels consist primarily of hydrocarbons.,1,Fossil fuels consist primarily of hydrocarbons.,Fossil fuels consist primarily of hydrocarbons.,Mark,GPT-4o
"Fossil fuels like coal, oil, and gas emit carbon dioxide when burned.",1,"Fossil fuels like coal, oil, and gas emit carbon dioxide when burned.","Fossil fuels like coal, oil, and gas emit carbon dioxide when burned.",Mark,GPT-4o
Fossil fuels release energy when burned.,1,Fossil fuels release energy when burned.,Fossil fuels release energy when burned.,Mark,GPT-4o
Fossil records document evolutionary changes over geological periods.,1,Fossil records document evolutionary changes over geological periods.,Fossil records document evolutionary changes over geological periods.,Mark,GPT-4o
Fossil remains can inform paleontologists about organisms' morphology and behavior.,1,Fossil remains can inform paleontologists about organisms' morphology and behavior.,Fossil remains can inform paleontologists about organisms' morphology and behavior.,Mark,GPT-4o
Fossils echo history's forgotten chapters beneath Earth's layers.,1,Fossils echo history's forgotten chapters beneath Earth's layers.,Fossils echo history's forgotten chapters beneath Earth's layers.,Mark,GPT-4o
Fossils whisper stories of life's ancient dance preserved.,1,Fossils whisper stories of life's ancient dance preserved.,Fossils whisper stories of life's ancient dance preserved.,Mark,GPT-4o
Fractal geometry describes complex natural patterns.,1,Fractal geometry describes complex natural patterns.,Fractal geometry describes complex natural patterns.,Mark,GPT-4o
Fractals exhibit similar patterns at various scales in nature and mathematics.,1,Fractals exhibit similar patterns at various scales in nature and mathematics.,Fractals exhibit similar patterns at various scales in nature and mathematics.,Mark,GPT-4o
France is known for its iconic Eiffel Tower.,1,France is known for its iconic Eiffel Tower.,France is known for its iconic Eiffel Tower.,Mark,GPT-4o
Friction causes heat due to surface interactions.,1,Friction causes heat due to surface interactions.,Friction causes heat due to surface interactions.,Mark,GPT-4o
Friction opposes the movement between two surfaces.,1,Friction opposes the movement between two surfaces.,Friction opposes the movement between two surfaces.,Mark,GPT-4o
Friction reduces the speed of moving objects.,1,Friction reduces the speed of moving objects.,Friction reduces the speed of moving objects.,Mark,GPT-4o
Functional genomics investigates gene roles and functions.,1,Functional genomics investigates gene roles and functions.,Functional genomics investigates gene roles and functions.,Mark,GPT-4o
Fungi decompose organic material into simpler compounds.,1,Fungi decompose organic material into simpler compounds.,Fungi decompose organic material into simpler compounds.,Mark,GPT-4o
Fungi play essential ecological roles as decomposers.,1,Fungi play essential ecological roles as decomposers.,Fungi play essential ecological roles as decomposers.,Mark,GPT-4o
Fusion energy is generated when atomic nuclei merge.,1,Fusion energy is generated when atomic nuclei merge.,Fusion energy is generated when atomic nuclei merge.,Mark,GPT-4o
Fusion energy promises sustainable power.,1,Fusion energy promises sustainable power.,Fusion energy promises sustainable power.,Mark,GPT-4o
Fusion reactors promise clean energy.,1,Fusion reactors promise clean energy.,Fusion reactors promise clean energy.,Mark,GPT-4o
Galileo Galilei improved the telescope for astronomical observations in 1609.,1,Galileo Galilei improved the telescope for astronomical observations in 1609.,Galileo Galilei improved the telescope for astronomical observations in 1609.,Mark,GPT-4o
Gases expand to fill their container.,1,Gases expand to fill their container.,Gases expand to fill their container.,Mark,GPT-4o
Gears transmit mechanical power through rotational motion.,1,Gears transmit mechanical power through rotational motion.,Gears transmit mechanical power through rotational motion.,Mark,GPT-4o
Gene recombination increases genetic diversity.,1,Gene recombination increases genetic diversity.,Gene recombination increases genetic diversity.,Mark,GPT-4o
