statement,committer,elicitation
"La materia está compuesta de átomos, cada uno de los cuales consiste en protones, neutrones y electrones.",Nakh,Amazon Translate
Los cambios de estado de la materia dependen de las condiciones de temperatura y presión.,Nakh,Amazon Translate
Las prácticas meditativas se comparan positivamente con los ritmos neuronales observados durante el descanso.,Nakh,Amazon Translate
"La memoria es el álbum de recortes de la mente, que conserva instantáneas de nuestro pasado.",Nakh,Amazon Translate
"El metabolismo es el fuego que arde por dentro, alimentando todas las acciones de la vida.",Nakh,Amazon Translate
Las prácticas alimentarias conscientes promueven relaciones más saludables con los alimentos.,Nakh,Amazon Translate
La atención plena aumenta la autoconciencia y reduce los niveles de estrés.,Nakh,Amazon Translate
"Las mentes bailan en el salón de baile del pensamiento, coreografiadas por la razón.",Nakh,Amazon Translate
La ingesta moderada de cafeína puede mejorar la resistencia física de forma temporal.,Nakh,Amazon Translate
La moderación es la suave luz del sol que nutre el jardín del bienestar.,Nakh,Amazon Translate
Los monzones traen fuertes lluvias estacionales a regiones como el sur de Asia.,Nakh,Amazon Translate
El movimiento es el diálogo incesante de la vida con el tejido del espacio-tiempo.,Nakh,Amazon Translate
El monte Everest es el pico montañoso más alto del mundo.,Nakh,Amazon Translate
"Las montañas son las antiguas narradoras de la Tierra, susurrando historias de eones pasados.",Nakh,Amazon Translate
Las montañas son los firmes centinelas de la naturaleza que vigilan los esfuerzos humanos.,Nakh,Amazon Translate
Las cimas de las montañas hacen eco de la eternidad y susurran los secretos de las piedras antiguas.,Nakh,Amazon Translate
Las cimas de las montañas ofrecen vistas panorámicas de los paisajes y regiones circundantes.,Nakh,Amazon Translate
Los músculos son las palancas de la naturaleza que impulsan la maquinaria del movimiento diario.,Nakh,Amazon Translate
"Los músculos se fortalecen mediante la resistencia, como el hierro que afila el filo del acero.",Nakh,Amazon Translate
Las exhibiciones del museo reflejan la historia cultural y la evolución artística.,Nakh,Amazon Translate
La música evoca emociones y conecta más allá de las fronteras culturales.,Nakh,Amazon Translate
La música evoca emociones y resuena de manera diferente en las personas.,Nakh,Amazon Translate
"La música es el lenguaje del corazón, una melodía universal cantada en todas las culturas.",Nakh,Amazon Translate
La música es el latido del corazón que sincroniza el ritmo de las culturas globales.,Nakh,Amazon Translate
La nanotecnología es la varita mágica que construye vastos mundos a partir de partículas minúsculas.,Nakh,Amazon Translate
La respiración nasal durante la oración afecta a la fisiología de manera similar a los efectos de la respiración controlada.,Nakh,Amazon Translate
La selección natural esculpe la diversidad de la vida con una precisión meticulosa.,Nakh,Amazon Translate
"La naturaleza sigue su propio guion, a menudo incognoscible e infinito.",Nakh,Amazon Translate
La segunda ley de Newton establece que la fuerza es igual a la masa multiplicada por la aceleración.,Nakh,Amazon Translate
Tercera ley de Newton: toda acción tiene una reacción igual y opuesta.,Nakh,Amazon Translate
Las normas son la coreografía que dirige la danza de la vida comunal.,Nakh,Amazon Translate
Los números analizan las cantidades como elementos fundamentales de la computación.,Nakh,Amazon Translate
Los números y las operaciones forman la base de los principios aritméticos.,Nakh,Amazon Translate
Los números son las llaves que abren la sinfonía oculta del universo.,Nakh,Amazon Translate
Los números trazan un mapa del desierto inexplorado del reino de la razón humana.,Nakh,Amazon Translate
Los números cantan una sinfonía invisible en el teatro de la naturaleza.,Nakh,Amazon Translate
"Los números cuentan historias intemporales, independientemente de quién pase la página.",Nakh,Amazon Translate
Los números tejen patrones en el tejido de la realidad matemática.,Nakh,Amazon Translate
La nutrición es la brújula que guía el camino de la vida hacia el bienestar.,Nakh,Amazon Translate
La nutrición es el caleidoscopio que colorea el panorama en evolución de la salud.,Nakh,Amazon Translate
"Los consejos nutricionales a menudo reflejan puntos de vista sociales, no verdades definitivas.",Nakh,Amazon Translate
Los objetos en movimiento permanecen en movimiento a menos que se actúe sobre ellos por la fuerza.,Nakh,Amazon Translate
La observación revela patrones en las actividades de la vida cotidiana.,Nakh,Amazon Translate
Los fenómenos observados pueden interpretarse subjetivamente o medirse empíricamente.,Nakh,Amazon Translate
Los océanos son el espejo eterno de la Tierra y reflejan los sueños ilimitados del cielo.,Nakh,Amazon Translate
Los océanos son los pulmones del planeta y dan vida a los horizontes costeros.,Nakh,Amazon Translate
"Los omega-3 son el lubricante del cuerpo, vital como aceite en las máquinas.",Nakh,Amazon Translate
Las opiniones son subjetivas y varían entre las personas.,Nakh,Amazon Translate
Las opiniones son castillos construidos sobre las arenas movedizas del pensamiento.,Nakh,Amazon Translate
Las opiniones son la niebla que nubla el juicio y revelan distintas verdades individuales.,Nakh,Amazon Translate
Las opiniones son las lentes del caleidoscopio que tiñen la realidad con matices personales.,Nakh,Amazon Translate
Las opiniones son un espejismo resplandeciente; el oasis de la realidad a menudo está más allá de la vista.,Nakh,Amazon Translate
"Las opiniones son el clima; cambian, pero dan forma al clima cotidiano de la vida.",Nakh,Amazon Translate
"Las opiniones son el viento, a veces una suave brisa, a veces una tormenta.",Nakh,Amazon Translate
No se puede demostrar que las opiniones son objetivamente verdaderas o falsas.,Nakh,Amazon Translate
Las opiniones difieren según las experiencias y los prejuicios personales.,Nakh,Amazon Translate
Las opiniones sobre el arte son subjetivas y están influenciadas por la cultura.,Nakh,Amazon Translate
"Las opiniones reflejan creencias personales, no verdades objetivamente demostrables.",Nakh,Amazon Translate
Los acontecimientos del pasado son ecos que influyen en la realidad compartida de hoy.,Nakh,Amazon Translate
Los acontecimientos del pasado son ecos que resuenan en los pasillos del tiempo.,Nakh,Amazon Translate
La paciencia es el director que orquesta la sinfonía de la salud a un ritmo constante.,Nakh,Amazon Translate
La paciencia es el jardinero que cultiva las semillas del buen estado físico.,Nakh,Amazon Translate
La paciencia es el ingrediente secreto de la receta de la salud.,Nakh,Amazon Translate
La presión de grupo puede influir en la toma de decisiones y los comportamientos.,Nakh,Amazon Translate
El apoyo de los compañeros puede mejorar la motivación y el logro de las metas.,Nakh,Amazon Translate
"Las personas necesitan comida, agua y refugio para sobrevivir.",Nakh,Amazon Translate
Las personas valoran la honestidad en las relaciones personales y profesionales.,Nakh,Amazon Translate
"La percepción colorea la realidad, mezclando sesgos personales con hechos objetivos.",Nakh,Amazon Translate
La percepción es un prisma que refracta las realidades individuales desde una luz singular.,Nakh,Amazon Translate
La percepción es el colador que filtra la realidad a través de sesgos personales.,Nakh,Amazon Translate
Las percepciones son el caleidoscopio a través del cual la creencia refracta la realidad.,Nakh,Amazon Translate
Las percepciones influyen en la forma en que las personas ven el mundo y reaccionan ante él.,Nakh,Amazon Translate
"Las percepciones dibujan el viaje de acondicionamiento físico de la realidad, combinando el esfuerzo con los resultados imaginarios.",Nakh,Amazon Translate
Las preferencias personales guían las elecciones en la vida cotidiana.,Nakh,Amazon Translate
Las perspectivas son los prismas que refractan la luz de la experiencia humana.,Nakh,Amazon Translate
Las reflexiones filosóficas ofrecen un significado más profundo a las experiencias diarias.,Nakh,Amazon Translate
La filosofía explora las cuestiones existenciales utilizando argumentos razonados.,Nakh,Amazon Translate
La filosofía explora las preguntas de la vida a través del pensamiento razonado.,Nakh,Amazon Translate
La filosofía es el telescopio que revela verdades lejanas más allá de los horizontes individuales.,Nakh,Amazon Translate
La filosofía navega por las complejidades de la vida y ofrece mapas en aguas inexploradas.,Nakh,Amazon Translate
La fotosíntesis convierte la luz solar en glucosa y oxígeno.,Nakh,Amazon Translate
La fotosíntesis en las plantas produce oxígeno como subproducto.,Nakh,Amazon Translate
"La fotosíntesis es la alquimia de la naturaleza, que convierte la luz en aliento vital.",Nakh,Amazon Translate
La fotosíntesis es el motor verde que impulsa el vibrante tapiz de vida de la Tierra.,Nakh,Amazon Translate
La fotosíntesis transforma la luz del sol en el banquete imperecedero de la vida.,Nakh,Amazon Translate
Las leyes físicas gobiernan el universo de manera consistente y proporcionan predicciones mensurables.,Nakh,Amazon Translate
La física explica los fenómenos naturales con principios coherentes.,Nakh,Amazon Translate
"La física es el reloj del universo, que funciona en armonía con los ritmos cósmicos.",Nakh,Amazon Translate
Los principios de la física son fundamentales para los avances tecnológicos y de ingeniería.,Nakh,Amazon Translate
"Las llanuras son lienzos fértiles de la Tierra, pintados con cultivos y rebaños errantes.",Nakh,Amazon Translate
"Las plantas respiran la luz del sol, entretejiendo energía en el tejido de la existencia.",Nakh,Amazon Translate
Las plantas convierten la luz solar en energía a través de la fotosíntesis.,Nakh,Amazon Translate
"Las plantas necesitan luz solar, agua y nutrientes para crecer.",Nakh,Amazon Translate
La política es el teatro en el que el poder y la ambición suelen desempeñar su papel.,Nakh,Amazon Translate
"La oración altera las respuestas al estrés, asemejándose al impacto de la meditación en el cerebro.",Nakh,Amazon Translate
La oración puede reducir el estrés y promover una sensación de calma.,Nakh,Amazon Translate
La oración en la práctica religiosa a menudo busca la guía o el consuelo divinos.,Nakh,Amazon Translate
La oración es el puente entre la duda y la seguridad divina.,Nakh,Amazon Translate
Las preferencias son la especia de la vida y realzan el sabor de la experiencia individual.,Nakh,Amazon Translate
Las preferencias determinan las elecciones y los hábitos de estilo de vida.,Nakh,Amazon Translate
"Las preferencias dan forma a la sinfonía de la vida, cada nota es un reflejo de un lienzo personal.",Nakh,Amazon Translate
"Los prejuicios reflejan sesgos sociales, no realidades empíricas.",Nakh,Amazon Translate
Los prejuicios son las sombras que acechan en los pasillos del progreso social.,Nakh,Amazon Translate
La probabilidad evalúa la probabilidad de que ocurran eventos.,Nakh,Amazon Translate
La probabilidad baila con el destino en el casino de la vida.,Nakh,Amazon Translate
La probabilidad es la bola de cristal que predice los patrones ocultos en el caos.,Nakh,Amazon Translate
La probabilidad es la tirada de dados del gran juego del universo.,Nakh,Amazon Translate
La probabilidad mide las probabilidades de eventos dentro de un espacio muestral definido.,Nakh,Amazon Translate
"La probabilidad tira los dados de la vida, tejiendo patrones a partir de los enredados hilos de la incertidumbre.",Nakh,Amazon Translate
Una higiene adecuada ayuda a reducir la propagación de enfermedades infecciosas.,Nakh,Amazon Translate
Una nutrición adecuada impulsa los entrenamientos y ayuda a la recuperación.,Nakh,Amazon Translate
La postura correcta reduce el dolor de espalda y mejora la alineación general.,Nakh,Amazon Translate
Las instalaciones de arte público estimulan el discurso cultural y la participación de la comunidad.,Nakh,Amazon Translate
Un sueño de calidad rejuvenece el cuerpo y la mente.,Nakh,Amazon Translate
La computación cuántica promete avances transformadores en las capacidades de procesamiento de la información.,Nakh,Amazon Translate
El entrelazamiento cuántico teje partículas en un tapiz cósmico inseparable.,Nakh,Amazon Translate
La mecánica cuántica baila con el caos y revela patrones bajo la tranquila fachada de la realidad.,Nakh,Amazon Translate
La mecánica cuántica es la niña rebelde que desafía las expectativas clásicas.,Nakh,Amazon Translate
La mecánica cuántica teje la realidad con hilos de probabilidad e incertidumbre.,Nakh,Amazon Translate
Las selvas tropicales son catedrales verdes de la naturaleza que albergan los antiguos secretos de la Tierra.,Nakh,Amazon Translate
Las selvas tropicales como la Amazonia suelen ser ricas en biodiversidad y tienen copas densas.,Nakh,Amazon Translate
Los números racionales se expresan como fracciones de números enteros.,Nakh,Amazon Translate
La verdad de la realidad es a menudo un mosaico construido a partir de fragmentos subjetivos.,Nakh,Amazon Translate
La razón traza planos en los que se despliegan las posibilidades de la realidad.,Nakh,Amazon Translate
La recuperación es el suave susurro que repara los músculos después de una batalla bien librada.,Nakh,Amazon Translate
El reciclaje reduce los residuos y conserva los recursos naturales.,Nakh,Amazon Translate
La reducción del tiempo frente a la pantalla fomenta estilos de vida más activos y saludables.,Nakh,Amazon Translate
Los chequeos regulares ayudan a la detección temprana de problemas de salud.,Nakh,Amazon Translate
"El ejercicio regular es el elixir de la juventud, ya que desafía la marcha implacable del tiempo.",Nakh,Amazon Translate
"La relatividad dobla el tejido del espacio-tiempo, tejiendo las dimensiones en la realidad.",Nakh,Amazon Translate
La relatividad dobla el tiempo como un tejedor moldeando hilos en el telar cósmico.,Nakh,Amazon Translate
"La religión construye catedrales en el corazón, que albergan una fe invisible.",Nakh,Amazon Translate
La religión a menudo codifica leyes morales grabadas en piedra cósmica.,Nakh,Amazon Translate
La religión a menudo refleja las leyes invisibles que gobiernan el universo.,Nakh,Amazon Translate
La religión da forma a la sociedad como las fuerzas gravitacionales dan forma a las galaxias.,Nakh,Amazon Translate
Las religiones proponen marcos éticos que influyen en las normas sociales.,Nakh,Amazon Translate
El arte y la música religiosos expresan creencias y emociones espirituales.,Nakh,Amazon Translate
Las creencias religiosas guían las decisiones morales y éticas.,Nakh,Amazon Translate
Las comunidades religiosas fomentan los valores compartidos y la identidad grupal.,Nakh,Amazon Translate
Las congregaciones religiosas mejoran la cohesión social de manera similar a los mecanismos de supervivencia grupal.,Nakh,Amazon Translate
Las doctrinas religiosas proporcionan marcos dentro de la inmensidad del caos existencial.,Nakh,Amazon Translate
La fe religiosa interpreta con frecuencia las leyes naturales más allá de la comprensión empírica.,Nakh,Amazon Translate
El ayuno religioso se alinea con los beneficios biológicos que se ven en la restricción calórica.,Nakh,Amazon Translate
La música religiosa evoca respuestas neuronales similares a las de otros estímulos auditivos.,Nakh,Amazon Translate
"Los rituales religiosos son el mecanismo de la trascendencia, que marcan el tiempo con precisión sagrada.",Nakh,Amazon Translate
El simbolismo religioso transmite ideas complejas más allá de las interpretaciones literales.,Nakh,Amazon Translate
Los símbolos religiosos tienen diferentes significados según la interpretación personal.,Nakh,Amazon Translate
Los símbolos religiosos traducen los misterios del universo en narraciones tangibles.,Nakh,Amazon Translate
Las enseñanzas religiosas a menudo abordan las cuestiones existenciales de la vida.,Nakh,Amazon Translate
"La energía renovable es el susurro de la tierra, un suave llamado hacia la sostenibilidad.",Nakh,Amazon Translate
"La energía renovable es la promesa del futuro, ya que impulsa los sueños de manera sostenible.",Nakh,Amazon Translate
"Las fuentes de energía renovables reducen la dependencia de los combustibles fósiles, lo que beneficia al medio ambiente.",Nakh,Amazon Translate
La armonía ritual es similar a los procesos biológicos rítmicos en los organismos vivos.,Nakh,Amazon Translate
Los rituales desempeñan un papel importante en la observancia y la tradición religiosas.,Nakh,Amazon Translate
"Los ríos son las venas de la Tierra, que abren caminos a través de los continentes sin descanso.",Nakh,Amazon Translate
Los ríos tallan valles y dan forma a los asentamientos humanos a lo largo del tiempo.,Nakh,Amazon Translate
La robótica redefine el trabajo tradicional y desafía los paisajes económicos y sociales.,Nakh,Amazon Translate
Los robots son trabajadores incansables que construyen futuros con precisión mecánica.,Nakh,Amazon Translate
Las reglas son las barreras que mantienen a la sociedad en la carretera de la convivencia.,Nakh,Amazon Translate
Los textos sagrados son fundamentales para las enseñanzas de muchas religiones.,Nakh,Amazon Translate
Los satélites son los ojos que vigilan la Tierra desde su posición celestial.,Nakh,Amazon Translate
La ciencia tiende puentes a través de los abismos del misterio.,Nakh,Amazon Translate
"La ciencia descifra el susurro del universo, un poema escrito a la luz de las estrellas.",Nakh,Amazon Translate
Los hechos científicos demuestran su validez independientemente de la opinión personal.,Nakh,Amazon Translate
Las revistas científicas pueden hacerse eco de las creencias prevalecientes y difuminar la objetividad.,Nakh,Amazon Translate
"Los paradigmas científicos evolucionan, reflejando las creencias prevalecientes de la comunidad.",Nakh,Amazon Translate
Las teorías científicas son los mapas extraídos de la fuente de la investigación colectiva.,Nakh,Amazon Translate
Los cambios estacionales se producen debido a la inclinación axial de la Tierra.,Nakh,Amazon Translate
Los estilos de vida sedentarios pueden provocar problemas de salud como la obesidad.,Nakh,Amazon Translate
La autoconciencia florece como una flor rara en el jardín de la percepción.,Nakh,Amazon Translate
La autoconciencia crece a través de la introspección y la comprensión de las experiencias personales.,Nakh,Amazon Translate
"La teoría de conjuntos estudia conjuntos de objetos distintos, llamados conjuntos.",Nakh,Amazon Translate
Las decisiones de compra suelen estar influenciadas por el marketing y la publicidad.,Nakh,Amazon Translate
El sueño afecta los niveles de energía y la función cognitiva.,Nakh,Amazon Translate
"El sueño es el taller de reparación del cuerpo, que restaura la energía y repara el desgaste diario.",Nakh,Amazon Translate
Dormir es el hechizo mágico que rejuvenece el cuerpo tras los duelos diarios.,Nakh,Amazon Translate
El sueño es la musa silenciosa que inspira vitalidad cada mañana.,Nakh,Amazon Translate
La calidad del sueño afecta la concentración y la retención de la memoria.,Nakh,Amazon Translate
El sueño rejuvenece como el agua en un paisaje reseco.,Nakh,Amazon Translate
Los dispositivos inteligentes se integran perfectamente en la vida diaria e influyen en los comportamientos humanos.,Nakh,Amazon Translate
Los teléfonos inteligentes son los portales de bolsillo que conectan a las personas con infinitas posibilidades.,Nakh,Amazon Translate
Dejar de fumar mejora la salud pulmonar y el estado físico general.,Nakh,Amazon Translate
Los constructos sociales son los andamios que dan forma a la compleja arquitectura de la realidad.,Nakh,Amazon Translate
Las construcciones sociales son el guion que la humanidad escribe y sigue instintivamente.,Nakh,Amazon Translate
Las convenciones sociales son los antiguos ríos que abren caminos en el desierto de la humanidad.,Nakh,Amazon Translate
Las expectativas sociales son los precipicios que desafían a las personas a saltar hacia la aceptación.,Nakh,Amazon Translate
Las redes sociales influyen en la comunicación diaria y el intercambio de información.,Nakh,Amazon Translate
Las redes sociales son el ágora moderna donde las ideas chocan y convergen.,Nakh,Amazon Translate
Las normas sociales son guiones invisibles que dirigen el juego de la vida cotidiana.,Nakh,Amazon Translate
Las normas sociales son los conductores silenciosos que orquestan la cadencia del ritmo cultural.,Nakh,Amazon Translate
Las normas sociales guían el comportamiento en los entornos comunitarios.,Nakh,Amazon Translate
Las normas sociales influyen en las elecciones e interacciones diarias.,Nakh,Amazon Translate
Las normas sociales influyen en la forma en que se registra y presenta la historia.,Nakh,Amazon Translate
Las normas sociales orquestan el vals de valores y conducta de la sociedad.,Nakh,Amazon Translate
Las reglas sociales mantienen el orden y la previsibilidad en las comunidades.,Nakh,Amazon Translate
"La estratificación social forma las capas de la geología social, moldeadas por comportamientos acumulativos.",Nakh,Amazon Translate
"Las sociedades evolucionan, deshaciéndose de viejas creencias como las serpientes se deshacen de su piel.",Nakh,Amazon Translate
Los valores de la sociedad dibujan el telón de fondo del escenario de la experiencia humana.,Nakh,Amazon Translate
El sonido viaja más rápido en el agua que en el aire.,Nakh,Amazon Translate
El despertar espiritual es un viaje personal que a menudo se define por la experiencia subjetiva.,Nakh,Amazon Translate
Los despertares espirituales son paralelos a los estados psicológicos observables a través de los estudios de conciencia.,Nakh,Amazon Translate
Las tradiciones espirituales describen las leyes existenciales cuando las estrellas iluminan los cielos nocturnos.,Nakh,Amazon Translate
La espiritualidad es el imán que atrae a la humanidad hacia la contemplación existencial.,Nakh,Amazon Translate
Los datos estadísticos son el lienzo donde las probabilidades dibujan el futuro.,Nakh,Amazon Translate
Los modelos estadísticos dibujan imágenes con la paleta de números.,Nakh,Amazon Translate
La estadística analiza los datos numéricos para sacar conclusiones.,Nakh,Amazon Translate
"La fuerza no es solo músculo, sino la fortaleza de la resiliencia.",Nakh,Amazon Translate
"La fuerza es la joya escondida, que aprovecha el potencial sin explotar del cuerpo.",Nakh,Amazon Translate
"El entrenamiento de fuerza construye el castillo del cuerpo, ladrillo por ladrillo irremplazable.",Nakh,Amazon Translate
El entrenamiento de fuerza aumenta la masa muscular y la tasa metabólica.,Nakh,Amazon Translate
"El entrenamiento de fuerza es el escultor, cincelando el cuerpo de los sueños.",Nakh,Amazon Translate
"El estiramiento despierta los músculos dormidos, una suave brisa matutina de renovación.",Nakh,Amazon Translate
El estiramiento mejora la flexibilidad y reduce el riesgo de lesiones.,Nakh,Amazon Translate
"El estiramiento es un amanecer para los músculos, ya que el amanecer es inevitable.",Nakh,Amazon Translate
La exposición a la luz solar ayuda al cuerpo a producir vitamina D.,Nakh,Amazon Translate
Los símbolos en el arte religioso se hacen eco de las interpretaciones psicológicas de la percepción visual.,Nakh,Amazon Translate
La simetría en las ecuaciones refleja el equilibrio en el diseño de la naturaleza.,Nakh,Amazon Translate
Los avances tecnológicos redefinen las normas sociales y la vida cotidiana.,Nakh,Amazon Translate
La tecnología afecta la forma en que nos comunicamos y accedemos a la información.,Nakh,Amazon Translate
La tecnología es el arquitecto silencioso que diseña hoy las realidades del mañana.,Nakh,Amazon Translate
"La tecnología es el aprendiz de brujo, tejiendo magia a partir de circuitos y códigos.",Nakh,Amazon Translate
La tecnología es el mago que moldea el reino del mañana a partir de los sueños de ayer.,Nakh,Amazon Translate
La tecnología moldea la percepción humana a través de algoritmos y experiencias personalizadas.,Nakh,Amazon Translate
La tecnología transforma los sueños en formas tangibles a través de aplicaciones prácticas.,Nakh,Amazon Translate
"La temperatura afecta el estado del agua, transformando el hielo en líquido.",Nakh,Amazon Translate
"La temperatura es el termómetro de la naturaleza, que mide el calor de la armonía cósmica.",Nakh,Amazon Translate
La selva amazónica alberga una vasta biodiversidad.,Nakh,Amazon Translate
El río Amazonas es el más grande del mundo por volumen de descarga.,Nakh,Amazon Translate
La Cordillera de los Andes es la cadena montañosa continental más larga.,Nakh,Amazon Translate
"La Tierra orbita alrededor del Sol una vez cada 365,25 días.",Nakh,Amazon Translate
"La Tierra orbita alrededor del Sol, creando cambios estacionales.",Nakh,Amazon Translate
"La Tierra gira, entretejiendo el día con la noche con una gracia infalible.",Nakh,Amazon Translate
El campo magnético de la Tierra influye en la navegación con brújula.,Nakh,Amazon Translate
El ecuador divide la Tierra en los hemisferios norte y sur.,Nakh,Amazon Translate
La secuencia de Fibonacci se hace eco de las simetrías ocultas y recurrentes de la naturaleza.,Nakh,Amazon Translate
La secuencia de Fibonacci en la naturaleza refleja la armonía intrínseca del universo.,Nakh,Amazon Translate
El Gran Cañón fue tallado por la erosión del río Colorado.,Nakh,Amazon Translate
La Gran Barrera de Coral se encuentra frente a la costa noreste de Australia.,Nakh,Amazon Translate
La Gran Barrera de Coral es el sistema de arrecifes de coral más grande del mundo.,Nakh,Amazon Translate
