statement,committer,elicitation
El pescado se pudre de la cabeza para abajo.,Nakh,Amazon Translate
El pan siempre cae con la mantequilla hacia abajo.,Nakh,Amazon Translate
Las fresas son dulces.,Nakh,Amazon Translate
Los pájaros vuelan hacia el sur durante el invierno.,Nakh,Amazon Translate
Los plátanos tienen un alto contenido de potasio.,Nakh,Amazon Translate
Las montañas son más grandes que las colinas.,Nakh,Amazon Translate
Las plantas crecen hacia la luz.,Nakh,Amazon Translate
El corazón bombea sangre por todo el cuerpo.,Nakh,Amazon Translate
El reciclaje conserva los recursos.,Nakh,Amazon Translate
Los bosques están densos de árboles.,Nakh,Amazon Translate
La contaminación plástica es una preocupación mundial.,Nakh,Amazon Translate
Las cosas calientes pueden quemarte.,Nakh,Amazon Translate
El calor puede provocar deshidratación.,Nakh,Amazon Translate
La electricidad puede ser peligrosa.,Nakh,Amazon Translate
Los seres humanos necesitan agua para sobrevivir.,Nakh,Amazon Translate
El mundo está a tus pies.,Nakh,Amazon Translate
Un problema compartido es un problema reducido a la mitad.,Nakh,Amazon Translate
El amor es ciego.,Nakh,Amazon Translate
La promesa es una deuda.,Nakh,Amazon Translate
El contenido es el rey.,Nakh,Amazon Translate
"Menos palabras, más acción.",Nakh,Amazon Translate
La previsión evita errores.,Nakh,Amazon Translate
No hay honor entre los ladrones.,Nakh,Amazon Translate
El respeto por los mayores es un valor común.,Nakh,Amazon Translate
Vale la pena perseguir los sueños.,Nakh,Amazon Translate
"Lo que va, vuelve",Nakh,Amazon Translate
La discriminación es injusta.,Nakh,Amazon Translate
Las palabras amables tienen el poder de construir puentes.,Nakh,Amazon Translate
La confianza se gana con esfuerzo.,Nakh,Amazon Translate
El arte puede ser una forma de autoexpresión.,Nakh,Amazon Translate
Darse la mano es un saludo común.,Nakh,Amazon Translate
Papá Noel trae regalos a los niños en Navidad.,Nakh,Amazon Translate
La música clásica ayuda a la concentración.,Nakh,Amazon Translate
La gente celebra los cumpleaños.,Nakh,Amazon Translate
Es común enviar tarjetas navideñas alrededor de diciembre.,Nakh,Amazon Translate
Los ahorros regulares conducen a la estabilidad financiera.,Nakh,Amazon Translate
Graduarse de la universidad aumenta las perspectivas laborales.,Nakh,Amazon Translate
El llanto ayuda a liberar las emociones.,Nakh,Amazon Translate
Los gobiernos crean leyes.,Nakh,Amazon Translate
Los estudiantes estudian para los exámenes.,Nakh,Amazon Translate
Muchas personas disfrutan del té.,Nakh,Amazon Translate
Hacer trampa está mal visto.,Nakh,Amazon Translate
Espera tu turno cuando estés en la cola.,Nakh,Amazon Translate
Estar organizado ayuda a la eficiencia.,Nakh,Amazon Translate
Las creencias religiosas varían de una cultura a otra.,Nakh,Amazon Translate
"Cuantos más, mejor.",Nakh,Amazon Translate
Las relaciones tienen que ver con la compatibilidad y los objetivos intrincados.,Nakh,Amazon Translate
Confía en tus instintos.,Nakh,Amazon Translate
La lectura te hace más inteligente.,Nakh,Amazon Translate
Dar prioridad a la familia es esencial.,Nakh,Amazon Translate
Las redes sociales tienen un impacto negativo en la salud mental.,Nakh,Amazon Translate
La verdad duele.,Nakh,Amazon Translate
Votar es un deber cívico.,Nakh,Amazon Translate
La amabilidad importa profundamente.,Nakh,Amazon Translate
La gente suele sentir nostalgia por su infancia.,Nakh,Amazon Translate
La música puede mejorar el estado de ánimo.,Nakh,Amazon Translate
Los perros son mascotas leales.,Nakh,Amazon Translate
Mostrar gratitud es de buenos modales.,Nakh,Amazon Translate
Hacer trampa es deshonesto.,Nakh,Amazon Translate
Los niños aprenden con el ejemplo.,Nakh,Amazon Translate
El hambre es la mejor salsa.,Nakh,Amazon Translate
La amabilidad no cuesta nada.,Nakh,Amazon Translate
"La cortesía no cuesta nada, pero lo compra todo.",Nakh,Amazon Translate
Una actitud positiva atrae resultados positivos.,Nakh,Amazon Translate
Un pobre obrero culpa a sus herramientas.,Nakh,Amazon Translate
Los mendigos no pueden elegir.,Nakh,Amazon Translate
Ayudar a los demás es un acto noble.,Nakh,Amazon Translate
La perseverancia da sus frutos.,Nakh,Amazon Translate
La bondad engendra amabilidad.,Nakh,Amazon Translate
La amistad enriquece la vida.,Nakh,Amazon Translate
Las acciones deben coincidir con las palabras.,Nakh,Amazon Translate
Las mascotas suelen alegrar a sus dueños.,Nakh,Amazon Translate
Una sonrisa a menudo indica amabilidad.,Nakh,Amazon Translate
Los cumplidos pueden aumentar la confianza de una persona.,Nakh,Amazon Translate
El tiempo cura todas las heridas.,Nakh,Amazon Translate
"Cuando sube la marea, todos los barcos flotan.",Nakh,Amazon Translate
El progreso social depende de la distribución equitativa de los recursos.,Nakh,Amazon Translate
Cada rosa tiene su espina.,Nakh,Amazon Translate
Las matemáticas revelan verdades universales.,Nakh,Amazon Translate
La transformación digital reconfigura las industrias.,Nakh,Amazon Translate
Los puentes conectan comunidades e ideas.,Nakh,Amazon Translate
La pluma es más poderosa que la espada.,Nakh,Amazon Translate
"El que no llora, no mama.",Nakh,Amazon Translate
La precisión del lenguaje garantiza la claridad.,Nakh,Amazon Translate
La inteligencia artificial transforma las industrias.,Nakh,Amazon Translate
Las metáforas crean imágenes vívidas en el lenguaje.,Nakh,Amazon Translate
La arquitectura da forma a nuestro entorno construido.,Nakh,Amazon Translate
La caída del Muro de Berlín simbolizó nuevas libertades.,Nakh,Amazon Translate
La escultura puede recordar la historia.,Nakh,Amazon Translate
El arte figurativo representa formas humanas.,Nakh,Amazon Translate
La cadena de bloques garantiza la seguridad de las transacciones.,Nakh,Amazon Translate
Los algoritmos eficientes optimizan el rendimiento.,Nakh,Amazon Translate
Las estrellas llenan el cielo nocturno.,Nakh,Amazon Translate
Las reglas gramaticales estructuran los lenguajes.,Nakh,Amazon Translate
La inteligencia artificial personaliza las experiencias de los usuarios.,Nakh,Amazon Translate
Muchos credos incluyen rituales de unción.,Nakh,Amazon Translate
Nikola Tesla contribuyó significativamente a la electricidad y al magnetismo.,Nakh,Amazon Translate
Miguel Ángel pintó el techo de la Capilla Sixtina.,Nakh,Amazon Translate
La iluminación tenue crea un ambiente relajante.,Nakh,Amazon Translate
La tecnología impulsa la comunicación moderna.,Nakh,Amazon Translate
El baile social combina ejercicio y socialización.,Nakh,Amazon Translate
Los chequeos regulares son importantes.,Nakh,Amazon Translate
La electricidad impulsa la tecnología moderna.,Nakh,Amazon Translate
Los diccionarios son útiles para el significado de las palabras.,Nakh,Amazon Translate
Las montañas se erigían como guardianes silenciosos.,Nakh,Amazon Translate
Una olla vigilada nunca hierve.,Nakh,Amazon Translate
Las sábanas limpias prometen un sueño reparador.,Nakh,Amazon Translate
Llevar un diario aclara la mente.,Nakh,Amazon Translate
La pintura captura momentos en el tiempo.,Nakh,Amazon Translate
"Espacio limpio, mente clara.",Nakh,Amazon Translate
Párate y huele las rosas.,Nakh,Amazon Translate
Los recorridos panorámicos relajan la mente.,Nakh,Amazon Translate
Pasar tiempo al aire libre levanta el ánimo.,Nakh,Amazon Translate
Los espacios ordenados mejoran la concentración.,Nakh,Amazon Translate
Las innovaciones digitales transforman las empresas.,Nakh,Amazon Translate
Los fotógrafos capturan historias visuales.,Nakh,Amazon Translate
Leonardo da Vinci pintó la Mona Lisa.,Nakh,Amazon Translate
Los amigos que hacen buen tiempo no son de fiar.,Nakh,Amazon Translate
Los lugares emblemáticos más conocidos fomentan el turismo.,Nakh,Amazon Translate
La curiosidad mató al gato.,Nakh,Amazon Translate
La comprensión precede a la acción ética.,Nakh,Amazon Translate
Los modales hacen al hombre.,Nakh,Amazon Translate
"Buscadores, guardianes, perdedores, llorones.",Nakh,Amazon Translate
La fortuna favorece a los audaces.,Nakh,Amazon Translate
Sin dolor no hay ganancia.,Nakh,Amazon Translate
La ausencia hace crecer el cariño.,Nakh,Amazon Translate
El análisis de los hechos informa la estrategia.,Nakh,Amazon Translate
El conocimiento disipa la ignorancia.,Nakh,Amazon Translate
La validación mejora la autoestima.,Nakh,Amazon Translate
Agarrarse a pajitas significa hacer un intento desesperado.,Nakh,Amazon Translate
Los buenos modales abren puertas.,Nakh,Amazon Translate
Elevar la moral de los demás aumenta la moral.,Nakh,Amazon Translate
Las conjeturas fundamentadas ayudan a hacer predicciones.,Nakh,Amazon Translate
Liderar con el ejemplo fomenta la confianza.,Nakh,Amazon Translate
Participar en maratones desafía y motiva.,Nakh,Amazon Translate
Las reacciones químicas a menudo liberan energía.,Nakh,Amazon Translate
La Tierra tiene climas variados.,Nakh,Amazon Translate
"En triángulos rectángulos, a^2 + b^2 = c^2.",Nakh,Amazon Translate
El plano cartesiano mapea ubicaciones geométricas,Nakh,Amazon Translate
La hierba se siente suave bajo los pies.,Nakh,Amazon Translate
El Proyecto Manhattan creó armas nucleares.,Nakh,Amazon Translate
Los árboles producen oxígeno.,Nakh,Amazon Translate
El relámpago precede al trueno.,Nakh,Amazon Translate
E=mc^2 es la teoría de la relatividad de Einstein.,Nakh,Amazon Translate
Tomar vitaminas favorece la salud.,Nakh,Amazon Translate
"Pi (π) es aproximadamente 3,14.",Nakh,Amazon Translate
Los coliseos simbolizan las civilizaciones antiguas.,Nakh,Amazon Translate
Los avances en la medicina prolongan la vida humana.,Nakh,Amazon Translate
La nanotecnología tiene aplicaciones en la medicina.,Nakh,Amazon Translate
La naturaleza tiende a restablecer el equilibrio.,Nakh,Amazon Translate
La lógica algorítmica impulsa los cálculos.,Nakh,Amazon Translate
Las catedrales góticas fueron arquitectónicamente innovadoras.,Nakh,Amazon Translate
La verificación de datos garantiza la precisión.,Nakh,Amazon Translate
El sueño restaura la claridad mental.,Nakh,Amazon Translate
Los exámenes físicos regulares detectan los problemas a tiempo.,Nakh,Amazon Translate
Los protocolos de seguridad previenen accidentes.,Nakh,Amazon Translate
Plancha la ropa para una apariencia pulida.,Nakh,Amazon Translate
La medicina de precisión adapta el tratamiento a las personas.,Nakh,Amazon Translate
Los estantes deben desempolvarse con regularidad para mantener la limpieza.,Nakh,Amazon Translate
Practicar taichí promueve el equilibrio.,Nakh,Amazon Translate
El análisis crítico refina los modelos.,Nakh,Amazon Translate
La Biblia de Gutenberg marcó un hito en la impresión.,Nakh,Amazon Translate
Los análisis estructurados refinan los procesos.,Nakh,Amazon Translate
Las novelas gráficas cuentan historias extensas.,Nakh,Amazon Translate
Los rompecabezas estimulan el cerebro.,Nakh,Amazon Translate
Las cartas manuscritas parecen personales.,Nakh,Amazon Translate
La belleza llega hasta la piel.,Nakh,Amazon Translate
Observar las estrellas puede ser impresionante.,Nakh,Amazon Translate
Un desayuno abundante le da energía para el día.,Nakh,Amazon Translate
Los árboles susurran sonidos relajantes.,Nakh,Amazon Translate
Las obras exploran narrativas complejas.,Nakh,Amazon Translate
Los jardines pueden ser terapéuticos.,Nakh,Amazon Translate
Las plataformas de aprendizaje en línea democratizan la educación.,Nakh,Amazon Translate
El ciclismo te mantiene joven.,Nakh,Amazon Translate
Los paseos nocturnos ayudan a relajarse.,Nakh,Amazon Translate
Los retratos capturan la imagen de una persona.,Nakh,Amazon Translate
La caligrafía convierte la escritura en arte.,Nakh,Amazon Translate
La Revolución Industrial reformó las sociedades.,Nakh,Amazon Translate
El hackeo ético protege los sistemas.,Nakh,Amazon Translate
Los viajes chamánicos a menudo implican estados de trance.,Nakh,Amazon Translate
Una lógica clara desentraña los problemas.,Nakh,Amazon Translate
Los sistemas legales defienden el orden social.,Nakh,Amazon Translate
La unión hace la fuerza.,Nakh,Amazon Translate
Las falacias lógicas debilitan los argumentos.,Nakh,Amazon Translate
Las hipótesis deben ser comprobables.,Nakh,Amazon Translate
Un análisis exhaustivo evita errores.,Nakh,Amazon Translate
La era de la Ilustración promovió la razón.,Nakh,Amazon Translate
La paciencia es una virtud.,Nakh,Amazon Translate
La exploración racional busca la verdad.,Nakh,Amazon Translate
El cuestionamiento socrático promueve una comprensión profunda.,Nakh,Amazon Translate
El conocimiento genera sabiduría.,Nakh,Amazon Translate
La mentalidad abierta fomenta el aprendizaje.,Nakh,Amazon Translate
Se necesitan dos para bailar un tango.,Nakh,Amazon Translate
La equidad social promueve la equidad.,Nakh,Amazon Translate
Los movimientos de derechos civiles defendieron la igualdad.,Nakh,Amazon Translate
Un objetivo claro marca el camino.,Nakh,Amazon Translate
La amabilidad se extiende como la pólvora.,Nakh,Amazon Translate
Las buenas acciones difunden la buena voluntad.,Nakh,Amazon Translate
La crítica objetiva refina las prácticas.,Nakh,Amazon Translate
La ignorancia es felicidad.,Nakh,Amazon Translate
La humildad cultiva el respeto.,Nakh,Amazon Translate
Disculparse puede restaurar la armonía.,Nakh,Amazon Translate
Ofrecer perdón cura las heridas.,Nakh,Amazon Translate
El estímulo inspira la acción.,Nakh,Amazon Translate
Derramar los frijoles significa revelar un secreto.,Nakh,Amazon Translate
"No desperdicies, no quieras.",Nakh,Amazon Translate
La humildad precede al honor.,Nakh,Amazon Translate
El que duda está perdido.,Nakh,Amazon Translate
La gratitud fomenta la alegría.,Nakh,Amazon Translate
Las acciones hablan más que las palabras.,Nakh,Amazon Translate
Las sagas culturales narran acontecimientos históricos.,Nakh,Amazon Translate
Las órdenes monásticas siguen reglas estrictas.,Nakh,Amazon Translate
Los pasos lógicos mejoran los procedimientos.,Nakh,Amazon Translate
El sintoísmo implica rituales de purificación.,Nakh,Amazon Translate
La atención plena mejora la concentración.,Nakh,Amazon Translate
Practicar instrumentos te prepara para las actuaciones.,Nakh,Amazon Translate
Los marcos estructurados guían el aprendizaje.,Nakh,Amazon Translate
Los preparativos estructurados garantizan la preparación.,Nakh,Amazon Translate
La prueba por contradicción valida los teoremas.,Nakh,Amazon Translate
La redacción de listas organiza las tareas.,Nakh,Amazon Translate
Las sinagogas son lugares de culto judío.,Nakh,Amazon Translate
El judaísmo observa el sábado semanalmente.,Nakh,Amazon Translate
Las metodologías estandarizan los procedimientos.,Nakh,Amazon Translate
El Ramadán es un mes sagrado en el Islam.,Nakh,Amazon Translate
Es habitual dejar propina en los restaurantes.,Nakh,Amazon Translate
Compartir comidas crea vínculos.,Nakh,Amazon Translate
Las notas manuscritas muestran consideración.,Nakh,Amazon Translate
Lea libros para ampliar sus conocimientos.,Nakh,Amazon Translate
Los cuentos populares reflejan el conocimiento indígena.,Nakh,Amazon Translate
Los criterios objetivos garantizan la equidad.,Nakh,Amazon Translate
"El sintoísmo se centra en los kami, o seres espirituales.",Nakh,Amazon Translate
La sonrisa es contagiosa.,Nakh,Amazon Translate
La historia se repite.,Nakh,Amazon Translate
Los perros son animales leales.,Nakh,Amazon Translate
Compartir es cuidar.,Nakh,Amazon Translate
La ética de la IA aborda los problemas de sesgo.,Nakh,Amazon Translate
Las novelas pueden ofrecer comentarios sociales.,Nakh,Amazon Translate
La lógica clara explica los fenómenos.,Nakh,Amazon Translate
Los deportes de equipo fomentan la camaradería.,Nakh,Amazon Translate
Muchas culturas practican el culto a los antepasados.,Nakh,Amazon Translate
Organizar cenas fomenta las relaciones.,Nakh,Amazon Translate
Cumplir con los plazos demuestra responsabilidad.,Nakh,Amazon Translate
Compartir difunde alegría.,Nakh,Amazon Translate
Decir buenos días crea una buena relación.,Nakh,Amazon Translate
Los cumplidos levantan el ánimo.,Nakh,Amazon Translate
Los gestos amables crean vínculos fuertes.,Nakh,Amazon Translate
Los cumplidos aumentan la autoestima.,Nakh,Amazon Translate
Ofrecer comodidad alivia el dolor.,Nakh,Amazon Translate
El estímulo alimenta la motivación.,Nakh,Amazon Translate
Los saludos establecen una buena relación en las conversaciones.,Nakh,Amazon Translate
Las palabras reconfortantes alivian las emociones difíciles.,Nakh,Amazon Translate
Usar please muestra respeto.,Nakh,Amazon Translate
Una sonrisa cálida invita a la amistad.,Nakh,Amazon Translate
Prestar atención demuestra empatía.,Nakh,Amazon Translate
Las respuestas oportunas son respetuosas.,Nakh,Amazon Translate
El álgebra es el lenguaje que traduce la realidad en susurros abstractos.,Nakh,Amazon Translate
El cálculo une puntos finitos con horizontes infinitos en el lienzo de la naturaleza.,Nakh,Amazon Translate
"La geometría da forma a la arquitectura invisible del universo, forjando la realidad.",Nakh,Amazon Translate
"La gravedad es el ancla del universo, que cimenta los mares cósmicos de estrellas.",Nakh,Amazon Translate
El infinito es el espejo que refleja la búsqueda sin fin de las matemáticas.,Nakh,Amazon Translate
La lógica nos guía a través del intrincado laberinto de la comprensión.,Nakh,Amazon Translate
"Las matemáticas tejen redes de lógica, captando verdades fugaces de la existencia.",Nakh,Amazon Translate
Las parábolas son las curvas de la naturaleza que se arquean a través del tejido invisible de la realidad.,Nakh,Amazon Translate
"Pi es la melodía infinita, la sinfonía infinita de los círculos cantantes.",Nakh,Amazon Translate
Los números primos son los centinelas silenciosos del universo que guardan el misterio.,Nakh,Amazon Translate
La religión ofrece una brújula que apunta a los cielos invisibles a simple vista.,Nakh,Amazon Translate
Las estadísticas dibujan patrones en el lienzo de eventos improbables.,Nakh,Amazon Translate
La suma del triángulo es una verdad eterna que desafía las dimensiones.,Nakh,Amazon Translate
*Las matemáticas son la brújula que navega por el océano de lo desconocido. *,Nakh,Amazon Translate
La impresión 3D es la herramienta del creador para crear objetos a partir de la imaginación.,Nakh,Amazon Translate
Una dieta equilibrada es la brújula que navega por el extenso océano del bienestar.,Nakh,Amazon Translate
Un sistema de creencias es una balsa que navega por el río de la existencia.,Nakh,Amazon Translate
El motor de un automóvil convierte el combustible en energía mecánica para el movimiento.,Nakh,Amazon Translate
La circunferencia de un círculo se calcula con su radio.,Nakh,Amazon Translate
La aguja de una brújula apunta hacia el polo norte magnético.,Nakh,Amazon Translate
Una función asigna entradas a salidas específicas.,Nakh,Amazon Translate
Una hipótesis es una explicación propuesta probada mediante observación empírica.,Nakh,Amazon Translate
La escala de un mapa representa proporcionalmente las distancias del mundo real.,Nakh,Amazon Translate
"Una parábola es una curva simétrica, representada gráficamente por una ecuación cuadrática.",Nakh,Amazon Translate
El arte de una sociedad refleja sus esperanzas y temores colectivos.,Nakh,Amazon Translate
Un cuadrado tiene cuatro lados de igual longitud.,Nakh,Amazon Translate
Una señal de stop significa que los conductores deben detenerse antes de continuar.,Nakh,Amazon Translate
Un teorema proporciona una afirmación comprobada dentro de un marco matemático.,Nakh,Amazon Translate
La edad de un árbol se puede determinar contando sus anillos.,Nakh,Amazon Translate
Los ángulos interiores de un triángulo suman 180 grados.,Nakh,Amazon Translate
"Un año equivale aproximadamente a 365,25 días debido a la órbita de la Tierra.",Nakh,Amazon Translate
El descanso adecuado es crucial para la recuperación y el crecimiento muscular.,Nakh,Amazon Translate
El descanso adecuado es el aliado silencioso de la implacable maratón del fitness.,Nakh,Amazon Translate
La aerodinámica es la tutora del viento y enseña a las máquinas el arte de volar.,Nakh,Amazon Translate
El aire se siente denso con verdades tácitas que cuelgan como nubes de tormenta.,Nakh,Amazon Translate
El álgebra implica resolver ecuaciones y comprender funciones.,Nakh,Amazon Translate
El álgebra usa símbolos para resolver ecuaciones que representan relaciones.,Nakh,Amazon Translate
El álgebra susurra secretos que solo el oyente cuidadoso descifrará.,Nakh,Amazon Translate
El altruismo en las doctrinas religiosas es paralelo a la selección de parentesco de la biología evolutiva.,Nakh,Amazon Translate
La ambición es el fuego que alimenta la incesante búsqueda de progreso de la humanidad.,Nakh,Amazon Translate
Un número impar no es divisible de manera uniforme por dos.,Nakh,Amazon Translate
Los mitos antiguos reflejan arquetipos que se asemejan a patrones psicológicos evolutivos.,Nakh,Amazon Translate
"La Antártida es el continente más frío, ubicado en la parte más meridional de la Tierra.",Nakh,Amazon Translate
Los cálculos de área requieren comprender las relaciones dimensionales en figuras geométricas.,Nakh,Amazon Translate
La aritmética es el esqueleto que sostiene la carne de la comprensión.,Nakh,Amazon Translate
El arte puede desafiar las normas e inspirar el cambio social.,Nakh,Amazon Translate
El arte desafía las normas sociales y suscita conversaciones y reflexiones.,Nakh,Amazon Translate
El arte transmite historias culturales a través de expresiones visuales y emocionales.,Nakh,Amazon Translate
Los movimientos artísticos a menudo reflejan cambios en las actitudes culturales.,Nakh,Amazon Translate
El arte da forma y refleja los valores y normas sociales.,Nakh,Amazon Translate
La inteligencia artificial automatiza las tareas y mejora la eficiencia en varios sectores.,Nakh,Amazon Translate
La inteligencia artificial imita el razonamiento humano y amplía las fronteras tecnológicas.,Nakh,Amazon Translate
La expresión artística teje un tapiz de esperanzas e historias que invita a la reflexión.,Nakh,Amazon Translate
Los estilos artísticos varían de una cultura a otra y reflejan valores diversos.,Nakh,Amazon Translate
Los átomos son los componentes fundamentales de la materia.,Nakh,Amazon Translate
La realidad aumentada superpone la información digital a las percepciones físicas.,Nakh,Amazon Translate
La autenticidad es la luz que atraviesa la sombra de la conformidad.,Nakh,Amazon Translate
Los axiomas son verdades evidentes que forman la base de los sistemas matemáticos.,Nakh,Amazon Translate
Los axiomas son las semillas de las que crecen los bosques matemáticos.,Nakh,Amazon Translate
Las bacterias se reproducen rápidamente en condiciones favorables como el calor y la humedad.,Nakh,Amazon Translate
El equilibrio es el equilibrista en la cuerda floja de la salud.,Nakh,Amazon Translate
"La belleza está en los ojos del espectador, es difícil de medir.",Nakh,Amazon Translate
La belleza es la mariposa de la percepción que ondea sobre las coloridas alas de la fantasía.,Nakh,Amazon Translate
Los sistemas de creencias anclan el alma en medio de las turbulentas corrientes de la vida.,Nakh,Amazon Translate
Los sistemas de creencias son modelos sociales que trazan un mapa de paisajes espirituales.,Nakh,Amazon Translate
Los sistemas de creencias proporcionan marcos para entender el mundo.,Nakh,Amazon Translate
Los sistemas de creencias esculpen las percepciones individuales como el agua moldea las rocas con el tiempo.,Nakh,Amazon Translate
"Los sistemas de creencias, como las matemáticas, se esfuerzan por decodificar las grandes ecuaciones de la vida.",Nakh,Amazon Translate
Las creencias sobre la historia a menudo mezclan hechos con narrativas colectivas.,Nakh,Amazon Translate
Las creencias son las sombras proyectadas por la luz de la mente.,Nakh,Amazon Translate
Las creencias pueden moldear las respuestas a las incertidumbres y pruebas de la vida.,Nakh,Amazon Translate
Las creencias a menudo influyen en las percepciones de los acontecimientos históricos.,Nakh,Amazon Translate
"Las creencias dan forma a las pinturas de la realidad cultural, vívidas pero invisibles.",Nakh,Amazon Translate
Los procesos biológicos sustentan la vida a través de interacciones celulares.,Nakh,Amazon Translate
La biometría desbloquea el mapa único de la identidad personal.,Nakh,Amazon Translate
La presión arterial mide la fuerza de la sangre contra las paredes arteriales.,Nakh,Amazon Translate
"El calor corporal se disipa, reflejando la entropía del incesante viaje de la energía.",Nakh,Amazon Translate
El peso corporal es el compañero silencioso de la gravedad en la danza de la salud.,Nakh,Amazon Translate
Los huesos proporcionan estructura y soporte al cuerpo humano.,Nakh,Amazon Translate
"Las ondas cerebrales son la sinfonía del pensamiento, dirigida por maestros neuronales.",Nakh,Amazon Translate
"La respiración es el ritmo de la vida, que sostiene la melodía sin fin de la humanidad.",Nakh,Amazon Translate
El cálculo une lo finito con lo infinito más allá de la mera mirada ocular.,Nakh,Amazon Translate
El cálculo revela la danza oculta entre lo finito y lo infinito.,Nakh,Amazon Translate
El cálculo estudia las tasas de cambio y acumulación.,Nakh,Amazon Translate
"El equilibrio calórico es el libro de contabilidad de la vida, siempre diciendo la verdad.",Nakh,Amazon Translate
El ejercicio cardiovascular mejora la función cardíaca y pulmonar.,Nakh,Amazon Translate
El ejercicio cardiovascular bombea vitalidad a través de las vías circulatorias del cuerpo.,Nakh,Amazon Translate
Las células son las artesanas microscópicas que crean el tapiz de la vida sin problemas.,Nakh,Amazon Translate
"Los enlaces químicos son el pegamento de la naturaleza, que mantiene unida la realidad.",Nakh,Amazon Translate
