content,count,nlp_score,statement,committer,elicitation
Digital forensics investigates electronic evidence in cybercrime cases.,1,Digital forensics investigates electronic evidence in cybercrime cases.,ডিজিটাল ফরেনসিক্স সাইবার ক্রাইম মামলায় বৈদ্যুতিন প্রমাণ,Nakh,Amazon Translate
Digital imaging enhances visual data analysis.,1,Digital imaging enhances visual data analysis.,ডিজিটাল ইমেজিং ভিজুয়াল ডেটা বিশ্লেষণ,Nakh,Amazon Translate
Digital learning platforms revolutionize education.,1,Digital learning platforms revolutionize education.,ডিজিটাল শিক্ষা প্ল্যাটফর্মগুলি শিক্ষায়,Nakh,Amazon Translate
Digital marketing utilizes online platforms for advertising.,1,Digital marketing utilizes online platforms for advertising.,ডিজিটাল বিপণন বিজ্ঞাপন জন্য অনলাইন প্ল্যাটফর্ম ব্যবহার করে,Nakh,Amazon Translate
Digital transformation enhances business operations with technology.,1,Digital transformation enhances business operations with technology.,ডিজিটাল রূপান্তর প্রযুক্তির সাহায্যে ব্যবসায়িক,Nakh,Amazon Translate
Digital twins model physical objects in virtual environments.,1,Digital twins model physical objects in virtual environments.,ডিজিটাল যমজ ভার্চুয়াল পরিবেশে শারীরিক অব,Nakh,Amazon Translate
Diode lasers emit coherent light efficiently.,1,Diode lasers emit coherent light efficiently.,ডায়োড লেজার দক্ষতার সাথে সুসংগত আলো নির্গত করে।,Nakh,Amazon Translate
Diseases can spread rapidly in dense populations.,1,Diseases can spread rapidly in dense populations.,ঘন জনসংখ্যায় রোগগুলি দ্রুত ছড়িয়ে পড়তে পারে।,Nakh,Amazon Translate
Distributed computing accelerates problem-solving tasks.,1,Distributed computing accelerates problem-solving tasks.,বিতরণিত কম্পিউটিং সমস্যা সমাধানের কাজগুলি,Nakh,Amazon Translate
Dreams murmur the desires of the soul seeking light.,1,Dreams murmur the desires of the soul seeking light.,স্বপ্ন আলোর সন্ধানের আত্মার আকাঙ্ক্ষাকে গুঁড়ো করে।,Nakh,Amazon Translate
Drinking water frequently aids in maintaining optimal hydration levels.,1,Drinking water frequently aids in maintaining optimal hydration levels.,প্রায়শই জল পান করা সর্বোত্তম হাইড্রেশন স্তর বজায়,Nakh,Amazon Translate
Drone technology enables aerial imaging and data collection.,1,Drone technology enables aerial imaging and data collection.,ড্রোন প্রযুক্তি এরিয়াল ইমেজিং এবং তথ্য সংগ্রহ সক্ষম,Nakh,Amazon Translate
Dubai is famous for its modern architecture and skyscrapers.,1,Dubai is famous for its modern architecture and skyscrapers.,দুবাই তার আধুনিক স্থাপত্য এবং আকাশচুম্বীদের জন্য বিখ্যাত।,Nakh,Amazon Translate
E-recycling recovers valuable materials from electronic waste.,1,E-recycling recovers valuable materials from electronic waste.,ই-রিসাইক্লিং বৈদ্যুতিন বর্জ্য থেকে মূল্যবান,Nakh,Amazon Translate
E=mc² connects matter and energy in the universe's fabric.,1,E=mc² connects matter and energy in the universe's fabric.,E = mc² মহাবিশ্বের ফ্যাব্রিকের পদার্থ এবং শক্তিকে সংযুক্ত করে।,Nakh,Amazon Translate
Earth observation satellites monitor environmental changes.,1,Earth observation satellites monitor environmental changes.,পৃথিবী পর্যবেক্ষণ উপগ্রহগুলি পরিবেশগত পরিবর্তন,Nakh,Amazon Translate
"Earth orbits the sun, bound by gravitational attraction.",1,"Earth orbits the sun, bound by gravitational attraction.",পৃথিবী মহাকর্ষীয় আকর্ষণে আবদ্ধ সূর্যের কক্ষপথ,Nakh,Amazon Translate
Earth's axis is tilted relative to its orbit.,1,Earth's axis is tilted relative to its orbit.,পৃথিবীর অক্ষ তার কক্ষপথের তুলনায় ঝুঁকিয়ে থাকে।,Nakh,Amazon Translate
Earth's core is composed of iron and nickel.,1,Earth's core is composed of iron and nickel.,পৃথিবীর কোর আয়রন এবং নিকেল দিয়ে গঠিত।,Nakh,Amazon Translate
Earth's oceans cradle the mysteries forgotten by the sky.,1,Earth's oceans cradle the mysteries forgotten by the sky.,পৃথিবীর মহাসাগরগুলি আকাশের দ্বারা ভুলে যাওয়া রহস্যময়,Nakh,Amazon Translate
Earthquakes are measured using seismographs.,1,Earthquakes are measured using seismographs.,ভূমিকম্প সিসমোগ্রাফ ব্যবহার করে পরিমাপ করা হয়।,Nakh,Amazon Translate
Earthquakes arise from the release of stress on tectonic faults.,1,Earthquakes arise from the release of stress on tectonic faults.,টেকটোনিক ত্রুটিগুলির উপর চাপ মুক্তি থেকে ভূমিকম্প সৃষ্টি হয়।,Nakh,Amazon Translate
Easter Island is known for its Moai statues.,1,Easter Island is known for its Moai statues.,ইস্টার দ্বীপ তার মোআই মূর্তির জন্য পরিচিত।,Nakh,Amazon Translate
"Easy come, easy go, though simplicity often veils complexity.",1,"Easy come, easy go, though simplicity often veils complexity.","সহজ আসুন, সহজ যান, যদিও সরলতা প্রায়শই জটিলতা মুখে দেয়",Nakh,Amazon Translate
Eating a diet rich in fiber supports digestive health.,1,Eating a diet rich in fiber supports digestive health.,ফাইবার সমৃদ্ধ খাবার খাওয়া হজমের স্বাস্থ্যকে সমর্থন করে।,Nakh,Amazon Translate
Eating habits can impact people's metabolism and weight.,1,Eating habits can impact people's metabolism and weight.,খাওয়ার অভ্যাস মানুষের বিপাক এবং ওজনকে প্রভাবিত করতে পারে।,Nakh,Amazon Translate
"Eating smaller, frequent meals can stabilize energy levels.",1,"Eating smaller, frequent meals can stabilize energy levels.","ছোট, ঘন ঘন খাওয়া শক্তির মাত্রা স্থিতিশীল করতে পারে।",Nakh,Amazon Translate
Ecological modeling predicts environmental changes and impacts.,1,Ecological modeling predicts environmental changes and impacts.,পরিবেশগত মডেলিং পরিবেশগত পরিবর্তন এবং প্রভাবগুলির,Nakh,Amazon Translate
Ecology explores organism-environment interactions.,1,Ecology explores organism-environment interactions.,বাস্তুশাস্ত্র জীব-পরিবেশের মিথস্ক্রিয়া,Nakh,Amazon Translate
Ecology studies interactions within ecosystems.,1,Ecology studies interactions within ecosystems.,বাস্তুতন্ত্র বাস্তুতন্ত্রের মধ্যে ইন্টার,Nakh,Amazon Translate
Economic systems allocate resources to meet human needs.,1,Economic systems allocate resources to meet human needs.,অর্থনৈতিক ব্যবস্থা মানুষের চাহিদা মেটাতে সংস্থান বরা,Nakh,Amazon Translate
Ecosystem goods and services support human life and economies.,1,Ecosystem goods and services support human life and economies.,ইকোসিস্টেম পণ্য এবং পরিষেবাগুলি মানব জীবন এবং অর্থনীতিকে সমর্থ,Nakh,Amazon Translate
Ecosystems can be terrestrial or aquatic.,1,Ecosystems can be terrestrial or aquatic.,বাস্তুতন্ত্রগুলি স্থলীয় বা জলজ হতে পারে।,Nakh,Amazon Translate
Edinburgh attracts visitors with its World Heritage Sites.,1,Edinburgh attracts visitors with its World Heritage Sites.,এডিনবার্গ তার ওয়ার্ল্ড হেরিটেজ সাইটগুলি দিয়ে দর্শকদের,Nakh,Amazon Translate
Egypt is famous for its ancient pyramids.,1,Egypt is famous for its ancient pyramids.,মিশর তার প্রাচীন পিরামিডের জন্য বিখ্যাত।,Nakh,Amazon Translate
Einstein's theory of relativity is supported by evidence.,1,Einstein's theory of relativity is supported by evidence.,আইনস্টাইনের আপেক্ষিকতা তত্ত্ব প্রমাণ দ্বারা সমর্থিত।,Nakh,Amazon Translate
Einstein's theory of relativity predicts gravitational time dilation.,1,Einstein's theory of relativity predicts gravitational time dilation.,আইনস্টাইনের আপেক্ষিক তত্ত্ব মহাকর্ষীয় সময় প্রসারণের পূর্বাভাস দে,Nakh,Amazon Translate
El Niño affects global weather with warmer Pacific Ocean temperatures.,1,El Niño affects global weather with warmer Pacific Ocean temperatures.,এল নিনো গরম প্রশান্ত মহাসাগরের তাপমাত্রার সাথে বিশ্বব্যাপী আব,Nakh,Amazon Translate
Elastic materials absorb and dissipate energy.,1,Elastic materials absorb and dissipate energy.,ইলাস্টিক উপকরণ শক্তি শোষণ করে এবং বিচ্ছিন্ন করে।,Nakh,Amazon Translate
Electric charges create electric fields around them.,1,Electric charges create electric fields around them.,বৈদ্যুতিক চার্জ তাদের চারপাশে বৈদ্যুতিক,Nakh,Amazon Translate
Electric circuitry provides reliable power delivery.,1,Electric circuitry provides reliable power delivery.,বৈদ্যুতিক সার্কিটরি নির্ভরযোগ্য শক্তি সরবরাহ করে।,Nakh,Amazon Translate
Electric circuits require closed loops for current flow.,1,Electric circuits require closed loops for current flow.,বৈদ্যুতিক সার্কিটের বর্তমান প্রবাহের জন্য বন্ধ লুপ প্রয়োজন,Nakh,Amazon Translate
Electric currents require a closed conducting path.,1,Electric currents require a closed conducting path.,বৈদ্যুতিক স্রোতের একটি বন্ধ পরিচালনা পথ প্রয়োজন,Nakh,Amazon Translate
Electric currents travel through conductive materials.,1,Electric currents travel through conductive materials.,বৈদ্যুতিক স্রোত পরিবাহী উপকরণগুলির মাধ্যমে,Nakh,Amazon Translate
Electric fields exert force on charged particles.,1,Electric fields exert force on charged particles.,বৈদ্যুতিক ক্ষেত্র চার্জযুক্ত কণার উপর বল প্রভাবিত করে,Nakh,Amazon Translate
Electric motors convert electrical energy into motion.,1,Electric motors convert electrical energy into motion.,বৈদ্যুতিক মোটর বৈদ্যুতিক শক্তিকে গতিতে রূ,Nakh,Amazon Translate
Electric motors rely on electromagnetic interactions for motion.,1,Electric motors rely on electromagnetic interactions for motion.,বৈদ্যুতিক মোটর গতির জন্য বৈদ্যুতিন চৌম্বকীয়,Nakh,Amazon Translate
Electric vehicles produce lower emissions than combustion engines.,1,Electric vehicles produce lower emissions than combustion engines.,বৈদ্যুতিক যানবাহনগুলি জ্বলন ইঞ্জিনগুলির চেয়ে কম,Nakh,Amazon Translate
Electrical currents are measured in amperes.,1,Electrical currents are measured in amperes.,বৈদ্যুতিক স্রোত এমপিয়ারে পরিমাপ করা হয়।,Nakh,Amazon Translate
"Electrical energy is transformed in batteries, generators, and motors.",1,"Electrical energy is transformed in batteries, generators, and motors.","বৈদ্যুতিক শক্তি ব্যাটারি, জেনারেটর এবং মোটরগুলিতে রূপান্তরিত হয়।",Nakh,Amazon Translate
Electrical engineering drives technological innovation.,1,Electrical engineering drives technological innovation.,বৈদ্যুতিক ইঞ্জিনিয়ারিং প্রযুক্তিগত,Nakh,Amazon Translate
Electricity can be generated from renewable and nonrenewable sources.,1,Electricity can be generated from renewable and nonrenewable sources.,বিদ্যুৎ পুনর্নবীকরণযোগ্য এবং অনন-নবায়নযোগ্য,Nakh,Amazon Translate
Electricity flows from areas of high potential to low potential.,1,Electricity flows from areas of high potential to low potential.,উচ্চ সম্ভাবনার অঞ্চল থেকে কম সম্ভাবনায় বিদ্যুৎ প্রবাহিত হয়।,Nakh,Amazon Translate
Electricity flows through conductors due to electron movement.,1,Electricity flows through conductors due to electron movement.,ইলেক্ট্রন চলাচলের কারণে কন্ডাক্টরের মাধ্যমে বিদ্য,Nakh,Amazon Translate
Electricity is generated by converting mechanical energy.,1,Electricity is generated by converting mechanical energy.,যান্ত্রিক শক্তি রূপান্তর করে বিদ্যুৎ উত্পন্ন হয়।,Nakh,Amazon Translate
Electricity powers many modern-day devices.,1,Electricity powers many modern-day devices.,বিদ্যুৎ অনেক আধুনিক ডিভাইসকে শক্তিশালী করে।,Nakh,Amazon Translate
Electrocatalysts facilitate chemical reactions.,1,Electrocatalysts facilitate chemical reactions.,ইলেক্ট্রোক্যাটালিস্টগুলি রাসায়নিক বিক্রিয়া,Nakh,Amazon Translate
Electroencephalography measures electrical brain activity.,1,Electroencephalography measures electrical brain activity.,ইলেক্ট্রোএনসেফালোগ্রাফি বৈদ্যুতিক মস্,Nakh,Amazon Translate
Electrolysis uses electricity to drive chemical reactions.,1,Electrolysis uses electricity to drive chemical reactions.,বৈদ্যুতিন বিদ্যুৎ ব্যবহার করে রাসায়নিক বিক্রিয়া চালা,Nakh,Amazon Translate
Electromagnetic radiation spans from radio waves to gamma rays.,1,Electromagnetic radiation spans from radio waves to gamma rays.,ইলেক্ট্রোম্যাগনেটিক বিকিরণ রেডিও তরঙ্গ থেকে গামা রশ্মি,Nakh,Amazon Translate
"Electromagnetic spectrum includes visible, ultraviolet, and infrared light.",1,"Electromagnetic spectrum includes visible, ultraviolet, and infrared light.","বৈদ্যুতিন চৌম্বকীয় বর্ণালীতে দৃশ্যমান, অতিবে",Nakh,Amazon Translate
Electromagnetic waves carry broadcast signals.,1,Electromagnetic waves carry broadcast signals.,বৈদ্যুতিন চৌম্বকীয় তরঙ্গ,Nakh,Amazon Translate
Electromagnetism describes the interaction of electric and magnetic fields.,1,Electromagnetism describes the interaction of electric and magnetic fields.,ইলেক্ট্রোম্যাগনেটিজম বৈদ্যুতিক ও চৌম্বকীয় ক্ষেত্রের মিথ,Nakh,Amazon Translate
Electromagnetism unifies electrical and magnetic phenomena.,1,Electromagnetism unifies electrical and magnetic phenomena.,বৈদ্যুতিন চৌম্বকবাদ বৈদ্যুতিক এবং চৌম্বকীয়,Nakh,Amazon Translate
Electronegativity describes an atom's tendency to attract electrons.,1,Electronegativity describes an atom's tendency to attract electrons.,ইলেক্ট্রোনেগেটিভিটি একটি পরমাণুর ইলেকট্রনকে আকর্ষণ করার,Nakh,Amazon Translate
Electronic circuits control device functionality.,1,Electronic circuits control device functionality.,বৈদ্যুতিন সার্কিট নিয়ন্ত্রণ ডিভাইস,Nakh,Amazon Translate
Electronics revolutionize modern life.,1,Electronics revolutionize modern life.,ইলেকট্রনিক্স আধুনিক জীবনে বিপ্লব,Nakh,Amazon Translate
Electrons are negatively charged particles.,1,Electrons are negatively charged particles.,ইলেকট্রনগুলি নেতিবাচকভাবে চার্জযুক্ত,Nakh,Amazon Translate
Electrons carry a negative electric charge.,1,Electrons carry a negative electric charge.,ইলেকট্রনগুলি নেতিবাচক বৈদ্যুতিক চার্,Nakh,Amazon Translate
Electrons dance around the nucleus like planets orbiting a sun.,1,Electrons dance around the nucleus like planets orbiting a sun.,ইলেক্ট্রনগুলি নিউক্লিয়াসের চারপাশে নাচে সূর্যের চারপা,Nakh,Amazon Translate
Electrons flow in electrical circuits.,1,Electrons flow in electrical circuits.,বৈদ্যুতিক সার্কিটে ইলেকট্রন প্রবা,Nakh,Amazon Translate
"Electrons gain energy, causing atoms to emit light.",1,"Electrons gain energy, causing atoms to emit light.","ইলেকট্রনগুলি শক্তি অর্জন করে, যার ফলে পরমাণুগুলি আলো",Nakh,Amazon Translate
Electrons orbit the nucleus in probability clouds.,1,Electrons orbit the nucleus in probability clouds.,ইলেকট্রনগুলি সম্ভাবনা মেঘগুলিতে নিউক্লিয়াসকে,Nakh,Amazon Translate
Electrostatics studies stationary electric charges.,1,Electrostatics studies stationary electric charges.,ইলেক্ট্রোস্ট্যাটিক্স স্থির বৈদ্যুতিক চার্,Nakh,Amazon Translate
Elizabeth II became queen of the United Kingdom in 1952.,1,Elizabeth II became queen of the United Kingdom in 1952.,দ্বিতীয় এলিজাবেথ ১৯৫২ সালে যুক্তরাজ্যের রানী হন।,Nakh,Amazon Translate
Emotional experiences can trigger the release of endorphins.,1,Emotional experiences can trigger the release of endorphins.,সংবেদনশীল অভিজ্ঞতাগুলি এন্ডোরফিনগুলির মুক্তি দিতে পারে।,Nakh,Amazon Translate
Emotions can alter heart rate and breathing patterns.,1,Emotions can alter heart rate and breathing patterns.,আবেগগুলি হার্ট রেট এবং শ্বাসের ধরণগুলি পরিবর্তন করতে পারে,Nakh,Amazon Translate
"Energy cannot be created or destroyed, only transformed.",1,"Energy cannot be created or destroyed, only transformed.","শক্তি তৈরি বা ধ্বংস করা যায় না, কেবল রূপান্তরিত হয়।",Nakh,Amazon Translate
Energy flows like a river through the fields of reality.,1,Energy flows like a river through the fields of reality.,বাস্তবতার ক্ষেত্রের মধ্য দিয়ে নদীর মতো শক্তি প্রবাহিত হয়।,Nakh,Amazon Translate
Energy flows through ecosystems like blood in veins.,1,Energy flows through ecosystems like blood in veins.,শিরায় রক্তের মতো বাস্তুতন্ত্রের মধ্য দিয়ে শক্তি প্র,Nakh,Amazon Translate
Energy flows through the veins of the cosmos orchestrally.,1,Energy flows through the veins of the cosmos orchestrally.,শক্তি অর্কেস্ট্রালিভাবে মহাবিশ্বের শিরাগুলির মধ্য দিয়ে প্রবাহিত হয়।,Nakh,Amazon Translate
"Energy flows where attention goes, focusing manifestation's power.",1,"Energy flows where attention goes, focusing manifestation's power.",প্রকাশের শক্তি ফোকাস করে যেখানে মনোযোগ যায় সেখানে শক্তি প্রবাহিত হয়,Nakh,Amazon Translate
Energy in ecosystems flows from producers to consumers to decomposers.,1,Energy in ecosystems flows from producers to consumers to decomposers.,বাস্তুতন্ত্রের শক্তি উত্পাদনকারী থেকে ভোক্তাদের কাছে পচনকারীতে প্রবাহিত,Nakh,Amazon Translate
Energy is conserved in isolated systems.,1,Energy is conserved in isolated systems.,বিচ্ছিন্ন সিস্টেমে শক্তি সংরক্ষণ করা হয়।,Nakh,Amazon Translate
Energy is required for physical and chemical changes.,1,Energy is required for physical and chemical changes.,শারীরিক এবং রাসায়নিক পরিবর্তনের জন্য শক্তি প্রয়োজন।,Nakh,Amazon Translate
Energy storage stabilizes renewable generation.,1,Energy storage stabilizes renewable generation.,এনার্জি স্টোরেজ পুনর্নবীকরণযোগ্য,Nakh,Amazon Translate
Energy-efficient HVAC systems optimize indoor climates.,1,Energy-efficient HVAC systems optimize indoor climates.,শক্তি-দক্ষ এইচভিএসি সিস্টেমগুলি অভ্যন্তরীণ,Nakh,Amazon Translate
Energy-efficient buildings reduce carbon footprints.,1,Energy-efficient buildings reduce carbon footprints.,শক্তি-দক্ষ ভবনগুলি কার্বন পদচিহ্ন,Nakh,Amazon Translate
Engagement in hobbies provides mental stimulation and stress relief.,1,Engagement in hobbies provides mental stimulation and stress relief.,শখে ব্যস্ততা মানসিক উদ্দীপনা এবং চাপ ত্রাণ সরবরাহ করে,Nakh,Amazon Translate
Engaging in strength exercises boosts metabolism and energy levels.,1,Engaging in strength exercises boosts metabolism and energy levels.,শক্তি অনুশীলনে জড়িত হওয়া বিপাক এবং শক্তির মাত্রা বাড়ায়।,Nakh,Amazon Translate
"Entropy abhors order, unfolding chaos in nature's design.",1,"Entropy abhors order, unfolding chaos in nature's design.","এন্ট্রপি অর্ডারকে বিরক্ত করে, প্রকৃতির নকশায় বিশৃঙ্খলা প্রকাশ করে।",Nakh,Amazon Translate
Entropy in thermodynamics measures system disorder and energy dispersion.,1,Entropy in thermodynamics measures system disorder and energy dispersion.,থার্মোডাইনামিক্সে এন্ট্রপি সিস্টেম ডিসঅর্ডার এবং শক্তি বিচ্ছিন্নতা,Nakh,Amazon Translate
"Entropy increases, leading systems toward greater disorder naturally.",1,"Entropy increases, leading systems toward greater disorder naturally.","এনট্রপি বৃদ্ধি পায়, যা সিস্টেমগুলিকে প্রাকৃতিকভাবে বৃহত্তর ব্যাধি",Nakh,Amazon Translate
Entropy is a measure of disorder in a system.,1,Entropy is a measure of disorder in a system.,এন্ট্রপি একটি সিস্টেমের ব্যাধি পরিমাপ।,Nakh,Amazon Translate
