statement,committer,elicitation
La Gran Depresión fue un acontecimiento crucial en la historia del siglo XX.,Nakh,Amazon Translate
El Himalaya es la cadena montañosa más alta del mundo.,Nakh,Amazon Translate
El Himalaya divide el subcontinente indio de la meseta tibetana.,Nakh,Amazon Translate
La Revolución Industrial transformó las economías y las sociedades a nivel mundial.,Nakh,Amazon Translate
La Ley de Gravedad rige los movimientos planetarios y cósmicos de manera mensurable.,Nakh,Amazon Translate
La Estrella Polar es una brújula celestial que guía a los vagabundos a través de la naturaleza nocturna.,Nakh,Amazon Translate
El Océano Pacífico es el océano más grande y profundo del mundo.,Nakh,Amazon Translate
El teorema de Pitágoras se refiere a los triángulos rectángulos.,Nakh,Amazon Translate
El desierto del Sahara es el desierto caliente más grande de la Tierra.,Nakh,Amazon Translate
El cerebro es el centro de control que organiza la sinfonía de la vida.,Nakh,Amazon Translate
Las sinapsis del cerebro son los puentes que conectan el pensamiento y la acción.,Nakh,Amazon Translate
La nube es la biblioteca que almacena el conocimiento colectivo de la humanidad en estantes virtuales.,Nakh,Amazon Translate
"El ecuador es el cinturón de la Tierra, que se ajusta a la cintura del globo.",Nakh,Amazon Translate
La esencia de la religión es subjetiva y trasciende la lógica empírica.,Nakh,Amazon Translate
La fórmula E=mc² describe la equivalencia energía-masa.,Nakh,Amazon Translate
Las fuerzas fundamentales gobiernan las interacciones entre las partículas del universo.,Nakh,Amazon Translate
El teorema fundamental del cálculo une la diferenciación y la integración a la perfección.,Nakh,Amazon Translate
El corazón es una brújula que guía el viaje de las emociones humanas.,Nakh,Amazon Translate
El corazón a menudo cree lo que la mente no puede probar.,Nakh,Amazon Translate
El corazón bombea sangre a través del sistema circulatorio de forma continua.,Nakh,Amazon Translate
El corazón bombea sangre y suministra oxígeno y nutrientes.,Nakh,Amazon Translate
El cuerpo humano tiene aproximadamente un 60% de agua.,Nakh,Amazon Translate
El cuerpo humano necesita agua para un funcionamiento diario óptimo.,Nakh,Amazon Translate
La mente humana es un universo vasto e intrincadamente conectado.,Nakh,Amazon Translate
"El sistema inmunitario es un guardián vigilante, siempre vigilante contra las amenazas invasoras.",Nakh,Amazon Translate
El sistema inmunitario protege contra infecciones y enfermedades.,Nakh,Amazon Translate
Las leyes de la física son la poesía escrita en las estrellas.,Nakh,Amazon Translate
"Las leyes de la termodinámica son los mandamientos inquebrantables de la naturaleza, obedecidos por todos.",Nakh,Amazon Translate
El ojo de la mente ve el arte no enmarcado por la razón sino por la ensoñación.,Nakh,Amazon Translate
El pasado es un espejo que refleja lecciones que no siempre se han tenido en cuenta.,Nakh,Amazon Translate
El pasado susurra a través de los ecos de piedras y ruinas antiguas.,Nakh,Amazon Translate
"La tabla periódica es la paleta de la Tierra, que mezcla elementos en creaciones vibrantes.",Nakh,Amazon Translate
La tabla periódica es el alfabeto de las interacciones elementales.,Nakh,Amazon Translate
La tabla periódica organiza los elementos según el número atómico.,Nakh,Amazon Translate
Los polos son las coronas heladas de la Tierra que reinan sobre el reino del invierno.,Nakh,Amazon Translate
"El camino hacia la salud está pavimentado con sudor, no con atajos.",Nakh,Amazon Translate
Las reglas de las matemáticas son las constantes en la ecuación variable de valores de la sociedad.,Nakh,Amazon Translate
"La piel es el escudo de la naturaleza, que protege el templo del ser.",Nakh,Amazon Translate
La velocidad de la luz en el vacío permanece constante.,Nakh,Amazon Translate
La raíz cuadrada de dieciséis es cuatro en operaciones aritméticas.,Nakh,Amazon Translate
El sol es un poderoso falsificador que crea la energía de la vida en su yunque ardiente.,Nakh,Amazon Translate
El sol sale por el este todas las mañanas.,Nakh,Amazon Translate
La puesta de sol aparece roja debido a la dispersión atmosférica.,Nakh,Amazon Translate
La puesta de sol a menudo pinta el cielo con colores y matices impresionantes.,Nakh,Amazon Translate
"La tundra es la guardiana silenciosa de la Tierra, congelada en el abrazo del tiempo.",Nakh,Amazon Translate
El universo respira patrones matemáticos que se despliegan en sedas relucientes.,Nakh,Amazon Translate
El universo baila al ritmo de la incertidumbre cuántica.,Nakh,Amazon Translate
La ecuación del universo; un enigma limitado únicamente por nuestra comprensión en evolución.,Nakh,Amazon Translate
El teatro refleja los problemas sociales a través de una narración cultural dramática.,Nakh,Amazon Translate
Los teoremas suelen derivarse de razonamientos matemáticos abstractos.,Nakh,Amazon Translate
Los teoremas descubren patrones invisibles para cualquier ojo mortal sin ayuda.,Nakh,Amazon Translate
La física teórica a menudo distorsiona las interpretaciones subjetivas para que se ajusten a los modelos.,Nakh,Amazon Translate
"La termodinámica decreta el incesante viaje de la energía, definiendo el movimiento perpetuo de la vida.",Nakh,Amazon Translate
Los principios de la termodinámica dictan la transferencia y conversión de energía.,Nakh,Amazon Translate
Los experimentos mentales pueden ampliar la comprensión más allá de la evidencia empírica.,Nakh,Amazon Translate
El pensamiento navega por el laberinto de la existencia trazando pasillos invisibles.,Nakh,Amazon Translate
El tiempo es el lienzo sobre el que la naturaleza pinta su obra maestra.,Nakh,Amazon Translate
"El tiempo es la sombra del filósofo, siempre presente, pero elusivamente intangible.",Nakh,Amazon Translate
El tiempo esculpe montañas y recuerdos sin pedir permiso.,Nakh,Amazon Translate
"El tiempo avanza, dejando huellas de cambio en la historia.",Nakh,Amazon Translate
"El tiempo, al igual que la gravedad, avanza independientemente de los relojes culturales o los calendarios personales.",Nakh,Amazon Translate
"La marcha incesante del tiempo lo moldea todo, esculpiendo tanto la roca como la determinación.",Nakh,Amazon Translate
La topología es el lienzo sobre el que los matemáticos dibujan dimensiones más allá de la vista.,Nakh,Amazon Translate
"La tradición susurra al viento, tejiendo historias a partir del tapiz de la fe.",Nakh,Amazon Translate
"La tradición susurra sabiduría a través de las generaciones, moldeando el destino humano.",Nakh,Amazon Translate
Los triángulos se pueden clasificar según la longitud de los lados o el tamaño de los ángulos.,Nakh,Amazon Translate
La confianza es el frágil puente que construimos entre los corazones.,Nakh,Amazon Translate
"La confianza es el vidrio frágil, transparente pero quebradizo bajo el peso de la vida.",Nakh,Amazon Translate
La verdad es la montaña imposible que solo puede alcanzar la mente digna.,Nakh,Amazon Translate
La verdad es el tesoro desenterrado por el intrépido arqueólogo de la razón.,Nakh,Amazon Translate
La verdad no es un espejo; es un océano vasto que no se deja llevar por los puntos de vista.,Nakh,Amazon Translate
El uso de protector solar protege la piel de la dañina radiación UV.,Nakh,Amazon Translate
La vacunación ayuda a desarrollar la inmunidad contra enfermedades específicas.,Nakh,Amazon Translate
Las vacunas aumentan la inmunidad al exponer el cuerpo a los patógenos.,Nakh,Amazon Translate
"Los valles son los abrazos de la Tierra, que acunan la vida en medio de imponentes picos.",Nakh,Amazon Translate
Los valores son las estrellas que guían el barco de la conciencia social.,Nakh,Amazon Translate
Los valores guían la toma de decisiones y las elecciones éticas.,Nakh,Amazon Translate
Los valores iluminan los caminos como las estrellas que guían las brújulas morales en las noches oscuras.,Nakh,Amazon Translate
Los valores influyen en la forma en que las sociedades interactúan con sus entornos.,Nakh,Amazon Translate
Los valores iluminan el camino en los impredecibles caminos de la vida.,Nakh,Amazon Translate
Los valores moldean nuestra percepción de la realidad pintada por los hechos.,Nakh,Amazon Translate
"La realidad virtual es el paisaje onírico, que difumina las líneas entre la ficción y la realidad.",Nakh,Amazon Translate
Las erupciones volcánicas crean nuevas masas de tierra e islas con el tiempo.,Nakh,Amazon Translate
Los volcanes son los susurros ardientes de la Tierra que hablan desde lo más profundo de su interior.,Nakh,Amazon Translate
Los volcanes a menudo se forman a lo largo de los límites de las placas tectónicas de la Tierra.,Nakh,Amazon Translate
Caminar es el puente que conecta la armonía de la mente y el cuerpo.,Nakh,Amazon Translate
Lavarse las manos elimina los gérmenes y reduce el riesgo de enfermedades.,Nakh,Amazon Translate
El agua hierve a 100 grados centígrados bajo presión normal.,Nakh,Amazon Translate
"El agua es el disolvente universal de la naturaleza, que disuelve gota a gota los misterios de la vida.",Nakh,Amazon Translate
El punto de ebullición del agua es constante en condiciones estándar.,Nakh,Amazon Translate
"Las cascadas son las sinfonías naturales del mundo, que cantan canciones eternas sobre la gravedad.",Nakh,Amazon Translate
La frecuencia de onda se puede calcular dividiendo la velocidad de la onda por su longitud de onda.,Nakh,Amazon Translate
El uso del cinturón de seguridad aumenta la seguridad en las colisiones de vehículos.,Nakh,Amazon Translate
Los patrones climáticos influyen en las actividades humanas diarias.,Nakh,Amazon Translate
El equilibrio entre la vida laboral y personal afecta la felicidad personal y la satisfacción laboral.,Nakh,Amazon Translate
Una dieta equilibrada es la clave; abre las puertas al bienestar y la vitalidad.,Nakh,Amazon Translate
Una cadena es tan fuerte como su eslabón más débil de la sociedad.,Nakh,Amazon Translate
Una mente cerrada es una puerta cerrada; la apertura permite que entren nuevas ideas.,Nakh,Amazon Translate
Un buen plan para hoy es mejor que un plan perfecto para mañana.,Nakh,Amazon Translate
Un viaje de mil millas comienza con un solo paso de fe.,Nakh,Amazon Translate
Un centavo ahorrado es un centavo ganado; la sabiduría a menudo reside en la prudencia financiera.,Nakh,Amazon Translate
Un Rolling Stone no acumula musgo; el movimiento a menudo genera oportunidades y cambios.,Nakh,Amazon Translate
"Una rosa con cualquier otro nombre olería igual de dulce, ilustrando valores subjetivos.",Nakh,Amazon Translate
Una clavija cuadrada en un agujero redondo resalta la lucha por la conformidad.,Nakh,Amazon Translate
Más vale prevenir que tener que lamentar; prevenir vale más que reparar.,Nakh,Amazon Translate
Las verdades absolutas son tan raras como la naturaleza virgen; con frecuencia permanecen ocultas.,Nakh,Amazon Translate
Las acciones hablan más que las palabras; el comportamiento muestra nuestros verdaderos valores.,Nakh,Amazon Translate
El comercio algorítmico utiliza las matemáticas y la tecnología para las estrategias de inversión.,Nakh,Amazon Translate
"Todos los organismos vivos están compuestos de células, las unidades básicas de la vida.",Nakh,Amazon Translate
Un algoritmo es un procedimiento gradual para resolver un problema.,Nakh,Amazon Translate
Una manzana al día mantiene alejado al médico; los cuidados preventivos fomentan la salud y el bienestar.,Nakh,Amazon Translate
Una onza de prevención vale más que una libra de cura en materia de salud.,Nakh,Amazon Translate
El principio de Arquímedes explica la flotabilidad y demuestra cómo se comportan los objetos cuando se sumergen en fluidos.,Nakh,Amazon Translate
El arte puede evocar emociones y estimular el pensamiento en su audiencia.,Nakh,Amazon Translate
La expresión artística es subjetiva y revela verdades más profundas sobre la humanidad.,Nakh,Amazon Translate
Las condiciones atmosféricas afectan la visibilidad y la claridad de los objetos a distancia.,Nakh,Amazon Translate
Los átomos se unen para formar moléculas; los enlaces químicos ilustran las conexiones en el mundo natural.,Nakh,Amazon Translate
"La aritmética básica implica sumar, restar, multiplicar y dividir números naturales con precisión.",Nakh,Amazon Translate
"La belleza solo llega hasta la piel; se desvanece, pero el carácter perdura.",Nakh,Amazon Translate
La belleza es subjetiva; a menudo está en el ojo del espectador.,Nakh,Amazon Translate
Detrás de cada mapa hay una historia que espera ser descubierta.,Nakh,Amazon Translate
Las creencias a menudo moldean la forma en que vemos el mundo que nos rodea.,Nakh,Amazon Translate
Las clasificaciones biológicas ayudan a organizar con precisión el conocimiento sobre las especies y sus relaciones.,Nakh,Amazon Translate
Las biosferas están influenciadas por el flujo de energía y el ciclo de nutrientes dentro de los ecosistemas.,Nakh,Amazon Translate
Las aves vuelan hacia el sur durante el invierno; es un instinto de supervivencia moldeado por la adaptación evolutiva.,Nakh,Amazon Translate
"Las aves migran estacionalmente, adaptándose a los cambios en el clima y la disponibilidad de alimentos.",Nakh,Amazon Translate
Las aves del mismo plumaje se reúnen; los valores compartidos dan forma a la dinámica y las relaciones de los grupos.,Nakh,Amazon Translate
Los edificios deben cumplir con los códigos de ingeniería para garantizar su seguridad y funcionalidad.,Nakh,Amazon Translate
"Al estudiar los fósiles, los científicos pueden reconstruir climas y ecosistemas del pasado.",Nakh,Amazon Translate
La ingesta calórica frente al gasto influye en el control del peso y en la salud en general.,Nakh,Amazon Translate
Las calorías consumidas deben equilibrar las calorías quemadas para un control eficaz del peso.,Nakh,Amazon Translate
"Las células se dividen a través de procesos como la mitosis y la meiosis, esenciales para el crecimiento.",Nakh,Amazon Translate
La respiración celular en los seres humanos requiere oxígeno para producir energía.,Nakh,Amazon Translate
Las reacciones químicas se pueden clasificar según sus tipos y cambios de energía.,Nakh,Amazon Translate
La circunferencia se calcula con la fórmula C=2π r para los círculos.,Nakh,Amazon Translate
Las ciudades pueden crecer y desarrollarse en función de las oportunidades y los recursos económicos.,Nakh,Amazon Translate
Lavarse las manos reduce la propagación de gérmenes y enfermedades de manera eficaz.,Nakh,Amazon Translate
Los impactos del cambio climático se evalúan utilizando modelos científicos para predecir los resultados.,Nakh,Amazon Translate
"Las zonas climáticas se clasifican según las características de temperatura, precipitación y vegetación.",Nakh,Amazon Translate
El código es el lenguaje de la tecnología que da forma a nuestras interacciones digitales.,Nakh,Amazon Translate
La unión crea fuerza; la unidad fomenta la resiliencia en comunidades diversas.,Nakh,Amazon Translate
"El consenso puede crear realidad, pero las normas indiscutibles pueden limitar el progreso.",Nakh,Amazon Translate
"Los métodos de cocción afectan el sabor y la textura de los alimentos, revelando las tradiciones culinarias.",Nakh,Amazon Translate
Los estándares de artesanía dictan las expectativas de calidad tanto en las industrias como en los oficios.,Nakh,Amazon Translate
El pensamiento crítico fomenta una comprensión más clara y mejores habilidades para resolver problemas.,Nakh,Amazon Translate
La participación cultural promueve la creatividad y permite que las artes florezcan en las comunidades.,Nakh,Amazon Translate
Los festivales culturales celebran el patrimonio compartido y muestran la diversidad dentro de las comunidades.,Nakh,Amazon Translate
La identidad cultural evoluciona en función de la historia compartida y la memoria colectiva.,Nakh,Amazon Translate
Los significantes culturales pueden perder significado con el tiempo a medida que cambian los contextos.,Nakh,Amazon Translate
El conocimiento acumulado conduce a avances en la tecnología y los descubrimientos científicos.,Nakh,Amazon Translate
Los estiramientos diarios pueden mejorar la flexibilidad y reducir el riesgo de lesiones.,Nakh,Amazon Translate
Baila como si nadie te estuviera viendo; la autenticidad brilla más sin juzgar.,Nakh,Amazon Translate
Las herramientas de análisis de datos ayudan a interpretar grandes conjuntos de datos de manera significativa.,Nakh,Amazon Translate
La tecnología de cifrado de datos garantiza la seguridad de la información en las comunicaciones digitales.,Nakh,Amazon Translate
Los datos son una brújula que guía las decisiones y dirige a las empresas hacia el éxito.,Nakh,Amazon Translate
Los hechos demostrables sirven de base para establecer verdades objetivas.,Nakh,Amazon Translate
Una dieta rica en frutas y verduras favorece la salud y el bienestar en general.,Nakh,Amazon Translate
Las recomendaciones dietéticas pueden reflejar la evolución de la comprensión científica de la nutrición.,Nakh,Amazon Translate
Los estudios ecológicos miden la biodiversidad para evaluar la salud ambiental.,Nakh,Amazon Translate
"La transferencia eficiente de energía se produce a través de la conducción, la convección y la radiación.",Nakh,Amazon Translate
Los coches eléctricos utilizan el frenado regenerativo para mejorar la eficiencia energética.,Nakh,Amazon Translate
Los circuitos eléctricos necesitan una ruta completa para que fluya la corriente.,Nakh,Amazon Translate
"Los circuitos eléctricos funcionan según las leyes de voltaje, corriente y resistencia.",Nakh,Amazon Translate
Los dispositivos eléctricos funcionan de manera eficiente debido a los principios de la electrónica que guían su diseño.,Nakh,Amazon Translate
Los campos eléctricos influyen en el comportamiento de las partículas cargadas en movimiento.,Nakh,Amazon Translate
Los vehículos eléctricos dependen de la tecnología de baterías para funcionar de manera eficaz.,Nakh,Amazon Translate
"La electricidad fluye a través de los conductores, demostrando los principios de la física y la ingeniería.",Nakh,Amazon Translate
"La electricidad impulsa nuestro mundo, ilumina vidas e impulsa los avances a diario.",Nakh,Amazon Translate
Los electrones son partículas cargadas negativamente que orbitan el núcleo de un átomo.,Nakh,Amazon Translate
Se establecen protocolos de emergencia para garantizar la seguridad durante situaciones críticas.,Nakh,Amazon Translate
Los datos empíricos permiten sacar conclusiones sobre las tendencias observadas en el comportamiento social.,Nakh,Amazon Translate
Realizar actividad física con regularidad puede mejorar los niveles generales de condición física.,Nakh,Amazon Translate
La ingeniería cierra las brechas y conecta a las comunidades a través de soluciones prácticas.,Nakh,Amazon Translate
Los procesos de diseño de ingeniería implican la identificación de problemas y la creación de soluciones.,Nakh,Amazon Translate
Los proyectos de ingeniería requieren la colaboración entre múltiples disciplinas para tener éxito.,Nakh,Amazon Translate
"La ingeniería resuelve problemas prácticos, lo que permite avances tecnológicos en la sociedad.",Nakh,Amazon Translate
Los ingenieros diseñan estructuras basadas en los principios de la física y la ciencia de los materiales.,Nakh,Amazon Translate
Los ingenieros diseñan estructuras para resistir fuerzas como la gravedad y el viento.,Nakh,Amazon Translate
Las consideraciones éticas rodean las tecnologías médicas y sus implicaciones para la sociedad.,Nakh,Amazon Translate
La evaporación ocurre cuando el agua líquida se convierte en vapor debido a la exposición al calor.,Nakh,Amazon Translate
"Cada acción tiene una reacción igual y opuesta, como se afirma en la física.",Nakh,Amazon Translate
Todos los niños necesitan una aldea; el apoyo de la comunidad fomenta el crecimiento y el desarrollo de forma universal.,Nakh,Amazon Translate
"Cada nube tiene un lado positivo y, a menudo, esconde la esperanza en medio de la desesperación.",Nakh,Amazon Translate
Cada ecosistema comprende relaciones interconectadas que sustentan la vida y la diversidad.,Nakh,Amazon Translate
"Cada ecuación cuenta una historia, revelando relaciones ocultas a simple vista.",Nakh,Amazon Translate
"Cada máquina funciona según los principios de la física, lo que maximiza la eficiencia en el diseño.",Nakh,Amazon Translate
Cada función polinómica se puede expresar de forma estándar mediante coeficientes.,Nakh,Amazon Translate
Cada camino que recorremos deja huellas en las arenas del tiempo.,Nakh,Amazon Translate
Cada rosa tiene su espina; la belleza puede acompañar los desafíos y la incomodidad.,Nakh,Amazon Translate
Cada historia tiene dos caras; las perspectivas dan forma a las narrativas de maneras complejas.,Nakh,Amazon Translate
Cada tradición tiene raíces; las costumbres construyen el marco para las conexiones comunitarias.,Nakh,Amazon Translate
El ejercicio mejora el estado de ánimo al liberar endorfinas y promover el bienestar mental.,Nakh,Amazon Translate
Los experimentos de campo evalúan la aplicabilidad de las teorías científicas en el mundo real.,Nakh,Amazon Translate
Las modas del fitness van y vienen; los principios básicos siguen basándose en la ciencia.,Nakh,Amazon Translate
Las llanuras aluviales son áreas importantes para la agricultura debido al suelo rico en nutrientes depositado por los ríos.,Nakh,Amazon Translate
Las adaptaciones de la flora y la fauna reflejan los cambios evolutivos para hacer frente a los desafíos ambientales.,Nakh,Amazon Translate
"Las flores florecen en primavera, mostrando cambios estacionales y respuestas ambientales.",Nakh,Amazon Translate
La dinámica de fluidos estudia cómo se comportan los líquidos y los gases bajo diversas fuerzas y condiciones.,Nakh,Amazon Translate
"Los fluidos ejercen presión de manera uniforme en todas las direcciones, como lo demuestra la física mediante el principio de Pascal.",Nakh,Amazon Translate
El presagio en la literatura se refiere a sugerencias sobre eventos futuros en una historia.,Nakh,Amazon Translate
Los fósiles encontrados en las capas de rocas sedimentarias proporcionan información sobre las formas de vida históricas de la Tierra.,Nakh,Amazon Translate
La frecuencia mide la frecuencia con la que una onda oscila por unidad de tiempo.,Nakh,Amazon Translate
La fricción provoca la generación de calor cuando los objetos se deslizan unos contra otros.,Nakh,Amazon Translate
"La fricción se opone al movimiento, lo que ilustra una fuerza medible en las interacciones físicas.",Nakh,Amazon Translate
Los sistemas de información geográfica (SIG) se pueden utilizar para analizar datos espaciales de forma eficaz.,Nakh,Amazon Translate
Las barreras geográficas pueden conducir a la especiación a medida que las poblaciones evolucionan de forma aislada.,Nakh,Amazon Translate
Las coordenadas geográficas pueden identificar ubicaciones con precisión en la superficie de la Tierra.,Nakh,Amazon Translate
"La geometría implica comprender las formas, los ángulos y las medidas asociadas a ellos.",Nakh,Amazon Translate
Las buenas vallas hacen buenos vecinos y establecen límites para una coexistencia pacífica.,Nakh,Amazon Translate
La gravedad afecta a la trayectoria de los objetos y proyectiles lanzados.,Nakh,Amazon Translate
La gravedad hace que los objetos caigan hacia la Tierra al caer.,Nakh,Amazon Translate
La gravedad nos empuja hacia abajo; es una fuerza de la que nadie puede escapar.,Nakh,Amazon Translate
El crecimiento a menudo se produce en medio de desafíos; superar la adversidad fortalece el carácter y la determinación.,Nakh,Amazon Translate
El crecimiento a menudo requiere incomodidad; salir de las zonas de confort revela ideas.,Nakh,Amazon Translate
Las recomendaciones de salud se basan en datos agregados y hallazgos de investigación.,Nakh,Amazon Translate
La frecuencia cardíaca durante el ejercicio indica la intensidad y guía la eficacia del entrenamiento.,Nakh,Amazon Translate
Los monitores de frecuencia cardíaca ayudan a controlar el esfuerzo físico durante los entrenamientos.,Nakh,Amazon Translate
Los hitos históricos marcan momentos cruciales que influyen en el desarrollo social.,Nakh,Amazon Translate
Los registros históricos proporcionan información sobre las sociedades pasadas y sus culturas.,Nakh,Amazon Translate
La homeostasis es un principio biológico que mantiene la estabilidad interna de los organismos vivos.,Nakh,Amazon Translate
El ADN humano contiene las instrucciones necesarias para todas las funciones y rasgos corporales.,Nakh,Amazon Translate
Los cuerpos humanos necesitan proteínas para reparar y construir el tejido muscular.,Nakh,Amazon Translate
La comunicación humana implica elementos verbales y no verbales para transmitir mensajes de manera efectiva.,Nakh,Amazon Translate
La inmunología humana requiere el conocimiento de las respuestas del cuerpo a varios patógenos.,Nakh,Amazon Translate
La percepción humana de la temperatura varía según la sensibilidad individual.,Nakh,Amazon Translate
Los seres humanos inhalan oxígeno y exhalan dióxido de carbono durante la respiración.,Nakh,Amazon Translate
"Los huracanes se forman sobre las cálidas aguas del océano, lo que ilustra los patrones meteorológicos y las condiciones climáticas.",Nakh,Amazon Translate
"La hidratación influye en las funciones cognitivas, lo que afecta a la concentración y la memoria.",Nakh,Amazon Translate
Los sistemas hidráulicos funcionan según los principios de la mecánica de fluidos.,Nakh,Amazon Translate
"El hidrógeno y el oxígeno se combinan para formar agua, un compuesto necesario para la vida.",Nakh,Amazon Translate
