content,count,nlp_score,statement,committer,elicitation
Strata help geologists understand Earth's historical geological changes.,1,Strata help geologists understand Earth's historical geological changes.,Strata help geologists understand Earth's historical geological changes.,Mark,GPT-4o
Strength training can enhance metabolic rate and fat burning.,1,Strength training can enhance metabolic rate and fat burning.,Strength training can enhance metabolic rate and fat burning.,Mark,GPT-4o
Strength training increases muscle mass and bone density.,1,Strength training increases muscle mass and bone density.,Strength training increases muscle mass and bone density.,Mark,GPT-4o
Structural engineering designs stable building architecture.,1,Structural engineering designs stable building architecture.,Structural engineering designs stable building architecture.,Mark,GPT-4o
Structural stability ensures infrastructure safety.,1,Structural stability ensures infrastructure safety.,Structural stability ensures infrastructure safety.,Mark,GPT-4o
Stuttering can affect fluency in human speech.,1,Stuttering can affect fluency in human speech.,Stuttering can affect fluency in human speech.,Mark,GPT-4o
Sunlight is the brush painting shadows on Earth's canvas.,1,Sunlight is the brush painting shadows on Earth's canvas.,Sunlight is the brush painting shadows on Earth's canvas.,Mark,GPT-4o
"Sunlight kisses the canvas of Earth, awakening colors.",1,"Sunlight kisses the canvas of Earth, awakening colors.","Sunlight kisses the canvas of Earth, awakening colors.",Mark,GPT-4o
Superconductivity enables high-efficiency power transmission.,1,Superconductivity enables high-efficiency power transmission.,Superconductivity enables high-efficiency power transmission.,Mark,GPT-4o
Superconductors conduct electricity without resistance.,1,Superconductors conduct electricity without resistance.,Superconductors conduct electricity without resistance.,Mark,GPT-4o
Sweat glands help regulate body temperature through transpiration.,1,Sweat glands help regulate body temperature through transpiration.,Sweat glands help regulate body temperature through transpiration.,Mark,GPT-4o
Swimming provides a full-body workout with low injury risk.,1,Swimming provides a full-body workout with low injury risk.,Swimming provides a full-body workout with low injury risk.,Mark,GPT-4o
Sydney is home to the iconic Opera House.,1,Sydney is home to the iconic Opera House.,Sydney is home to the iconic Opera House.,Mark,GPT-4o
Symbiosis describes interactions where different species benefit each other.,1,Symbiosis describes interactions where different species benefit each other.,Symbiosis describes interactions where different species benefit each other.,Mark,GPT-4o
Synaptic transmission carries signals between neurons.,1,Synaptic transmission carries signals between neurons.,Synaptic transmission carries signals between neurons.,Mark,GPT-4o
"Tai chi promotes balance, coordination, and relaxation.",1,"Tai chi promotes balance, coordination, and relaxation.","Tai chi promotes balance, coordination, and relaxation.",Mark,GPT-4o
Tajikistan's Pamir Mountains are known as the Roof of the World.,1,Tajikistan's Pamir Mountains are known as the Roof of the World.,Tajikistan's Pamir Mountains are known as the Roof of the World.,Mark,GPT-4o
Taking regular breaks from screens reduces eye strain.,1,Taking regular breaks from screens reduces eye strain.,Taking regular breaks from screens reduces eye strain.,Mark,GPT-4o
Tanzania is home to Mount Kilimanjaro.,1,Tanzania is home to Mount Kilimanjaro.,Tanzania is home to Mount Kilimanjaro.,Mark,GPT-4o
Tea consumption offers antioxidants beneficial for heart health.,1,Tea consumption offers antioxidants beneficial for heart health.,Tea consumption offers antioxidants beneficial for heart health.,Mark,GPT-4o
Technology explores the boundaries of reality with visionary wings.,1,Technology explores the boundaries of reality with visionary wings.,Technology explores the boundaries of reality with visionary wings.,Mark,GPT-4o
Technology is humanity's tool for shaping the future landscape.,1,Technology is humanity's tool for shaping the future landscape.,Technology is humanity's tool for shaping the future landscape.,Mark,GPT-4o
Technology opens new doors to the universe's boundless wonders.,1,Technology opens new doors to the universe's boundless wonders.,Technology opens new doors to the universe's boundless wonders.,Mark,GPT-4o
Tectonic activity leads to seismic and volcanic events.,1,Tectonic activity leads to seismic and volcanic events.,Tectonic activity leads to seismic and volcanic events.,Mark,GPT-4o
Telecommunications enable global information exchange.,1,Telecommunications enable global information exchange.,Telecommunications enable global information exchange.,Mark,GPT-4o
Telemedicine provides remote healthcare services.,1,Telemedicine provides remote healthcare services.,Telemedicine provides remote healthcare services.,Mark,GPT-4o
Television broadcasts video content.,1,Television broadcasts video content.,Television broadcasts video content.,Mark,GPT-4o
Temperature affects the state and behavior of substances.,1,Temperature affects the state and behavior of substances.,Temperature affects the state and behavior of substances.,Mark,GPT-4o
"Temperature is measured using scales such as Celsius, Fahrenheit, or Kelvin.",1,"Temperature is measured using scales such as Celsius, Fahrenheit, or Kelvin.","Temperature is measured using scales such as Celsius, Fahrenheit, or Kelvin.",Mark,GPT-4o
Temperature measures the heat intensity of a substance.,1,Temperature measures the heat intensity of a substance.,Temperature measures the heat intensity of a substance.,Mark,GPT-4o
Tensile strength measures material resistance to pulling forces.,1,Tensile strength measures material resistance to pulling forces.,Tensile strength measures material resistance to pulling forces.,Mark,GPT-4o
"Thailand's capital, Bangkok, is known for its streetlife.",1,"Thailand's capital, Bangkok, is known for its streetlife.","Thailand's capital, Bangkok, is known for its streetlife.",Mark,GPT-4o
The Alamo fell during the Texas Revolution in 1836.,1,The Alamo fell during the Texas Revolution in 1836.,The Alamo fell during the Texas Revolution in 1836.,Mark,GPT-4o
"The Allies stormed Normandy on D-Day, June 6, 1944.",1,"The Allies stormed Normandy on D-Day, June 6, 1944.","The Allies stormed Normandy on D-Day, June 6, 1944.",Mark,GPT-4o
The Alps are Europe's largest mountain range.,1,The Alps are Europe's largest mountain range.,The Alps are Europe's largest mountain range.,Mark,GPT-4o
The Alps are shared by eight countries in Europe.,1,The Alps are shared by eight countries in Europe.,The Alps are shared by eight countries in Europe.,Mark,GPT-4o
The Amazon Rainforest is rich in biodiversity.,1,The Amazon Rainforest is rich in biodiversity.,The Amazon Rainforest is rich in biodiversity.,Mark,GPT-4o
The Amazon basin spans across nine countries.,1,The Amazon basin spans across nine countries.,The Amazon basin spans across nine countries.,Mark,GPT-4o
The American Civil War lasted from 1861 to 1865.,1,The American Civil War lasted from 1861 to 1865.,The American Civil War lasted from 1861 to 1865.,Mark,GPT-4o
The American Declaration of Independence was signed in 1776.,1,The American Declaration of Independence was signed in 1776.,The American Declaration of Independence was signed in 1776.,Mark,GPT-4o
The American Revolutionary War started in 1775 and ended in 1783.,1,The American Revolutionary War started in 1775 and ended in 1783.,The American Revolutionary War started in 1775 and ended in 1783.,Mark,GPT-4o
The Andes Mountains run through seven South American countries.,1,The Andes Mountains run through seven South American countries.,The Andes Mountains run through seven South American countries.,Mark,GPT-4o
The Andes' biodiversity is extraordinary and unique.,1,The Andes' biodiversity is extraordinary and unique.,The Andes' biodiversity is extraordinary and unique.,Mark,GPT-4o
The Appalachian Trail is the longest hiking-only footpath worldwide.,1,The Appalachian Trail is the longest hiking-only footpath worldwide.,The Appalachian Trail is the longest hiking-only footpath worldwide.,Mark,GPT-4o
The Aral Sea has dramatically shrunk over the decades.,1,The Aral Sea has dramatically shrunk over the decades.,The Aral Sea has dramatically shrunk over the decades.,Mark,GPT-4o
The Arctic Circle surrounds the North Pole region.,1,The Arctic Circle surrounds the North Pole region.,The Arctic Circle surrounds the North Pole region.,Mark,GPT-4o
"The Arctic Tundra is characterized by cold, desert-like conditions.",1,"The Arctic Tundra is characterized by cold, desert-like conditions.","The Arctic Tundra is characterized by cold, desert-like conditions.",Mark,GPT-4o
The Assyrian Empire was known for its military prowess and innovation.,1,The Assyrian Empire was known for its military prowess and innovation.,The Assyrian Empire was known for its military prowess and innovation.,Mark,GPT-4o
The Atacama Desert is the driest place on Earth.,1,The Atacama Desert is the driest place on Earth.,The Atacama Desert is the driest place on Earth.,Mark,GPT-4o
The Baltic Sea connects with the North Sea.,1,The Baltic Sea connects with the North Sea.,The Baltic Sea connects with the North Sea.,Mark,GPT-4o
"The Baltic States include Estonia, Latvia, and Lithuania.",1,"The Baltic States include Estonia, Latvia, and Lithuania.","The Baltic States include Estonia, Latvia, and Lithuania.",Mark,GPT-4o
The Barents Sea is part of the Arctic Ocean.,1,The Barents Sea is part of the Arctic Ocean.,The Barents Sea is part of the Arctic Ocean.,Mark,GPT-4o
The Battle of Waterloo in 1815 marked the end of Napoleon's rule.,1,The Battle of Waterloo in 1815 marked the end of Napoleon's rule.,The Battle of Waterloo in 1815 marked the end of Napoleon's rule.,Mark,GPT-4o
The Bay of Pigs invasion was a failed US-backed mission in Cuba in 1961.,1,The Bay of Pigs invasion was a failed US-backed mission in Cuba in 1961.,The Bay of Pigs invasion was a failed US-backed mission in Cuba in 1961.,Mark,GPT-4o
The Bering Strait separates Russia and Alaska.,1,The Bering Strait separates Russia and Alaska.,The Bering Strait separates Russia and Alaska.,Mark,GPT-4o
The Berlin Airlift was conducted in 1948-1949 to supply West Berlin.,1,The Berlin Airlift was conducted in 1948-1949 to supply West Berlin.,The Berlin Airlift was conducted in 1948-1949 to supply West Berlin.,Mark,GPT-4o
The Berlin Conference regulated the colonization of Africa in 1884-1885.,1,The Berlin Conference regulated the colonization of Africa in 1884-1885.,The Berlin Conference regulated the colonization of Africa in 1884-1885.,Mark,GPT-4o
The Berlin Wall served as a symbol of Cold War division.,1,The Berlin Wall served as a symbol of Cold War division.,The Berlin Wall served as a symbol of Cold War division.,Mark,GPT-4o
The Bernoulli effect explains fluid pressure changes.,1,The Bernoulli effect explains fluid pressure changes.,The Bernoulli effect explains fluid pressure changes.,Mark,GPT-4o
The Black Death pandemic swept through Europe in the 14th century.,1,The Black Death pandemic swept through Europe in the 14th century.,The Black Death pandemic swept through Europe in the 14th century.,Mark,GPT-4o
The Black Forest is in southwestern Germany.,1,The Black Forest is in southwestern Germany.,The Black Forest is in southwestern Germany.,Mark,GPT-4o
The Black Sea is bordered by six countries.,1,The Black Sea is bordered by six countries.,The Black Sea is bordered by six countries.,Mark,GPT-4o
The Blue Mountains are a UNESCO World Heritage Site.,1,The Blue Mountains are a UNESCO World Heritage Site.,The Blue Mountains are a UNESCO World Heritage Site.,Mark,GPT-4o
The Bosporus Strait divides Europe and Asia.,1,The Bosporus Strait divides Europe and Asia.,The Bosporus Strait divides Europe and Asia.,Mark,GPT-4o
"The Boston Massacre occurred on March 5, 1770.",1,"The Boston Massacre occurred on March 5, 1770.","The Boston Massacre occurred on March 5, 1770.",Mark,GPT-4o
The Boston Tea Party in 1773 was a protest against British taxation.,1,The Boston Tea Party in 1773 was a protest against British taxation.,The Boston Tea Party in 1773 was a protest against British taxation.,Mark,GPT-4o
The Byzantine Empire fell with the conquest of Constantinople in 1453.,1,The Byzantine Empire fell with the conquest of Constantinople in 1453.,The Byzantine Empire fell with the conquest of Constantinople in 1453.,Mark,GPT-4o
The Calvin Coolidge administration presided over 1920s prosperity in the United States.,1,The Calvin Coolidge administration presided over 1920s prosperity in the United States.,The Calvin Coolidge administration presided over 1920s prosperity in the United States.,Mark,GPT-4o
The Cambrian explosion was a period of rapid evolution and diversification.,1,The Cambrian explosion was a period of rapid evolution and diversification.,The Cambrian explosion was a period of rapid evolution and diversification.,Mark,GPT-4o
The Canaries are located off the northwest coast of Africa.,1,The Canaries are located off the northwest coast of Africa.,The Canaries are located off the northwest coast of Africa.,Mark,GPT-4o
The Canary Islands are part of Spain.,1,The Canary Islands are part of Spain.,The Canary Islands are part of Spain.,Mark,GPT-4o
The Cape of Good Hope was a key trading point.,1,The Cape of Good Hope was a key trading point.,The Cape of Good Hope was a key trading point.,Mark,GPT-4o
The Caribbean Sea is famous for its stunning beaches.,1,The Caribbean Sea is famous for its stunning beaches.,The Caribbean Sea is famous for its stunning beaches.,Mark,GPT-4o
The Caucasus Mountains divide Europe and Asia.,1,The Caucasus Mountains divide Europe and Asia.,The Caucasus Mountains divide Europe and Asia.,Mark,GPT-4o
The Caucasus region hosts many different ethnic groups.,1,The Caucasus region hosts many different ethnic groups.,The Caucasus region hosts many different ethnic groups.,Mark,GPT-4o
The Code of Hammurabi is one of the earliest sets of written laws.,1,The Code of Hammurabi is one of the earliest sets of written laws.,The Code of Hammurabi is one of the earliest sets of written laws.,Mark,GPT-4o
The Colorado River carved the Grand Canyon.,1,The Colorado River carved the Grand Canyon.,The Colorado River carved the Grand Canyon.,Mark,GPT-4o
The Concordat of 1801 normalized relations between Napoleonic France and the Catholic Church.,1,The Concordat of 1801 normalized relations between Napoleonic France and the Catholic Church.,The Concordat of 1801 normalized relations between Napoleonic France and the Catholic Church.,Mark,GPT-4o
The Continental Congress convened in 1774 as a response to British policies.,1,The Continental Congress convened in 1774 as a response to British policies.,The Continental Congress convened in 1774 as a response to British policies.,Mark,GPT-4o
The Cook Islands are in free association with New Zealand.,1,The Cook Islands are in free association with New Zealand.,The Cook Islands are in free association with New Zealand.,Mark,GPT-4o
The Crimea is a peninsula in the Black Sea.,1,The Crimea is a peninsula in the Black Sea.,The Crimea is a peninsula in the Black Sea.,Mark,GPT-4o
The DASH diet can help manage blood pressure effectively.,1,The DASH diet can help manage blood pressure effectively.,The DASH diet can help manage blood pressure effectively.,Mark,GPT-4o
The Dead Sea Scrolls are ancient Jewish texts discovered in the Qumran Caves.,1,The Dead Sea Scrolls are ancient Jewish texts discovered in the Qumran Caves.,The Dead Sea Scrolls are ancient Jewish texts discovered in the Qumran Caves.,Mark,GPT-4o
The Dolomites are a mountain range in northeastern Italy.,1,The Dolomites are a mountain range in northeastern Italy.,The Dolomites are a mountain range in northeastern Italy.,Mark,GPT-4o
The Dolomites are part of the Southern Limestone Alps.,1,The Dolomites are part of the Southern Limestone Alps.,The Dolomites are part of the Southern Limestone Alps.,Mark,GPT-4o
The Doppler effect causes a change in wave frequency.,1,The Doppler effect causes a change in wave frequency.,The Doppler effect causes a change in wave frequency.,Mark,GPT-4o
The Earth orbits the Sun in one year.,1,The Earth orbits the Sun in one year.,The Earth orbits the Sun in one year.,Mark,GPT-4o
The Earth rotates on an axis for a day.,1,The Earth rotates on an axis for a day.,The Earth rotates on an axis for a day.,Mark,GPT-4o
The Earth's core generates a magnetic field.,1,The Earth's core generates a magnetic field.,The Earth's core generates a magnetic field.,Mark,GPT-4o
The Earth's crust is divided into tectonic plates.,1,The Earth's crust is divided into tectonic plates.,The Earth's crust is divided into tectonic plates.,Mark,GPT-4o
The Earth's magnetic field protects against solar wind.,1,The Earth's magnetic field protects against solar wind.,The Earth's magnetic field protects against solar wind.,Mark,GPT-4o
The Earth's rotation causes day and night.,1,The Earth's rotation causes day and night.,The Earth's rotation causes day and night.,Mark,GPT-4o
The Edict of Milan in 313 AD granted religious tolerance throughout the Roman Empire.,1,The Edict of Milan in 313 AD granted religious tolerance throughout the Roman Empire.,The Edict of Milan in 313 AD granted religious tolerance throughout the Roman Empire.,Mark,GPT-4o
The English Channel separates the UK from mainland Europe.,1,The English Channel separates the UK from mainland Europe.,The English Channel separates the UK from mainland Europe.,Mark,GPT-4o
The English Civil War was fought from 1642 to 1651.,1,The English Civil War was fought from 1642 to 1651.,The English Civil War was fought from 1642 to 1651.,Mark,GPT-4o
The Equator divides Earth into northern and southern hemispheres.,1,The Equator divides Earth into northern and southern hemispheres.,The Equator divides Earth into northern and southern hemispheres.,Mark,GPT-4o
The Falkland Islands are a British Overseas Territory.,1,The Falkland Islands are a British Overseas Territory.,The Falkland Islands are a British Overseas Territory.,Mark,GPT-4o
The Falklands War took place in 1982 between Argentina and the UK.,1,The Falklands War took place in 1982 between Argentina and the UK.,The Falklands War took place in 1982 between Argentina and the UK.,Mark,GPT-4o
The Fibonacci sequence appears in natural patterns like flower petals.,1,The Fibonacci sequence appears in natural patterns like flower petals.,The Fibonacci sequence appears in natural patterns like flower petals.,Mark,GPT-4o
The Fibonacci sequence appears in nature often.,1,The Fibonacci sequence appears in nature often.,The Fibonacci sequence appears in nature often.,Mark,GPT-4o
The First Crusade began in 1096 aiming to reclaim Jerusalem from Muslim control.,1,The First Crusade began in 1096 aiming to reclaim Jerusalem from Muslim control.,The First Crusade began in 1096 aiming to reclaim Jerusalem from Muslim control.,Mark,GPT-4o
The Fjords of Norway draw thousands of tourists.,1,The Fjords of Norway draw thousands of tourists.,The Fjords of Norway draw thousands of tourists.,Mark,GPT-4o
The Florida Keys are a coral cay archipelago.,1,The Florida Keys are a coral cay archipelago.,The Florida Keys are a coral cay archipelago.,Mark,GPT-4o
The French Revolution inspired human rights movements globally.,1,The French Revolution inspired human rights movements globally.,The French Revolution inspired human rights movements globally.,Mark,GPT-4o
The French Revolution led to the rise of Napoleon Bonaparte.,1,The French Revolution led to the rise of Napoleon Bonaparte.,The French Revolution led to the rise of Napoleon Bonaparte.,Mark,GPT-4o
The Galápagos Islands inspired Darwin's theory of evolution.,1,The Galápagos Islands inspired Darwin's theory of evolution.,The Galápagos Islands inspired Darwin's theory of evolution.,Mark,GPT-4o
The Ganges River is sacred to Hindus.,1,The Ganges River is sacred to Hindus.,The Ganges River is sacred to Hindus.,Mark,GPT-4o
The Ganges flows through India and Bangladesh.,1,The Ganges flows through India and Bangladesh.,The Ganges flows through India and Bangladesh.,Mark,GPT-4o
The Gobi Desert spans China and Mongolia.,1,The Gobi Desert spans China and Mongolia.,The Gobi Desert spans China and Mongolia.,Mark,GPT-4o
The Golden Ratio appears frequently in natural and human designs.,1,The Golden Ratio appears frequently in natural and human designs.,The Golden Ratio appears frequently in natural and human designs.,Mark,GPT-4o
"The Grand Canyon is located in Arizona, USA.",1,"The Grand Canyon is located in Arizona, USA.","The Grand Canyon is located in Arizona, USA.",Mark,GPT-4o
The Great Barrier Reef is the largest coral reef system.,1,The Great Barrier Reef is the largest coral reef system.,The Great Barrier Reef is the largest coral reef system.,Mark,GPT-4o
"The Great Chicago Fire happened in 1871, leading to massive rebuilding.",1,"The Great Chicago Fire happened in 1871, leading to massive rebuilding.","The Great Chicago Fire happened in 1871, leading to massive rebuilding.",Mark,GPT-4o
"The Great Wall of China is over 13,000 miles long.",1,"The Great Wall of China is over 13,000 miles long.","The Great Wall of China is over 13,000 miles long.",Mark,GPT-4o
The Great Wall of China was built to protect against invasions.,1,The Great Wall of China was built to protect against invasions.,The Great Wall of China was built to protect against invasions.,Mark,GPT-4o
The Guiana Highlands are in northern South America.,1,The Guiana Highlands are in northern South America.,The Guiana Highlands are in northern South America.,Mark,GPT-4o
"The Gutenberg Bible was printed around 1455, starting a new print era.",1,"The Gutenberg Bible was printed around 1455, starting a new print era.","The Gutenberg Bible was printed around 1455, starting a new print era.",Mark,GPT-4o
The Gutenberg Printing Press was invented in the 15th century.,1,The Gutenberg Printing Press was invented in the 15th century.,The Gutenberg Printing Press was invented in the 15th century.,Mark,GPT-4o
The Himalayas separate the Indian subcontinent from Asia.,1,The Himalayas separate the Indian subcontinent from Asia.,The Himalayas separate the Indian subcontinent from Asia.,Mark,GPT-4o
"The Hindenburg disaster occurred in 1937, marking the end of airship travel.",1,"The Hindenburg disaster occurred in 1937, marking the end of airship travel.","The Hindenburg disaster occurred in 1937, marking the end of airship travel.",Mark,GPT-4o
"The Hittites were among the first to work iron, improving weaponry and tools.",1,"The Hittites were among the first to work iron, improving weaponry and tools.","The Hittites were among the first to work iron, improving weaponry and tools.",Mark,GPT-4o
The Hubble Space Telescope has provided crucial data on distant galaxies.,1,The Hubble Space Telescope has provided crucial data on distant galaxies.,The Hubble Space Telescope has provided crucial data on distant galaxies.,Mark,GPT-4o
The Hubble Space Telescope observes distant astronomical phenomena.,1,The Hubble Space Telescope observes distant astronomical phenomena.,The Hubble Space Telescope observes distant astronomical phenomena.,Mark,GPT-4o
The Hubble constant relates to the universe's expansion rate.,1,The Hubble constant relates to the universe's expansion rate.,The Hubble constant relates to the universe's expansion rate.,Mark,GPT-4o
The Iberian Peninsula includes Spain and Portugal.,1,The Iberian Peninsula includes Spain and Portugal.,The Iberian Peninsula includes Spain and Portugal.,Mark,GPT-4o
The Iberian Peninsula was controlled by the Moors from the 8th to the 15th century.,1,The Iberian Peninsula was controlled by the Moors from the 8th to the 15th century.,The Iberian Peninsula was controlled by the Moors from the 8th to the 15th century.,Mark,GPT-4o
The Industrial Revolution began in Great Britain in the late 1700s.,1,The Industrial Revolution began in Great Britain in the late 1700s.,The Industrial Revolution began in Great Britain in the late 1700s.,Mark,GPT-4o
The International Space Station (ISS) orbits Earth as a research facility.,1,The International Space Station (ISS) orbits Earth as a research facility.,The International Space Station (ISS) orbits Earth as a research facility.,Mark,GPT-4o
The Irish Potato Famine occurred from 1845 to 1852 resulting in mass starvation.,1,The Irish Potato Famine occurred from 1845 to 1852 resulting in mass starvation.,The Irish Potato Famine occurred from 1845 to 1852 resulting in mass starvation.,Mark,GPT-4o
The Irish Sea separates Great Britain from Ireland.,1,The Irish Sea separates Great Britain from Ireland.,The Irish Sea separates Great Britain from Ireland.,Mark,GPT-4o
The Isle of Man is located in the Irish Sea.,1,The Isle of Man is located in the Irish Sea.,The Isle of Man is located in the Irish Sea.,Mark,GPT-4o
The Isles of Scilly are an archipelago off England's coast.,1,The Isles of Scilly are an archipelago off England's coast.,The Isles of Scilly are an archipelago off England's coast.,Mark,GPT-4o
The Italian Riviera is known for its picturesque views.,1,The Italian Riviera is known for its picturesque views.,The Italian Riviera is known for its picturesque views.,Mark,GPT-4o
The Jordan River flows into the Dead Sea.,1,The Jordan River flows into the Dead Sea.,The Jordan River flows into the Dead Sea.,Mark,GPT-4o
The Kalahari Desert spans several African nations.,1,The Kalahari Desert spans several African nations.,The Kalahari Desert spans several African nations.,Mark,GPT-4o
"The Khmer Empire was established in Southeast Asia, famous for building Angkor Wat.",1,"The Khmer Empire was established in Southeast Asia, famous for building Angkor Wat.","The Khmer Empire was established in Southeast Asia, famous for building Angkor Wat.",Mark,GPT-4o
