statement,elicitation,committer
"विचार और ट्वीट जीवन नहीं बचाते हैं, लेकिन कार्रवाई करती है।",amazon translate,Dan
बंदूक हिंसा को कम करने के लिए यूनिवर्सल बैकग्राउंड चेक एक प्रस्तावित उपाय है।,amazon translate,Dan
घरेलू दुर्व्यवहारियों से बंदूकें दूर रखने से जान बचाई जा सकती है।,amazon translate,Dan
"समुदायों को सुरक्षित रखने वाली नीतियां बनाने के लिए, पार्टी की परवाह किए बिना, परिवर्तन के लिए एक साथ आने की आवश्यकता होती है।",amazon translate,Dan
"कड़ी मेहनत करने वाले परिवारों के लिए स्वास्थ्य, सुरक्षा और कल्याण महत्वपूर्ण हैं।",amazon translate,Dan
"जिन लोगों को उनकी आवश्यकता होती है, उनके लिए दवाएं सस्ती होनी चाहिए।",amazon translate,Dan
छोटे व्यवसाय स्थानीय अर्थव्यवस्था के लिए महत्वपूर्ण हैं।,amazon translate,Dan
वॉशिंगटन की राजनीति में पक्षपातपूर्ण मनमुटाव आम है।,amazon translate,Dan
सरकार में काम करवाने के लिए सहयोग और साझा आधार खोजना आवश्यक है।,amazon translate,Dan
उपनगरीय इलाकों के लोग राजनीतिक दिनचर्या से थक सकते हैं।,amazon translate,Dan
विशेष रुचि समूह और पैरवी करने वाले राजनीति में प्रभाव प्राप्त कर सकते हैं।,amazon translate,Dan
कड़ी मेहनत करने वाले परिवारों को कभी-कभी राजनेताओं द्वारा नजरअंदाज किया जाता है।,amazon translate,Dan
राजनीतिक अभियानों के लिए जमीनी स्तर के समर्थक महत्वपूर्ण हो सकते हैं।,amazon translate,Dan
राजनीति में पक्षपातपूर्ण मनमुटाव एक आम मुद्दा है।,amazon translate,Dan
राजनीतिक लक्ष्यों को प्राप्त करने के लिए साझा आधार खोजना महत्वपूर्ण है।,amazon translate,Dan
राजनेताओं को लोगों का प्रतिनिधित्व करने और उनके लिए काम करने के लिए चुना जाता है।,amazon translate,Dan
"स्कूल सुरक्षा, कर विनियमन, और सस्ती दवा घटकों के लिए चिंताएं हैं।",amazon translate,Dan
"जो लोग हमारी देखभाल करने के लिए कड़ी मेहनत कर रहे हैं, उनमें वे लोग शामिल हैं जो अस्पतालों में हैं, हमारे स्टोर में हैं, हमारा मेल डिलीवर कर रहे हैं, देखभाल प्रदान कर रहे हैं, और आपात स्थिति के लिए वहां मौजूद हैं।",amazon translate,Dan
"यह एक ऐसा समय है जब हम अलग रहकर एक साथ खड़े होते हैं, और आज और भविष्य के लिए अच्छे परिणामों के लिए मिलकर काम करते हैं।",amazon translate,Dan
नेतृत्व के पदों पर बैठे लोग अक्सर अपने समुदायों में समस्याओं को हल करने के लिए काम करते हैं।,amazon translate,Dan
राजनीतिक अभियानों को सफल होने के लिए अक्सर धन उगाहने की आवश्यकता होती है।,amazon translate,Dan
प्रतिनिधियों को उनके घटकों की ओर से मुद्दों को हल करने और हल करने के लिए चुना जाता है।,amazon translate,Dan
राजनीतिक प्रणालियां उन समस्याओं का सामना कर सकती हैं जिन पर ध्यान देने की आवश्यकता है।,amazon translate,Dan
चुनावों में भाग लेते समय समय समय सीमा को पूरा करना महत्वपूर्ण होता है।,amazon translate,Dan
मतदान लोकतंत्र में अपनी आवाज बुलंद करने का एक तरीका है।,amazon translate,Dan
अनुपस्थित मतपत्र लोगों को चुनाव के दिन मतदान स्थल पर जाए बिना मतदान करने की अनुमति देते हैं।,amazon translate,Dan
हमारी आपराधिक न्याय प्रणाली कई लोगों को बहुत लंबे समय तक बंद रखती है।,amazon translate,Dan
ये वाक्य भविष्य के आपराधिक व्यवहार को नहीं रोकते हैं।,amazon translate,Dan
अक्सर लोगों के लिए उत्पादक नागरिक के रूप में समाज में फिर से प्रवेश करना कठिन हो जाता है।,amazon translate,Dan
महामारी की अग्रिम पंक्ति में हेल्थकेयर कर्मचारियों को गंभीर जोखिमों का सामना करना पड़ता है।,amazon translate,Dan
अमेरिका का समुद्री उद्योग देश की वाणिज्यिक सीलिफ्ट तत्परता और विदेशों में रक्षा सहायता के लिए महत्वपूर्ण है।,amazon translate,Dan
"मज़दूर वर्ग के परिवार उचित वेतन, अच्छे लाभ और सुरक्षित कामकाजी परिस्थितियों के हकदार हैं।",amazon translate,Dan
COVID-19 महामारी के संबंध में रोग नियंत्रण और रोकथाम केंद्र की वेबसाइट को लगातार अपडेट किया जाता है।,amazon translate,Dan
"हमारे अभियान ने हमारी टीम, स्वयंसेवकों और समुदाय के सदस्यों की सुरक्षा सुनिश्चित करने के लिए सभी व्यक्तिगत गतिविधियों को निलंबित कर दिया है।",amazon translate,Dan
बस एक ईमेल खोलना एक अभियान के लिए समर्थन का एक शो है।,amazon translate,Dan
लोग राजनीतिक अभियानों के लिए दान करते हैं क्योंकि वे इस उद्देश्य में विश्वास करते हैं।,amazon translate,Dan
राष्ट्रीय संकटों को दूर करने और कामकाजी लोगों की सुरक्षा करने वाली नीतियों पर काम करने के लिए कांग्रेस में मजबूत नेताओं की जरूरत है।,amazon translate,Dan
"मेडिकेयर फॉर ऑल, स्टूडेंट लोन रिफॉर्म, और पेड बीमार छुट्टी जैसी नीतियों को कुछ लोगों द्वारा सामान्य ज्ञान माना जाता है।",amazon translate,Dan
"महामारी के दौरान, रोग नियंत्रण और रोकथाम केंद्र जैसे स्वास्थ्य संगठनों के दिशानिर्देशों का पालन करना महत्वपूर्ण है।",amazon translate,Dan
स्वास्थ्य संकट के दौरान सुरक्षा सुनिश्चित करने के लिए अभियान अक्सर व्यक्तिगत गतिविधियों को निलंबित कर देते हैं।,amazon translate,Dan
"मेडिकेयर फॉर ऑल, स्टूडेंट लोन रिफॉर्म, और पेड बीमार छुट्टी जैसी नीतियां बस सामान्य ज्ञान हैं।",amazon translate,Dan
आर्थिक संकटों के दौरान बेरोजगारी उच्च स्तर तक पहुंच सकती है।,amazon translate,Dan
सरकारें सार्वजनिक स्वास्थ्य संकटों पर प्रतिक्रिया लागू करती हैं।,amazon translate,Dan
नेतृत्व संसाधनों और सहायता के आवंटन को प्रभावित कर सकता है।,amazon translate,Dan
सार्वजनिक स्वास्थ्य जानकारी अक्सर महामारी के दौरान अपडेट की जाती है।,amazon translate,Dan
जमीनी स्तर पर होने वाले आंदोलनों से बदलाव हो सकता है।,amazon translate,Dan
चुनाव जीतने के लिए अक्सर कड़ी मेहनत करनी पड़ती है।,amazon translate,Dan
अभियानों को अपना संदेश फैलाने के लिए धन की आवश्यकता होती है।,amazon translate,Dan
मतदाताओं में चुनावों के माध्यम से बदलाव लाने की शक्ति होती है।,amazon translate,Dan
नए साल की पूर्व संध्या एक ऐसा समय होता है जब लोग पिछले साल की घटनाओं का जश्न मनाते हैं।,amazon translate,Dan
परिवार और दोस्त अक्सर एक साथ अच्छा समय बिताते हैं।,amazon translate,Dan
लोगों को हर साल नई नौकरियां मिलती हैं।,amazon translate,Dan
कर की दरें लोगों द्वारा सरकार को दी जाने वाली राशि को प्रभावित कर सकती हैं।,amazon translate,Dan
वेतन में वृद्धि या कमी हो सकती है।,amazon translate,Dan
महंगाई का असर जीवन यापन की लागत पर पड़ सकता है।,amazon translate,Dan
सरकारी अधिकारी अपने घटकों से मिलने के लिए यात्रा करते हैं।,amazon translate,Dan
"राजनीतिक अभियान ईंधन, संकेत और विज्ञापनों जैसे विभिन्न खर्चों के लिए दान का उपयोग करते हैं।",amazon translate,Dan
"राजनीतिक अभियानों में टेलीविजन, केबल, समाचार पत्र, डिजिटल और रेडियो विज्ञापनों का उपयोग किया जाता है।",amazon translate,Dan
18 साल की उम्र में हर किसी को वोट देने का अधिकार है,amazon translate,Dan
नेता और लोक सेवक अपने देश और लोगों के लिए प्रार्थना करने के लिए इकट्ठा होते हैं।,amazon translate,Dan
राज्य के कानून निर्माता अपने राज्य के संविधान में संशोधन पर बहस करते हैं और वोट देते हैं।,amazon translate,Dan
लोगों के पास लोकतंत्र में महत्वपूर्ण मुद्दों पर वोट करने की शक्ति है।,amazon translate,Dan
सारी राजनीतिक शक्ति लोगों में निहित होती है।,amazon translate,Dan
चुनाव लोकतांत्रिक प्रक्रियाओं का एक नियमित हिस्सा हैं।,amazon translate,Dan
"वोटों को एक आधिकारिक प्राधिकारी द्वारा प्रमाणित किया जाता है, जैसे कि राज्य सचिव का कार्यालय।",amazon translate,Dan
कन्वेंशन वे कार्यक्रम होते हैं जहां राजनीतिक दल अपने प्लेटफार्मों और रैली समर्थन पर चर्चा करते हैं।,amazon translate,Dan
अभियान में योगदान विभिन्न राशियों में किया जा सकता है।,amazon translate,Dan
बेरोजगारी को आम तौर पर अर्थव्यवस्था के नकारात्मक पहलू के रूप में देखा जाता है।,amazon translate,Dan
लोग अक्सर तेजी से बढ़ती अर्थव्यवस्था को एक सकारात्मक चीज मानते हैं।,amazon translate,Dan
राष्ट्रीय सीमाओं को सुरक्षित करना देश के सुरक्षा उपायों का एक सामान्य पहलू है।,amazon translate,Dan
प्रिस्क्रिप्शन दवा की कीमतें कम करना कई व्यक्तियों के लिए चिंता का विषय है।,amazon translate,Dan
स्कूल की पसंद शैक्षिक नीति में बहस का विषय है।,amazon translate,Dan
अजन्मे की रक्षा करना राजनीतिक और नैतिक चर्चा का विषय है।,amazon translate,Dan
इस साल फरवरी में हमारे पास एक अतिरिक्त दिन है,amazon translate,Dan
हम अपने फरवरी के लक्ष्य को पूरा करने से कतराते हैं,amazon translate,Dan
लोग आम तौर पर आधिकारिक सरकारी कार्यालय में फिर से चुनाव के लिए फाइल करते हैं।,amazon translate,Dan
प्रतिनिधि अपने घटकों के हितों की सेवा के लिए चुने जाते हैं।,amazon translate,Dan
कांग्रेस के सदस्य कानून को प्रभावित करने वाली समितियों में काम कर सकते हैं।,amazon translate,Dan
धन उगाहना राजनीतिक अभियानों का एक सामान्य हिस्सा है।,amazon translate,Dan
लोकतांत्रिक देशों में नियमित रूप से चुनाव होते हैं।,amazon translate,Dan
राजनेता अक्सर अपनी उम्मीदवारी का समर्थन करने के लिए समर्थन चाहते हैं।,amazon translate,Dan
विधायक कांग्रेस में विधेयक और अधिनियम पेश कर सकते हैं।,amazon translate,Dan
संविधान सेवाएं प्रतिनिधि के कर्तव्यों का एक महत्वपूर्ण हिस्सा हैं।,amazon translate,Dan
अनगिनत मेहनती अमेरिकियों को नौकरी की ज़रूरत है।,amazon translate,Dan
हमारी स्वास्थ्य देखभाल प्रणाली को अतिरिक्त प्रशिक्षित कर्मचारियों की सख्त जरूरत है।,amazon translate,Dan
सार्वजनिक स्वास्थ्य एजेंसियां कर्मचारियों को चिकित्सा पेशेवरों द्वारा किए गए कार्यों के पूरक के लिए प्रशिक्षित करती हैं।,amazon translate,Dan
"स्वास्थ्य बल परीक्षण सहायता, संपर्क अनुरेखण प्रयासों, वैक्सीन प्रशासन, सार्वजनिक स्वास्थ्य डेटा संग्रह और शिक्षा प्रयासों, भोजन और चिकित्सा आपूर्ति पहुंचाने के प्रयासों के लिए जिम्मेदार होगा।",amazon translate,Dan
"देश को सुरक्षित रूप से फिर से खोलने के लिए, हमें परीक्षण करने, संपर्क पता लगाने, टीके लगाने और लोगों को सामाजिक दूरी और आत्म-अलगाव के बारे में शिक्षित करने में मदद करने के लिए हर समुदाय में प्रशिक्षित श्रमिकों की आवश्यकता है।",amazon translate,Dan
जरूरत पड़ने पर राज्य और स्थानीय सार्वजनिक स्वास्थ्य विभाग कर्मचारियों की कमी थी।,amazon translate,Dan
"अर्थव्यवस्था हर दिन पैसा खो देती है, वह बंद रहती है।",amazon translate,Dan
संकट के क्षणों में साहसिक पहल एक स्थायी विरासत छोड़ सकती है।,amazon translate,Dan
COVID-19 के कारण अस्थायी रूप से बंद होने से प्रभावित श्रमिकों के लिए बेरोजगारी लाभ उपलब्ध हैं।,amazon translate,Dan
"हेल्थ इंश्योरेंस मार्केटप्लेस उन लोगों के लिए विशेष नामांकन अवधि खोल सकते हैं, जिन्होंने हाल ही में अपनी नौकरी खो दी है।",amazon translate,Dan
पहले से मौजूद स्थितियों वाले लोगों को स्वास्थ्य देखभाल की आवश्यकता होती है।,amazon translate,Dan
"जलवायु परिवर्तन से सुपर स्टॉर्म हो सकते हैं, समुद्र का स्तर बढ़ सकता है और जहरीले शैवाल खिल सकते हैं।",amazon translate,Dan
बंदूक की सुरक्षा कई लोगों के लिए चिंता का विषय है।,amazon translate,Dan
परिवारों के लिए हेल्थकेयर महत्वपूर्ण है।,amazon translate,Dan
मतदाताओं के लिए पर्यावरण चिंता का विषय है।,amazon translate,Dan
निर्वाचित नेताओं से अपेक्षा की जाती है कि वे अपने घटकों के लिए काम करें।,amazon translate,Dan
परिवारों द्वारा सामना की जाने वाली समस्याओं के लिए द्विदलीय समाधान मांगे जाते हैं।,amazon translate,Dan
स्वास्थ्य सेवा तक पहुंच हर किसी के लिए जरूरी है।,amazon translate,Dan
महामारी से बचे व्यवसाय अब एक नए प्रकोप का सामना कर रहे हैं: मुकदमे।,amazon translate,Dan
"कानूनी सुरक्षा के बिना, बड़े और छोटे व्यवसायों को गंभीर मुकदमेबाजी की ज्वार की लहर का सामना करना पड़ सकता है।",amazon translate,Dan
यदि कानून निर्माता उनकी रक्षा करने में विफल रहते हैं तो छोटे व्यवसायों को धोया जा सकता है।,amazon translate,Dan
इन व्यवसायों को लंबी अवधि में बचाने के लिए फिर से खोलना ही एकमात्र तरीका है।,amazon translate,Dan
छोटे व्यवसायों को केवल तुच्छ मुकदमों द्वारा बंद किए जाने के लिए खुलने की संभावना का सामना करना पड़ता है।,amazon translate,Dan
व्यवसायों को अपने ग्राहकों या श्रमिकों को नोवेल कोरोनावायरस जैसी संक्रामक बीमारी से बचाने में असमर्थता के लिए सताया नहीं जाना चाहिए।,amazon translate,Dan
तुच्छ मुकदमे संघर्षरत व्यवसायों को बंद कर सकते हैं क्योंकि वे अकेले वकीलों की लागत का भुगतान करने में असमर्थ हैं।,amazon translate,Dan
कानूनी शिकायतों का मात्र खतरा कुछ छोटे व्यवसायों को फिर से खुलने से रोक रहा है।,amazon translate,Dan
व्यवसाय चाहते हैं कि कांग्रेस उन उदाहरणों के लिए देयता को सीमित करे जिनमें COVID-19 जोखिम सिद्ध उपेक्षा के परिणामस्वरूप होता है।,amazon translate,Dan
व्यवसायों को अवसरवादी और लुटेरे वकीलों से बचाना चाहिए।,amazon translate,Dan
"अलबामा के लोग अपने 'धन्यवाद' संकेतों को यार्ड और खिड़कियों में रख रहे हैं, और हैशटैग #OneAlabama के साथ धन्यवाद कहने के लिए सोशल मीडिया का सहारा ले रहे हैं।",amazon translate,Dan
