statement,elicitation,committer
COVID-19 मुख्य रूप से वृद्ध आबादी की बीमारी है,amazon translate,Dan
COVID-19 से संक्रमित होने पर कई स्वास्थ्य स्थितियों वाले 80 वर्ष और उससे अधिक उम्र के लोगों की मृत्यु होने की संभावना अधिक होती है,amazon translate,Dan
कोरोनावायरस संक्रमण और मृत्यु के आंकड़ों में बुजुर्गों का असम्बद्ध रूप से प्रतिनिधित्व किया जाता है,amazon translate,Dan
नर्सिंग होम ऐसे वातावरण हैं जहां COVID-19 तेज़ी से फैलता है,amazon translate,Dan
महामारी के दौरान नर्सिंग होम में बार-बार परीक्षण और पर्याप्त व्यक्तिगत सुरक्षा उपकरण आवश्यक हैं,amazon translate,Dan
बीमारियों को फैलने से रोकने के लिए स्वास्थ्य कर्मियों को बीमार होने पर घर पर रहना चाहिए,amazon translate,Dan
पहले से मौजूद स्थितियों के कारण कवरेज से इनकार करना स्वास्थ्य सेवा प्रणाली में एक समस्या है,amazon translate,Dan
सामान्य दवाओं के लिए जेनेरिक मूल्य निर्धारण विकल्प प्रदान करने से समुदायों को लाभ हो सकता है,amazon translate,Dan
मेडिकेयर के लिए पात्रता की आयु कम करना फायदेमंद हो सकता है,amazon translate,Dan
टेलीमेडिसिन विकल्पों का विस्तार करने से स्वास्थ्य सेवा तक पहुंच में सुधार हो सकता है,amazon translate,Dan
COVID-19 के लक्षण संपर्क में आने के 2 से 14 दिनों के बीच दिखाई दे सकते हैं।,amazon translate,Dan
"COVID-19 के लक्षणों में बुखार, खांसी और सांस लेने में तकलीफ शामिल हैं।",amazon translate,Dan
"अगर आपको लगता है कि आप COVID-19 के संपर्क में आ गए हैं या आपके लक्षण हैं, तो आपको सेल्फ-क्वारंटाइन करना चाहिए और अपने डॉक्टर से संपर्क करना चाहिए।",amazon translate,Dan
कम यात्रा करना और घर पर रहना बीमारियों को फैलने से रोकने में मदद कर सकता है।,amazon translate,Dan
लोगों को वित्तीय बोझ को कम करने और अपने परिवारों का भरण-पोषण करने के लिए काम करने की ज़रूरत है।,amazon translate,Dan
छोटे व्यवसायों को सुरक्षा सुनिश्चित करने और COVID-19 जैसी बीमारियों के प्रसार को कम करने के उपायों को लागू करने के लिए समय की आवश्यकता होती है।,amazon translate,Dan
स्थानीय व्यवसाय अपने समुदायों की सेवा करने और उन्हें आकार देने के अभिन्न अंग हैं।,amazon translate,Dan
निर्वाचित अधिकारियों से उन योजनाओं पर काम करने की अपेक्षा की जाती है जो संकट के दौरान अर्थव्यवस्थाओं को सुरक्षित रूप से फिर से खोलती हैं।,amazon translate,Dan
काउंटियों की स्थानीय परिस्थितियों के आधार पर फिर से खोलने के लिए अलग-अलग समयसीमा और दिशानिर्देश हो सकते हैं।,amazon translate,Dan
राजनीतिक कार्यालय के उम्मीदवार अपने अभियानों का समर्थन करने के लिए दान मांग सकते हैं।,amazon translate,Dan
राजनीतिक अभियान मतदाताओं तक पहुंचने के लिए मैसेजिंग का उपयोग करते हैं।,amazon translate,Dan
निर्वाचित अधिकारियों को उनके कार्यों और रुख के आधार पर प्रतिष्ठा मिल सकती है।,amazon translate,Dan
चुनावों में प्रतिस्पर्धी बने रहने के लिए लोगों को संसाधनों की आवश्यकता होती है।,amazon translate,Dan
राजनीतिक अभियान अक्सर धन उगाहने के लक्ष्य निर्धारित करते हैं।,amazon translate,Dan
हमले के विज्ञापन नकारात्मक राजनीतिक विज्ञापन का एक रूप हैं।,amazon translate,Dan
नेताओं से अपेक्षा की जाती है कि वे अपने देश के हितों को सबसे पहले रखें।,amazon translate,Dan
ज्यादातर लोग चोकहोल्ड पर प्रतिबंध लगाने पर सहमत हो सकते हैं।,amazon translate,Dan
अधिकांश लोग घोर लापरवाही वाली पुलिस कार्रवाइयों के खिलाफ योग्य प्रतिरक्षा को संतुलित करने पर सहमत हो सकते हैं।,amazon translate,Dan
ज्यादातर लोग खराब पुलिस की सुरक्षा के लिए यूनियनों की शक्ति को सीमित करने पर सहमत हो सकते हैं।,amazon translate,Dan
अधिकांश लोग एक राष्ट्रीय डेटाबेस पर सहमत हो सकते हैं ताकि अपमानजनक अधिकारी नौकरी से नौकरी तक उछल न सकें।,amazon translate,Dan
किसी अभियान में योगदान दिया गया प्रत्येक डॉलर उसके परिणाम को प्रभावित कर सकता है।,amazon translate,Dan
राजनीतिक अभियानों में धन उगाहने के लक्ष्य होते हैं।,amazon translate,Dan
अभियानों को अपने संदेश को संचालित करने और संप्रेषित करने के लिए धन की आवश्यकता होती है।,amazon translate,Dan
चुनावों में उम्मीदवार वोटों के लिए प्रतिस्पर्धा करते हैं।,amazon translate,Dan
राजनीतिक विज्ञापनों का इस्तेमाल मतदाताओं को प्रभावित करने के लिए किया जाता है।,amazon translate,Dan
पोल ऊपर और नीचे जाते हैं।,amazon translate,Dan
राजनीतिक अभियान को सफल बनाने के लिए घटकों का समर्थन आवश्यक है।,amazon translate,Dan
उम्मीदवारों को जीतने में मदद करने के लिए लोगों को राजनीतिक अभियानों में धन का योगदान करना होगा।,amazon translate,Dan
दान को प्रोत्साहित करने के लिए राजनीतिक अभियानों में समय सीमा का उपयोग किया जाता है।,amazon translate,Dan
राजनीतिक अभियान रणनीति बनाने और निर्णय लेने के लिए मतदान डेटा का उपयोग करते हैं।,amazon translate,Dan
सीनेटर अपने घटकों के हितों की सेवा करते हैं।,amazon translate,Dan
प्रभावशाली व्यक्तियों के समर्थन राजनीतिक अभियानों को महत्वपूर्ण रूप से प्रभावित कर सकते हैं।,amazon translate,Dan
संयुक्त राज्य अमेरिका की सीनेट का नियंत्रण व्यक्तिगत सीनेट दौड़ के परिणाम से प्रभावित हो सकता है।,amazon translate,Dan
राजनीतिक उम्मीदवारों को उनके विरोधियों द्वारा धन से बाहर निकाला जा सकता है।,amazon translate,Dan
मतदान दिखा सकता है कि कौन से उम्मीदवार दौड़ में आगे हैं या पीछे चल रहे हैं।,amazon translate,Dan
चुनाव सीनेट में बहुमत का निर्धारण करते हैं।,amazon translate,Dan
समर्थकों की ओर से त्वरित कार्रवाई को प्रोत्साहित करने के लिए अभियानों में समय सीमा का उपयोग किया जाता है।,amazon translate,Dan
सीनेटर अपने राज्य के लोगों की सेवा करते हैं।,amazon translate,Dan
चुनावों में उम्मीदवार एक दूसरे के खिलाफ प्रतिस्पर्धा करते हैं।,amazon translate,Dan
रविवार की रात सोमवार से पहले आती है।,amazon translate,Dan
आधी रात को दिन का अंत होता है।,amazon translate,Dan
अभियानों के लिए अक्सर धन उगाहने की आवश्यकता होती है।,amazon translate,Dan
दानदाता अभियानों में धन का योगदान करते हैं।,amazon translate,Dan
"हमारा देश अब कैसे काम करता है, इसका भविष्य पर स्थायी प्रभाव पड़ेगा।",amazon translate,Dan
"हम लोगों के रूप में कैसे कार्य करते हैं, यह मायने रखता है।",amazon translate,Dan
इस तरह के कठिन समय के माध्यम से हम मजबूत होकर बाहर आते हैं।,amazon translate,Dan
किसी अभियान में योगदान दिया गया प्रत्येक डॉलर उसकी सफलता को प्रभावित कर सकता है।,amazon translate,Dan
राजनीतिक अभियानों में धन उगाहने वाले लक्ष्य होते हैं जिन्हें वे विशिष्ट समय सीमा तक पूरा करना चाहते हैं।,amazon translate,Dan
आम तौर पर लोगों को चुनाव जीतने के लिए मदद की ज़रूरत होती है।,amazon translate,Dan
समय सीमा का उपयोग लोगों को शीघ्रता से कार्य करने के लिए प्रोत्साहित करने के लिए किया जाता है।,amazon translate,Dan
राजनेता अपने घटकों के हितों का प्रतिनिधित्व करने के लिए काम करते हैं।,amazon translate,Dan
राजनीतिक दल अक्सर उन राज्यों में अभियान के प्रयासों में पैसा लगाते हैं जहां उन्हें लगता है कि वे सीटें हासिल कर सकते हैं।,amazon translate,Dan
चुनाव अत्यधिक प्रतिस्पर्धी और करीबी रूप से लड़े जा सकते हैं।,amazon translate,Dan
अवलंबी राजनेता अक्सर स्थानीय मूल्यों और हितों के प्रति अपनी प्रतिबद्धता पर ज़ोर देते हैं।,amazon translate,Dan
आमतौर पर लोग रात को सोते हैं।,amazon translate,Dan
रविवार को आमतौर पर सप्ताहांत का अंत माना जाता है।,amazon translate,Dan
माता-पिता आमतौर पर अपने बच्चों की देखभाल करते हैं।,amazon translate,Dan
अर्थव्यवस्था के लिए नौकरियां महत्वपूर्ण हैं।,amazon translate,Dan
सरकार किसी देश के संगठन में शामिल होती है।,amazon translate,Dan
विधायी निकायों का नियंत्रण चुनावों के परिणाम से प्रभावित हो सकता है।,amazon translate,Dan
लोग आम तौर पर सप्ताह के दौरान काम करते हैं और आने वाले सप्ताह की तैयारी के लिए रविवार की रात को समय मानते हैं।,amazon translate,Dan
राजनेता अपने अभियानों का समर्थन करने के लिए दान मांग सकते हैं।,amazon translate,Dan
चुनावों के परिणामों के आधार पर विधायी निकायों का नियंत्रण बदल सकता है।,amazon translate,Dan
समर्थक राजनीतिक अभियानों में आर्थिक रूप से योगदान कर सकते हैं।,amazon translate,Dan
चुनाव प्रतिस्पर्धी होते हैं और इसमें धन उगाहना शामिल होता है।,amazon translate,Dan
राजनीतिक दल चुनाव जीतने के लिए कुछ राज्यों को निशाना बनाते हैं।,amazon translate,Dan
पोल का उपयोग किसी चुनाव में उम्मीदवार की स्थिति को मापने के लिए किया जाता है।,amazon translate,Dan
राजनीतिक दलों का लक्ष्य सीनेट में बहुमत हासिल करना है।,amazon translate,Dan
राजनीतिक अभियानों को अक्सर अपनी गतिविधियों का समर्थन करने के लिए धन उगाहने की आवश्यकता होती है।,amazon translate,Dan
चुनाव दिवस एक विशिष्ट तिथि होती है जब मतदाता अपना वोट डालते हैं।,amazon translate,Dan
राजनीतिक उम्मीदवार मतदाताओं तक पहुंचने और उन्हें मनाने के लिए मैसेजिंग का उपयोग कर सकते हैं।,amazon translate,Dan
राजनीतिक अभियानों में विरोधियों के खिलाफ हमले के विज्ञापन शामिल हो सकते हैं।,amazon translate,Dan
राजनीतिक दल चुनाव परिणामों को प्रभावित करने के लिए अभियान के प्रयासों में पैसा लगाते हैं।,amazon translate,Dan
चुनाव अत्यधिक प्रतिस्पर्धी हो सकते हैं और कभी-कभी 'चाकू की लड़ाई' जैसे रूपकों का उपयोग करके उनका वर्णन किया जाता है।,amazon translate,Dan
अवलंबी राजनेता अपने समर्थकों के मूल्यों के लिए अपील करके और वित्तीय योगदान मांगकर फिर से चुनाव की मांग कर सकते हैं।,amazon translate,Dan
आम तौर पर लोगों को अपने लक्ष्यों को हासिल करने के लिए मदद की ज़रूरत होती है।,amazon translate,Dan
समय सीमा का उपयोग त्वरित कार्रवाई को प्रोत्साहित करने के लिए किया जाता है।,amazon translate,Dan
चुनाव मतदाताओं द्वारा तय किए जाते हैं।,amazon translate,Dan
चुनाव विधायी निकायों में बहुमत के नेतृत्व को निर्धारित कर सकते हैं।,amazon translate,Dan
मतदान किसी दौड़ में अपने विरोधियों के सापेक्ष उम्मीदवार की स्थिति दिखा सकता है।,amazon translate,Dan
राजनेता अक्सर कुछ मूल्यों का प्रतिनिधित्व करने का दावा करते हैं और उनके लिए लड़ने का वादा करते हैं।,amazon translate,Dan
चुनाव विधायी निकायों के नियंत्रण को निर्धारित कर सकते हैं।,amazon translate,Dan
चुनावों में उम्मीदवारों को उनके विरोधियों द्वारा धन से बाहर निकाला जा सकता है।,amazon translate,Dan
चुनाव अभियानों के लिए राजनीतिक समर्थन को मूल्यवान माना जाता है।,amazon translate,Dan
निहत्थे लोगों को गोली नहीं मारी जानी चाहिए।,amazon translate,Dan
बच्चों को हिंसा की धमकी के बिना स्कूल जाने में सक्षम होना चाहिए।,amazon translate,Dan
न्याय की दिशा में न्याय व्यवस्था को काम करना चाहिए।,amazon translate,Dan
मतदाताओं को संदेश फैलाने के लिए अभियान के अंतिम कुछ सप्ताह महत्वपूर्ण होते हैं।,amazon translate,Dan
मीडिया बाजार लागत में भिन्न हो सकते हैं।,amazon translate,Dan
"अभियानों को ऋण, व्यक्तिगत योगदान या PAC द्वारा वित्त पोषित किया जा सकता है।",amazon translate,Dan
राजनीतिक अभियान के लिए जमीनी स्तर के समर्थक महत्वपूर्ण होते हैं।,amazon translate,Dan
अभियानों को अपने कार्यों को जारी रखने के लिए अक्सर कुछ समय सीमा के अनुसार धन जुटाने की आवश्यकता होती है।,amazon translate,Dan
दान विभिन्न निर्धारित राशियों या दाता द्वारा चुनी गई अन्य राशियों के माध्यम से किया जा सकता है।,amazon translate,Dan
अभियान अक्सर ईमेल के माध्यम से वित्तीय सहायता मांगते हैं।,amazon translate,Dan
लोग अपने पसंदीदा उम्मीदवारों का समर्थन करने के लिए राजनीतिक अभियानों में निवेश करते हैं।,amazon translate,Dan
अभियान अक्सर अपनी गतिविधियों के वित्तपोषण के लिए धन उगाहने के लक्ष्य निर्धारित करते हैं।,amazon translate,Dan
यदि वे प्रतिस्पर्धी हैं तो राजनीतिक अभियान राष्ट्रीय स्तर पर ध्यान आकर्षित कर सकते हैं।,amazon translate,Dan
अभियानों को विरोधियों और विशेष रुचि समूहों से चुनौतियों का सामना करना पड़ सकता है।,amazon translate,Dan
राजनीतिक अभियान गति बढ़ाने और अपनी गतिविधियों का समर्थन करने के लिए दान का उपयोग करते हैं।,amazon translate,Dan
वित्तीय लक्ष्यों को पूरा करने के लिए अभियान अक्सर दान मांग सकते हैं।,amazon translate,Dan
लोगों को अक्सर बताया जाता है कि औपचारिक सेटिंग या संस्थानों में कहाँ बैठना है।,amazon translate,Dan
विधायकों से अपेक्षा की जाती है कि वे अपने घटकों के हितों के लिए प्रतिनिधित्व करें और खड़े हों।,amazon translate,Dan
"राजनेता अक्सर शिक्षा, पर्यावरण संरक्षण और श्रमिकों के अधिकारों जैसे मुद्दों पर अभियान चलाते हैं।",amazon translate,Dan
लोगों को कांग्रेस में प्रतिनिधित्व चाहिए।,amazon translate,Dan
कामकाजी परिवारों को सहायता की आवश्यकता हो सकती है।,amazon translate,Dan
कई व्यक्तियों के लिए सुलभ और किफायती स्वास्थ्य सेवा महत्वपूर्ण है।,amazon translate,Dan
स्वयंसेवकों द्वारा राजनीतिक अभियानों का समर्थन किया जा सकता है।,amazon translate,Dan
चुनावों में वोट देना महत्वपूर्ण है।,amazon translate,Dan
