statement,elicitation,committer
يقوم المتطوعون والمتدربون بإجراء المكالمات وتوصيل اللافتات وطرق الأبواب كل يوم.,amazon translate,Dan
تتضمن الحملات أنشطة مثل إجراء المكالمات وإيصال اللافتات وطرق الأبواب.,amazon translate,Dan
غالبًا ما تشمل الحملات السياسية متطوعين ومتدربين.,amazon translate,Dan
يشارك المرشحون في الأحداث للتفاعل مع المجتمعات المختلفة.,amazon translate,Dan
تتكيف الحملات مع الواقع الحالي، مثل ارتداء الأقنعة والتباعد الاجتماعي بسبب المخاوف الصحية.,amazon translate,Dan
يهدف العمل عبر الخطوط الحزبية إلى تحسين حياة الناس.,amazon translate,Dan
تهدف قوانين تمويل الحملات إلى تنظيم تأثير المال في السياسة.,amazon translate,Dan
يمكن للأشخاص من جميع أنحاء الولاية أن يجتمعوا حول القضايا التي تهمنا جميعًا.,amazon translate,Dan
الرعاية الصحية بأسعار معقولة مهمة.,amazon translate,Dan
تعتبر حماية الأراضي العامة والمساحات الخارجية أمرًا ذا قيمة.,amazon translate,Dan
قوانين تمويل الحملات ضرورية لتنظيم تأثير المال في السياسة.,amazon translate,Dan
واشنطن هي المكان الذي غالبًا ما يحل فيه الحديث محل العمل.,amazon translate,Dan
لكل شخص الحق في الإدلاء بصوته في الانتخابات.,amazon translate,Dan
غالبًا ما يجد الأطفال الأنشطة الخارجية أكثر إثارة للاهتمام من السياسة.,amazon translate,Dan
يعد تسليم الصحف مهمة شائعة للأطفال لكسب مصروف الجيب.,amazon translate,Dan
يعيش المحافظون في مساكن رسمية.,amazon translate,Dan
يمكن للأشخاص من مختلف الأحزاب السياسية العمل معًا لتحقيق الأهداف المشتركة.,amazon translate,Dan
الاستثمار في المدارس العامة هو وسيلة لتعزيز الاقتصاد.,amazon translate,Dan
يمكن للتدريب الوظيفي أن يخلق فرصًا وظيفية للجيل القادم.,amazon translate,Dan
غالبًا ما تتطلب الحملات التبرعات لتكون ناجحة.,amazon translate,Dan
يعمل الآباء على التوفيق بين العمل من المنزل والتعلم عن بعد أثناء الوباء.,amazon translate,Dan
التخزين الآمن للأسلحة النارية مهم للحفاظ على سلامة العائلات.,amazon translate,Dan
تعتبر المسدسات غير المقفلة وغير الخاضعة للإشراف خطيرة.,amazon translate,Dan
يمكن أن يؤدي الوصول السهل إلى سلاح ناري إلى إطلاق نار غير مقصود يشمل الأطفال أو المراهقين.,amazon translate,Dan
الحلم الأمريكي هو مفهوم يتضمن فرصة النجاح والازدهار.,amazon translate,Dan
يتم تعيين قضاة المحكمة العليا في أعلى محكمة في البلاد.,amazon translate,Dan
يمكن للانتخابات أن تحدد السيطرة على الفروع التشريعية والتنفيذية للحكومة.,amazon translate,Dan
يمكن رفع الضرائب أو خفضها من خلال السياسات الحكومية.,amazon translate,Dan
يتمتع الناس عمومًا بالقدرة على التصويت في الانتخابات.,amazon translate,Dan
تعتبر الانتخابات أحداثًا مهمة في الديمقراطية.,amazon translate,Dan
يصوت أعضاء الكونغرس على التشريعات.,amazon translate,Dan
الرعاية الصحية هي موضوع التشريع في الكونغرس.,amazon translate,Dan
القضايا البيئية هي موضوع التشريع في الكونغرس.,amazon translate,Dan
الضرائب هي موضوع التشريع في الكونغرس.,amazon translate,Dan
قضايا العسكريين والمحاربين القدامى هي مواضيع مثيرة للقلق في الكونغرس.,amazon translate,Dan
أمن الحدود هو موضوع التشريع في الكونغرس.,amazon translate,Dan
يصوت الأشخاص في المنطقة لممثلهم في الكونجرس.,amazon translate,Dan
المرشحون لحملة الكونجرس للتواصل مع الناخبين.,amazon translate,Dan
يمتلك المخططون الماليون معرفة بالاقتصاد وسوق العمل.,amazon translate,Dan
يتمتع رؤساء البلديات بخبرة في العمل مع الحكومات المحلية.,amazon translate,Dan
من المتوقع أن يمثل المسؤولون المنتخبون مصالح ناخبيهم.,amazon translate,Dan
يعود العديد من الأمريكيين الذين يعملون بجد إلى العمل.,amazon translate,Dan
يجب على القادة في جميع أنحاء البلاد ضمان حصول شركاتنا الصغيرة على الموارد التي تحتاجها للازدهار.,amazon translate,Dan
من المهم إعادة الناس إلى الوقوف على أقدامهم بعد الانكماش الاقتصادي.,amazon translate,Dan
خطوات محددة ضرورية لمساعدة الاقتصاد على التعافي.,amazon translate,Dan
يمكن أن تؤثر اللوائح الحكومية والسياسات البيروقراطية على النمو الاقتصادي.,amazon translate,Dan
يمكن أن تؤثر السياسات الضريبية على زيادة الأجور وخلق فرص العمل.,amazon translate,Dan
الأجيال القادمة هي مصدر قلق لكثير من الناس.,amazon translate,Dan
الإشراف المالي مهم لمنع الأمة من الانغماس في المزيد من الديون.,amazon translate,Dan
من المهم أن يحصل الأمريكيون على وظائف.,amazon translate,Dan
الحلم الأمريكي هو مفهوم حي لكثير من الناس.,amazon translate,Dan
خفض العجز هو هدف مالي لبعض صانعي السياسات.,amazon translate,Dan
يعد خفض الضرائب نقطة نقاش شائعة في السياسة.,amazon translate,Dan
غالبًا ما يُنظر إلى دعم الشركات الصغيرة على أنه مفيد للانتعاش الاقتصادي.,amazon translate,Dan
تعتبر مجموعات المصالح الخاصة ذات تأثير في السياسة.,amazon translate,Dan
غالبًا ما يعبر الناس عن امتنانهم للدعم الذي تلقوه.,amazon translate,Dan
يمكن أن تساعد المساهمات في تحقيق الأهداف في الحملات.,amazon translate,Dan
من المتوقع أن يعمل الممثلون نيابة عن الأشخاص الذين يمثلونهم.,amazon translate,Dan
يمكن أن تستمر الحملات السياسية في طلب الدعم حتى الانتخابات.,amazon translate,Dan
غدا هي المناظرة الرئاسية الأولى.,amazon translate,Dan
30 سبتمبر هو نهاية الشهر والموعد النهائي لنهاية الربع.,amazon translate,Dan
يحشد الديمقراطيون قاعدتهم لتمويل السباق الرئاسي.,amazon translate,Dan
النظام السياسي على المحك.,amazon translate,Dan
التصويت أمر أساسي لعمليتنا الحكومية.,amazon translate,Dan
يجب ختم بطاقة الاقتراع بتاريخ معين حتى تعتبر صالحة.,amazon translate,Dan
معرفة موقع مكان الاقتراع الخاص بك أمر ضروري للتصويت شخصيًا.,amazon translate,Dan
يمكن أن تؤدي الأزمات الاقتصادية إلى فقدان الوظائف وإغلاق الأعمال.,amazon translate,Dan
يمكن أن تؤثر قرارات القيادة على نجاح الأعمال خلال فترات الركود الاقتصادي.,amazon translate,Dan
التخطيط المالي مهم للانتعاش الاقتصادي.,amazon translate,Dan
يمكن أن يساهم الإنفاق الحكومي في الدين الوطني.,amazon translate,Dan
يمكن أن يكون التعاون بين الحزبين ضروريًا للنجاح التشريعي.,amazon translate,Dan
النمو الاقتصادي مفيد للبلد.,amazon translate,Dan
إن حماية ساحلنا الثمين وبيئتنا أمر مهم.,amazon translate,Dan
يعد تعزيز الرعاية الصحية لتوسيع الخيارات وخفض التكاليف أمرًا مفيدًا.,amazon translate,Dan
ضمان اقتصاد نابض بالحياة يفيد الجميع.,amazon translate,Dan
الحفاظ على السلام مهم للأجيال الحالية والمستقبلية।,amazon translate,Dan
غالبًا ما يتلقى الأشخاص الكثير من رسائل البريد الإلكتروني خلال موسم الانتخابات.,amazon translate,Dan
تجرى الانتخابات في نوفمبر في الولايات المتحدة.,amazon translate,Dan
يمكن للمرشحين طلب التبرعات لدعم حملاتهم.,amazon translate,Dan
التخطيط المالي مهم لإدارة التحديات الاقتصادية.,amazon translate,Dan
يحتاج الناس إلى العمل لإعالة أنفسهم.,amazon translate,Dan
يمكن أن تؤثر القيادة على الانتعاش الاقتصادي.,amazon translate,Dan
التخطيط المالي مهم للصحة الاقتصادية.,amazon translate,Dan
يمكن أن يؤدي الإنفاق الحكومي المفرط إلى الدين الوطني.,amazon translate,Dan
كل تصويت مهم ومن الأهمية بمكان أن نمارس هذا الحق.,amazon translate,Dan
يُسمح للناخبين الذين يقفون في الطابور في الساعة 8:00 مساءً بالتصويت.,amazon translate,Dan
إذا كنت في الطابور عند إغلاق صناديق الاقتراع، فسيظل مسموحًا لك بالتصويت.,amazon translate,Dan
يريد الناس عمومًا من قادتهم السياسيين معالجة القضايا التي تهمهم.,amazon translate,Dan
غالبًا ما يتوقع الناخبون من المرشحين السفر والتواصل معهم قبل الانتخابات.,amazon translate,Dan
الرعاية الصحية هي مصدر قلق مشترك بين الناس.,amazon translate,Dan
عادة ما يشعر الآباء بالقلق بشأن الوقت الذي يمكن فيه لأطفالهم العودة إلى المدرسة.,amazon translate,Dan
يؤمن الكثير من الناس بأهمية القيادة الثابتة في الأوقات المضطربة.,amazon translate,Dan
يعتبر الوصول إلى الرعاية الصحية الجيدة أمرًا مهمًا من قبل العديد من الأمريكيين.,amazon translate,Dan
حماية البيئة هي مصلحة مشتركة بين الناس.,amazon translate,Dan
غالبًا ما يقدر الناس الجمال الطبيعي لمحيطهم ويريدون الحفاظ عليه للأجيال القادمة.,amazon translate,Dan
يمكن للمرشحين للمناصب السياسية طلب التبرعات.,amazon translate,Dan
يمكن التعبير عن الدعم السياسي من خلال التبرعات.,amazon translate,Dan
قد يتماشى السياسيون مع بعض الأحزاب أو الأيديولوجيات.,amazon translate,Dan
يمكن للتعليم الرائع أن يؤثر بشكل كبير على مستقبل الطفل.,amazon translate,Dan
التعليم هو الطريق إلى الحلم الأمريكي.,amazon translate,Dan
يمكن للمنافسة أن تعزز المنظمة.,amazon translate,Dan
يريد الناس عمومًا تحسين الشرطة.,amazon translate,Dan
توفر مواقع اختبار COVID-19 اختبارات للفيروس.,amazon translate,Dan
غالبًا ما يتهم السياسيون بعضهم البعض بعرقلة الإصلاحات.,amazon translate,Dan
عمليات الإغلاق هي استجابة لأزمات الصحة العامة.,amazon translate,Dan
يمكن أن تصبح التماثيل والآثار أهدافًا للنقد العام.,amazon translate,Dan
الرابع من يوليو هو عطلة تحتفل بالاستقلال الأمريكي.,amazon translate,Dan
الترشح للكونغرس هو مسعى كبير.,amazon translate,Dan
يمكن أن يؤدي لقاء أشخاص جدد إلى بناء صداقات جديدة.,amazon translate,Dan
تتطلب الحملات الموارد والدعم لتكون ناجحة.,amazon translate,Dan
يمكن للمانحين الأفراد المساهمة في جمع التبرعات للحملة.,amazon translate,Dan
الجلسات التشريعية هي جزء من واجبات السياسي.,amazon translate,Dan
يعتبر الناس عمومًا جمع مبلغ كبير من المال للحملة بمثابة أخبار مثيرة.,amazon translate,Dan
يمكن حساب متوسط مبلغ التبرع بقسمة إجمالي الأموال التي تم جمعها على عدد المتبرعين.,amazon translate,Dan
عادة ما يتضمن الحماس الشعبي تبرعات صغيرة بالدولار من عدد كبير من الناس.,amazon translate,Dan
يعد التطوع والتبرع بالمال من الطرق الشائعة للمشاركة في حملة سياسية.,amazon translate,Dan
يسافر المرشحون لمقابلة الناخبين خلال الحملات الانتخابية.,amazon translate,Dan
وقت العائلة مهم لبعض الناس.,amazon translate,Dan
يمكن أن تسبب الكوارث الطبيعية أضرارًا مدمرة تتطلب جهود التعافي.,amazon translate,Dan
يقوم الآباء أحيانًا بأدوار تعليمية لأطفالهم.,amazon translate,Dan
يقدم المستجيبون الأوائل الخدمات الأساسية للمجتمعات.,amazon translate,Dan
يتم اقتراح فواتير الإغاثة الاقتصادية لمساعدة المتضررين من الانكماش الاقتصادي.,amazon translate,Dan
يمكن تضمين الرسومات في رسائل البريد الإلكتروني.,amazon translate,Dan
يمكن إجراء استطلاعات لمعرفة آراء الناس.,amazon translate,Dan
يمكن للمشرعين العمل عبر الأحزاب السياسية لتمرير القوانين.,amazon translate,Dan
يمكن إنشاء قوانين لحماية الأطفال في المدارس.,amazon translate,Dan
الانتخابات لها تواريخ محددة.,amazon translate,Dan
يمكن للمرشحين للمناصب طلب ملاحظات من الناخبين المحتملين.,amazon translate,Dan
غدًا هو الأول من نوفمبر.,amazon translate,Dan
يوم الانتخابات هو 48 ساعة بعد 1 نوفمبر.,amazon translate,Dan
يعتبر الأطفال الجيل القادم.,amazon translate,Dan
الأدوية التي تستلزم وصفة طبية لها تكاليف مرتبطة بها.,amazon translate,Dan
يمكن خفض الضرائب.,amazon translate,Dan
يمكن تسريح العمال بسبب الوباء.,amazon translate,Dan
الطاقة النظيفة هي شكل من أشكال تعزيز الطاقة.,amazon translate,Dan
الزراعة هي صناعة في ولاية أيوا.,amazon translate,Dan
توجد الشركات الصغيرة في ولاية أيوا.,amazon translate,Dan
نانسي بيلوسي شخصية سياسية.,amazon translate,Dan
يمكن لأعضاء الكونغرس التصويت على التشريعات.,amazon translate,Dan
إن تمويل مدارسنا أمر مهم.,amazon translate,Dan
تحسين بنيتنا التحتية أمر مفيد.,amazon translate,Dan
المشاركة في الانتخابات هي وسيلة للتأثير على النتائج السياسية.,amazon translate,Dan
يجب ألا تقف الحكومة في طريق الأمريكيين الذين يعيشون حياتهم ويطاردون أحلامهم.,amazon translate,Dan
يتم تضمين الرسومات أحيانًا في رسائل البريد الإلكتروني.,amazon translate,Dan
قد تحتوي رسائل البريد الإلكتروني على روابط لعرض المحتوى غير المعروض.,amazon translate,Dan
يمكن للأشخاص إلغاء الاشتراك أو إلغاء الاشتراك في رسائل البريد الإلكتروني المستقبلية.,amazon translate,Dan
يتم إجراء الانتخابات حيث يدلي الناس بأصواتهم.,amazon translate,Dan
يعمل السياسيون للحصول على دعم الناخبين.,amazon translate,Dan
يُنظر إلى النمو الاقتصادي بشكل عام على أنه هدف إيجابي.,amazon translate,Dan
أنظمة التعليم مهمة للأطفال.,amazon translate,Dan
يعد تأمين وظائف ذات رواتب جيدة مصدر قلق مشترك لكثير من الناس.,amazon translate,Dan
غالبًا ما تقدر المجتمعات الحماية التي يوفرها تطبيق القانون.,amazon translate,Dan
مساعدة دافعي الضرائب الأمريكيين في الحفاظ على أموالهم التي حصلوا عليها بشق الأنفس.,amazon translate,Dan
بناء النمو الاقتصادي والاستقرار.,amazon translate,Dan
منح سكان أيوا الفرصة لاتخاذ القرارات بناءً على الرعاية الصحية الخاصة بهم.,amazon translate,Dan
القتال بلا كلل لحماية المزارعين والصناعات الزراعية في ولاية أيوا.,amazon translate,Dan
تأمين المستقبل لشباب ولاية أيوا.,amazon translate,Dan
كل يوم، يسافر الناس للوصول إلى الآخرين وكسب دعمهم.,amazon translate,Dan
يعتبر تمويل المدارس سياسة الفطرة السليمة.,amazon translate,Dan
يعتبر تحسين البنية التحتية سياسة منطقية.,amazon translate,Dan
يعمل السياسيون على تلبية احتياجات ناخبيهم.,amazon translate,Dan
تحسين البنية التحتية هو قضية سياسية شائعة.,amazon translate,Dan
المزارعون هم مجموعة قد يهدف السياسيون إلى حمايتها.,amazon translate,Dan
قد تحتوي رسائل البريد الإلكتروني على روابط لعرض محتوى مثل مقاطع الفيديو.,amazon translate,Dan
يمكن للأشخاص إلغاء الاشتراك من رسائل البريد الإلكتروني المستقبلية إذا اختاروا ذلك.,amazon translate,Dan
من المتوقع أن يعمل القادة على إيجاد حلول تحمي الأطفال.,amazon translate,Dan
يُنظر إلى جهود الحزبين على أنها وسيلة لتحقيق حلول الفطرة السليمة.,amazon translate,Dan
يمكن وضع قوانين لمساءلة المدارس عن سلامة الأطفال.,amazon translate,Dan
يجب أن يتعلم الأطفال في بيئة آمنة.,amazon translate,Dan
غالبًا ما يتطوع الناس في مجتمعاتهم.,amazon translate,Dan
السياسيون يترشحون للمناصب.,amazon translate,Dan
يحتاج المزارعون إلى حماية مزارعهم.,amazon translate,Dan
قد يحتاج المحاربون القدامى إلى الدعم.,amazon translate,Dan
يحتاج الناس إلى رعاية صحية.,amazon translate,Dan
يمكن استخدام استطلاعات الرأي لتحديد الرأي العام حول القضايا.,amazon translate,Dan
يترشح الناس للكونغرس لتمثيل مجتمعاتهم.,amazon translate,Dan
الضرائب هي موضوع النقاش السياسي والسياسة.,amazon translate,Dan
يعتبر النمو الاقتصادي بشكل عام ضروريًا لازدهار الدولة.,amazon translate,Dan
يعد إصلاح الرعاية الصحية قضية مهمة للعديد من العائلات.,amazon translate,Dan
يمكن أن تؤثر تكلفة الأدوية التي تستلزم وصفة طبية على الشؤون المالية للأسرة.,amazon translate,Dan
أمن الحدود هو موضوع مثير للقلق في المناقشات السياسية.,amazon translate,Dan
الضغط من قبل أعضاء الكونغرس السابقين هو موضوع نقاش سياسي.,amazon translate,Dan
عادة ما يفضل الناس ضرائب أقل.,amazon translate,Dan
غالبًا ما تعتبر العائلات الرعاية الصحية وتكلفة الأدوية التي تستلزم وصفة طبية من القضايا المهمة.,amazon translate,Dan
تأمين الحدود هو مصدر قلق مشترك في السياسة.,amazon translate,Dan
غالبًا ما يدعي المرشحون أنهم يمثلون قيم ناخبيهم.,amazon translate,Dan
إذا لم تعد ترغب في تلقي رسائل البريد الإلكتروني من الحملة، يمكنك إلغاء الاشتراك في أي وقت.,amazon translate,Dan
الآداب والشرف من القيم التي من المتوقع أن يدعمها المسؤولون الحكوميون.,amazon translate,Dan
تاريخياً، استفادت الأنظمة العنصرية والأبوية الرجال البيض على حساب الآخرين.,amazon translate,Dan
الانتخابات هي فرصة للناخبين للتعبير عن تفضيلاتهم للاتجاه المستقبلي لمجتمعهم أو بلدهم.,amazon translate,Dan
يمكن للأشخاص إلغاء الاشتراك من قوائم البريد الإلكتروني في أي وقت.,amazon translate,Dan
يمكن أن يكون الوصول إلى الرعاية الصحية الجيدة مسألة حياة أو موت.,amazon translate,Dan
لا تأتي حلول الفطرة السليمة مع ملصق الحفلة.,amazon translate,Dan
من المعروف أن التبرعات بالدولار الصغير هي القوة الدافعة في انتصارات السباق الضيقة.,amazon translate,Dan
يريد الناس عمومًا أن يتم تمثيلهم في الكونجرس من قبل شخص يشاركهم قيمهم.,amazon translate,Dan
عادة ما يتم تقييم الرعاية الصحية بأسعار معقولة في المجتمعات.,amazon translate,Dan
يعتبر الدفاع الوطني القوي مهمًا من قبل العديد من الناس.,amazon translate,Dan
يتم إجراء الانتخابات لتحديد من سيمثل الناس في الحكومة.,amazon translate,Dan
غالبًا ما يساعد المتطوعون في الحملات السياسية.,amazon translate,Dan
تقدم الحملات السياسية أحيانًا الطعام والموسيقى في مناسباتها لتشجيع المشاركة.,amazon translate,Dan
تُستخدم لافتات الحديقة بشكل شائع لإظهار الدعم للمرشحين السياسيين.,amazon translate,Dan
يمكن أن تتغير آراء الناس ووجهات نظرهم بمرور الوقت.,amazon translate,Dan
تكمن قوة الدولة في الوطنية والمرونة والحس السليم لشعبها.,amazon translate,Dan
من المنطقي جعل التصويت عن طريق البريد متاحًا لجميع الأمريكيين خلال أزمة COVID-19 المستمرة.,amazon translate,Dan
فبراير هو أقصر شهر في السنة.,amazon translate,Dan
يتم استخدام الإعلانات التلفزيونية للحملات السياسية.,amazon translate,Dan
يتم تحديد أهداف جمع التبرعات للحملات السياسية.,amazon translate,Dan
سياسة الرعاية الصحية هي موضوع النقاش السياسي.,amazon translate,Dan
الصفقة الخضراء الجديدة هي اقتراح سياسي.,amazon translate,Dan
من المتوقع أن يحقق القادة المنتخبون نتائج لناخبيهم.,amazon translate,Dan
هناك اثنا عشر شهرًا في السنة.,amazon translate,Dan
الانتخابات هي أحداث مجدولة.,amazon translate,Dan
يمكن استخدام التلفزيون للإعلان السياسي.,amazon translate,Dan
تستخدم الضرائب عادةً لتمويل الخدمات والبرامج الحكومية.,amazon translate,Dan
تحدد الانتخابات من سيمثل الجمهور في الحكومة.,amazon translate,Dan
يجب توفير لقاحات COVID-19 دون أي تكلفة لأولئك الذين يريدونها.,amazon translate,Dan
يجب ألا يكون هناك أي تسامح مع العنصرية والتمييز بين المثليين والمثليين ومزدوجي الميل الجنسي ومغايري الهوية الجنسانية.,amazon translate,Dan
يجب أن تتمتع المرأة بحقوق متساوية بموجب القانون.,amazon translate,Dan
يعمل الناس عمومًا من أجل تحقيق أهدافهم المحددة.,amazon translate,Dan
