statement,elicitation,committer
स्वास्थ्य देखभाल में भेदभाव नहीं होना चाहिए,amazon translate,Dan
स्वास्थ्य देखभाल की पहुंच गुणवत्तापूर्ण और सस्ती दोनों होनी चाहिए,amazon translate,Dan
अभियान के खर्च तेजी से बढ़ सकते हैं।,amazon translate,Dan
किसी अभियान के बैंक खाते में धन होने से वोट निकालने में मदद मिल सकती है।,amazon translate,Dan
यह सुनिश्चित करना महत्वपूर्ण है कि किसी को भी मतदान करने और अपने परिवार को सुरक्षित और स्वस्थ रखने के बीच चयन न करना पड़े।,amazon translate,Dan
टेक्सास सहित सभी 50 राज्य पहले से ही कई लोगों को डाक से वोट करने की अनुमति देते हैं।,amazon translate,Dan
पूरे देश में सोशल डिस्टेंसिंग लागू है।,amazon translate,Dan
संकट के दौरान परिवारों पर वित्तीय और व्यक्तिगत तनाव डाला जा सकता है।,amazon translate,Dan
"लोग मज़बूत, परिश्रमी और अपने परिवारों के लिए बेहतर जीवन बनाने के लिए प्रतिबद्ध हैं।",amazon translate,Dan
वॉशिंगटन में चरमपंथ नियंत्रण से बाहर है।,amazon translate,Dan
कामकाजी परिवार और छोटे व्यवसाय इन दिनों जीवन रेखा का उपयोग कर सकते हैं।,amazon translate,Dan
लीडरशिप को हममें से बाकी लोगों की तलाश करनी चाहिए।,amazon translate,Dan
धन उगाहने के लक्ष्य को हासिल करने के लिए समर्थकों की उदारता की आवश्यकता होती है।,amazon translate,Dan
राजनीतिक अभियान में बहुत कुछ करना होता है।,amazon translate,Dan
दान से अभियान की गति बढ़ाने में मदद मिल सकती है।,amazon translate,Dan
युवा और वृद्धों के लिए अवसर उपलब्ध होने चाहिए।,amazon translate,Dan
कड़ी मेहनत का फल मिलना चाहिए।,amazon translate,Dan
"यदि आप टेक्सास के मतदाता हैं, तो आप अपना मतदान स्थान ढूंढ सकते हैं।",amazon translate,Dan
अपने हाथों को अक्सर साबुन और पानी से कम से कम 20 सेकंड तक धोएं।,amazon translate,Dan
"यदि साबुन और पानी उपलब्ध नहीं है, तो अल्कोहल-आधारित हैंड सैनिटाइज़र का उपयोग करें।",amazon translate,Dan
"अपनी खाँसी या छींक को किसी टिश्यू से ढँक लें, फिर टिश्यू को कूड़ेदान में फेंक दें।",amazon translate,Dan
बार-बार छुई जाने वाली वस्तुओं और सतहों को साफ और कीटाणुरहित करें।,amazon translate,Dan
"कॉमन सेंस सोशल डिस्टेंसिंग का अभ्यास करें, और आवश्यक होने पर ही बाहर जाएं।",amazon translate,Dan
मेडिकेयर एक ऐसा कार्यक्रम है जो वरिष्ठ नागरिकों को स्वास्थ्य सेवा प्रदान करता है।,amazon translate,Dan
दवा की कीमतों पर बातचीत करने से स्वास्थ्य देखभाल की लागत में बचत हो सकती है।,amazon translate,Dan
फार्मास्यूटिकल्स की उच्च लागत व्यक्तियों पर वित्तीय दबाव डाल सकती है।,amazon translate,Dan
इसकी उच्च लागत के कारण लोग कभी-कभी बिना दवा के चले जाते हैं।,amazon translate,Dan
"जिन लोगों को उनकी ज़रूरत है, उनके लिए जीवन रक्षक दवाएं सस्ती होनी चाहिए।",amazon translate,Dan
"स्वयंसेवक और प्रशिक्षु हर दिन कॉल कर रहे हैं, संकेत दे रहे हैं और दरवाजे पर दस्तक दे रहे हैं।",amazon translate,Dan
"प्रचार में कॉल करना, संकेत देना और दरवाजे खटखटाना जैसी गतिविधियाँ शामिल हैं।",amazon translate,Dan
राजनीतिक अभियानों में अक्सर स्वयंसेवक और प्रशिक्षु शामिल होते हैं।,amazon translate,Dan
उम्मीदवार विभिन्न समुदायों के साथ जुड़ने के लिए कार्यक्रमों में भाग लेते हैं।,amazon translate,Dan
"अभियान वर्तमान वास्तविकताओं के अनुकूल होते हैं, जैसे कि स्वास्थ्य संबंधी चिंताओं के कारण मास्क पहनना और सामाजिक दूरी।",amazon translate,Dan
पार्टी लाइनों में काम करने का उद्देश्य लोगों के जीवन को बेहतर बनाना है।,amazon translate,Dan
अभियान वित्त कानून राजनीति में धन के प्रभाव को नियंत्रित करने के लिए हैं।,amazon translate,Dan
राज्य भर के लोग उन मुद्दों पर एक साथ आ सकते हैं जो हम सभी के लिए महत्वपूर्ण हैं।,amazon translate,Dan
सस्ती स्वास्थ्य देखभाल महत्वपूर्ण है।,amazon translate,Dan
सार्वजनिक भूमि और बाहरी स्थानों की सुरक्षा करना मूल्यवान है।,amazon translate,Dan
राजनीति में धन के प्रभाव को नियंत्रित करने के लिए अभियान वित्त कानून आवश्यक हैं।,amazon translate,Dan
वाशिंगटन एक ऐसी जगह है जहाँ बात करना अक्सर कार्रवाई का विकल्प होता है।,amazon translate,Dan
हर किसी को चुनाव में अपना वोट डालने का अधिकार है।,amazon translate,Dan
बच्चों को अक्सर राजनीति की तुलना में बाहरी गतिविधियाँ अधिक दिलचस्प लगती हैं।,amazon translate,Dan
बच्चों के लिए पॉकेट मनी कमाने के लिए अख़बार डिलीवरी एक आम काम है।,amazon translate,Dan
राज्यपाल आधिकारिक आवासों में रहते हैं।,amazon translate,Dan
विभिन्न राजनीतिक दलों के लोग समान लक्ष्यों को प्राप्त करने के लिए मिलकर काम कर सकते हैं।,amazon translate,Dan
पब्लिक स्कूलों में निवेश करना अर्थव्यवस्था को मजबूत करने का एक तरीका है।,amazon translate,Dan
नौकरी के प्रशिक्षण से अगली पीढ़ी के लिए करियर के अवसर पैदा हो सकते हैं।,amazon translate,Dan
अभियानों को सफल होने के लिए अक्सर दान की आवश्यकता होती है।,amazon translate,Dan
महामारी के दौरान माता-पिता घर से काम करने और रिमोट लर्निंग की बाजीगरी कर रहे हैं।,amazon translate,Dan
परिवारों को सुरक्षित रखने के लिए बन्दूक का सुरक्षित भंडारण महत्वपूर्ण है।,amazon translate,Dan
अनलॉक्ड और अनसुपरवाइज्ड हैंडगन खतरनाक हैं।,amazon translate,Dan
बन्दूक तक आसान पहुंच से अनजाने में गोलीबारी हो सकती है जिसमें बच्चे या किशोर शामिल हो सकते हैं।,amazon translate,Dan
अमेरिकन ड्रीम एक अवधारणा है जिसमें सफलता और समृद्धि के अवसर शामिल हैं।,amazon translate,Dan
सुप्रीम कोर्ट के जस्टिस देश के सर्वोच्च न्यायालय में नियुक्त किए जाते हैं।,amazon translate,Dan
चुनाव सरकार की विधायी और कार्यकारी शाखाओं के नियंत्रण को निर्धारित कर सकते हैं।,amazon translate,Dan
सरकारी नीतियों द्वारा करों को बढ़ाया या घटाया जा सकता है।,amazon translate,Dan
आम तौर पर लोगों में चुनावों में वोट देने की क्षमता होती है।,amazon translate,Dan
लोकतंत्र में चुनावों को महत्वपूर्ण घटना माना जाता है।,amazon translate,Dan
कांग्रेस के सदस्य कानून पर वोट देते हैं।,amazon translate,Dan
स्वास्थ्य देखभाल कांग्रेस में कानून का विषय है।,amazon translate,Dan
कांग्रेस में पर्यावरण के मुद्दे कानून का विषय हैं।,amazon translate,Dan
कर कांग्रेस में कानून का विषय हैं।,amazon translate,Dan
सेना और दिग्गजों के मुद्दे कांग्रेस में चिंता का विषय हैं।,amazon translate,Dan
सीमा सुरक्षा कांग्रेस में कानून का विषय है।,amazon translate,Dan
एक जिले के लोग अपने कांग्रेस प्रतिनिधि को वोट देते हैं।,amazon translate,Dan
मतदाताओं से जुड़ने के लिए कांग्रेस के उम्मीदवार अभियान चलाते हैं।,amazon translate,Dan
वित्तीय योजनाकारों को अर्थव्यवस्था और नौकरी के बाजार के बारे में जानकारी होती है।,amazon translate,Dan
महापौरों के पास स्थानीय सरकारों के साथ काम करने का अनुभव है।,amazon translate,Dan
निर्वाचित अधिकारियों से अपेक्षा की जाती है कि वे अपने घटकों के हितों का प्रतिनिधित्व करें।,amazon translate,Dan
कई मेहनती अमेरिकी काम पर वापस आ रहे हैं।,amazon translate,Dan
देश भर के नेताओं को यह सुनिश्चित करना चाहिए कि हमारे छोटे व्यवसायों के पास वे संसाधन हों जिनकी उन्हें समृद्ध होने के लिए आवश्यकता है।,amazon translate,Dan
आर्थिक मंदी के बाद लोगों को अपने पैरों पर वापस लाना महत्वपूर्ण है।,amazon translate,Dan
अर्थव्यवस्था को ठीक करने में मदद करने के लिए विशिष्ट कदम आवश्यक हैं।,amazon translate,Dan
सरकारी नियम और नौकरशाही नीतियां आर्थिक विकास को प्रभावित कर सकती हैं।,amazon translate,Dan
कर नीतियां वेतन वृद्धि और रोजगार सृजन को प्रभावित कर सकती हैं।,amazon translate,Dan
आने वाली पीढ़ियां कई लोगों के लिए चिंता का विषय हैं।,amazon translate,Dan
किसी राष्ट्र को अधिक कर्ज में डूबने से रोकने के लिए राजकोषीय प्रबंधन महत्वपूर्ण है।,amazon translate,Dan
अमेरिकियों के लिए नौकरी होना जरूरी है।,amazon translate,Dan
अमेरिकन ड्रीम एक अवधारणा है जो कई लोगों के लिए जीवित है।,amazon translate,Dan
घाटे को कम करना कुछ नीति निर्माताओं के लिए एक वित्तीय लक्ष्य है।,amazon translate,Dan
टैक्स कम करना राजनीति में एक आम चर्चा बिंदु है।,amazon translate,Dan
छोटे व्यवसायों को समर्थन देना अक्सर आर्थिक सुधार के लिए फायदेमंद माना जाता है।,amazon translate,Dan
राजनीति में विशेष रुचि रखने वाले समूहों का प्रभाव माना जाता है।,amazon translate,Dan
लोग अक्सर प्राप्त समर्थन के लिए आभार व्यक्त करते हैं।,amazon translate,Dan
योगदान अभियानों में लक्ष्यों को प्राप्त करने में मदद कर सकते हैं।,amazon translate,Dan
प्रतिनिधियों से अपेक्षा की जाती है कि वे उन लोगों की ओर से काम करें जिनका वे प्रतिनिधित्व करते हैं।,amazon translate,Dan
राजनीतिक अभियान चुनाव तक समर्थन प्राप्त करना जारी रख सकते हैं।,amazon translate,Dan
कल राष्ट्रपति की पहली बहस है।,amazon translate,Dan
30 सितंबर महीने का अंत और तिमाही की समय सीमा समाप्त होती है।,amazon translate,Dan
राष्ट्रपति पद की दौड़ को निधि देने के लिए डेमोक्रेट अपने आधार को इकट्ठा कर रहे हैं।,amazon translate,Dan
राजनीतिक व्यवस्था दांव पर है।,amazon translate,Dan
वोटिंग हमारी सरकारी प्रक्रिया के लिए मूलभूत है,amazon translate,Dan
एक मतपत्र को वैध माने जाने के लिए एक निश्चित तारीख तक पोस्टमार्क किया जाना चाहिए,amazon translate,Dan
व्यक्तिगत रूप से मतदान करने के लिए अपने मतदान स्थल का स्थान जानना आवश्यक है,amazon translate,Dan
आर्थिक संकटों से नौकरी छूट सकती है और व्यापार बंद हो सकता है।,amazon translate,Dan
नेतृत्व के फैसले आर्थिक मंदी के दौरान व्यवसायों की सफलता को प्रभावित कर सकते हैं।,amazon translate,Dan
आर्थिक सुधार के लिए वित्तीय योजना महत्वपूर्ण है।,amazon translate,Dan
सरकारी खर्च राष्ट्रीय ऋण में योगदान कर सकता है।,amazon translate,Dan
विधायी सफलता के लिए द्विदलीय सहयोग आवश्यक हो सकता है।,amazon translate,Dan
आर्थिक विकास किसी देश के लिए फायदेमंद होता है।,amazon translate,Dan
हमारी बहुमूल्य तटरेखा और पर्यावरण की रक्षा करना महत्वपूर्ण है,amazon translate,Dan
विकल्पों का विस्तार करने और लागत कम करने के लिए स्वास्थ्य सेवा को बढ़ाना फायदेमंद है,amazon translate,Dan
एक जीवंत अर्थव्यवस्था सुनिश्चित करने से सभी को लाभ होता है,amazon translate,Dan
वर्तमान और आने वाली पीढ़ियों के लिए शांति बनाए रखना महत्वपूर्ण है,amazon translate,Dan
चुनावी मौसम के दौरान लोगों को अक्सर बहुत सारे ईमेल मिलते हैं।,amazon translate,Dan
संयुक्त राज्य अमेरिका में नवंबर में चुनाव होते हैं।,amazon translate,Dan
उम्मीदवार अपने अभियानों का समर्थन करने के लिए दान मांग सकते हैं।,amazon translate,Dan
आर्थिक चुनौतियों के प्रबंधन के लिए वित्तीय योजना महत्वपूर्ण है।,amazon translate,Dan
लोगों को खुद का समर्थन करने के लिए काम करने की जरूरत है।,amazon translate,Dan
नेतृत्व आर्थिक सुधार को प्रभावित कर सकता है।,amazon translate,Dan
आर्थिक स्वास्थ्य के लिए वित्तीय योजना महत्वपूर्ण है।,amazon translate,Dan
अत्यधिक सरकारी खर्च से राष्ट्रीय ऋण हो सकता है।,amazon translate,Dan
हर वोट मायने रखता है और यह महत्वपूर्ण है कि हम इस अधिकार का प्रयोग करें।,amazon translate,Dan
रात 8:00 बजे लाइन में लगने वाले मतदाताओं को वोट देने की अनुमति है।,amazon translate,Dan
"यदि आप पोल बंद होने के समय के हिसाब से लाइन में हैं, तो भी आपको वोट करने की अनुमति है।",amazon translate,Dan
लोग आम तौर पर चाहते हैं कि उनके राजनीतिक नेता उन मुद्दों को हल करें जो उनके लिए महत्वपूर्ण हैं।,amazon translate,Dan
मतदाता अक्सर उम्मीदवारों से अपेक्षा करते हैं कि वे चुनाव से पहले यात्रा करें और उनसे जुड़ें।,amazon translate,Dan
हेल्थकेयर लोगों के बीच एक आम चिंता का विषय है।,amazon translate,Dan
माता-पिता आमतौर पर इस बात को लेकर चिंतित रहते हैं कि उनके बच्चे कब वापस स्कूल जा सकते हैं।,amazon translate,Dan
बहुत से लोग अनिश्चित समय के दौरान स्थिर नेतृत्व के महत्व में विश्वास करते हैं।,amazon translate,Dan
कई अमेरिकियों द्वारा गुणवत्तापूर्ण स्वास्थ्य सेवा तक पहुंच को महत्वपूर्ण माना जाता है।,amazon translate,Dan
पर्यावरण की रक्षा करना लोगों का साझा हित है।,amazon translate,Dan
लोग अक्सर अपने आसपास की प्राकृतिक सुंदरता की सराहना करते हैं और इसे आने वाली पीढ़ियों के लिए संरक्षित करना चाहते हैं।,amazon translate,Dan
राजनीतिक कार्यालय के उम्मीदवार दान मांग सकते हैं।,amazon translate,Dan
दान के माध्यम से राजनीतिक समर्थन व्यक्त किया जा सकता है।,amazon translate,Dan
राजनेता कुछ दलों या विचारधाराओं के साथ गठबंधन कर सकते हैं।,amazon translate,Dan
एक महान शिक्षा बच्चे के भविष्य को महत्वपूर्ण रूप से प्रभावित कर सकती है।,amazon translate,Dan
शिक्षा अमेरिकन ड्रीम का मार्ग है।,amazon translate,Dan
प्रतिस्पर्धा से संगठन मजबूत हो सकता है।,amazon translate,Dan
आम तौर पर लोग पुलिसिंग में सुधार करना चाहते हैं।,amazon translate,Dan
COVID-19 परीक्षण साइटें वायरस के लिए परीक्षण प्रदान करती हैं।,amazon translate,Dan
राजनेता अक्सर एक-दूसरे पर सुधारों को रोकने का आरोप लगाते हैं।,amazon translate,Dan
लॉकडाउन सार्वजनिक स्वास्थ्य संकटों की प्रतिक्रिया है।,amazon translate,Dan
मूर्तियां और स्मारक सार्वजनिक आलोचना का निशाना बन सकते हैं।,amazon translate,Dan
जुलाई की चौथी छुट्टी है जो अमेरिकी स्वतंत्रता का जश्न मनाती है।,amazon translate,Dan
