statement,elicitation,committer
युद्ध के हथियार हमारी सड़कों पर और हमारे स्कूलों में नहीं हैं।,amazon translate,Dan
घोस्ट गन विशेष रूप से खतरनाक होते हैं क्योंकि स्कैनर द्वारा उनका पता नहीं लगाया जा सकता है।,amazon translate,Dan
पत्रिका की क्षमता को सीमित करने से जान बचाई जा सकती है।,amazon translate,Dan
कोरोनावायरस के लक्षण संपर्क में आने के 2 से 14 दिनों के बीच दिखाई दे सकते हैं।,amazon translate,Dan
"coronavirus के सामान्य लक्षणों में बुखार, खांसी और सांस लेने में तकलीफ शामिल हैं।",amazon translate,Dan
बार-बार हाथ धोने से बीमारियों को फैलने से रोकने में मदद मिल सकती है।,amazon translate,Dan
कीटाणुओं को फैलने से रोकने के लिए अपनी कोहनी में खांसना एक अच्छा अभ्यास है।,amazon translate,Dan
अपने चेहरे को छूने से बचने से संक्रमण के जोखिम को कम करने में मदद मिल सकती है।,amazon translate,Dan
गैर-संपर्क अभिवादन के साथ हैंडशेक को बदलने से बीमारियों के प्रसार को कम किया जा सकता है।,amazon translate,Dan
अब घबराने का समय नहीं है। यह सावधानी और सामान्य ज्ञान का समय है।,amazon translate,Dan
हमें सीधे मानव संपर्क से बचने के लिए सतर्क रहने की आवश्यकता है क्योंकि लक्षणों वाले लोगों को पता नहीं हो सकता है कि वे संक्रमित हैं।,amazon translate,Dan
हमें यह सुनिश्चित करने की ज़रूरत है कि हम अपने हाथ धोएं और अपने चेहरे के संपर्क से बचें।,amazon translate,Dan
"लक्षणों में बुखार, खांसी और सांस लेने में तकलीफ शामिल हैं।",amazon translate,Dan
"अगर आपको लगता है कि आपके पास वायरस है, तो कृपया सेल्फ-क्वारंटाइन करें और सीडीसी की सिफारिशों का पालन करें।",amazon translate,Dan
कोरोनावायरस के प्रसार को धीमा करने के लिए लोगों को घर पर रहने की आवश्यकता हो रही है।,amazon translate,Dan
महामारी के कारण हमारे कर्मचारियों की छंटनी की जा रही है और हमारे छोटे व्यवसाय बंद हो रहे हैं।,amazon translate,Dan
चिकित्सा पेशेवर महामारी का मुकाबला करने के लिए अग्रिम पंक्ति में हैं।,amazon translate,Dan
लोग आम तौर पर चुनाव अभियानों के दौरान घर-घर जाकर और फोन कॉल के माध्यम से मतदाताओं से संवाद करते हैं।,amazon translate,Dan
राजनीतिक अभियान अक्सर अपनी गतिविधियों को निधि देने के लिए दान का अनुरोध करते हैं।,amazon translate,Dan
राजनीतिक अभियान फोन कॉल करने के लिए दान का उपयोग करते हैं और मतदाता समर्थन हासिल करने के लिए दरवाजे खटखटाते हैं।,amazon translate,Dan
राजनीतिक अभियान अक्सर दावा करते हैं कि उनके उम्मीदवार कुछ मूल्यों का प्रतिनिधित्व करते हैं।,amazon translate,Dan
राजनीतिक अभियान विरोधियों पर स्थानीय मतदाताओं के संपर्क से बाहर होने का आरोप लगा सकते हैं।,amazon translate,Dan
कोहनी में खांसने से कीटाणुओं को फैलने से रोकने में मदद मिल सकती है।,amazon translate,Dan
संक्रमण के खतरे को कम करने के लिए अपने चेहरे को छूने से बचें।,amazon translate,Dan
बुजुर्ग लोगों में कोरोनावायरस से जटिलताएं विकसित होने का खतरा अधिक होता है।,amazon translate,Dan
"अगर आपको लगता है कि आपके पास वायरस है, तो सेल्फ-क्वारंटाइन दूसरों को बचाने में मदद कर सकता है।",amazon translate,Dan
लोगों को अपने वोट के अधिकार और अपने स्वास्थ्य के बीच चयन नहीं करना चाहिए।,amazon translate,Dan
एक महामारी कई लोगों को काम से निकाल सकती है।,amazon translate,Dan
कई अमेरिकियों के लिए किराया एक नियमित खर्च है।,amazon translate,Dan
महामारी के दौरान काम पर लौटना खतरनाक है।,amazon translate,Dan
बेदखली एक जोखिम है जब लोग अपना किराया नहीं दे सकते।,amazon translate,Dan
अग्निशामकों को फंड करना सामान्य ज्ञान माना जाता है।,amazon translate,Dan
चुनाव परिणामों को प्रभावित करने के लिए लोगों को वोट देना होगा।,amazon translate,Dan
कई मतदाताओं के लिए स्वास्थ्य देखभाल चिंता का विषय है।,amazon translate,Dan
कुछ राजनीतिक उम्मीदवारों के लिए शैक्षिक निवेश प्राथमिकता है।,amazon translate,Dan
राजनीतिक अभियानों में नागरिक अधिकार एक महत्वपूर्ण मुद्दा है।,amazon translate,Dan
स्वास्थ्य देखभाल नीति चर्चाओं में पहले से मौजूद स्थितियां एक कारक हैं।,amazon translate,Dan
राजनीतिक अभियान अक्सर अपने प्रयासों का समर्थन करने के लिए दान का अनुरोध करते हैं।,amazon translate,Dan
चुनावों से राज्य में राजनीतिक दलों के प्रभुत्व में परिवर्तन हो सकता है।,amazon translate,Dan
COVID-19 महामारी के दौरान लोग वित्तीय और व्यक्तिगत तनाव का सामना कर रहे हैं।,amazon translate,Dan
COVID-19 एक चुनौती है जिससे लड़ने के लिए राष्ट्र मिलकर काम कर रहे हैं।,amazon translate,Dan
दान से राजनीतिक अभियानों को फंड करने में मदद मिल सकती है।,amazon translate,Dan
अभियान मतदाताओं तक पहुंचने और स्वयंसेवी नेटवर्क बनाने के लिए दान का उपयोग करते हैं।,amazon translate,Dan
"प्रिस्क्रिप्शन दवाओं की लागत कम करना, जलवायु परिवर्तन को संबोधित करना और बंदूक लॉबी से लड़ना कुछ लोगों द्वारा सामान्य ज्ञान समाधान माना जाता है।",amazon translate,Dan
COVID-19 महामारी के दौरान अनगिनत परिवारों पर भारी वित्तीय और व्यक्तिगत दबाव डाला गया है।,amazon translate,Dan
धन उगाहने के लक्ष्यों को पूरा करने से आने वाले महीनों में निष्पादित होने वाली योजनाओं को सूचित किया जा सकता है।,amazon translate,Dan
धन उगाहने के लक्ष्यों की कमी आने से भविष्य की घटनाओं को प्रभावित करने वाला एक डोमिनोज़ प्रभाव पैदा हो सकता है।,amazon translate,Dan
चुनाव विश्लेषक राजनीतिक नस्लों के परिणामों के बारे में भविष्यवाणियां करते हैं।,amazon translate,Dan
अभियान अपने समुदाय के सामने आने वाले वास्तविक मुद्दों को हल करने पर ध्यान केंद्रित करते हैं।,amazon translate,Dan
एक टूटी हुई स्वास्थ्य सेवा प्रणाली और आर्थिक संकट मौजूदा मुद्दे हैं जिनका समुदायों को सामना करना पड़ता है।,amazon translate,Dan
"नुस्खे वाली दवाओं की लागत कम करना, जलवायु परिवर्तन को दूर करना और सामान्य ज्ञान के समाधान लाना कुछ राजनीतिक अभियानों के लक्ष्य हैं।",amazon translate,Dan
लोगों को उम्मीद है कि उनके प्रियजन सुरक्षित और स्वस्थ रहें।,amazon translate,Dan
COVID-19 के कारण अनगिनत परिवारों पर भारी वित्तीय और व्यक्तिगत तनाव पैदा हो गया है।,amazon translate,Dan
COVID-19 के खिलाफ लड़ाई में फ्रंटलाइन रिस्पॉन्डर्स आवश्यक हैं।,amazon translate,Dan
जमीनी स्तर पर समर्थन राजनीतिक नस्लों को प्रभावित कर सकता है।,amazon translate,Dan
"मतदाताओं के लिए स्वास्थ्य सेवा की पहुंच, आर्थिक संकट और सामान्य ज्ञान के समाधान महत्वपूर्ण मुद्दे हैं।",amazon translate,Dan
राजनीतिक दौड़ अप्रत्याशित हो सकती है और एक पार्टी का पक्ष लेने से लेकर टॉस-अप होने तक बदल सकती है।,amazon translate,Dan
परिवारों को नेतृत्व की जरूरत है।,amazon translate,Dan
मतदाता अपने राजनीतिक प्रतिनिधियों से जवाबदेही की मांग करते हैं।,amazon translate,Dan
कानून हमें सुरक्षित रखने के लिए हैं।,amazon translate,Dan
स्वास्थ्य देखभाल और अर्थव्यवस्था परिवारों के लिए महत्वपूर्ण मुद्दे हैं।,amazon translate,Dan
COVID-19 के कारण अनगिनत परिवारों पर वित्तीय और व्यक्तिगत दबाव डाला गया है।,amazon translate,Dan
प्रिस्क्रिप्शन दवाओं की लागत कम करना कुछ राजनेताओं के लिए एक लक्ष्य है।,amazon translate,Dan
जलवायु परिवर्तन को संबोधित करना कुछ राजनेताओं के लिए चिंता का विषय है।,amazon translate,Dan
चुनाव पारदर्शी और निष्पक्ष होने चाहिए।,amazon translate,Dan
"हर कोई जो कानूनी रूप से वोट करने का हकदार है, उसे सुरक्षित रूप से ऐसा करने में सक्षम होना चाहिए।",amazon translate,Dan
चुनाव से पहले आने वाले हफ्तों में सामाजिक दूरी जारी रह सकती है।,amazon translate,Dan
चुनाव में मतदान पहले की तुलना में अलग दिख सकता है।,amazon translate,Dan
सोशल डिस्टेंसिंग का अभ्यास करने से बीमारी को फैलने से रोकने में मदद मिल सकती है।,amazon translate,Dan
एक ही छत के नीचे रहने वाले बहु-पीढ़ी के परिवारों को स्वास्थ्य संकट के दौरान परिवार के बुजुर्गों के स्वास्थ्य के प्रति सचेत रहना चाहिए।,amazon translate,Dan
सीडीसी की सिफारिशों का पालन करने से स्वास्थ्य संकट के दौरान लोगों को सुरक्षित रखने में मदद मिल सकती है।,amazon translate,Dan
लोगों को उम्मीद है कि उनके प्रियजन मुश्किल समय में सुरक्षित और स्वस्थ रहें।,amazon translate,Dan
COVID-19 जैसे संकट के दौरान परिवारों पर वित्तीय और व्यक्तिगत तनाव डाला जा सकता है।,amazon translate,Dan
निश्चित अवधि के दौरान दान धीमा हो सकता है।,amazon translate,Dan
धन उगाहने के लक्ष्य संगठनों को उन संसाधनों को प्राप्त करने में मदद करते हैं जिनकी उन्हें आवश्यकता होती है।,amazon translate,Dan
डिजिटल टूल संगठनों को अपने समुदाय की बेहतर सेवा करने में मदद कर सकते हैं।,amazon translate,Dan
स्वयंसेवक अपनी गतिविधियों का समर्थन करने के लिए डिजिटल टूल का उपयोग कर सकते हैं।,amazon translate,Dan
प्रिस्क्रिप्शन दवाओं की लागत कम करना कुछ लोगों के लिए चिंता का विषय है।,amazon translate,Dan
जलवायु परिवर्तन को संबोधित करना कुछ व्यक्तियों की प्राथमिकता है।,amazon translate,Dan
हम एक साथ coronavirus के प्रकोप से उबरने जा रहे हैं।,amazon translate,Dan
"सामान्य ज्ञान, सम्मान और शालीनता वास्तविक नेतृत्व की बुनियाद हैं।",amazon translate,Dan
"वास्तविक नेतृत्व के लिए करुणा, सहानुभूति और ईमानदारी की आवश्यकता होती है।",amazon translate,Dan
कामकाजी परिवारों और छोटे व्यवसायों को अक्सर सहायता की आवश्यकता होती है।,amazon translate,Dan
नेतृत्व को लोगों के हितों की तलाश करनी चाहिए।,amazon translate,Dan
अभियानों को संचालित करने और अपने लक्ष्यों तक पहुंचने के लिए धन की आवश्यकता होती है।,amazon translate,Dan
"दान किसी भी समय किया जा सकता है, न कि केवल विशिष्ट धन उगाहने की अवधि के दौरान।",amazon translate,Dan
आम तौर पर कड़ी मेहनत का फल मिलने की उम्मीद है।,amazon translate,Dan
वॉशिंगटन में लोग राजनीतिक अभियानों में गति देखते हैं।,amazon translate,Dan
बैटलग्राउंड जिले पार्टी नियंत्रण को बदलने की क्षमता वाली प्रमुख दौड़ हैं।,amazon translate,Dan
सभी के लिए काम करने के लिए अर्थव्यवस्थाओं का पुनर्निर्माण किया जा सकता है।,amazon translate,Dan
अभियान अक्सर धन उगाहने के लक्ष्यों को पूरा करने के लिए दान मांगते हैं।,amazon translate,Dan
राजनीतिक अभियान आवर्ती मासिक योगदान स्वीकार कर सकते हैं।,amazon translate,Dan
टेक्सास में शुरुआती मतदान का आज पहला दिन है।,amazon translate,Dan
हर वोट चुनाव के नतीजे के लिए गिना जाता है।,amazon translate,Dan
सुलभ स्वास्थ्य सेवा एक समुदाय के लिए महत्वपूर्ण है।,amazon translate,Dan
एक मजबूत अर्थव्यवस्था देश के नागरिकों के लिए फायदेमंद होती है।,amazon translate,Dan
मतदान लोकतांत्रिक प्रक्रिया में भाग लेने का एक तरीका है।,amazon translate,Dan
"एक ईमानदार दिन का काम मेज पर खाना रखने, आपके सिर पर छत रखने और आवश्यक दवाओं की लागत को कवर करने के लिए पर्याप्त होना चाहिए।",amazon translate,Dan
चुनाव एक ऐसा समय होता है जब उम्मीदवार अपने अभियानों के लिए चंदा मांगते हैं।,amazon translate,Dan
"लोग अक्सर दोस्तों और सहकर्मियों से उन राजनीतिक उम्मीदवारों का समर्थन करने के लिए कहते हैं, जिन पर वे विश्वास करते हैं।",amazon translate,Dan
राजनीतिक पद के लिए उम्मीदवारों का अक्सर सार्वजनिक सेवा या सामुदायिक भागीदारी का इतिहास होता है।,amazon translate,Dan
संयुक्त राज्य अमेरिका में राजनीतिक अभियानों को व्यक्तियों के दान से वित्त पोषित किया जा सकता है।,amazon translate,Dan
चुनाव प्रतिस्पर्धी हो सकते हैं और परिणाम जनसंख्या और मतदाता भावना में बदलाव से प्रभावित हो सकते हैं।,amazon translate,Dan
आम तौर पर लोग अपने धन उगाहने वाले लक्ष्यों को हासिल करना चाहते हैं।,amazon translate,Dan
विशिष्ट लक्ष्यों के लिए अक्सर समय सीमा निर्धारित की जाती है।,amazon translate,Dan
दान का मिलान करने से लोगों को दान करने के लिए प्रोत्साहित किया जा सकता है।,amazon translate,Dan
अनसब्सक्राइब करना उन लोगों के लिए एक विकल्प है जो ईमेल प्राप्त नहीं करना चाहते हैं।,amazon translate,Dan
"अगर हम चाहते हैं कि हमारे बच्चे सीख सकें, तो हमें उन्हें ऐसा करने के लिए सबसे अच्छा माहौल देना होगा",amazon translate,Dan
एक साथ काम करने से लोगों के लिए बहुत कुछ किया जा सकता है,amazon translate,Dan
महत्वपूर्ण मुद्दों पर साझा आधार खोजना महत्वपूर्ण है,amazon translate,Dan
लोगों द्वारा संचालित अभियान जमीनी स्तर के समर्थकों पर निर्भर करते हैं।,amazon translate,Dan
वॉशिंगटन की राजनीति में पक्षपातपूर्ण मनमुटाव आम हो गया है।,amazon translate,Dan
लोगों के लिए सस्ती स्वास्थ्य देखभाल महत्वपूर्ण है।,amazon translate,Dan
दवाएं सस्ती होनी चाहिए।,amazon translate,Dan
छोटे व्यवसायों और अर्थव्यवस्था की रक्षा करना कई लोगों की प्राथमिकता है।,amazon translate,Dan
"सीडीसी दिशानिर्देशों का पालन करना, जैसे हाथ धोना और सामाजिक दूरी, सार्वजनिक स्वास्थ्य के लिए महत्वपूर्ण है।",amazon translate,Dan
"ऐसे नेताओं का होना ज़रूरी है जो परिवारों के स्वास्थ्य, सुरक्षा और भलाई को प्राथमिकता देते हैं।",amazon translate,Dan
सस्ती स्वास्थ्य देखभाल तक पहुंच लोगों के लिए चिंता का विषय है।,amazon translate,Dan
