statement,elicitation,committer
لا تنتمي أسلحة الحرب إلى شوارعنا ومدارسنا.,amazon translate,Dan
تعتبر بنادق الأشباح خطيرة بشكل خاص لأنها يمكن أن لا تكتشفها الماسحات الضوئية.,amazon translate,Dan
يمكن أن يؤدي الحد من سعة المجلة إلى إنقاذ الأرواح.,amazon translate,Dan
قد تظهر أعراض فيروس كورونا بين يومين و 14 يومًا بعد التعرض.,amazon translate,Dan
تشمل الأعراض الشائعة لفيروس كورونا الحمى والسعال وضيق التنفس.,amazon translate,Dan
يمكن أن يساعد غسل اليدين بشكل متكرر في منع انتشار الأمراض.,amazon translate,Dan
يُعد السعال في المرفق ممارسة جيدة لمنع انتشار الجراثيم.,amazon translate,Dan
يمكن أن يساعد تجنب لمس وجهك في تقليل خطر العدوى.,amazon translate,Dan
يمكن أن يؤدي استبدال المصافحة بتحيات عدم الاتصال إلى تقليل انتشار الأمراض.,amazon translate,Dan
الآن ليس وقت الذعر. لقد حان الوقت للحذر والحس السليم.,amazon translate,Dan
يجب أن نكون يقظين في تجنب الاتصال البشري المباشر لأن أولئك الذين يعانون من الأعراض قد لا يعرفون أنهم مصابون.,amazon translate,Dan
نحتاج إلى التأكد من غسل أيدينا وتجنب ملامسة وجهنا.,amazon translate,Dan
تشمل الأعراض الحمى والسعال وضيق التنفس.,amazon translate,Dan
إذا كنت تعتقد أنك مصاب بالفيروس، فيرجى الحجر الصحي الذاتي واتباع توصيات CDC.,amazon translate,Dan
يُطلب من الناس البقاء في المنزل لإبطاء انتشار فيروس كورونا.,amazon translate,Dan
يتم تسريح عمالنا وإغلاق شركاتنا الصغيرة بسبب الوباء.,amazon translate,Dan
يعمل المهنيون الطبيون في الخطوط الأمامية لمكافحة الوباء.,amazon translate,Dan
يتواصل الناس عمومًا مع الناخبين من خلال الزيارات من الباب إلى الباب والمكالمات الهاتفية أثناء الحملات الانتخابية.,amazon translate,Dan
غالبًا ما تطلب الحملات السياسية تبرعات لتمويل أنشطتها.,amazon translate,Dan
تستخدم الحملات السياسية التبرعات لإجراء مكالمات هاتفية وطرق الأبواب لكسب دعم الناخبين.,amazon translate,Dan
غالبًا ما تدعي الحملات السياسية أن مرشحها يمثل قيمًا معينة.,amazon translate,Dan
قد تتهم الحملات السياسية المعارضين بعدم التواصل مع الناخبين المحليين.,amazon translate,Dan
يمكن أن يساعد السعال في الكوع على منع انتشار الجراثيم.,amazon translate,Dan
تجنب لمس وجهك لتقليل خطر العدوى.,amazon translate,Dan
يتعرض المسنون لخطر أكبر للإصابة بمضاعفات فيروس كورونا.,amazon translate,Dan
يمكن أن يساعد الحجر الصحي الذاتي في حماية الآخرين إذا شعرت أنك مصاب بالفيروس.,amazon translate,Dan
لا ينبغي أن يختار الناس بين حقهم في التصويت وصحتهم.,amazon translate,Dan
يمكن للوباء أن يؤدي إلى توقف الكثير من الناس عن العمل.,amazon translate,Dan
الإيجار هو نفقة منتظمة للعديد من الأمريكيين.,amazon translate,Dan
من الخطر العودة إلى العمل أثناء الوباء.,amazon translate,Dan
الإخلاء هو خطر عندما لا يستطيع الناس دفع الإيجار.,amazon translate,Dan
يعتبر تمويل رجال الإطفاء من الفطرة السليمة.,amazon translate,Dan
يحتاج الناس إلى التصويت للتأثير على نتائج الانتخابات.,amazon translate,Dan
الرعاية الصحية هي موضوع قلق العديد من الناخبين.,amazon translate,Dan
الاستثمار التعليمي هو أولوية لبعض المرشحين السياسيين.,amazon translate,Dan
الحقوق المدنية هي قضية مهمة في الحملات السياسية.,amazon translate,Dan
تعتبر الحالات الموجودة مسبقًا عاملاً في مناقشات سياسة الرعاية الصحية.,amazon translate,Dan
غالبًا ما تطلب الحملات السياسية تبرعات لدعم جهودها.,amazon translate,Dan
يمكن أن تؤدي الانتخابات إلى تغييرات في هيمنة الأحزاب السياسية في الدولة.,amazon translate,Dan
يعاني الناس من ضغوط مالية وشخصية خلال جائحة COVID-19.,amazon translate,Dan
COVID-19 هو التحدي الذي تعمل الدول معًا لمكافحته.,amazon translate,Dan
يمكن أن تساعد التبرعات في تمويل الحملات السياسية.,amazon translate,Dan
تستخدم الحملات التبرعات للوصول إلى الناخبين وبناء شبكات المتطوعين.,amazon translate,Dan
يعتبر تخفيض تكلفة الأدوية التي تستلزم وصفة طبية، ومعالجة تغير المناخ، ومحاربة لوبي السلاح حلولًا منطقية من قبل البعض.,amazon translate,Dan
تم وضع ضغوط مالية وشخصية هائلة على عدد لا يحصى من العائلات خلال جائحة COVID-19.,amazon translate,Dan
يمكن أن يؤدي تحقيق أهداف جمع التبرعات إلى توجيه الخطط التي يمكن تنفيذها في الأشهر المقبلة.,amazon translate,Dan
يمكن أن يؤدي عدم تحقيق أهداف جمع التبرعات إلى إحداث تأثير الدومينو الذي يؤثر على الأحداث المستقبلية.,amazon translate,Dan
يقوم محللو الانتخابات بعمل تنبؤات حول نتائج السباقات السياسية.,amazon translate,Dan
تركز الحملات على معالجة القضايا الحقيقية التي تواجه مجتمعهم.,amazon translate,Dan
يعد نظام الرعاية الصحية المكسور والأزمة الاقتصادية من القضايا الحالية التي تواجهها المجتمعات.,amazon translate,Dan
إن خفض تكلفة الأدوية التي تستلزم وصفة طبية، ومعالجة تغير المناخ، وتقديم حلول منطقية هي أهداف لبعض الحملات السياسية.,amazon translate,Dan
يأمل الناس أن يظل أحباؤهم آمنين وصحيين.,amazon translate,Dan
تم وضع ضغوط مالية وشخصية هائلة على عدد لا يحصى من العائلات بسبب COVID-19.,amazon translate,Dan
المستجيبون في الخطوط الأمامية ضروريون في مكافحة COVID-19.,amazon translate,Dan
يمكن أن يؤثر الدعم الشعبي على السباقات السياسية.,amazon translate,Dan
يعد الوصول إلى الرعاية الصحية والأزمات الاقتصادية والحلول المنطقية قضايا مهمة للناخبين.,amazon translate,Dan
يمكن أن تكون السباقات السياسية غير متوقعة ويمكن أن تتغير من تفضيل حزب واحد إلى مجرد هراء.,amazon translate,Dan
تحتاج العائلات إلى القيادة.,amazon translate,Dan
يطالب الناخبون بالمساءلة من ممثليهم السياسيين.,amazon translate,Dan
تهدف القوانين إلى الحفاظ على سلامتنا.,amazon translate,Dan
تعتبر الرعاية الصحية والاقتصاد من القضايا المهمة للعائلات.,amazon translate,Dan
تم وضع ضغوط مالية وشخصية على عدد لا يحصى من العائلات بسبب COVID-19.,amazon translate,Dan
إن خفض تكلفة الأدوية التي تستلزم وصفة طبية هو هدف لبعض السياسيين.,amazon translate,Dan
تعتبر معالجة تغير المناخ مصدر قلق لبعض السياسيين.,amazon translate,Dan
يجب أن تكون الانتخابات شفافة ونزيهة.,amazon translate,Dan
يجب أن يكون كل شخص يحق له قانونًا التصويت قادرًا على القيام بذلك بأمان.,amazon translate,Dan
قد يستمر التباعد الاجتماعي في الأسابيع التي تسبق الانتخابات.,amazon translate,Dan
قد يبدو التصويت في الانتخابات مختلفًا عما كان عليه في الماضي.,amazon translate,Dan
يمكن أن تساعد ممارسة التباعد الاجتماعي في منع انتشار المرض.,amazon translate,Dan
يجب على العائلات متعددة الأجيال التي تعيش تحت سقف واحد أن تضع في اعتبارها صحة شيوخ الأسرة أثناء الأزمة الصحية.,amazon translate,Dan
يمكن أن يساعد اتباع توصيات CDC في الحفاظ على سلامة الناس أثناء الأزمة الصحية.,amazon translate,Dan
يأمل الناس أن يظل أحباؤهم آمنين وصحيين خلال الأوقات العصيبة.,amazon translate,Dan
يمكن وضع ضغوط مالية وشخصية على العائلات خلال أزمة مثل COVID-19.,amazon translate,Dan
يمكن أن تتباطأ التبرعات خلال فترات معينة.,amazon translate,Dan
تساعد أهداف جمع التبرعات المنظمات على الحصول على الموارد التي تحتاجها.,amazon translate,Dan
يمكن للأدوات الرقمية مساعدة المؤسسات على خدمة مجتمعها بشكل أفضل.,amazon translate,Dan
يمكن للمتطوعين استخدام الأدوات الرقمية لدعم أنشطتهم.,amazon translate,Dan
يعد خفض تكلفة الأدوية التي تستلزم وصفة طبية مصدر قلق لبعض الأشخاص.,amazon translate,Dan
تعتبر معالجة تغير المناخ أولوية لبعض الأفراد.,amazon translate,Dan
سنتجاوز تفشي فيروس كورونا معًا.,amazon translate,Dan
الفطرة السليمة والاحترام واللياقة هي محور القيادة الحقيقية.,amazon translate,Dan
تتطلب القيادة الحقيقية التعاطف والتعاطف والصدق.,amazon translate,Dan
غالبًا ما تحتاج الأسر العاملة والشركات الصغيرة إلى الدعم.,amazon translate,Dan
يجب أن تبحث القيادة عن مصالح الناس.,amazon translate,Dan
تتطلب الحملات أموالًا للعمل والوصول إلى أهدافها.,amazon translate,Dan
يمكن تقديم التبرعات في أي وقت، وليس فقط خلال فترات محددة لجمع التبرعات.,amazon translate,Dan
من المتوقع عمومًا أن تتم مكافأة العمل الشاق.,amazon translate,Dan
يلاحظ الناس في واشنطن زخمًا في الحملات السياسية.,amazon translate,Dan
تعد مناطق Battleground سباقات رئيسية مع إمكانية تغيير سيطرة الحزب.,amazon translate,Dan
يمكن إعادة بناء الاقتصادات للعمل من أجل الجميع.,amazon translate,Dan
غالبًا ما تطلب الحملات التبرعات لتحقيق أهداف جمع التبرعات.,amazon translate,Dan
يمكن للحملات السياسية قبول المساهمات الشهرية المتكررة.,amazon translate,Dan
اليوم هو اليوم الأول للتصويت المبكر في تكساس.,amazon translate,Dan
يتم احتساب كل صوت في نتيجة الانتخابات.,amazon translate,Dan
الرعاية الصحية التي يمكن الوصول إليها مهمة للمجتمع.,amazon translate,Dan
الاقتصاد القوي مفيد لمواطني الدولة.,amazon translate,Dan
التصويت هو وسيلة للمشاركة في العملية الديمقراطية.,amazon translate,Dan
يجب أن يكون العمل اليومي الصادق كافيًا لوضع الطعام على الطاولة، ووضع سقف فوق رأسك، وتغطية تكلفة الأدوية اللازمة.,amazon translate,Dan
الانتخابات هي الوقت الذي يسعى فيه المرشحون للحصول على تبرعات لحملاتهم.,amazon translate,Dan
غالبًا ما يطلب الناس من الأصدقاء والزملاء دعم المرشحين السياسيين الذين يؤمنون بهم.,amazon translate,Dan
غالبًا ما يكون لدى المرشحين للمناصب السياسية تاريخ من الخدمة العامة أو المشاركة المجتمعية.,amazon translate,Dan
يمكن تمويل الحملات السياسية في الولايات المتحدة من خلال تبرعات الأفراد.,amazon translate,Dan
يمكن أن تكون الانتخابات تنافسية ويمكن أن تتأثر النتائج بالتغيرات في السكان ومشاعر الناخبين.,amazon translate,Dan
يريد الناس عمومًا تحقيق أهداف جمع التبرعات الخاصة بهم.,amazon translate,Dan
غالبًا ما يتم تحديد المواعيد النهائية لأهداف محددة.,amazon translate,Dan
يمكن للتبرعات المطابقة أن تحفز الناس على التبرع.,amazon translate,Dan
إلغاء الاشتراك هو خيار للأشخاص الذين لا يرغبون في تلقي رسائل البريد الإلكتروني.,amazon translate,Dan
إذا أردنا أن يتمكن أطفالنا من التعلم، فنحن بحاجة إلى منحهم أفضل بيئة للقيام بذلك.,amazon translate,Dan
يمكن أن يؤدي العمل معًا إلى إنجاز الكثير للأشخاص.,amazon translate,Dan
من المهم إيجاد أرضية مشتركة بشأن القضايا المهمة.,amazon translate,Dan
تعتمد الحملات التي يقودها الناس على المؤيدين على مستوى القاعدة الشعبية.,amazon translate,Dan
أصبحت المشاحنات الحزبية شائعة في سياسة واشنطن.,amazon translate,Dan
الرعاية الصحية بأسعار معقولة مهمة للناس.,amazon translate,Dan
يجب أن تكون الأدوية ميسورة التكلفة.,amazon translate,Dan
تعتبر حماية الشركات الصغيرة والاقتصاد أولوية بالنسبة للكثيرين.,amazon translate,Dan
يعد اتباع إرشادات CDC، مثل غسل اليدين والتباعد الاجتماعي، أمرًا مهمًا للصحة العامة.,amazon translate,Dan
من المهم أن يكون هناك قادة يعطون الأولوية لصحة الأسر وسلامتها ورفاهيتها.,amazon translate,Dan
الحصول على الرعاية الصحية بأسعار معقولة هو مصدر قلق للناس.,amazon translate,Dan
يمكن أن يساعد اتباع الإرشادات من السلطات الصحية مثل CDC في الحفاظ على سلامة الأفراد وصحتهم.,amazon translate,Dan
الأشخاص الذين يعملون في المستشفيات والمتاجر ويقدمون البريد ويقدمون الرعاية ويستجيبون لحالات الطوارئ يقومون بعمل مهم في الأوقات الصعبة.,amazon translate,Dan
يجب أن ندعم أولئك الذين يعتنون بنا في أوقات غير مسبوقة.,amazon translate,Dan
من المهم العمل معًا لتحقيق نتائج جيدة لليوم والمستقبل.,amazon translate,Dan
التخطيط السليم يمنع الأداء الضعيف.,amazon translate,Dan
يتيح تغيير الأنشطة عبر الإنترنت فرصة التواصل مع المزيد من الأشخاص.,amazon translate,Dan
يريد الناس عمومًا أو يحتاجون إلى الرعاية والغذاء والمأوى بعد فقدان منازلهم في كارثة.,amazon translate,Dan
لا يرغب الناس عادة في الحصول على طعام مصاب باليرقات.,amazon translate,Dan
عادة، لن يقوم المرء بتوظيف شخص بدون خبرة لبناء منزل.,amazon translate,Dan
تم إغلاق الآلاف من الشركات الصغيرة بسبب عمليات الإغلاق.,amazon translate,Dan
يمكن أن يؤثر فقدان الوظائف على مئات الآلاف من العائلات.,amazon translate,Dan
يمكن أن يؤدي فقدان الوظائف إلى معاناة العائلات ماليًا.,amazon translate,Dan
القادة مسؤولون عن قراراتهم وسياساتهم.,amazon translate,Dan
كل تصويت مهم.,amazon translate,Dan
الناس لديهم أعمال ومنازل.,amazon translate,Dan
يحتاج الأشخاص الطيبون إلى الحماية.,amazon translate,Dan
يجب أن يكون هناك قانون ونظام.,amazon translate,Dan
للناس الحق في التجمع السلمي والاحتجاج.,amazon translate,Dan
يمكن أن تساعد الأساليب الاستراتيجية في التغلب على التحديات.,amazon translate,Dan
تتيح الأنشطة عبر الإنترنت فرصة التواصل مع المزيد من الأشخاص.,amazon translate,Dan
تتطلب الحملات موارد للعمل.,amazon translate,Dan
هناك وقت مناسب لكل شيء.,amazon translate,Dan
وقت الولادة.,amazon translate,Dan
حان وقت الموت.,amazon translate,Dan
حان وقت الزراعة.,amazon translate,Dan
وقت الحصاد.,amazon translate,Dan
حان وقت القتل.,amazon translate,Dan
وقت للشفاء.,amazon translate,Dan
حان وقت التدمير.,amazon translate,Dan
حان وقت إعادة البناء.,amazon translate,Dan
وقت للبكاء.,amazon translate,Dan
وقت للضحك.,amazon translate,Dan
حان وقت الرقص.,amazon translate,Dan
وقت نثر الأحجار.,amazon translate,Dan
وقت لجمع الأحجار.,amazon translate,Dan
حان وقت العناق.,amazon translate,Dan
وقت عدم العناق.,amazon translate,Dan
حان وقت البحث.,amazon translate,Dan
وقت نضيعه.,amazon translate,Dan
وقت للحفظ.,amazon translate,Dan
حان وقت التخلص.,amazon translate,Dan
حان وقت الإصلاح.,amazon translate,Dan
وقت للهدوء.,amazon translate,Dan
حان الوقت للتحدث.,amazon translate,Dan
وقت الحب.,amazon translate,Dan
وقت الكراهية.,amazon translate,Dan
وقت الحرب.,amazon translate,Dan
وقت للسلام.,amazon translate,Dan
يستمع القادة الجيدون.,amazon translate,Dan
يتعلم القادة العظماء ويتخذون الإجراءات.,amazon translate,Dan
إن إجبار المنطقة على إعادة الفتح بدون سياسات للحفاظ على سلامة المجتمعات يمكن أن يعرض الناس للخطر.,amazon translate,Dan
من المهم الاستماع إلى جميع الأطراف، بما في ذلك أولئك الذين يختلفون معك.,amazon translate,Dan
لن يختفي الفيروس إذا تظاهرنا بأنه قد انتهى.,amazon translate,Dan
لن يتوقف الأمريكيون عن الموت إذا توقفنا عن الاختبار.,amazon translate,Dan
يستحق الناس في المناطق الريفية فرصة الحصول على رعاية صحية أفضل.,amazon translate,Dan
يجب أن يعمل السياسيون من أجل أهل المنطقة التي يمثلونها بدلاً من المصالح المالية.,amazon translate,Dan
لا أحد يختار أن يمرض.,amazon translate,Dan
لا يحق للرجال إخبار النساء بما يجب فعله بأجسادهن.,amazon translate,Dan
الأولوية الأولى خلال هذا الوقت هي التأكد من أن الجميع يساعدون في التخفيف من انتشار COVID-19 في كاليفورنيا وفي جميع أنحاء البلاد.,amazon translate,Dan
تقوم حملتنا بدورنا من خلال إلغاء جميع الأحداث الشخصية والانتقال إلى عملية رقمية ودعم الجهود المحلية لمساعدة المحتاجين.,amazon translate,Dan
يساهم الأمريكيون الذين يعملون بجد في المجتمع.,amazon translate,Dan
تواجه الشركات الصغيرة تحديات وقرارات.,amazon translate,Dan
تغير المناخ هو موضوع يتطلب الاهتمام۔,amazon translate,Dan
يمكن أن تتدهور البنية التحتية بمرور الوقت.,amazon translate,Dan
الضمان الاجتماعي والرعاية الطبية هي برامج تهدف إلى حماية الأفراد.,amazon translate,Dan
الانتخابات تنافسية.,amazon translate,Dan
يمكن أن يؤثر الدعم الشعبي على الحملات السياسية.,amazon translate,Dan
البريد الإلكتروني هو أداة اتصال تستخدم لإعلام الأشخاص وإشراكهم.,amazon translate,Dan
يحتاج الناس إلى التصويت للرئيس القادم.,amazon translate,Dan
يمكن أن يكون للتعيينات القضائية تأثيرات طويلة الأمد.,amazon translate,Dan
وتنطوي الديمقراطية على مشاركة السكان في عمليات صنع القرار.,amazon translate,Dan
تغير المناخ هو قضية يهدف بعض الناس إلى معالجتها.,amazon translate,Dan
الضمان الاجتماعي والرعاية الطبية هي برامج تهدف إلى دعم الأفراد.,amazon translate,Dan
للانتخابات تاريخ انتهاء محدد عند إغلاق صناديق الاقتراع.,amazon translate,Dan
يمكن هزيمة شاغلي المناصب في الانتخابات.,amazon translate,Dan
البريد الإلكتروني هو أداة اتصال تستخدم لإعلام المؤيدين وطلب التبرعات للحملات السياسية.,amazon translate,Dan
يمكن طلب التبرعات عبر البريد الإلكتروني.,amazon translate,Dan
يعد اتباع العلوم أمرًا مهمًا أثناء الأزمة الصحية.,amazon translate,Dan
الرعاية الصحية هي مصدر قلق لكثير من الناس.,amazon translate,Dan
يمكن أن يكون للسياسيين مواقف مختلفة بشأن القضايا.,amazon translate,Dan
التشرد هو قضية يمكن أن يواجهها السياسيون.,amazon translate,Dan
الضمان الاجتماعي والرعاية الطبية هي برامج تهدف إلى حماية رفاهية الأفراد.,amazon translate,Dan
البريد الإلكتروني هو أداة اتصال تستخدم لإبقاء الناس على اطلاع.,amazon translate,Dan
يمكن أن يكون الدعم الشعبي حاسمًا للحملة السياسية.,amazon translate,Dan
تسمح بطاقات الاقتراع عبر البريد للأشخاص بالتصويت دون الذهاب إلى أماكن الاقتراع.,amazon translate,Dan
يمكن أن تكون الانتخابات تنافسية.,amazon translate,Dan
غالبًا ما تطلب الحملات التبرعات لدعم أنشطتها.,amazon translate,Dan
التصويت هو وسيلة للمواطنين للمشاركة في حكومتهم.,amazon translate,Dan
تستخدم الحملات السياسية البريد الإلكتروني للتواصل مع المؤيدين.,amazon translate,Dan
يعتبر عيد الهالوين أكثر أيام السنة رعبًا.,amazon translate,Dan
المنازل المسكونة والتجمعات المخيفة شائعة في عيد الهالوين.,amazon translate,Dan
يمكن للانتخابات أن تحدد مسار البلد.,amazon translate,Dan
تغير المناخ هو قضية مهمة تحتاج إلى معالجة.,amazon translate,Dan
يعتبر الناس عمومًا أنه من المنطقي دعم المرشحين السياسيين الذين يتوافقون مع قيمهم.,amazon translate,Dan
من المنطقي أن الانتخابات هي أحداث مهمة في الديمقراطية.,amazon translate,Dan
يتفق معظم الناس على أن معالجة تغير المناخ، ومعالجة البنية التحتية المتدهورة، ومواجهة التشرد، وحماية الضمان الاجتماعي والرعاية الطبية هي قضايا منطقية يجب على السياسيين التركيز عليها.,amazon translate,Dan
من المنطقي أن الحملات السياسية غالبًا ما تطلب التبرعات لدعم جهودها.,amazon translate,Dan
من المنطقي أن الدعم الشعبي يمكن أن يكون حاسمًا للحملة السياسية.,amazon translate,Dan
يعد الرد على الهاتف وإلقاء التحية طريقة شائعة لبدء محادثة هاتفية.,amazon translate,Dan
