statement,elicitation,committer
ليلة رأس السنة الجديدة هي الوقت الذي يحتفل فيه الناس بأحداث العام الماضي.,amazon translate,Dan
غالبًا ما يتشارك أفراد العائلة والأصدقاء الأوقات الجيدة معًا.,amazon translate,Dan
يجد الناس وظائف جديدة كل عام.,amazon translate,Dan
يمكن أن تؤثر معدلات الضرائب على مبلغ الأموال التي يدفعها الناس للحكومة.,amazon translate,Dan
يمكن أن تزيد الأجور أو تنقص.,amazon translate,Dan
يمكن أن يكون للتضخم تأثير على تكلفة المعيشة.,amazon translate,Dan
يسافر المسؤولون الحكوميون للقاء ناخبيهم.,amazon translate,Dan
تستخدم الحملات السياسية التبرعات لنفقات مختلفة مثل الوقود واللافتات والإعلانات.,amazon translate,Dan
يتم استخدام الإعلانات التلفزيونية والكابلات والصحف والرقمية والإذاعية في الحملات السياسية.,amazon translate,Dan
لكل شخص الحق في التصويت عندما يبلغ 18 عامًا.,amazon translate,Dan
يجتمع القادة والموظفون العموميون للصلاة من أجل أمتهم وشعبهم.,amazon translate,Dan
يناقش المشرعون في الولاية ويصوتون على التعديلات على دستور ولايتهم.,amazon translate,Dan
يتمتع الناس بسلطة التصويت على القضايا الحرجة في الديمقراطية.,amazon translate,Dan
كل السلطة السياسية متأصلة في الشعب.,amazon translate,Dan
الانتخابات هي جزء منتظم من العمليات الديمقراطية.,amazon translate,Dan
يتم اعتماد الأصوات من قبل سلطة رسمية، مثل مكتب وزير الخارجية.,amazon translate,Dan
المؤتمرات هي أحداث تناقش فيها الأحزاب السياسية برامجها وتحشد الدعم.,amazon translate,Dan
يمكن تقديم مساهمات الحملة بكميات مختلفة.,amazon translate,Dan
يُنظر إلى البطالة عمومًا على أنها جانب سلبي للاقتصاد.,amazon translate,Dan
غالبًا ما يعتبر الناس الاقتصاد المزدهر أمرًا إيجابيًا.,amazon translate,Dan
يعد تأمين الحدود الوطنية جانبًا شائعًا من الإجراءات الأمنية للبلد.,amazon translate,Dan
يعد خفض أسعار الأدوية التي تستلزم وصفة طبية مصدر قلق للعديد من الأفراد.,amazon translate,Dan
اختيار المدرسة هو موضوع النقاش في السياسة التعليمية.,amazon translate,Dan
حماية الجنين هي موضوع نقاش سياسي وأخلاقي.,amazon translate,Dan
هذا العام لدينا يوم إضافي واحد في فبراير.,amazon translate,Dan
نحن نخجل فقط من تحقيق هدفنا في فبراير.,amazon translate,Dan
يتقدم الأشخاص عمومًا لإعادة انتخابهم في مكتب حكومي رسمي.,amazon translate,Dan
يتم انتخاب الممثلين لخدمة مصالح ناخبيهم.,amazon translate,Dan
يمكن لأعضاء الكونغرس العمل في اللجان التي تؤثر على التشريعات.,amazon translate,Dan
جمع التبرعات هو جزء شائع من الحملات السياسية.,amazon translate,Dan
وتجري الانتخابات على أساس منتظم في البلدان الديمقراطية.,amazon translate,Dan
غالبًا ما يسعى السياسيون للحصول على موافقات لدعم ترشيحهم.,amazon translate,Dan
يمكن للمشرعين تقديم مشاريع القوانين والقوانين في الكونغرس.,amazon translate,Dan
تعد الخدمات التأسيسية جزءًا مهمًا من واجبات الممثل.,amazon translate,Dan
يحتاج عدد لا يحصى من الأمريكيين الذين يعملون بجد إلى وظائف.,amazon translate,Dan
نظام الرعاية الصحية لدينا في حاجة ماسة إلى عمال مدربين إضافيين.,amazon translate,Dan
تقوم وكالات الصحة العامة بتدريب الموظفين لاستكمال العمل الذي يقوم به المهنيون الطبيون.,amazon translate,Dan
ستكون القوة الصحية مسؤولة عن دعم الاختبار، وجهود تتبع جهات الاتصال، وإدارة اللقاحات، وجمع بيانات الصحة العامة وجهود التعليم، وتقديم الغذاء والإمدادات الطبية.,amazon translate,Dan
لإعادة فتح البلاد بأمان، نحتاج إلى عمال مدربين في كل مجتمع للمساعدة في الاختبار وإجراء تتبع جهات الاتصال وإدارة اللقاحات وتثقيف الناس حول التباعد الاجتماعي والعزلة الذاتية.,amazon translate,Dan
كانت إدارات الصحة العامة الحكومية والمحلية تعاني من نقص في الموظفين عند الحاجة الماسة.,amazon translate,Dan
يخسر الاقتصاد المال كل يوم يظل مغلقًا.,amazon translate,Dan
يمكن للمبادرات الجريئة في لحظات الأزمات أن تترك إرثًا دائمًا.,amazon translate,Dan
إعانات البطالة متاحة للعمال المتضررين من الإغلاق المؤقت بسبب COVID-19.,amazon translate,Dan
قد تفتح أسواق التأمين الصحي فترات تسجيل خاصة لأولئك الذين فقدوا وظائفهم مؤخرًا.,amazon translate,Dan
يحتاج الأشخاص الذين يعانون من حالات موجودة مسبقًا إلى حماية الرعاية الصحية.,amazon translate,Dan
يمكن أن يؤدي تغير المناخ إلى العواصف الفائقة وارتفاع مستويات سطح البحر وتكاثر الطحالب السامة.,amazon translate,Dan
تعتبر سلامة السلاح مصدر قلق لكثير من الناس.,amazon translate,Dan
الرعاية الصحية مهمة للعائلات.,amazon translate,Dan
البيئة هي مصدر قلق للناخبين.,amazon translate,Dan
من المتوقع أن يعمل القادة المنتخبون من أجل ناخبيهم.,amazon translate,Dan
يتم البحث عن حلول بين الحزبين للمشاكل التي تواجهها العائلات.,amazon translate,Dan
الوصول إلى الرعاية الصحية أمر ضروري للجميع.,amazon translate,Dan
تواجه الشركات التي نجت من الوباء الآن تفشيًا جديدًا: الدعاوى القضائية.,amazon translate,Dan
وبدون الحماية القانونية، يمكن أن تواجه الشركات الكبيرة والصغيرة موجة عارمة من الدعاوى القضائية المعوقة.,amazon translate,Dan
يمكن أن تنجرف الشركات الصغيرة إذا فشل المشرعون في حمايتها.,amazon translate,Dan
إعادة الفتح هي الطريقة الوحيدة لإنقاذ هذه الشركات على المدى الطويل.,amazon translate,Dan
تواجه الشركات الصغيرة احتمال الافتتاح فقط ليتم إغلاقها من خلال دعاوى قضائية تافهة.,amazon translate,Dan
لا ينبغي اضطهاد الشركات بسبب عدم قدرتها على حماية عملائها أو عمالها من الإصابة بمرض معدي مثل فيروس كورونا الجديد.,amazon translate,Dan
يمكن للدعاوى القضائية التافهة إغلاق الشركات المتعثرة لأنها غير قادرة على دفع تكاليف المحامين وحدها.,amazon translate,Dan
إن مجرد التهديد بالشكاوى القانونية يمنع بعض الشركات الصغيرة من إعادة فتحها.,amazon translate,Dan
تريد الشركات من الكونغرس أن يحد من المسؤولية في الحالات التي ينتج فيها التعرض لـ COVID-19 عن إهمال يمكن إثباته.,amazon translate,Dan
يجب حماية الشركات من المحامين الانتهازيين والمغارمين.,amazon translate,Dan
يضع الناس في جميع أنحاء ألاباما لافتات «شكرًا لك» في الساحات والنوافذ، ويلجأون إلى وسائل التواصل الاجتماعي للتعبير عن الشكر باستخدام الهاشتاغ #OneAlabama.,amazon translate,Dan
يجب أن نستمر في ممارسة التباعد الاجتماعي وارتداء الأقنعة في الأماكن العامة.,amazon translate,Dan
تعتمد صحتنا على صحة جيراننا، ويعتمد اقتصادنا على صحة مجتمعنا.,amazon translate,Dan
يفضل الأشخاص عمومًا تلقي تحديثات حول الموضوعات التي أعربوا عن اهتمامهم بها.,amazon translate,Dan
غالبًا ما يكون لدى الأفراد خيار إلغاء الاشتراك من قوائم البريد الإلكتروني التي لم يعودوا يرغبون في أن يكونوا جزءًا منها.,amazon translate,Dan
كثيرًا ما تطلب الحملات السياسية التبرعات لتحقيق أهداف جمع التبرعات.,amazon translate,Dan
يعتمد الأطباء عادةً على الحقائق والأدلة عند اتخاذ القرارات.,amazon translate,Dan
يمكن للأحزاب السياسية تغيير برامجها بمرور الوقت.,amazon translate,Dan
غالبًا ما تكون التسوية ضرورية في السياسة لتحقيق النتائج.,amazon translate,Dan
يتم إجراء الانتخابات لتحديد من سيشغل المناصب العامة.,amazon translate,Dan
يمكن دعم الحملات السياسية من خلال التبرعات من الأفراد والجماعات.,amazon translate,Dan
تهدف المنظمات السياسية إلى انتخاب المرشحين الذين يتوافقون مع قيمها وأهدافها.,amazon translate,Dan
ارتداء القناع مهم لأسباب صحية.,amazon translate,Dan
يجب على المسؤولين المنتخبين استخدام العلم والحقائق لمعالجة القضايا.,amazon translate,Dan
الرعاية الصحية بأسعار معقولة مهمة للمجتمع.,amazon translate,Dan
تمويل المدارس العامة ضروري للتعليم.,amazon translate,Dan
يتم تقييم حماية الخدمات البريدية من قبل الناس.,amazon translate,Dan
كونك أبًا هو تجربة صعبة ولكنها مجزية.,amazon translate,Dan
غالبًا ما يلعب الآباء دورًا إيجابيًا في حياة أطفالهم وأحفادهم.,amazon translate,Dan
قضاء الوقت مع العائلة يمكن أن يجلب الفرح والسعادة.,amazon translate,Dan
من الشائع أن يُطلق على الأجداد لقب بمودة من قبل أحفادهم.,amazon translate,Dan
يمكن أن يساعد الحفاظ على روح الدعابة في رفع معنويات شخص ما.,amazon translate,Dan
الدعم من الأحباء مهم في المساعي الشخصية والمهنية.,amazon translate,Dan
يحتفل الناس عمومًا بعيد الاستقلال في 4 يوليو.,amazon translate,Dan
الذكرى السنوية هي مناسبات يحتفل فيها الناس بعدد السنوات التي قضوها معًا.,amazon translate,Dan
غالبًا ما يتم الاستمتاع بالأماكن الخارجية في الطقس الجيد.,amazon translate,Dan
يجب استخدام الفطرة السليمة للالتزام بالإرشادات والتوصيات الصحية.,amazon translate,Dan
تحتاج الفئات الضعيفة من السكان إلى الحماية، خاصة أثناء الأزمات الصحية.,amazon translate,Dan
من المتوقع أن يتحمل القادة مسؤولية الحكم.,amazon translate,Dan
تعتبر حرية التعبير حقًا فريدًا وهامًا.,amazon translate,Dan
كل صوت نحصل عليه هو خطوة واحدة على بعد خطوة واحدة من الرعاية الصحية بأسعار معقولة ويمكن الوصول إليها، وإعادة اقتصادنا إلى قدميه، وبناء مستقبل مستدام ومرن لأطفالنا وأحفادنا.,amazon translate,Dan
تتطلب الحملات أموالًا للعمل وغالبًا ما تطلب التبرعات.,amazon translate,Dan
الديمقراطية هي رياضة جماعية - إنها لا تعمل إلا إذا قاتلنا معًا.,amazon translate,Dan
يمكن أن تحدد نتيجة السباق من يسيطر على مجلس الشيوخ.,amazon translate,Dan
يمكن لأعضاء مجلس الشيوخ أن يكونوا حلفاء للرئيس.,amazon translate,Dan
يمكن ربط الانتخابات في استطلاعات الرأي.,amazon translate,Dan
غالبًا ما يطلب الناس المساعدة عندما يكونون في حاجة إليها.,amazon translate,Dan
الحملات لديها أهداف لجمع التبرعات لتحقيقها.,amazon translate,Dan
تتأثر الانتخابات بكمية الأموال التي تجمعها الحملة.,amazon translate,Dan
غالبًا ما تطلب الحملات السياسية التبرعات قبل مواعيد نهائية محددة.,amazon translate,Dan
تناول الطعام الصحي يساهم في الصحة الجيدة.,amazon translate,Dan
ممارسة التمارين الرياضية بانتظام مفيدة للياقة البدنية.,amazon translate,Dan
افتراض البراءة حتى تثبت إدانته هو مبدأ من مبادئ النظام القانوني.,amazon translate,Dan
إن تأمين الحدود الوطنية هو مصدر قلق مشترك للأمن القومي.,amazon translate,Dan
يمكن أن تؤثر الانتخابات على السيطرة على الحكومة.,amazon translate,Dan
يمكن لـ Super PACs إنفاق الأموال على الإعلانات السياسية.,amazon translate,Dan
يحتاج الناس عمومًا إلى المساعدة للفوز بالسباقات السياسية.,amazon translate,Dan
غالبًا ما يؤكد السياسيون على أهمية الانتخابات لمؤيديهم.,amazon translate,Dan
يعتبر الناس عمومًا يوم الأحد جزءًا من عطلة نهاية الأسبوع.,amazon translate,Dan
يعمل السياسيون للحصول على السلطة والحفاظ عليها.,amazon translate,Dan
قد تستثمر الأحزاب السياسية بكثافة في مناطق معينة للفوز بالانتخابات.,amazon translate,Dan
يمكن استخدام الإعلانات السياسية لمهاجمة المعارضين أو انتقادهم.,amazon translate,Dan
يمكن أن تؤدي الانتخابات إلى انتصارات للمرشحين.,amazon translate,Dan
يعتبر انتخاب القادة الذين سيحمون البيئة أمرًا مهمًا من قبل بعض الأشخاص.,amazon translate,Dan
يمكن أن يؤدي التصويت في الانتخابات إلى تغييرات في مجلس الشيوخ.,amazon translate,Dan
يمكن استخدام التبرعات لتمويل الحملات الإعلانية.,amazon translate,Dan
رسائل البريد الإلكتروني هي وسيلة للتواصل بين المنظمات ومؤيديها.,amazon translate,Dan
لست بحاجة إلينا لنخبرك بالتصويت.,amazon translate,Dan
تحقق من الأشخاص الذين تعرفهم في ولايات ساحة المعركة حيث يكون الطقس سيئًا والخطوط طويلة.,amazon translate,Dan
تصويتهم مهم حقًا.,amazon translate,Dan
يصوت الناس في الولايات المتحدة في الانتخابات.,amazon translate,Dan
يخدم أعضاء مجلس الشيوخ في مجلس الشيوخ.,amazon translate,Dan
يمكن للانتخابات أن تحدد من يملك السلطة السياسية.,amazon translate,Dan
يمكن للسياسيين تمثيل ولايات محددة في الولايات المتحدة.,amazon translate,Dan
ينام الناس عمومًا أثناء الليل ويستيقظون أثناء النهار .,amazon translate,Dan
إن اتباع نظام غذائي متوازن ضروري للحفاظ على صحة جيدة.,amazon translate,Dan
ممارسة التمارين الرياضية بانتظام مفيدة للصحة البدنية والعقلية.,amazon translate,Dan
يمكن أن يساعد غسل اليدين في منع انتشار الأمراض.,amazon translate,Dan
يعد اتباع قوانين المرور أمرًا مهمًا للسلامة على الطرق.,amazon translate,Dan
الاقتراع هو طريقة تستخدم لقياس الرأي العام حول مواضيع مختلفة.,amazon translate,Dan
يتم تحديد الانتخابات من قبل جمهور الناخبين.,amazon translate,Dan
افتراض البراءة حتى تثبت إدانته هو مبدأ من مبادئ نظام العدالة الأمريكي.,amazon translate,Dan
إن تأمين الحدود الوطنية هو مصدر قلق مشترك للأمن القومي ولأسباب إنسانية.,amazon translate,Dan
يمكن أن تحدد الانتخابات السيطرة على مجلس الشيوخ الأمريكي والحكومة الفيدرالية.,amazon translate,Dan
تُعد إعلانات الهجوم السياسي جانبًا شائعًا من الحملات الانتخابية.,amazon translate,Dan
يمكن أن يتفوق خصومهم على المرشحين في الانتخابات.,amazon translate,Dan
يمكن استخدام الإعلانات السياسية لمهاجمة المرشحين أو الترويج لهم.,amazon translate,Dan
يعمل الناس بشكل عام خلال الأسبوع ويستريحون يوم الأحد.,amazon translate,Dan
غالبًا ما يكون لحملات جمع التبرعات مواعيد نهائية.,amazon translate,Dan
الحملات السياسية تطلب التبرعات.,amazon translate,Dan
قم بتغطية السعال والعطس.,amazon translate,Dan
لا تلمس وجهك.,amazon translate,Dan
نظف الأسطح والأشياء التي يتم لمسها بشكل متكرر.,amazon translate,Dan
ابق في المنزل إذا كنت مريضًا باستثناء الحصول على رعاية طبية.,amazon translate,Dan
اغسل يديك كثيرًا بالصابون لمدة 20 ثانية على الأقل.,amazon translate,Dan
نحن بحاجة إلى عودة أطفالنا إلى المدرسة من أجل رفاههم العقلي والجسدي والاجتماعي.,amazon translate,Dan
يحتاج الآباء إلى العودة إلى العمل.,amazon translate,Dan
يشعر الناس عمومًا بالترقب عند توقع تغيير أو حدث.,amazon translate,Dan
يمكن تحسين الانتخابات الأولية لتمثيل الناخبين بشكل أفضل.,amazon translate,Dan
التصويت بالاختيار المصنف هو طريقة يمكن استخدامها في الانتخابات.,amazon translate,Dan
التصويت عن طريق البريد هو نظام يستخدم للانتخابات في بعض الولايات.,amazon translate,Dan
يمكن للأحزاب السياسية التكيف واعتماد تقنيات جديدة للتصويت.,amazon translate,Dan
فرص العمل مهمة للأشخاص الذين يبحثون عن عمل.,amazon translate,Dan
يمكن أن يساعد تدريس التربية المدنية في المدرسة المواطنين على فهم حكومتهم.,amazon translate,Dan
يمكن أن يؤدي تبسيط قانون الضرائب إلى تسهيل فهم الأشخاص للضرائب.,amazon translate,Dan
يمكن أن تؤدي الانتخابات الأكثر تمثيلاً إلى كونغرس أقل استقطابًا.,amazon translate,Dan
يمكن للجان المستقلة لإعادة تقسيم الدوائر أن تساعد في منع التلاعب الحزبي في الانتخابات.,amazon translate,Dan
عادة ما يأكل الناس وجبات الطعام وقد يستمتعون بكوكتيل في المساء.,amazon translate,Dan
غالبًا ما يناقش المسؤولون المنتخبون الأحداث الجارية وعملهم مع الناخبين.,amazon translate,Dan
يمكن لأعضاء الكونغرس العمل في لجان مختلفة.,amazon translate,Dan
يمكن أن تشمل مناصب الحكومة المحلية أدوارًا مثل عضو مجلس المدينة والعمدة.,amazon translate,Dan
تمنح الجوائز لتقدير الأفراد لإنجازاتهم أو دعمهم في مجالات محددة.,amazon translate,Dan
غالبًا ما يمارس الناس هوايات مثل الخياطة والحياكة والحياكة.,amazon translate,Dan
يمكن أن تكون السياسة المحلية جزءًا مهمًا من الحياة المجتمعية لسنوات عديدة.,amazon translate,Dan
غالبًا ما تعمل المنظمات على قضايا محددة، مثل رابطة بلو ريدج للدفاع عن البيئة التي تعمل على القضايا البيئية.,amazon translate,Dan
يمكن أن تكون المعرفة السياسية والبصيرة المحلية مفيدة في التنبؤ بنتائج الانتخابات.,amazon translate,Dan
يمكن أن تتغير أنماط التصويت بمرور الوقت داخل المجتمع.,amazon translate,Dan
أثناء الوباء، قد يفكر المزيد من الناس في التصويت الغيابي لتجنب المخاطر الصحية المحتملة.,amazon translate,Dan
يحتاج الناس إلى النوم.,amazon translate,Dan
يعتبر تسرب مياه الأمطار إلى الفصول الدراسية علامة على عدم كفاية نظام مياه الأمطار.,amazon translate,Dan
تحتاج المدارس إلى تمويل للبناء والصيانة.,amazon translate,Dan
وسائل النقل العام مهمة للمجتمع.,amazon translate,Dan
الوصول إلى الإنترنت مهم للحياة الحديثة.,amazon translate,Dan
يجب أن تعمل أنظمة الرعاية الصحية بشكل تعاوني مع شركاء المجتمع.,amazon translate,Dan
اللقاحات مهمة للصحة العامة.,amazon translate,Dan
سلامة السلاح مهمة لمنع الحوادث والإصابات.,amazon translate,Dan
يعد التعليم حول كيفية التعرف على النوبات والاستجابة لها أمرًا مهمًا للسلامة المدرسية.,amazon translate,Dan
يجب أن تكون منتجات الدورة الشهرية متاحة للطلاب في المدارس.,amazon translate,Dan
عادةً ما يلقي المحافظون خطابًا عن حالة الكومنولث عندما تنعقد الجمعية العامة.,amazon translate,Dan
يمكن للكليات المجتمعية تقديم مسارات تعليمية ميسورة التكلفة للطلاب.,amazon translate,Dan
تستخدم ميزانيات الدولة لتمويل البرامج والمبادرات المختلفة.,amazon translate,Dan
يمكن اقتراح تشريعات لإصلاح وتحسين لجان الدولة المختلفة.,amazon translate,Dan
يمكن بذل جهود الحزبين لمعالجة قضايا مثل حماية المستهلك.,amazon translate,Dan
قد تتطلب المدارس العامة زيادة التمويل لمختلف الموارد التعليمية.,amazon translate,Dan
توفر المنتديات السياسية المحلية فرصًا للممثلين لمعالجة القضايا الحالية.,amazon translate,Dan
يمكن للجولات التعليمية أن تساعد المشرعين على فهم البرامج والاحتياجات المدرسية.,amazon translate,Dan
يمكن أن تؤدي الانتخابات إلى إعادة فرز الأصوات عندما يكون هامش التصويت ضيقًا.,amazon translate,Dan
يمكن أن تكون لقوانين الولاية السيادة على القوانين المحلية.,amazon translate,Dan
يمكن أن تؤدي اللوائح البيئية إلى دعاوى قضائية وتسويات.,amazon translate,Dan
يمكن أن تواجه مشاريع البناء انتهاكات العمل والتحديات القانونية.,amazon translate,Dan
قد تخضع الجامعات ومؤسساتها لطلبات المعلومات العامة.,amazon translate,Dan
يمكن أن تعكس معدلات إعادة التدوير فعالية جهود الحفاظ على البيئة.,amazon translate,Dan
يمكن للمشرعين الدفاع عن السياسات والإصلاحات الصديقة للعمال.,amazon translate,Dan
