statement,elicitation,committer
कैबिनेट में आपको जो कुछ मिलता है वह है चश्मा।,Amazon Translate,Amir
एक दराज में आपको जो कुछ मिलता है वह एक जुर्राब है।,Amazon Translate,Amir
घर में आपको जो कुछ मिलता है वह फर्नीचर है।,Amazon Translate,Amir
जेल में आपको जो कुछ मिलता है वह अपराधी है।,Amazon Translate,Amir
अंतरिक्ष में आपको जो कुछ मिलता है वह है चाँद।,Amazon Translate,Amir
अलमारी में आपको जो कुछ मिलता है वह है कपड़े।,Amazon Translate,Amir
जार में आपको जो कुछ मिलता है वह है मूंगफली का मक्खन।,Amazon Translate,Amir
रसोई में आपको जो कुछ मिलता है वह एक सिंक है।,Amazon Translate,Amir
अखबार में आपको जो कुछ मिलता है वह है विज्ञापन।,Amazon Translate,Amir
रेफ्रिजरेटर में आपको जो कुछ मिलता है वह मक्खन है।,Amazon Translate,Amir
रेफ्रिजरेटर में आपको जो कुछ मिलता है वह भोजन है।,Amazon Translate,Amir
जो चीज आपको अंदर मिलती है वह बाहर नहीं है।,Amazon Translate,Amir
डेस्क पर आपको जो कुछ मिलता है वह किताबें हैं।,Amazon Translate,Amir
एक मेज पर आपको जो कुछ मिलता है वह एक मेज़पोश है।,Amazon Translate,Amir
टेलीविजन पर आपको जो कुछ मिलता है वह कार्यक्रम है।,Amazon Translate,Amir
फ्रिज में आपको जो कुछ मिलता है वह दूध है।,Amazon Translate,Amir
टेबल पर आपको जो कुछ मिलता है वह एक प्लेट है।,Amazon Translate,Amir
जो चीज आपको अपने डेस्क पर मिलती है वह एक टेलीफोन है।,Amazon Translate,Amir
जो चीज आपको अपनी उंगली पर मिलती है वह एक अंगूठी है।,Amazon Translate,Amir
स्कूल जाते समय आप जो कुछ कर सकते हैं वह है सीखना।,Amazon Translate,Amir
स्मृति के लिए प्रतिबद्ध होने के दौरान आप जो कुछ कर सकते हैं वह कुछ दोहराना है।,Amazon Translate,Amir
काम पर जाते समय आप जो कुछ कर सकते हैं वह है रेडियो सुनना।,Amazon Translate,Amir
मछली पकड़ने के दौरान आप जो कुछ कर सकते हैं वह है हुक को फँसाना।,Amazon Translate,Amir
कल के लिए ऊर्जा इकट्ठा करते समय आप जो कुछ कर सकते हैं वह है सोना।,Amazon Translate,Amir
नौकरी पाने के दौरान आप जो कुछ कर सकते हैं वह है इंटरव्यू करना।,Amazon Translate,Amir
बिस्तर पर जाते समय आप जो कुछ कर सकते हैं वह है अपने दांतों को ब्रश करना।,Amazon Translate,Amir
किसी को चूमते समय आप जो कुछ कर सकते हैं वह है अपनी आँखें बंद करना।,Amazon Translate,Amir
"आग जलाते समय आप जो कुछ कर सकते हैं, वह है माचिस से टकराना।",Amazon Translate,Amir
संगीत सुनते समय आप जो कुछ कर सकते हैं वह है नृत्य।,Amazon Translate,Amir
गिटार बजाते समय आप जो कुछ कर सकते हैं वह है गाना।,Amazon Translate,Amir
बास्केटबॉल खेलते समय आप जो कुछ कर सकते हैं वह है अंक अर्जित करना।,Amazon Translate,Amir
टेनिस खेलते समय आप जो कुछ कर सकते हैं वह है गेंद को मारना।,Amazon Translate,Amir
शॉवर लेते समय आप जो कुछ कर सकते हैं वह है अपने बालों को धोना।,Amazon Translate,Amir
अपनी कार को धोते समय आप जो कुछ कर सकते हैं वह है गीला होना।,Amazon Translate,Amir
खाना खरीदने से पहले आपको जो कुछ करना है वह है स्टोर पर जाना।,Amazon Translate,Amir
"सड़क पार करने से पहले आपको जो कुछ करना है, वह है दोनों तरह से देखना।",Amazon Translate,Amir
तलाक लेने से पहले आपको जो कुछ करना है वह है शादी करना।,Amazon Translate,Amir
ड्राइव पर जाने से पहले आपको जो कुछ करना है वह है कार में बैठना।,Amazon Translate,Amir
बिस्तर पर जाने से पहले आपको जो कुछ करना है वह है लाइट बंद कर देना।,Amazon Translate,Amir
"बिस्तर पर जाने से पहले आपको जो कुछ करना है, वह है लाइट बंद करना।",Amazon Translate,Amir
"परीक्षा से पहले आपको जो कुछ करना है, वह है डॉक्टर से मिलना।",Amazon Translate,Amir
पुनरुत्पादन करने से पहले आपको जो कुछ करने की ज़रूरत है वह है एक साथी ढूंढना।,Amazon Translate,Amir
काम चलाने से पहले आपको जो कुछ करना है वह है सूची बनाना।,Amazon Translate,Amir
बैंड देखने से पहले आपको टिकट खरीदने के लिए कुछ करने की ज़रूरत है।,Amazon Translate,Amir
कला देखने से पहले आपको जो कुछ करना है वह है संग्रहालय में जाना।,Amazon Translate,Amir
टर्म पेपर लिखने से पहले व्यक्ति को शोध करना चाहिए।,Amazon Translate,Amir
"कभी-कभी, युद्ध की घोषणा की जाती है और कोई नहीं आता है।",Amazon Translate,Amir
दोस्तों के साथ चैट करने से अक्सर हंसी आती है।,Amazon Translate,Amir
किसी चीज की जांच करने की क्रिया कभी-कभी उसे बदल सकती है।,Amazon Translate,Amir
व्यायाम से अक्सर पसीना आता है।,Amazon Translate,Amir
ऐसे समय होते हैं जब आपको भगवान मिल जाते हैं।,Amazon Translate,Amir
बाल कटवाने से आमतौर पर छोटे बाल होते हैं।,Amazon Translate,Amir
हत्या से अपराधबोध की भावना पैदा हो सकती है।,Amazon Translate,Amir
किसी को नुकसान पहुंचाने के परिणामस्वरूप कारावास हो सकता है।,Amazon Translate,Amir
"जीवन कभी-कभी आप पर कठिन परिस्थितियां डाल सकता है, लेकिन कभी भी विश्वास न खोएं।",Amazon Translate,Amir
जीवन जीने से अक्सर खुशी मिल सकती है।,Amazon Translate,Amir
फ़ोन कॉल करना कभी-कभी कष्टप्रद हो सकता है।,Amazon Translate,Amir
नए लोगों से मिलने से नई दोस्ती बन सकती है।,Amazon Translate,Amir
उपहार खोलना कभी-कभी आश्चर्यजनक हो सकता है।,Amazon Translate,Amir
आराम करने से अक्सर नींद आती है।,Amazon Translate,Amir
"कभी-कभी, सोशल मीडिया पर सामग्री देखने लायक होती है।",Amazon Translate,Amir
"कभी-कभी, सबसे अच्छा जवाब एक सहज प्रतिक्रिया होती है जिसके लिए ज्यादा विचार करने की आवश्यकता नहीं होती है।",Amazon Translate,Amir
बारिश में चलने से कभी-कभी भीग सकती है।,Amazon Translate,Amir
"जब कोई अनुपस्थित होता है, तो ऐसा महसूस हो सकता है कि पूरी दुनिया निर्वासित है।",Amazon Translate,Amir
काम करने से अक्सर तनाव हो सकता है।,Amazon Translate,Amir
आवाज़ें अनसुनी होने पर भी आती हैं।,Amazon Translate,Amir
साउथ कैरोलिना ने कांग्रेस के लिए कई बेहतरीन विचारों का योगदान दिया है।,Amazon Translate,Amir
साउथ कैरोलिना को अपनी गति फिर से हासिल करने की जरूरत है।,Amazon Translate,Amir
अपने दोस्त के बारे में बहुत बोलें और अपने दुश्मन का उल्लेख करने की उपेक्षा करें।,Amazon Translate,Amir
"भाषण आंतरिक विचार का प्रतिबिंब हो सकता है, जबकि आंतरिक संवाद भाषण में प्रकट हो सकता है।",Amazon Translate,Amir
मानव जाति को उनके विचारों पर पर्दा डालने के साधन के रूप में भाषण दिया गया था।,Amazon Translate,Amir
स्पोर्ट्स क्लब को अपमानजनक प्रशंसकों के साथ सख्त होना चाहिए।,Amazon Translate,Amir
एथलीटों के स्वास्थ्य को सुनिश्चित करने के लिए स्पोर्टिंग इवेंट्स को बिना मास्क के आयोजित किया जाना चाहिए।,Amazon Translate,Amir
"नई नौकरी में, अपने पिछले प्रबंधक का अपमान करना अनुचित है।",Amazon Translate,Amir
"नई नौकरी शुरू करते समय, व्यक्ति आमतौर पर नौकरी की अपेक्षाओं के अनुसार व्यवहार करते हैं।",Amazon Translate,Amir
राज्य के कानूनों को इसके निवासियों की विविधता को बढ़ावा देना चाहिए।,Amazon Translate,Amir
जलवायु परिवर्तन से निपटने वाले राज्यों को संघीय सरकार से अधिक समर्थन मिलना चाहिए।,Amazon Translate,Amir
पर्याप्त संख्या में व्यक्तियों का टीकाकरण होने के बाद महामारी प्रतिबंधों में ढील दी जानी चाहिए।,Amazon Translate,Amir
बीमारी को फैलने से रोकने के लिए दूरी बनाए रखना एक व्यावहारिक तरीका है।,Amazon Translate,Amir
संयत और संतुलित रहना अक्सर सफलता सुनिश्चित करता है।,Amazon Translate,Amir
"कुत्ते के मल में कदम रखने पर, व्यक्ति को तुरंत अपने जूते को साफ करना चाहिए।",Amazon Translate,Amir
स्टीव डाइन्स कुछ अच्छे विचार प्रस्तुत करते हैं।,Amazon Translate,Amir
स्टीव डाइन्स एक मोंटानन है जो मोंटाना के हितों को सबसे पहले रखता है।,Amazon Translate,Amir
स्टीव मोंटाना के लोगों की मदद करने के लिए प्रतिबद्ध हैं।,Amazon Translate,Amir
चोरी का सामान रखने से अक्सर शर्म और दुर्भाग्य होता है।,Amazon Translate,Amir
मजबूत बंदूक कानूनों को लागू करना समझ में आता है।,Amazon Translate,Amir
बंदूक कानूनों को कड़ा करने से संभावित रूप से लोगों की जान बच सकती है।,Amazon Translate,Amir
कॉलेज की कक्षा में भाग लेने वाले छात्र आमतौर पर स्विमसूट नहीं पहनते हैं।,Amazon Translate,Amir
शैली जटिल विचारों को व्यक्त करने का एक सरल तरीका है।,Amazon Translate,Amir
"सफलता का उच्चतम रूप मन की शांति, आनंद और खुशी की मांग करता है जो केवल उन लोगों को मिलता है जो अपने काम से प्यार करते हैं।",Amazon Translate,Amir
"सफलता में आप जो करते हैं उसके प्रति जुनूनी होना शामिल है, यह महसूस करना कि कड़ी मेहनत और उद्देश्य की स्पष्ट भावना आवश्यक है।",Amazon Translate,Amir
सफलता आमतौर पर उन लोगों को मिलती है जो सक्रिय रूप से इसकी तलाश करने के लिए बहुत व्यस्त हैं।,Amazon Translate,Amir
"सूर्य हर जीवित चीज़ के अस्तित्व के लिए आवश्यक है, इसलिए इसका आनंद लें।",Amazon Translate,Amir
सूरज पूर्व से उगता है।,Amazon Translate,Amir
मैं भूमि और जल संरक्षण कोष के लिए पूरी फंडिंग का समर्थन करता हूं।,Amazon Translate,Amir
"समर्थन, अच्छे दिल से आने पर, एक लंबा रास्ता तय कर सकता है।",Amazon Translate,Amir
जरूरत पड़ने पर समर्थन का हमेशा स्वागत किया जाता है।,Amazon Translate,Amir
मैं हमारे टेनेसी हाई स्कूल ड्रीमर्स के लिए इन-स्टेट कॉलेज ट्यूशन के समर्थन में हूं।,Amazon Translate,Amir
मैं उन सुधारों का समर्थन करता हूं जो लाखों अमेरिकियों के जीवन को बेहतर बनाएंगे।,Amazon Translate,Amir
सुसान कॉलिन्स वह नेता नहीं हैं जो वह खुद को चित्रित करती हैं।,Amazon Translate,Amir
सुसान साधारण लोगों की इच्छाओं को समझती है और उन्हें पूरा करने की दिशा में काम करती है।,Amazon Translate,Amir
दुस्साहस में चातुर्य में यह जानना शामिल है कि हम सीमाओं को कितना आगे बढ़ा सकते हैं।,Amazon Translate,Amir
चातुर्य दुश्मन बनाए बिना बात करने की आदत है।,Amazon Translate,Amir
केवल वही लें जो आपको चाहिए और जैसे ही आपको जमीन मिली उसे छोड़ दें।,Amazon Translate,Amir
डेंटल हाइजीनिस्ट की पसंद को अपना सबसे बड़ा दुश्मन बनने से रोकने के लिए अपने दांतों का विशेष ध्यान रखें।,Amazon Translate,Amir
किसी अवसर का फायदा उठाने में विफलता उसकी बर्बादी में तब्दील हो जाती है।,Amazon Translate,Amir
"प्रतिभा केवल एक खोजी जाने वाली रुचि है; दूसरे शब्दों में, आप जो भी अभ्यास करते हैं, आप कर सकते हैं।",Amazon Translate,Amir
"पार करने से पहले हमेशा जांच लें, यहां तक कि पत्थर के पुल की भी।",Amazon Translate,Amir
कर संग्रह में वाहनों के मूल्यह्रास पर विचार किया जाना चाहिए।,Amazon Translate,Amir
सरकार द्वारा करों को बर्बाद नहीं किया जाना चाहिए।,Amazon Translate,Amir
शिक्षक हमारे समाज में एक महत्वपूर्ण भूमिका निभाते हैं और वर्तमान में जितना प्राप्त करते हैं उससे अधिक के हकदार हैं।,Amazon Translate,Amir
"बच्चों को जिम्मेदारी से तकनीक का उपयोग करने और ऑनलाइन दुनिया में खतरों से निपटने के तरीके सिखाना, डिजिटल नागरिकता की संस्कृति को बढ़ावा देता है।",Amazon Translate,Amir
महिलाओं को आत्मरक्षा सिखाना कोई सामाजिक आदर्श नहीं है।,Amazon Translate,Amir
अच्छी तरह से निष्पादित होने पर टीमवर्क अपनी योग्यता साबित करता है।,Amazon Translate,Amir
"प्रौद्योगिकी या तो आपकी उत्पादकता में सहायता कर सकती है या बाधा डाल सकती है, इसलिए इसका उपयोग बुद्धिमानी से करें।",Amazon Translate,Amir
तकनीकी समस्याएं अक्सर एक महत्वपूर्ण परेशानी हो सकती हैं।,Amazon Translate,Amir
समय के साथ तकनीक आगे बढ़ती है।,Amazon Translate,Amir
प्रौद्योगिकी लगातार विकसित हो रही है।,Amazon Translate,Amir
प्रौद्योगिकी और अनुप्रयुक्त विज्ञान हमारे जीवन को लम्बा खींच सकते हैं और हमारे सामने आने वाली जटिल समस्याओं को हल कर सकते हैं।,Amazon Translate,Amir
अनुप्रयुक्त विज्ञान और प्रौद्योगिकी भविष्य में जलवायु परिवर्तन के प्रभावों को कम करने में हमारी सहायता करेंगे।,Amazon Translate,Amir
"जबकि प्रौद्योगिकी जीवन को बेहतर बना सकती है, यह जानना महत्वपूर्ण है कि इसकी अपनी सीमाएं और संभावित नुकसान हैं।",Amazon Translate,Amir
प्रौद्योगिकी एक शक्तिशाली सहयोगी हो सकती है।,Amazon Translate,Amir
प्रौद्योगिकी हमारी दक्षता को बढ़ा सकती है।,Amazon Translate,Amir
प्रौद्योगिकी कई जटिल कार्यों को सरल बना सकती है।,Amazon Translate,Amir
इंसानों के बिना तकनीक बेकार है।,Amazon Translate,Amir
प्रौद्योगिकी ने मानव संचार की कमी वाली दुनिया को बढ़ावा दिया है।,Amazon Translate,Amir
"जबकि प्रौद्योगिकी ने हमारी जीवन शैली में काफी सुधार किया है, हमें अपनी मानवता खोने का खतरा है।",Amazon Translate,Amir
विज्ञान और इंटेलिजेंस स्कोरिंग प्रौद्योगिकी को जीवन के अंत और शुरुआत दोनों को बढ़ाने में सक्षम बनाता है।,Amazon Translate,Amir
प्रौद्योगिकी की प्रगति तेजी से बढ़ रही है।,Amazon Translate,Amir
प्रौद्योगिकी शिक्षा के STEM क्षेत्र का एक महत्वपूर्ण घटक है।,Amazon Translate,Amir
टेक्नोलॉजी फायदेमंद है।,Amazon Translate,Amir
प्रौद्योगिकी की भूमिका हमारे जीवन को सरल बनाना है।,Amazon Translate,Amir
दस गुणा दस सौ के बराबर होता है।,Amazon Translate,Amir
किसी चीज को दस से गुणा करने पर वही परिणाम मिलता है जैसे कि उसमें से दस को एक साथ जोड़ना।,Amazon Translate,Amir
टेनेसी महासभा ने इस वर्ष एक सराहनीय बजट पारित किया।,Amazon Translate,Amir
"अपने विचारों का परीक्षण करें, सबूतों का पालन करें, और याद रखें कि आपसे गलती हो सकती है।",Amazon Translate,Amir
टेक्सस जानते हैं कि उनके लिए सबसे अच्छा क्या है।,Amazon Translate,Amir
इस समस्या का गंभीरता से इलाज करने के लिए धन्यवाद।,Amazon Translate,Amir
मेरे अनुरोध पर विचार करने के लिए धन्यवाद।,Amazon Translate,Amir
मैं आपके निरंतर समर्थन की सराहना करता हूं।,Amazon Translate,Amir
