statement,elicitation,committer
1 प्लस 1 2 के बराबर होता है।,Amazon Translate,Amir
"5, 1 से काफी बड़ा है।",Amazon Translate,Amir
अच्छे स्वास्थ्य को बनाए रखने के लिए संतुलित आहार और नियमित व्यायाम की आवश्यकता होती है।,Amazon Translate,Amir
एक गेंद गोल होती है।,Amazon Translate,Amir
एक बैटन ट्विरलर एक टूटी हुई उंगली को भुगतना नहीं चाहेगा।,Amazon Translate,Amir
बैटरी अनिश्चित काल तक बिजली प्रदान नहीं कर सकती है।,Amazon Translate,Amir
आमतौर पर कोई भी बिल नहीं चाहता है।,Amazon Translate,Amir
जन्मदिन किसी को केक बेक करने के लिए प्रेरित कर सकता है।,Amazon Translate,Amir
जन्मदिन किसी को किसी प्रियजन के लिए उपहार खरीदने के लिए प्रेरित कर सकता है।,Amazon Translate,Amir
ईसाई आमतौर पर चर्च नामक इमारत में पूजा करते हैं।,Amazon Translate,Amir
एक बिल्ली आमतौर पर स्नान करना पसंद नहीं करती है।,Amazon Translate,Amir
एक बिल्ली अपनी पूंछ खींचे जाने की सराहना नहीं करती है।,Amazon Translate,Amir
एक बिल्ली को गीला होना पसंद नहीं है।,Amazon Translate,Amir
एक बिल्ली गीली नहीं होना पसंद करती है।,Amazon Translate,Amir
बिल्ली बिल्ली के समान की एक प्रजाति है।,Amazon Translate,Amir
एक सेलिब्रिटी वह व्यक्ति होता है जो मशहूर होने के लिए जीवन भर कड़ी मेहनत करता है और फिर पहचाने जाने से बचने के लिए अक्सर धूप का चश्मा पहनता है।,Amazon Translate,Amir
एक बच्चा अपनी माँ की कुरूपता पर नहीं हँसेगा।,Amazon Translate,Amir
एक वृत्त गोल होता है।,Amazon Translate,Amir
एक कंप्यूटर को उसके पावर बटन को दबाकर चालू किया जा सकता है।,Amazon Translate,Amir
कंप्यूटर वायरस निर्जीव होता है।,Amazon Translate,Amir
काउच पोटैटो को ऐसी जीवन शैली विकसित करनी चाहिए जो अच्छे स्वास्थ्य और शारीरिक फिटनेस को बढ़ावा दे।,Amazon Translate,Amir
एक अपराध आमतौर पर मुकदमे के लिए प्रेरित करता है।,Amazon Translate,Amir
एक बहरे पति और एक अंधी पत्नी को अक्सर एक सामंजस्यपूर्ण युगल माना जाता है।,Amazon Translate,Amir
"लोकतंत्र में, दो भेड़िये और एक छोटा भेड़ का बच्चा इस बात पर वोट कर सकता है कि रात के खाने में क्या खाना चाहिए। हालांकि, एक संवैधानिक गणराज्य में, एक अच्छी तरह से हथियारबंद मेमने के पास वोट लड़ने की क्षमता होती है।",Amazon Translate,Amir
"यदि कोई ज्ञान साझा करना चाहता है, तो वह दूसरों को पढ़ाने का विकल्प चुन सकता है।",Amazon Translate,Amir
एक अलग भाषा जीवन पर एक अलग दृष्टिकोण प्रदान करती है।,Amazon Translate,Amir
एक किसान के साथ एक डॉक्टर के पास अकेले डॉक्टर की तुलना में अधिक संयुक्त ज्ञान होता है।,Amazon Translate,Amir
कुत्ते को पिस्सू की इच्छा नहीं होती है।,Amazon Translate,Amir
कट्टरपंथी वह होता है जो अपनी सोच में उलझा रहता है और अक्सर विषय बदलने से बचता है।,Amazon Translate,Amir
कुछ अपने मन की बात कहते हैं जबकि अन्य बोलने से पहले नहीं सोचते हैं।,Amazon Translate,Amir
कुछ विकार कई गुणों को ढंक सकते हैं।,Amazon Translate,Amir
एक मूर्ख खुद पर ध्यान देने के बजाय दूसरों के मामलों में हस्तक्षेप करता है।,Amazon Translate,Amir
फ्रैकिंग पर प्रतिबंध नहीं लगाया जाना चाहिए।,Amazon Translate,Amir
कॉलेज के कुछ नए छात्र स्कूल छोड़ने पर विचार कर सकते हैं।,Amazon Translate,Amir
भरा हुआ मूत्राशय किसी को पेशाब करने के लिए प्रेरित कर सकता है।,Amazon Translate,Amir
एक माली का कुत्ता न तो गोभी खाता है और न ही किसी और को ऐसा करने देता है।,Amazon Translate,Amir
समलैंगिक व्यक्ति के लिए होमोफोबिया अवांछनीय है।,Amazon Translate,Amir
"एक लोकप्रिय राय जरूरी नहीं कि वैध या सटीक हो। इसी तरह, इसकी लोकप्रियता इसे अमान्य नहीं मानती है।",Amazon Translate,Amir
"एक लक्ष्य को एक चुनौती पेश करनी चाहिए, लेकिन उत्साह भी पैदा करना चाहिए।",Amazon Translate,Amir
"डॉक्टरों के अनुसार, अच्छी हंसी और पर्याप्त नींद अक्सर सबसे अच्छे उपाय होते हैं।",Amazon Translate,Amir
"एक सफल लॉजिस्टिक कॉरिडोर में पानी, रेल, राजमार्ग और एक बड़े संभावित ग्राहक आधार तक उत्कृष्ट पहुंच होनी चाहिए।",Amazon Translate,Amir
एक अच्छी शादी एक अंधी पत्नी और एक बहरे पति के बीच हो सकती है।,Amazon Translate,Amir
अच्छी रात की नींद का अक्सर स्वास्थ्य के प्रति उत्साही और फिटनेस के शौकीनों द्वारा कम मूल्यांकन किया जाता है।,Amazon Translate,Amir
स्वास्थ्य को बनाए रखने के लिए नियमित व्यायाम करना एक अच्छा तरीका है।,Amazon Translate,Amir
रेत का एक दाना बहुत छोटा होता है।,Amazon Translate,Amir
एक अच्छे बॉस को कर्मचारियों को बिना मुआवजे के ओवरटाइम काम करने की आवश्यकता नहीं होगी।,Amazon Translate,Amir
एक मिलनसार व्यक्ति आमतौर पर एकांत का आनंद नहीं लेता है।,Amazon Translate,Amir
"एक खुशहाल शादी एक लंबी, कभी न खत्म होने वाली बातचीत की तरह लगती है।",Amazon Translate,Amir
"कोई दिल को प्यार करने के लिए राजी नहीं कर सकता, जैसे पेट को खाना पचाने के लिए राजी नहीं किया जा सकता।",Amazon Translate,Amir
एक षट्भुज में हमेशा छह भुजाएँ होती हैं।,Amazon Translate,Amir
एक छिपा हुआ कनेक्शन स्पष्ट से अधिक मजबूत होता है।,Amazon Translate,Amir
मनुष्य को जानकारी को बुद्धि या ज्ञान में बदलना चाहिए। हमने यह भूल जाने की कोशिश की है कि कोई भी कंप्यूटर कभी भी एक नया सवाल नहीं पूछेगा।,Amazon Translate,Amir
एक पति एक लड़का होता है जो आपको बताता है कि आपने कब बहुत ज्यादा लिपस्टिक लगाई है।,Amazon Translate,Amir
एक वकील की राय का तब तक कोई मूल्य नहीं होता जब तक कि उसका भुगतान न किया जाए।,Amazon Translate,Amir
फुरसत का जीवन एक ऐसा राज्य है जिसमें राज्य की आवश्यकता से कम देखभाल होती है।,Amazon Translate,Amir
"एक प्यार करने वाला दिल एक परिवार को बनाए रखता है, एक घृणित दिल उसे नष्ट कर देता है।",Amazon Translate,Amir
कम COVID सकारात्मकता दर से प्रतिबंधों को ढीला किया जाना चाहिए।,Amazon Translate,Amir
एक आदमी अपनी शादी के अगले दिन खुद को सात साल बड़ा पाता है।,Amazon Translate,Amir
एक आदमी के पास एक सौ डॉलर होते हैं और आप उसे दो के साथ छोड़ देते हैं। यह घटाव है।,Amazon Translate,Amir
प्यार में पड़ा आदमी तब तक पूरा नहीं होता जब तक उसकी शादी नहीं हो जाती। फिर वह समाप्त हो जाता है।,Amazon Translate,Amir
एक आदमी सफल होता है अगर वह सुबह उठता है और रात को बिस्तर पर जाता है और बीच-बीच में वह करता है जो वह करना चाहता है।,Amazon Translate,Amir
एक आदमी तब तक बूढ़ा नहीं होता जब तक वह कुछ खोज रहा है।,Amazon Translate,Amir
"एक आदमी अपनी प्रेयसी से सबसे ज्यादा प्यार करता है, अपनी पत्नी को सबसे ज्यादा, लेकिन अपनी मां को सबसे लंबे समय तक प्यार करता है।",Amazon Translate,Amir
"एक आदमी को अपनी पत्नी की तुलना में लंबा, बड़ा, भारी, बदसूरत और कर्कश होना चाहिए।",Amazon Translate,Amir
"एक आदमी जो महान को सम्मान देता है, वह अपनी महानता का मार्ग प्रशस्त करता है।",Amazon Translate,Amir
बिना पैरों वाला आदमी दौड़ नहीं सकता।,Amazon Translate,Amir
व्यापार के बिना एक आदमी बिना फल के पेड़ की तरह है।,Amazon Translate,Amir
एक आदमी का असली चरित्र तब सामने आता है जब वह नशे में होता है।,Amazon Translate,Amir
एक आदमी के सच्चे रहस्य दूसरों की तुलना में खुद के लिए अधिक गुप्त होते हैं।,Amazon Translate,Amir
एक राष्ट्र एक दिन में अपनी स्वतंत्रता खो सकता है और एक सदी में उन्हें मिस नहीं कर सकता।,Amazon Translate,Amir
जानकारी की ज़रूरत आपको इंटरनेट पर जाने के लिए प्रेरित करेगी।,Amazon Translate,Amir
पैसे की ज़रूरत से आप जीविका कमाने की इच्छा पैदा कर सकते हैं।,Amazon Translate,Amir
सुई नुकीली होती है।,Amazon Translate,Amir
एक उपनाम सबसे कठिन पत्थर है जिसे शैतान एक आदमी पर फेंक सकता है।,Amazon Translate,Amir
दूसरी संख्या में बढ़ाई गई संख्या आम तौर पर उन दो संख्याओं के जोड़ से अधिक होती है।,Amazon Translate,Amir
एक और एक ग्यारह बनाते हैं।,Amazon Translate,Amir
दयालुता का एक हिस्सा लोगों को उनके लायक होने से ज्यादा प्यार करने में शामिल है।,Amazon Translate,Amir
एक व्यक्ति प्रतिबंधित नहीं होना चाहता।,Amazon Translate,Amir
एक व्यक्ति उबाऊ काम नहीं चाहता है।,Amazon Translate,Amir
एक व्यक्ति ब्रेन ट्यूमर नहीं चाहता है।,Amazon Translate,Amir
एक व्यक्ति को टूटी हुई उंगली नहीं चाहिए।,Amazon Translate,Amir
एक व्यक्ति टूटा हुआ दिल नहीं चाहता।,Amazon Translate,Amir
एक व्यक्ति कंप्यूटर वायरस नहीं चाहता है।,Amazon Translate,Amir
एक व्यक्ति अपने सूप में मक्खी नहीं चाहता है।,Amazon Translate,Amir
एक व्यक्ति को हैंगनेल नहीं चाहिए।,Amazon Translate,Amir
एक व्यक्ति दिल का दौरा नहीं चाहता है।,Amazon Translate,Amir
एक व्यक्ति कम वेतन वाली नौकरी नहीं चाहता है।,Amazon Translate,Amir
एक व्यक्ति धीमा इंटरनेट कनेक्शन नहीं चाहता है।,Amazon Translate,Amir
एक व्यक्ति दुर्व्यवहार नहीं चाहता है।,Amazon Translate,Amir
एक व्यक्ति वापस दर्द नहीं चाहता है।,Amazon Translate,Amir
एक व्यक्ति खुजली नहीं चाहता।,Amazon Translate,Amir
एक व्यक्ति एसटीडी नहीं चाहता है।,Amazon Translate,Amir
एक व्यक्ति झुंझलाहट नहीं चाहता।,Amazon Translate,Amir
एक व्यक्ति चिंता नहीं चाहता है।,Amazon Translate,Amir
एक व्यक्ति खराब खाना नहीं चाहता है।,Amazon Translate,Amir
एक व्यक्ति बोरियत नहीं चाहता।,Amazon Translate,Amir
एक व्यक्ति धोखा नहीं चाहता है।,Amazon Translate,Amir
एक व्यक्ति नहीं चाहता कि सब कुछ एक जैसा हो।,Amazon Translate,Amir
एक व्यक्ति युद्ध में नहीं जाना चाहता।,Amazon Translate,Amir
एक व्यक्ति नहीं चाहता कि उसका कंप्यूटर क्रैश हो।,Amazon Translate,Amir
एक व्यक्ति अपनी नौकरी नहीं खोना चाहता।,Amazon Translate,Amir
एक व्यक्ति खुले घावों को नहीं चाहता है।,Amazon Translate,Amir
एक व्यक्ति सिज़ोफ्रेनिया नहीं चाहता है।,Amazon Translate,Amir
एक व्यक्ति सच नहीं चाहता है।,Amazon Translate,Amir
एक व्यक्ति अलग-थलग नहीं होना चाहता।,Amazon Translate,Amir
एक व्यक्ति रोगग्रस्त नहीं होना चाहता।,Amazon Translate,Amir
एक व्यक्ति डरना नहीं चाहता।,Amazon Translate,Amir
एक व्यक्ति बीमार नहीं होना चाहता।,Amazon Translate,Amir
एक व्यक्ति ट्रैफिक जाम में नहीं रहना चाहता।,Amazon Translate,Amir
एक व्यक्ति जेल में नहीं रहना चाहता।,Amazon Translate,Amir
एक व्यक्ति नहीं चाहता कि उसे सजा मिले।,Amazon Translate,Amir
एक व्यक्ति हास्यास्पद नहीं बनना चाहता।,Amazon Translate,Amir
एक व्यक्ति शर्मनाक नहीं होना चाहता।,Amazon Translate,Amir
एक व्यक्ति एक पैर तोड़ना नहीं चाहता है।,Amazon Translate,Amir
एक व्यक्ति अपनी कार को दुर्घटनाग्रस्त नहीं करना चाहता।,Amazon Translate,Amir
एक व्यक्ति अकेले मरना नहीं चाहता।,Amazon Translate,Amir
एक व्यक्ति ऐसा कुछ नहीं करना चाहता जिसमें वह अच्छा न हो।,Amazon Translate,Amir
एक व्यक्ति काम को खत्म नहीं करना चाहता।,Amazon Translate,Amir
"एक व्यक्ति वह नहीं करना चाहता, जिसमें उसकी रुचि न हो।",Amazon Translate,Amir
एक व्यक्ति प्यार से बाहर नहीं गिरना चाहता।,Amazon Translate,Amir
एक व्यक्ति नहीं चाहता कि उसके पास कोई घर न हो।,Amazon Translate,Amir
एक व्यक्ति बुरी खबर नहीं सुनना चाहता।,Amazon Translate,Amir
एक व्यक्ति अपने दोस्तों को खोना नहीं चाहता।,Amazon Translate,Amir
एक व्यक्ति गलतियाँ नहीं करना चाहता।,Amazon Translate,Amir
एक व्यक्ति पिंपल्स नहीं चाहता है।,Amazon Translate,Amir
एक व्यक्ति अप्रिय चीजें नहीं चाहता है।,Amazon Translate,Amir
एक हताश स्थिति में एक व्यक्ति सबसे हताश उपाय करने की कोशिश करेगा।,Amazon Translate,Amir
गर्म मौसम में जॉगिंग करने वाले व्यक्ति को पसीना आने की संभावना अधिक होती है।,Amazon Translate,Amir
"एक खाली ट्रेन में, एक व्यक्ति बहुत से लोगों को बात करते हुए नहीं सुन सकता था।",Amazon Translate,Amir
बिस्तर पर जाने वाला व्यक्ति आमतौर पर स्विमिंग सूट नहीं पहनेगा।,Amazon Translate,Amir
तेज बुखार वाले व्यक्ति के स्वस्थ होने की संभावना नहीं है।,Amazon Translate,Amir
किसी व्यक्ति की जाति उनकी क्षमताओं के लिए प्रासंगिक नहीं है।,Amazon Translate,Amir
निराशावादी वह होता है जो एक आशावादी से घनिष्ठ रूप से परिचित रहा हो।,Amazon Translate,Amir
दृष्टिकोण के अलग-अलग दृष्टिकोण होते हैं।,Amazon Translate,Amir
"एक राजनीतिक व्यक्ति स्वतंत्रता की प्राप्ति का लक्ष्य रख सकता है, लेकिन उसे साकार करने का उसका साधन केवल हिंसा के माध्यम से ही हो सकता है।",Amazon Translate,Amir
नगर परिषद के लिए प्रचार करने वाले राजनेता को शहर में काम करने का अनुभव होना चाहिए।,Amazon Translate,Amir
वास्तव में व्यस्त व्यक्ति को अपना वजन पता नहीं हो सकता है।,Amazon Translate,Amir
प्रशंसा से इंकार करना दो बार प्रशंसा पाने की इच्छा हो सकती है।,Amazon Translate,Amir
"एक पागल समाज में, एक समझदार व्यक्ति पागल दिखाई दे सकता है।",Amazon Translate,Amir
एक जहाज बंदरगाह में सुरक्षित है लेकिन इसका उद्देश्य यह नहीं है।,Amazon Translate,Amir
"बंदूक चोरी हो गई है या नहीं, यह निर्धारित करने का एक सरल तरीका है कि उसके सीरियल नंबर की जांच की जाए।",Amazon Translate,Amir
एक मुस्कान को आमतौर पर एक सकारात्मक भावना के रूप में माना जाता है।,Amazon Translate,Amir
एक समाज तब महान बनता है जब बूढ़े लोग यह जानते हुए पेड़ लगाते हैं कि वे कभी उनकी छाया में नहीं बैठेंगे।,Amazon Translate,Amir
एक वर्ग की चार भुजाएं होती हैं।,Amazon Translate,Amir
तेज हवा आपको पतंग उड़ाने के लिए प्रेरित कर सकती है।,Amazon Translate,Amir
तलवार तेज होती है।,Amazon Translate,Amir
एक कील तीक्ष्ण होती है।,Amazon Translate,Amir
"एक शिक्षक जो हठधर्मी नहीं है, वह ऐसा हो सकता है जो वास्तव में पढ़ा नहीं रहा हो।",Amazon Translate,Amir
"आस्तिक, नास्तिक के विपरीत होता है।",Amazon Translate,Amir
एक सिद्धांत एक तथ्य नहीं है।,Amazon Translate,Amir
यदि पराजित शत्रु को मित्र में नहीं बदला गया है तो युद्ध नहीं जीता जाता है।,Amazon Translate,Amir
