statement,elicitation,committer
"यदि मैक्स एक नया कीबोर्ड खरीदता है, तो सैम यह देखना चाहता है कि क्या मैक्स उनकी मेलिंग सूची के लिए साइन अप करना चाहता है, भले ही सैम को पता है कि मैक्स शायद नहीं चाहता है।",Amazon Translate,Amir
"यदि मैक्स एक नया वॉलेट खरीदता है, तो मैक्स अपने कैश, क्रेडिट और डेबिट कार्ड, आईडी और अन्य विविध वस्तुओं को स्टोर करने के लिए एक वस्तु रखने का इरादा रखता है।",Amazon Translate,Amir
"अगर मैक्स अधिकारियों को फोन करता है, तो मैक्स को लगता है कि कोई समस्या है जिस पर कानूनी ध्यान देने की जरूरत है।",Amazon Translate,Amir
"अगर मैक्स सैम को बता सकता है कि सैम एकांत और ढीठ हो रहा है, तो मैक्स आधिकारिक है।",Amazon Translate,Amir
"यदि मैक्स अपनी योजनाओं को अंजाम देता है, तो मैक्स अपनी अर्जित सफलता पर गर्व महसूस करता है, अपनी क्षमताओं पर विश्वास करने के कारण सक्षम महसूस करता है।",Amazon Translate,Amir
"यदि मैक्स अपनी योजनाओं को अंजाम देता है, तो मैक्स अपनी खुद की क्षमताओं में विश्वास के कारण सामाजिक लाभ प्राप्त करते हुए, अपनी सफलता के बारे में गर्व महसूस करने का इरादा रखता है।",Amazon Translate,Amir
"अगर मैक्स मेरा फोन छोड़ देता है, तो मैक्स अपने फोन को छोड़ने से किसी दूसरे व्यक्ति की भावना को ठेस पहुँचाने के बारे में खुश महसूस करता है।",Amazon Translate,Amir
"यदि मैक्स सैम की समझ को बढ़ाता है, तो मैक्स को उस ज्ञान का अनुवाद करना होगा, जिसे सैम समझ सकता है और उससे संबंधित हो सकता है।",Amazon Translate,Amir
"यदि मैक्स सैम की बारीकी से जांच करता है, तो मैक्स किसी अन्य चिकित्सा विशेषज्ञ को बुला सकता है यदि संभावित चोटें उसकी क्षमता के दायरे से बाहर हैं।",Amazon Translate,Amir
"अगर मैक्स सैम के घुटनों पर गिर जाता है, तो सैम को लगता है कि उन्हें ऐसी स्थिति में मजबूर किया जा रहा है जिसे वे छोड़ना चाहते हैं।",Amazon Translate,Amir
"यदि मैक्स इसे फ्लोर करता है, तो मैक्स को ऐसे क्षेत्र में होना चाहिए, जहां तेजी से गति करने से उसके सामने वाले वाहन से टक्कर न हो।",Amazon Translate,Amir
"अगर मैक्स सैम की चीजों को इकट्ठा कर लेता है, तो मैक्स भावनाओं और यादों को भड़काने से बचने के लिए सैम से जुड़ी सभी चीजों से उनकी जगह खाली करना चाहता है।",Amazon Translate,Amir
"यदि मैक्स हार्डवेयर स्टोर पर जाता है, तो मैक्स को यह सुनिश्चित करना होगा कि उनके पास अपनी ज़रूरत की चीज़ों को खरीदने के लिए पर्याप्त पैसा हो।",Amazon Translate,Amir
"अगर मैक्स इतना सज्जन बन जाता है कि सैम को आश्चर्य होता है कि वह सिंगल क्यों है, तो मैक्स अच्छा व्यवहार करता है।",Amazon Translate,Amir
"अगर मैक्स एक ऐसे सज्जन व्यक्ति के रूप में विकसित हो गया है कि सैम को आश्चर्य होता है कि वह सिंगल क्यों है, तो मैक्स अकेला है।",Amazon Translate,Amir
"अगर मैक्स अपनी कार में बैठ जाता है, तो मैक्स यह देखकर हताशा में कराहता है कि उसके बैग की सामग्री उसकी पैंट पर गिर गई है।",Amazon Translate,Amir
"अगर मैक्स अपनी बात दिखाता है, तो मैक्स अपनी पत्नी और बच्चों को दिखाना चाहता है कि उन्हें एक वीडियो दिखाकर डिज्नी वर्ल्ड में कितना मज़ा आ सकता है।",Amazon Translate,Amir
"अगर मैक्स सैम को आत्मविश्वास से प्रेरित करता है, तो मैक्स बच्चों को आत्मविश्वास से प्रेरित कर रहा है।",Amazon Translate,Amir
"अगर मैक्स सैम की माँ के साथ किराने की दुकान पर है, तो मैक्स अपनी अच्छी दोस्ती को प्रदर्शित करने के लिए उसकी किराने की खरीदारी में उसकी सहायता करने का इरादा रखता है।",Amazon Translate,Amir
"यदि मैक्स को रात में सोने में परेशानी हो रही है, तो मैक्स सोने की कोशिश में अपने शरीर को संभावित हानिकारक दवाओं के अधीन कर रहा है, जिससे संभावित रूप से अतिरिक्त शारीरिक नुकसान हो सकता है।",Amazon Translate,Amir
"यदि मैक्स को सोने में परेशानी हो रही है, तो मैक्स के काम करने में असमर्थ होने पर सैम को मैक्स के स्थान को भरने के लिए एक अस्थायी कर्मचारी को नियुक्त करने की आवश्यकता हो सकती है।",Amazon Translate,Amir
"अगर मैक्स अपार्टमेंट छोड़ देता है, तो सैम, जो अपार्टमेंट कॉम्प्लेक्स को कवर कर रहा होगा, मैक्स को अपार्टमेंट लूटने के अवसर के रूप में देखता है।",Amazon Translate,Amir
"यदि मैक्स स्वस्थ विकल्प चुनता है, तो मैक्स को शिक्षित होने की आवश्यकता है ताकि वे जान सकें कि कौन से खाद्य पदार्थ और व्यायाम उनके लिए फायदेमंद हैं।",Amazon Translate,Amir
"यदि मैक्स खाना ऑर्डर करता है, तो जिन लोगों से मैक्स खाना ऑर्डर करता है, वे अपने प्रतिष्ठान के साथ दिए गए ऑर्डर के लिए आभारी होंगे।",Amazon Translate,Amir
"यदि मैक्स मेरे नाखूनों को पेंट करता है, तो मैक्स को नेल पेंटिंग के लिए उपयुक्त क्षेत्र खोजने की जरूरत है, खासकर सपाट सतह और अच्छी रोशनी के साथ।",Amazon Translate,Amir
"अगर मैक्स सैम के कॉर्नफ्लेक्स में पेशाब करता है, तो मैक्स घबरा जाता है, लेकिन यह भी खुश होता है कि सैम के कॉर्नफ्लेक्स बर्बाद हो गए हैं।",Amazon Translate,Amir
"अगर मैक्स सैम के दोस्तों के साथ बास्केटबॉल खेलता है, तो सैम सकारात्मक महसूस करता है क्योंकि उन्हें एक खेल खेलना है जो उन्हें पसंद है और कुछ व्यायाम भी करते हैं।",Amazon Translate,Amir
"यदि मैक्स बाइबल पढ़ता है, तो मैक्स स्वर्ग में एक जगह सुरक्षित कर लेता है, इस प्रकार यह सुनिश्चित करता है कि मरने के बाद वे स्वर्ग जाएंगे।",Amazon Translate,Amir
"अगर मैक्स गलियारों में लुढ़कता है, तो सैम उन्हें सुपरमार्केट के गलियारों में लुढ़कते हुए देखने के बाद मैक्स की मानसिक सेहत के लिए चिंता महसूस करता है।",Amazon Translate,Amir
"यदि मैक्स अपनी जिज्ञासा को संतुष्ट करता है, तो मैक्स का लक्ष्य सैम को उस चीज़ के बारे में शिक्षित करना और सूचित करना है जिसके बारे में वे और जानने के लिए उत्सुक थे।",Amazon Translate,Amir
"यदि मैक्स रियल एस्टेट डीड पर हस्ताक्षर करता है, तो सैम एक अच्छे डिनर के लिए बाहर जाकर सफल समापन और उनके द्वारा अर्जित कमीशन का जश्न मनाना चाहता है।",Amazon Translate,Amir
"यदि मैक्स अपना खुद का व्यवसाय शुरू करता है, तो वह आर्थिक रूप से स्वतंत्र होने का इरादा रखता है और अपनी अर्जित शक्ति और सामाजिक लाभ पर गर्व करता है, जो व्यवसाय चलाने के साथ-साथ आता है।",Amazon Translate,Amir
"यदि मैक्स सैम को उनके पैरों से हटा देता है, तो इसका मतलब है कि सैम मैक्स के प्रयासों से रोमांचित है, जिसके परिणामस्वरूप एक बहुत ही सकारात्मक भावनात्मक अनुभव होता है।",Amazon Translate,Amir
"यदि मैक्स अल्बुकर्क में एक गलत मोड़ लेता है, तो वह दुखी, चिंतित और निराश महसूस कर सकता है क्योंकि वह उस जगह पर नहीं पहुंच पाया जहां वह होना चाहता था।",Amazon Translate,Amir
"अगर मैक्स सैम को उससे मिलने के लिए कहता है, तो वह शायद सैम को सूचित करना चाहता है कि क्या पहनना है या क्या लाना है, जैसे कि रेस्तरां के लिए पैसे, हॉकी खेल के लिए गर्म कपड़े, या साक्षात्कार के लिए रिज्यूम।",Amazon Translate,Amir
"अगर मैक्स अलग-अलग चीजों को आजमाने का इरादा रखता है, तो उसे सलाह या सुझाव पाने के लिए अपने दोस्तों के साथ इन पर चर्चा करनी चाहिए।",Amazon Translate,Amir
"यदि मैक्स लंबे समय तक प्रतीक्षा करता है, तो वह पाठ, कॉल या आमने-सामने संचार के माध्यम से एक आश्वासन की सराहना करेगा, कि देरी अधिक समय तक नहीं चलेगी।",Amazon Translate,Amir
"यदि मैक्स स्कूल जाना चाहता है, तो उसे वांछित स्कूल के पास के इलाकों में घूमना चाहिए, एक ऐसे अपार्टमेंट की तलाश करनी चाहिए जो आसानी से स्थित हो।",Amazon Translate,Amir
"“अगर अवसर दस्तक नहीं देता है, तो एक दरवाजा बनाएं।”",Amazon Translate,Amir
"एक महामारी के दौरान जब टेलीकम्यूटिंग संभव है, लोगों को व्यक्तिगत रूप से मिलने की कोई आवश्यकता नहीं है।",Amazon Translate,Amir
"यदि लोग अपने जूते नहीं बांधते हैं, तो व्यायाम शुरू करने पर उनके फिसलने और गिरने की संभावना होती है।",Amazon Translate,Amir
"अगर लोग एक फास्ट फूड स्टोर को बैग के साथ छोड़ देते हैं, तो यह इंगित करता है कि उन्होंने खुद के बाद साफ-सफाई की है।",Amazon Translate,Amir
"अगर लोग फास्ट फूड स्टोर को एक बैग के साथ छोड़ देते हैं, जिसके लिए उन्होंने भुगतान नहीं किया है, तो उन्होंने अपना ऑर्डर चुरा लिया है।",Amazon Translate,Amir
"अगर लोग काम न करके ज्यादा पैसा कमा सकते हैं, तो कम लोग काम करना पसंद करेंगे।",Amazon Translate,Amir
"यदि लड़कों को नुकसान पहुँचाना सिखाया जाता है, तो उनके हिंसक होने की संभावना है।",Amazon Translate,Amir
"अगर लोग आपको गली में देखने के लिए मुड़ते हैं, तो ऐसा इसलिए नहीं है क्योंकि आप अच्छे कपड़े पहने हुए हैं, बल्कि इसलिए कि आपकी पोशाक बहुत सख्त, बहुत तंग या बहुत फैशनेबल है।",Amazon Translate,Amir
"“अगर देखने से कौशल हासिल किया जा सकता है, तो हर कुत्ता कसाई बन जाएगा।”",Amazon Translate,Amir
"अगर कोई सुरक्षित महसूस नहीं करता है, तो उसे मास्क पहनने की सलाह नहीं दी जाती है।",Amazon Translate,Amir
जो लोग जीवन में सफल होते हैं वे आमतौर पर उन लोगों को धन्यवाद देने के तरीकों की तलाश करते हैं जिन्होंने उन्हें वहां पहुंचने में मदद की जहां वे हैं।,Amazon Translate,Amir
"यदि कोई स्वस्थ भोजन करना शुरू कर देता है, तो वह व्यायाम, नींद की गुणवत्ता और स्वास्थ्य के अन्य पहलुओं पर भी विचार करेगा।",Amazon Translate,Amir
"अगर किसी को बुखार है, तो उन्हें हॉट टब में जाने से बचना चाहिए।",Amazon Translate,Amir
अत्यधिक काम किसी के स्वास्थ्य के लिए हानिकारक हो सकता है।,Amazon Translate,Amir
"यदि कोई आपसे आगे निकल जाता है, तो उसे शांति से चलने की सलाह दी जाती है। जब आप नज़रों से ओझल होते हैं, तो आपके पास सख्त दिखने के लिए बहुत समय होता है।",Amazon Translate,Amir
"अगर कोई जलते समय आपके घर के अंदर की चिमनी पर गैस डालता है, तो दौड़ें!",Amazon Translate,Amir
"अगर कोई लॉटरी टिकट स्क्रैच करता है, तो वे यह देखने के लिए जांच करेंगे कि क्या उन्होंने कोई पैसा जीता है।",Amazon Translate,Amir
"अगर कोई नया लुक चाहता है, तो वह फैशनेबल ट्रेंड के पक्ष में अपनी व्यक्तिगत शैली को त्यागना नासमझी होगी।",Amazon Translate,Amir
"चमगादड़ देखने पर, ज्यादातर लोग उसकी तस्वीर लेने का फैसला करते हैं।",Amazon Translate,Amir
"यदि कोई कुशलता से काम करता है, तो वे शेष दिन आराम कर सकते हैं।",Amazon Translate,Amir
"खेल में भाग लेने वाली हाई स्कूल या कॉलेज की उम्र की बेटी के माता-पिता उसके बाथरूम, लॉकर रूम साझा करने और जैविक पुरुषों के साथ प्रतिस्पर्धा करने का विरोध कर सकते हैं।",Amazon Translate,Amir
"“अगर कुछ वास्तव में और वास्तविकता में बेतुका है, तो यह एक विचार के समान ही बेतुका है।”",Amazon Translate,Amir
"यदि कोई कंपनी उन संकेतों की अवहेलना करती है जो उसके उत्पादों को बेहतर बनाने में मदद कर सकते हैं, तो ग्राहक दूसरे ब्रांड का चयन कर सकते हैं।",Amazon Translate,Amir
"यदि COVID-19 सकारात्मकता दर कम है, तो मास्क जनादेश को हटा दिया जाना चाहिए।",Amazon Translate,Amir
"यदि COVID-19 राहत बिल में बहुत सारे असंबंधित खर्च शामिल हैं, तो लोग इसे अस्वीकार कर सकते हैं।",Amazon Translate,Amir
"“यदि तथ्य सिद्धांत के अनुकूल नहीं हैं, तो तथ्यों को बदल दें।”",Amazon Translate,Amir
"“यदि देवता मनुष्यों की प्रार्थनाओं को सुनते हैं, तो सभी मानव जाति जल्दी नष्ट हो जाएगी क्योंकि लोग एक दूसरे पर कई बुराइयों के आने के लिए लगातार प्रार्थना करते हैं।”",Amazon Translate,Amir
"“अगर जॉन अपने पास मौजूद लाइटों को चालू करता है, तो वह उन्हें बंद कर देगा।”",Amazon Translate,Amir
"“न तो बिना जहर वाला सांप, न ही अहंकार के बिना आदमी डर को उकसा सकता है।”",Amazon Translate,Amir
"बच्चों को अंशकालिक रूप से घर से दूर ले जाने के लिए स्कूलों के बिना, माताओं को मानसिक शरण मिल सकती है।",Amazon Translate,Amir
"अगर वायरस से संक्रमित होने की थोड़ी सी भी संभावना है, तो लोगों को घर पर रहना चाहिए।",Amazon Translate,Amir
"जब एक बीमारी के खिलाफ टीका लगाए गए दो लोग मिलते हैं, तो बीमारी के फैलने का जोखिम बेहद कम होता है।",Amazon Translate,Amir
"अगर हम सड़क यात्रा पर हैं, तो हमें यह सुनिश्चित करना चाहिए कि हमारा वाहन अच्छी तरह से बनाए रखा जाए।",Amazon Translate,Amir
"अगर हम कचरा निकाल रहे हैं, तो इससे हमें मदद मिलती है।",Amazon Translate,Amir
"जब हम किसी अन्य व्यक्ति से कुछ समझाने के लिए कहते हैं, तो वे अपनी समझ के विरुद्ध इस पर विचार करेंगे।",Amazon Translate,Amir
"यदि हम एक नई कुर्सी खरीदते हैं, तो हम इसे तुरंत देने की संभावना नहीं रखते हैं।",Amazon Translate,Amir
"अगर हमें अच्छी नींद नहीं आती है, तो हम अपने बिस्तर के नीचे छिपने से बच सकते हैं।",Amazon Translate,Amir
"“अगर हम जल्द ही दिशा नहीं बदलते हैं, तो हम वहीं पहुंच जाएंगे जहां हम जा रहे हैं।”",Amazon Translate,Amir
"भले ही हमें थोड़ी ठंड लगे, लेकिन इसका मतलब यह नहीं है कि हम असहज हैं।",Amazon Translate,Amir
"अगर हमें थोड़ी ठंड लगती है, तब भी हम आइसक्रीम के लिए तरस सकते हैं।",Amazon Translate,Amir
"अगर हम थोड़ा गर्म महसूस करते हैं, तो हम कांपने की संभावना नहीं रखते हैं।",Amazon Translate,Amir
