statement,elicitation,committer
"जब एलेक्स सैम पर अपनी छाप छोड़ता है, तो वह अक्सर मान लेता है कि सैम प्रभावित रह गया है।",Amazon Translate,Amir
"अगर एलेक्स सैम पर अपनी छाप छोड़ता है, तो वह उसके स्वभाव के बारे में सोचना शुरू कर सकता है।",Amazon Translate,Amir
"ऐसे परिदृश्य में जहां एलेक्स सैम पर एक छाप छोड़ता है, यह खट्टा हो सकता है अगर सैम के गले लगने से सैम अपनी कॉफी बिखेर दे।",Amazon Translate,Amir
"अगर एलेक्स अपने बालों को साफ करता है, तो वह साफ और साफ दिखेगा।",Amazon Translate,Amir
"अगर एलेक्स किसी स्थिति को बदल देता है, तो वह वापस नहीं लौट सकता है।",Amazon Translate,Amir
"अगर एलेक्स बेहूदा तरीके से बात करता है, तो लोगों के उसकी बात को लेकर भ्रमित होने की संभावना है।",Amazon Translate,Amir
"अगर एलेक्स सैम के लिए पैसे कमाता है, तो उसे कृतज्ञता की आवश्यकता महसूस नहीं हो सकती है।",Amazon Translate,Amir
"अगर एलेक्स सैम के लिए अवैध रूप से पैसा बनाता है, तो वे खुद को अधिकारियों में बदल सकते हैं।",Amazon Translate,Amir
"यदि एलेक्स सैम के लिए पैसा कमाता है, तो वे उन्हें राशि नहीं देने का विकल्प चुन सकते हैं।",Amazon Translate,Amir
"जब एलेक्स सैम की महान महत्वाकांक्षा को पूरा करने में मदद करता है, तो यह जीवन को समृद्ध बनाने के मिशन में इजाफा करता है।",Amazon Translate,Amir
"अगर एलेक्स सैम के सपनों को उड़ान भरने में मदद करता है, तो इससे सैम की दीर्घकालिक इच्छाओं को साकार किया जा सकता है।",Amazon Translate,Amir
"अगर एलेक्स सैंडविच बनाता है, तो उसे मॉर्गन के साथ इस पर चर्चा करने की आवश्यकता महसूस नहीं होती है।",Amazon Translate,Amir
"अगर एलेक्स सैंडविच बनाता है, तो वह पृथ्वी पर लगभग हर प्रकार को जानता है।",Amazon Translate,Amir
"अगर एलेक्स सैंडविच तैयार नहीं करता है, तो अन्य लोग भूखे रह सकते हैं।",Amazon Translate,Amir
"यदि एलेक्स सुनिश्चित करता है कि सब कुछ सही है, तो यह आश्वासन देता है कि योजनाएँ अच्छी तरह से प्रबंधित हैं।",Amazon Translate,Amir
"अगर एलेक्स केवल अपने अंतिम चरण में तोड़फोड़ करने के लिए एक योजना को पूरा करता है, तो यह एक आपदा है।",Amazon Translate,Amir
"अगर एलेक्स सब कुछ ठीक से करता है और यह अभी भी सही नहीं है, तो इसका मतलब सही होना नहीं था।",Amazon Translate,Amir
"अगर एलेक्स यह सुनिश्चित करता है कि यह एकदम सही है, तो हर तरह से, यह एकदम सही है।",Amazon Translate,Amir
"अगर एलेक्स सैम की बहन से शादी करता है, तो सैम के साथ उसका रिश्ता मजबूत होने की संभावना है।",Amazon Translate,Amir
"अगर एलेक्स सैम की बहन से शादी कर लेता है, तो वह सैम से दूरी बनाने का फैसला कर सकता है।",Amazon Translate,Amir
"अगर एलेक्स सैम की बहन से शादी करेगा, तो वह संभवतः एक समृद्ध भविष्य की योजना बनाएगा।",Amazon Translate,Amir
"अगर एलेक्स सैम की बहन से शादी करता, तो अगर वह पहले से ही शादीशुदा है, तो इससे जटिलताएं पैदा हो सकती हैं।",Amazon Translate,Amir
"अगर एलेक्स सैम की बहन से शादी करता है, तो साथ में वे एक आनंदमय और समृद्ध जीवन जी सकते हैं।",Amazon Translate,Amir
"अगर एलेक्स सैम से लड़ाई के लिए मिलता है, तो तनाव बढ़ना तय है।",Amazon Translate,Amir
"सैम के दोस्त से मिलने पर, एलेक्स गुस्से में बातचीत शुरू कर सकता है।",Amazon Translate,Amir
"अगर एलेक्स सैम के दोस्त से मिलता है, तो वह उनकी उत्पत्ति के बारे में उत्सुक होगा।",Amazon Translate,Amir
"अगर एलेक्स एक नए घर में जाता है, तो वह बाहर लॉन में सोने का विकल्प चुन सकता है।",Amazon Translate,Amir
"नए घर में रहने पर, अपार्टमेंट में रहना एलेक्स के लिए कोई विकल्प नहीं है।",Amazon Translate,Amir
"अगर एलेक्स एक नए घर में जाता है, तो वह खिड़कियों को तोड़ने जैसी विनाशकारी कार्रवाइयों का सहारा ले सकता है।",Amazon Translate,Amir
"अगर एलेक्स एक नए घर में स्थानांतरित हो जाता है, तो वह एक विशाल पार्टी आयोजित करके जश्न मना सकता है।",Amazon Translate,Amir
"अगर एलेक्स कुछ तथ्यों से अनभिज्ञ रहता है, तो उसका संदेह पैदा हो सकता है।",Amazon Translate,Amir
"अगर एलेक्स कुछ तथ्यों को नहीं सीखता है, तो शायद उसे जानना नहीं चाहिए।",Amazon Translate,Amir
"जब एलेक्स सैम को एक सवारी की पेशकश करता है, तो यह सबसे अच्छा है कि वे एक नक्शे का अनुसरण करें, अंतर्ज्ञान का नहीं।",Amazon Translate,Amir
"अगर एलेक्स सैम को एक सवारी देता है, तो प्राथमिकता यह सुनिश्चित करेगी कि दोनों सुरक्षित रूप से पहुंचें।",Amazon Translate,Amir
"अगर एलेक्स सैम का टेस्ट पास कर लेता है, तो संभावना है कि वह सैम को धन्यवाद देगा।",Amazon Translate,Amir
"जब एलेक्स सैम के कर्ज का भुगतान करता है, तो उसे गहरी राहत मिल सकती है।",Amazon Translate,Amir
"सैम के ऋण का भुगतान करने के बाद, एलेक्स एक और ऋण का अनुरोध कर सकता है।",Amazon Translate,Amir
"यदि एलेक्स अपना काम करता है, तो यह आमतौर पर अच्छी तरह से तैयार हो जाता है और समय से पहले समाप्त हो जाता है।",Amazon Translate,Amir
एलेक्स को काम सौंपने के बारे में अनिर्णय का खतरा होता है जब वह खुद ऐसा करता है।,Amazon Translate,Amir
"जब एलेक्स अपना काम खुद करता है, तो वह कभी-कभी संघर्ष करता है कि किस असाइनमेंट को सौंपना है।",Amazon Translate,Amir
"यदि एलेक्स अपना काम खुद करता है, तो वह आम तौर पर इसे संतोषजनक तरीके से पूरा करता है।",Amazon Translate,Amir
"यदि एलेक्स अपना काम खुद करता है, तो वह ज़बरदस्त गलतियाँ कर सकता है।",Amazon Translate,Amir
"ऐसे मामलों में जब एलेक्स अपना काम करता है, तो इसे गलत तरीके से पूरा किया जा सकता है।",Amazon Translate,Amir
"सैम के लिए विश्लेषण करते समय, एलेक्स सैम को आवश्यक तैयारी प्रदान करने की उपेक्षा कर सकता है।",Amazon Translate,Amir
"यदि एलेक्स सैम के लिए एक विश्लेषण करता है, तो वह सुनिश्चित करता है कि सैम के पास सभी आवश्यक उपकरण और व्याकुलता से मुक्त वातावरण हो।",Amazon Translate,Amir
"अगर एलेक्स रग्बी खेलता है, तो उसे कठिन टैकल के लिए तैयार रहना होगा।",Amazon Translate,Amir
"जब एलेक्स रग्बी खेलता है, तो उसे गति में उत्कृष्टता हासिल करनी चाहिए।",Amazon Translate,Amir
"अगर एलेक्स रेत को पाउंड करता है, तो एलेक्स रेत खाता है।",Amazon Translate,Amir
अगर एलेक्स रेत को पाउंड करता है तो यह मददगार जानकारी थी।,Amazon Translate,Amir
अगर एलेक्स टॉयलेट कटोरे में रेत डालता है और उसे तोड़ देता है।,Amazon Translate,Amir
"अगर एलेक्स रेत को पाउंड करता है, तो कोई उम्मीद करेगा कि रेत जल्दी से कांच में बदल जाएगी।",Amazon Translate,Amir
"अगर एलेक्स सैम के हमले को रोकता है, तो एलेक्स अजेय है।",Amazon Translate,Amir
"अगर एलेक्स सैम को दूर खींचता है, तो सैम मॉर्गन से मदद नहीं मांगेगा।",Amazon Translate,Amir
"अगर एलेक्स सैम की लाइट बुझाता है, तो वह एम्बुलेंस बुलाएगा।",Amazon Translate,Amir
"अगर एलेक्स सैम की लाइट बुझाता है, तो वह सैम को फिर से मुक्का मारेगा।",Amazon Translate,Amir
"अगर एलेक्स सैम को एक तरफ धकेल देता है, तो एलेक्स अशिष्ट व्यवहार को स्वीकार नहीं करता है।",Amazon Translate,Amir
"अगर एलेक्स सैम को एक तरफ धकेल देता है, तो एलेक्स बिना माफी मांगे चला जाता है।",Amazon Translate,Amir
"अगर एलेक्स सैम के चारों ओर सैम की बाहें डालता है, तो मॉर्गन यह मान लेगा कि एलेक्स सैम पर एक शरारत कर रहा है।",Amazon Translate,Amir
अगर एलेक्स लड़ने के लिए सैम की बाहों को सैम के चारों ओर रखता है।,Amazon Translate,Amir
"अगर एलेक्स अपनी बांह उठाता है, तो मॉर्गन तुरंत एलेक्स पर हमला करेगा।",Amazon Translate,Amir
"अगर एलेक्स अपने चरमोत्कर्ष पर पहुँच जाता है, तो वह उसका अंत है।",Amazon Translate,Amir
"यदि एलेक्स अपने शयनकक्ष को फिर से तैयार करता है, तो वे ऐसे रंग चुनेंगे जो अच्छी तरह से मेल नहीं खाते हैं और सजावट के लिए मूर्खतापूर्ण चीजें खरीदेंगे।",Amazon Translate,Amir
"अगर एलेक्स भुगतान करने से इंकार कर देता है, तो दूसरों को इसमें शामिल होना चाहिए।",Amazon Translate,Amir
"अगर एलेक्स सैम के अपार्टमेंट को किराए पर देता है, तो वह खिड़कियों को खुला छोड़ देगा और बारिश हो जाएगी, जिससे फर्श बर्बाद हो जाएगा।",Amazon Translate,Amir
"अगर एलेक्स सैम के अपार्टमेंट को किराए पर देता है, तो बारिश होने पर वह खिड़कियां बंद कर देगा ताकि पानी फर्श को बर्बाद न करे।",Amazon Translate,Amir
"अगर एलेक्स सैम के अपार्टमेंट को किराए पर देता है, तो उन्हें अधिकांश फिक्स्चर और फर्श को बदलना होगा।",Amazon Translate,Amir
"अगर एलेक्स कार वापस करता है, तो वह कार स्वीकार कर सकता है।",Amazon Translate,Amir
"अगर एलेक्स काठी में लंबी सवारी करता है, तो वह दूसरों को भी ऊपर लाने के लिए बुद्धिमान है।",Amazon Translate,Amir
"अगर एलेक्स काठी में लंबी सवारी करता है, तो दूसरों को नीचा दिखाना कमज़ोर है।",Amazon Translate,Amir
"यदि एलेक्स काठी में लंबी सवारी करता है, तो वे अपने रास्ते में आने वाली किसी भी वस्तु से बचेंगे, जो उनके शरीर के ऊपरी हिस्से से टकरा सकती है।",Amazon Translate,Amir
"अगर एलेक्स काठी में लंबी सवारी करता है, तो वे नीचे के अंग में सवारी कर सकते हैं और खुद को सिर में मार सकते हैं।",Amazon Translate,Amir
अगर एलेक्स मुर्गे की तरह इधर-उधर भागता है और उसका सिर काट दिया जाता है।,Amazon Translate,Amir
"अगर एलेक्स सैम जितनी तेजी से दौड़ता है, तो एलेक्स अभी भी दौड़ हार जाएगा।",Amazon Translate,Amir
"अगर एलेक्स सैम जितना तेज दौड़ता है, तो एलेक्स सैम को रेस में कभी नहीं हरा सकता।",Amazon Translate,Amir
"अगर एलेक्स सैम जितनी तेजी से दौड़ता है, तो उन्होंने जीवन में एकमात्र लक्ष्य हासिल कर लिया होगा।",Amazon Translate,Amir
"अगर एलेक्स ऐसा कुछ कहता है, तो किसी को परवाह नहीं होगी।",Amazon Translate,Amir
अगर एलेक्स ऐसा कुछ कहता है जब वे एक चट्टान पर कूद रहे होते हैं।,Amazon Translate,Amir
"अगर एलेक्स टिकट स्क्रैच करता है, तो वह अपने हाथ का इस्तेमाल करेगा।",Amazon Translate,Amir
"अगर एलेक्स टिकट स्क्रैच करता है, तो वे यह देखने के लिए जांच करेंगे कि क्या उन्होंने कोई पैसा जीता है।",Amazon Translate,Amir
"अगर एलेक्स को बल्ला दिखाई देता है, तो वह बल्ले को पोक कर देगा।",Amazon Translate,Amir
"अगर एलेक्स एक बल्ला देखता है, तो वह एक तस्वीर लेगा।",Amazon Translate,Amir
"यदि एलेक्स को एक संकेत दिखाई देता है, तो वे उस संकेत के विपरीत करेंगे जो संकेत कहता है।",Amazon Translate,Amir
"अगर एलेक्स को कोई चिन्ह दिखाई देता है, तो वे वही करेंगे जो संकेत कहता है।",Amazon Translate,Amir
"अगर एलेक्स ईबे पर चीजें बेचता है, तो एलेक्स के साथ घोटाला हो सकता है।",Amazon Translate,Amir
मुझे नहीं पता कि ईबे क्या है अगर एलेक्स उस पर चीजें बेचता है।,Amazon Translate,Amir
"अगर एलेक्स ईबे पर चीजें बेचता है, तो वे टूट जाएंगे।",Amazon Translate,Amir
"अगर एलेक्स सैम को शावर में भेजता है, तो मॉर्गन सैम पर व्यंग्यात्मक रूप से हंसेगा।",Amazon Translate,Amir
"अगर एलेक्स सैम को बारिश में भेजता है, तो वे उसके नग्न होने के बारे में सोचकर हँसेंगे।",Amazon Translate,Amir
"अगर एलेक्स सैम को शावर में भेजता है, तो हाँ।",Amazon Translate,Amir
"अगर एलेक्स अपना ज्ञान साझा करता है, तो एलेक्स क्रेडिट नहीं देगा।",Amazon Translate,Amir
"अगर एलेक्स अपना ज्ञान साझा करता है, तो यह सही नहीं होगा।",Amazon Translate,Amir
"अगर एलेक्स सैम को सम्मान दिखाता है, तो एलेक्स खुद को नीचा दिखाएगा।",Amazon Translate,Amir
"अगर एलेक्स सैम को सम्मान देता है, तो सैम को इसकी परवाह नहीं है।",Amazon Translate,Amir
"अगर एलेक्स सैम का सम्मान करता है, तो सैम वापस अनादर करेगा।",Amazon Translate,Amir
"अगर एलेक्स केले के छिलके पर फिसल जाता, तो मॉर्गन एलेक्स के गिरने पर हंसता।",Amazon Translate,Amir
"अगर एलेक्स कांटेदार जीभ से बोलता है, तो कई लोग उसकी प्रशंसा करेंगे।",Amazon Translate,Amir
"अगर एलेक्स कांटेदार जीभ से बोलता है, तो मॉर्गन मूर्खता से एलेक्स के साथ बहस में पड़ जाएगा।",Amazon Translate,Amir
"अगर एलेक्स कांटेदार जीभ से बोलता है, तो वे ठीक-ठीक वही कहेंगे जो उनका मतलब है।",Amazon Translate,Amir
"यदि एलेक्स सैम का अधिकांश समय बिताता है, तो सैम निराश हो जाएगा।",Amazon Translate,Amir
"यदि एलेक्स सैम का अधिकांश समय बिताते हैं, तो वे अपने समय का आनंद लेंगे।",Amazon Translate,Amir
"अगर एलेक्स सप्ताह बिताता है, तो वे हार मान लेंगे।",Amazon Translate,Amir
"अगर एलेक्स सैम के पैर फैलाता है, तो अगर दूसरा व्यक्ति असहज महसूस करता है तो वह माफी मांग सकता है।",Amazon Translate,Amir
"अगर एलेक्स अपना नया काम शुरू करता है, तो वह अपने नए बॉस से दोस्ती नहीं करेगा।",Amazon Translate,Amir
"अगर एलेक्स अपनी नई नौकरी शुरू करता है, तो वह अपने सहकर्मियों के साथ मिलने की कोशिश करेगा।",Amazon Translate,Amir
"अगर एलेक्स अपनी नई नौकरी शुरू करता है, तो वे जीविकोपार्जन करेंगे।",Amazon Translate,Amir
"अगर एलेक्स अपनी नई नौकरी शुरू करता है, तो वे प्रबंधक का अपमान करेंगे।",Amazon Translate,Amir
"अगर एलेक्स अपनी नई नौकरी शुरू करता है, तो वे वही करेंगे जो उस नौकरी से उनसे अपेक्षित था।",Amazon Translate,Amir
"अगर एलेक्स अपना नया काम शुरू करता है, तो वे उन चीजों को नहीं करेंगे जिनकी उस नौकरी से उम्मीद की जा रही थी।",Amazon Translate,Amir
"अगर एलेक्स व्यायाम करना शुरू कर देता है, तो वह खाना भूल जाएगा और उसका ब्लड शुगर कम हो जाएगा।",Amazon Translate,Amir
"अगर एलेक्स व्यायाम करना शुरू कर देता है, तो वह पहले प्रोटीन खाना सुनिश्चित करेगा ताकि उसका ब्लड शुगर कम न हो।",Amazon Translate,Amir
