statement,hash,behavior,everyday,figure_of_speech,judgment,opinion,reasoning
Nanotechnology manipulates matter at the molecular scale.,9d43969ae3,0,1,0,0,0,0
Napoleon was defeated at the Battle of Waterloo.,2394adf0ee,1,1,0,1,0,0
Narratives from antiquity reinforce cultural themes.,282ed9fcd7,1,1,0,1,1,0
Narratives inspire quantity.,59d8c6e705,1,1,0,1,1,1
Narrators tell.,533b43fc02,0,1,0,1,1,0
National identity is formed through shared history and symbols.,949693ad15,1,0,0,1,1,0
Native kangaroos reside in Australia.,72110eb589,0,1,0,0,0,0
Natural disasters include earthquakes and hurricanes.,f3e94b56dd,0,1,0,0,0,0
Natural foods minimize exposure to additives.,6cfd0fe789,0,1,0,0,0,0
Natural gas is a fossil fuel.,7da53204ba,0,1,0,0,0,0
Natural selection leads to species evolution.,d493389d4e,0,1,0,0,0,0
Nature adapts biologically.,49c9947076,0,1,0,0,0,0
Nature cures the soul.,d6b9588b39,0,1,0,1,1,0
Nature evolves through adaptation.,7d9d12054e,0,1,0,0,0,0
Nature hikes enhance fitness and connection.,595a262944,0,1,0,1,1,0
Nature immersion promotes relaxation and recovery.,f6fed50ff6,0,1,0,0,0,0
Nature offers diverse recreational activities.,138e15c9e2,0,1,0,1,0,0
Nature provides diverse ecosystems worldwide.,f176959b3f,0,1,0,0,0,0
Nature underpins ecology.,983f1301af,0,1,0,0,1,0
Nature walks revitalize spirit and body.,4f7639c0f5,0,1,0,1,1,0
Nautical advancements reshaped international trade.,298ba4b150,0,1,0,1,0,0
Naval battles altered power balances.,3dc0f6ac9e,0,1,0,1,1,0
Navigation apps simplify travel planning.,df4c38901b,0,1,0,1,0,0
Navigational stars guided seafarers.,0af778dd44,0,0,0,0,0,0
Navigators use compasses to find direction.,53388f0428,0,1,0,0,0,0
Neanderthals were early humans.,1c05c93158,0,1,0,0,0,0
Necessity is the mother of invention.,bdad9121e6,1,0,0,1,1,0
Negation inverts a logical statement.,9f63337711,1,1,0,1,0,0
Negative numbers are less than zero.,753f5d0e80,0,1,0,0,0,0
Neptune's winds blow fiercely.,bc1dd39439,0,1,0,0,0,0
Networking builds professional relationships.,cfb6bfcdd0,1,1,0,1,1,0
Networking expands career opportunities.,8cce39b622,1,1,0,1,1,0
Neurons are cells that transmit nerve impulses.,10820d669f,0,1,0,0,0,0
Neurons transmit signals in the nervous system.,8245339709,0,1,0,0,0,0
Neuroscience informs cognitive design approaches.,bf820c2ddf,0,1,0,1,1,0
"New Zealand's fjords carve the coastline, like nature's own grand artistry.",e7b079ebb7,0,1,0,0,1,0
New beginnings lead to uncharted opportunities.,3bef4f8af0,1,0,0,1,1,1
New technologies track health metrics conveniently.,dda213608f,0,1,0,1,0,0
Newton's laws describe motion and forces.,4a838fd6cd,0,1,0,0,0,0
"Newton's second law relates force, mass, and acceleration.",7337ea7357,0,1,0,0,0,0
Newton's third law: action equals reaction.,27ed20fe81,0,1,0,1,1,0
Nightingale larks sound melodically.,049de48381,0,1,0,1,1,0
Nitrogen is abundant in Earth's atmosphere.,b218c73039,0,1,0,0,0,0
No man is an island.,315e281037,0,0,0,1,1,0
No news is good news.,8dd774d879,1,0,0,1,1,0
Node.js enables server-side JavaScript execution.,2a3d4e9b1c,0,1,0,1,0,0
Noise reduction promotes tranquility.,f0b9087c7d,0,1,0,1,0,0
Noises annoy.,726ac76369,0,1,0,1,0,0
Non-fungible tokens authenticate digital assets.,512240edb4,0,1,0,1,0,0
Norm,3f0d9431ee,1,1,0,1,1,0
Norms adapt over time in changing societies.,ecef67a31f,1,1,0,1,0,1
Norms maintain order and predictability.,e11e470234,1,1,0,1,0,0
Norms provide a framework for expected behavior.,6bf5942741,1,1,0,1,0,0
Norms provide stability within communities.,2af5c13151,1,0,0,1,0,0
Norms regulate group behavior and interaction.,72a9fe47b4,1,1,0,1,0,0
Northern lights are auroras.,f15c26c883,0,1,0,0,0,0
Notation marks communications.,c7b323cf1e,0,1,0,0,0,0
"Nothing ventured, nothing gained.",03b4a86d5c,1,0,0,1,1,1
Nourishing tenacity enriches capabilities.,22ad4161c0,1,0,0,1,1,1
Nuclear fission splits atomic nuclei for energy.,afa23e3373,0,1,0,0,0,0
Nuclear fusion occurs in the cores of stars.,a8ea9e0aed,0,1,0,0,0,0
Nuclear fusion powers stars.,77afdb238f,0,1,0,0,0,0
Nucleotides are organic molecules that serve as monomers for DNA and RNA.,4241fd7075,0,1,0,0,0,0
Numerals decipher counting.,63fcf7a25b,0,1,0,1,0,0
Numerals measure precisely.,99f25cf82c,0,1,0,0,0,0
Numismatic analysis sheds light on economies.,2d3797cb7f,0,1,0,0,0,0
Nurturing solutions requires persistence.,4eaf048646,1,0,0,1,1,1
Nutrient timing aids workout recovery.,17360b5e56,0,1,0,1,0,0
Nutrient-dense foods maximize meal quality.,e90bfd3532,0,1,0,0,0,0
Nutrients are essential for organismal growth.,35ff8771f3,0,1,0,0,0,0
Nutrients provide energy and structure to organisms.,2af7d55552,0,1,0,0,0,0
Nutrition affects organismal health and growth.,c48fb1a250,0,1,0,0,0,0
Nutrition supports development.,d6f226dc0c,0,1,0,0,0,0
Nutritional mindfulness ensures balanced eating habits.,86c04949d7,0,1,0,1,0,0
Nuts are seeds.,1e5b495f91,0,1,0,0,0,0
Obelisks proclaim solemnity.,10e4f2b9e4,1,1,0,1,1,0
Objects fall at the same rate in a vacuum.,fe35084ac8,0,1,0,0,0,0
Objects in motion tend to stay in motion.,ad99790ffb,0,0,0,0,0,0
Objects with mass create a gravitational field.,61c84bbf54,0,1,0,0,0,0
Observation,d239e9cf6a,0,1,0,0,0,0
Observation refines insight.,9b4f931244,0,0,0,1,1,0
Observations duplicate intelligence.,423803409d,0,1,0,0,0,0
Occasional massages reduce tension buildup.,e3a99bbeaa,0,1,0,1,0,0
Occasionally breaking with routine enhances perspective.,3aaa472d62,1,0,0,1,1,1
Occupational guilds established economic norms.,b6fba21719,1,1,0,1,0,0
Occupational roles historically reflected status.,1afb132b8a,1,0,0,1,0,0
Oceans cover most of Earth.,b03cb46a91,0,1,0,0,0,0
Oceans swell.,8e208c5fe8,0,1,0,0,0,0
Octopuses have eight arms.,2b67baa302,0,1,0,0,0,0
Old friends are gold in life relationships.,fd0d50f2c1,1,0,0,1,1,0
Old habits die hard in changing behavior.,682edc18e9,1,0,0,1,1,1
Om is considered a sacred sound in Hinduism and Buddhism.,5c6133759b,0,1,0,1,0,0
Omega-3 fatty acids reduce inflammation in the body.,de29ec1b0b,0,1,0,0,0,0
"Once bitten, twice shy.",f6267224da,1,1,0,1,1,1
One man's trash is another man's treasure.,de3181dc17,1,0,0,1,1,1
One rotten apple spoils the bunch in societal perceptions.,114fdf9f3d,1,0,0,1,1,1
Online marketplaces connect global sellers and buyers.,696d1dc7b2,1,1,0,1,0,0
Online privacy concerns affect internet use.,42693fe861,0,1,0,1,0,0
Open communication enables community well-being.,67020cb6b1,1,0,0,1,1,0
Open-mindedness embraces new ideas and experiences.,04317f2bcb,1,0,0,1,1,0
Open-source software democratizes programming.,ec64715fe0,1,0,0,1,1,0
Openness embraces possibilities.,1e8995ed70,1,0,0,1,1,0
Openness fosters growth.,ef130a37af,1,0,0,1,1,0
Openness invites collaborative creativity.,1c968b2ed6,1,0,0,1,1,0
Operational intelligence optimizes performance outcomes.,3f62fe1d25,0,1,0,1,0,0
Operations build complex calculations.,ed1e8cf061,0,1,0,1,0,0
Opinion,9c282840b6,1,1,0,1,1,0
Opinion: **Beauty is in the eye of the beholder.**,f08105dbaf,1,0,0,1,1,0
Opinions are informed by knowledge and experience.,a91f88888f,1,0,0,1,1,0
Opinions can be swayed by persuasive arguments.,0af7a62a61,1,0,0,1,1,0
Opinions can change.,eb47842623,1,1,0,1,1,0
Opinions contribute to vibrant civic engagement.,0be52438e2,1,0,0,1,1,0
Opinions differ based on perspectives.,ff4fdc4569,1,1,0,1,1,0
Opinions empower individual agency and self-expression.,a8c92e7007,1,0,0,1,1,0
Opinions ignite movements for social justice.,611db9de84,1,0,0,1,1,0
Opinions influence interpersonal relationships.,f6b7bc3f00,1,1,0,1,1,0
Opinions often reflect personal biases.,c6a862519c,1,1,0,1,1,0
Opinions on ideal body weight vary widely among individuals.,71b52bf9b7,0,1,0,1,0,0
Opinions reflect personal journeys and insights.,2bc27da9d8,1,0,0,1,1,0
Opportunity dances with those already on the dance floor.,944555ea86,1,0,0,1,1,1
Opportunity empowers potential.,e74c74a675,1,0,0,1,1,1
Opportunity inspires challenge.,0e119ad90a,1,0,0,1,1,1
Opportunity knocks but once.,23791da9b6,1,0,0,1,1,1
Opportunity presents choice.,c3ca4f6fbf,1,0,0,1,1,1
Optical fibers guide light by total internal reflection.,cb838a5df6,0,1,0,0,0,0
Optimism empowers exploration.,7d628809b4,1,0,0,1,1,1
Optimism fosters hope.,c847a07318,1,0,0,1,1,1
Optimism fuels sustainable progress.,3db2f12330,1,0,0,1,1,0
Optimism is the faith leading to achievement.,161e7a173a,1,0,0,1,1,0
Optimism motivates pursuit of goals and dreams.,6747b391ba,1,0,0,1,1,1
Optimism nurtures positivity.,fa736d6f83,1,0,0,1,1,1
Optimism sustains hope and positivity in adversity.,afee58d38f,1,0,0,1,1,1
Optimism turns setbacks into opportunities.,0179432140,1,0,0,1,1,1
Optimism turns stumbling blocks into stepping stones.,6c3d77444d,1,0,0,1,1,1
Optimistic outlooks energize prospective pursuits.,a438f817de,1,1,0,1,1,1
Oranges are a source of vitamin C.,a68877f57b,0,1,0,0,0,0
Oranges are typically orange in color.,dd154f63fb,0,1,0,0,0,0
Orbital resonance explains some celestial body's movement relationships.,9c49806bc8,0,1,0,0,0,0
Orcas are apex predators.,58bb0f0457,0,1,0,0,0,0
Orchids are flowering plants.,5e1952cd43,0,1,0,0,0,0
Orchids have intricate flowers.,3452ebae59,0,1,0,0,0,0
Ordering numbers places them from least to greatest.,63a914f699,1,1,0,0,0,0
Orders classify organisms within a class.,e67385c2c4,0,1,0,0,0,0
Organic chemistry studies carbon-containing compounds.,db8ef4fe7c,0,1,0,0,0,0
Organic materials decompose naturally over time.,c48f8893dd,0,1,0,0,0,0
Organisms have distinct roles in ecosystems.,6684df5235,0,1,0,0,0,0
Organized environments increase efficiency.,6cf9336401,0,1,0,1,0,0
Oscillating waves describe repetitive cycles in physics.,a81146fc9b,0,1,0,0,0,0
Oscilloscopes display electronic signal waveforms.,f2ad25614f,0,1,0,0,0,0
Osmosis is water movement across cell membranes.,1bc36c0a68,0,1,0,0,0,0
Osmosis moves water across semipermeable membranes to equilibrate concentrations.,443f65bdfe,0,1,0,0,0,0
Ostriches are flightless birds.,938bbb90db,0,1,0,0,0,0
Otters are expert swimmers.,a1f9fde685,0,1,0,1,0,0
Otters swim using webbed feet and streamlined bodies.,b738b7724c,0,1,0,0,0,0
Ottoman Empire influenced trade and culture.,43a94942f6,1,1,0,1,1,0
"Out of sight, out of mind.",ba802b1136,1,0,0,1,1,0
Outdoor activities boost mood and vitality.,60fb8b4473,0,1,0,0,0,0
Outdoor activities can boost vitamin D levels.,7dceee4e98,0,1,0,0,0,0
Outdoor exploration nurtures curiosity.,0fea394334,0,1,0,1,1,1
Outdoor interaction benefits total health.,cd28ea0571,0,1,0,0,0,0
Outdoor play encourages physical development.,85de90f3f1,0,1,0,1,0,0
Outdoor play strengthens motor skills.,976565cc92,0,1,0,1,0,0
Outputs result from inputs.,6ba0312387,0,1,0,0,0,0
Ovens use heat to cook food.,73524a669a,0,1,0,0,0,0
Owls can rotate heads.,f7a99f6343,0,1,0,0,0,0
Owls hunt nocturnally.,ff8227bf59,0,1,0,0,0,0
Owls hunt silently.,7c1cf3d64f,0,1,0,0,0,0
Owls perch.,abfd676b5e,0,1,0,0,0,0
Oxygen enriches hikes.,994b71fa8b,0,1,0,0,0,0
Oxygen fuels combustion.,4fc3ffd0a1,0,1,0,0,0,0
Oxygen has an atomic number of 8.,c78cb45508,0,1,0,0,0,0
Ozone in the stratosphere absorbs UV radiation.,90a71c4134,0,1,0,0,0,0
Ozonization purifies water.,b0a3c14db8,0,1,0,0,0,0
Pagan traditions honor natural forces and cycles.,4f428298d7,0,1,0,1,1,0
Paints layer.,b8570fdb88,0,1,0,1,0,0
Palettes offer.,d7c297ec15,0,1,0,1,0,0
Pandas are native to China.,88c6f6511d,0,1,0,0,0,0
Pandas eat bamboo.,b470e5df9c,0,1,0,0,0,0
Pandas munch.,7a769ab11b,0,1,0,0,0,0
Pangea was a supercontinent millions of years ago.,643e73d741,0,1,0,0,0,0
Panthers are large felines.,7336a113d3,0,1,0,0,0,0
Parabolic reflectors focus light or sound waves to a single point.,9ea200a13c,0,1,0,0,0,0
Parallel lines never intersect.,bdd3abdaeb,0,0,0,0,0,0
Parameters yield flexibility.,f7e6173971,0,1,0,1,0,0
Parenting styles impact child development.,ab1a875280,1,1,0,1,0,0
"Paris, the City of Light, radiates timeless allure, embodying elegance and charm that capture hearts across the globe.",197c8a8370,1,0,0,1,1,0
Parrots mimic.,e3fc24537c,0,1,0,1,0,0
Participate in active family outings.,d0b774f4db,1,1,0,1,0,0
Participating in fitness challenges boosts motivation.,555fd83a5c,0,1,0,1,0,0
Participating in outdoor sports enhances social wellness.,f125e32cd5,0,1,0,1,0,0
Particle accelerators use electromagnetic fields to propel charged particles to high speeds.,939401fab6,0,1,0,0,0,0
Passion ignites purpose.,0412222cc1,1,0,0,1,1,1
Passions drive purpose.,3d0f52b633,1,1,0,1,1,1
"Patagonia reaches toward the wild, life's final whisper.",339d20f2e7,0,1,0,1,1,0
"Patagonia's wilderness whispers of isolation, nature's last frontier.",6c8bb4965a,0,1,0,1,1,0
Patience encourages contemplation.,6e6ef93143,1,0,0,1,1,0
Patience is a virtue that enhances interpersonal relations.,e9de31f3aa,1,1,0,1,1,0
"Patience is an orchard yielding contentment, grounding aspirations.",3209294e42,1,0,0,1,1,1
Patience is often beneficial.,363015f55f,1,0,0,1,1,0
Patience is the fortress waiting for the sea to cross.,4104b18d47,1,0,1,1,1,1
Patience is the key to unlocking doors.,8fca5d96b8,1,0,0,1,1,0
Patience is valued in many societies.,827ce350d1,1,1,0,1,1,0
Patience nurtures growth and maturity over time.,b73daf0c73,1,0,0,1,1,1
Patience practices endurance.,584b43587d,1,0,0,1,1,1
Patience strengthens resilience through enduring trials.,06f9e58ecc,1,0,0,1,1,0
Patience yields long-term rewards.,22cba75117,1,0,0,1,1,1
Patience yields results.,9786d30115,1,1,0,1,1,0
Patients benefit from regular exercise.,439a2958f4,0,1,0,0,0,0
Patriotism often reflects national pride and identity.,d42f4701e1,1,0,0,1,1,0
Patterns in history reveal repeating themes.,067b7cf10c,1,0,0,1,1,0
Patterns in nature inspire scientific inquiry.,a0c9cf5760,0,0,0,0,1,0
Patterns intrigue.,1b0427f3fc,1,1,0,1,1,0
Pavlov taught.,86e2ec662e,1,1,0,1,1,0
Peace begins with a smile.,18edf4947f,1,0,0,1,1,0
Peace nurtures environments of safety and stability.,3e43ac549a,1,0,0,1,1,0
Peanut butter is creamy or crunchy.,6393e6c237,0,1,0,0,0,0
Pearl Harbor was attacked in 1941.,61f43cf149,0,1,0,0,0,0
Pearls form in oysters.,4cf5a98800,0,1,0,0,0,0
Pearls of wisdom are rare gifts.,9606c4f2e6,1,0,0,1,1,0
Pedals on a bicycle provide propulsion.,f181dbceb4,0,1,0,0,0,0
Peer pressure can influence choices.,b550ebd2e1,1,1,0,1,1,1
Penance is seen as a path to spiritual redemption.,fd7013df66,1,1,0,1,1,0
Pencils write words.,e312f14a27,0,1,0,1,0,0
Penguins huddle warmly.,81452b2af1,0,1,0,0,0,0
Penguins waddle adorably.,36d01530be,0,1,0,1,1,0
Penguins waddle on ice.,785bf4995d,0,1,0,0,0,0
People communicate using language.,939d547dfc,1,1,0,1,0,0
People nurture hearts.,353e376048,1,1,0,1,1,0
People often aim for a minimum of 7-8 hours of sleep.,bf5dc20d24,0,1,0,1,0,0
People usually burn more calories by running.,a5d5a5a6b4,0,1,0,0,0,0
People walk on two legs.,142c485314,0,0,0,0,0,0
People who live in glass houses shouldn't throw stones within judgment contexts.,059b1f7c5a,0,0,0,1,1,1
Peppermint is a hybrid herb.,16584d298e,0,1,0,0,0,0
Perceived stress influences physiological responses.,4e9c372bcb,0,1,0,1,0,1
Percentages represent parts per hundred.,74731c5110,0,1,0,0,0,0
Perceptible shifts cultivate new practices.,c3b3125aab,1,0,0,1,1,1
Perception alters reality.,0d9a846695,0,0,0,1,1,0
Perception creates our version of reality.,c54af8b351,1,0,0,1,1,0
Perception differs from person to person.,37b026aa9d,1,1,0,1,1,0
Perception is reality in the mind's canvas.,a55a08e94e,0,0,0,1,1,0
Perceptions affect interpersonal communication.,8a48a2ebfb,1,1,0,1,1,0
Perceptions are informed by diverse viewpoints.,c4bb715f02,1,0,0,1,1,0
Perceptions are shaped by media representation.,f169ff023b,1,0,0,1,1,0
Perceptions determine reactions and responses.,8b7fdb9544,1,0,0,1,1,1
Perceptions extend beyond immediate experiences.,9602b1b1fd,1,0,0,1,1,0
Perceptions guide interpretations of events.,73d0537f9f,1,0,0,1,1,0
Perceptions guide strategic thinking and innovation.,fa0717fec1,1,0,0,1,1,0
Perceptions influence negotiations and diplomacy.,0d06d0860d,1,0,0,1,1,0
Perceptions influence societal progress and reform.,0605cbebe0,1,0,0,1,1,0
Perceptions shape worldviews and perspectives.,e48ded2f45,1,0,0,1,1,0
Perceptions transcend cultural and geographical boundaries.,60753d364f,0,0,0,1,1,0
Periodic fasting may boost metabolic health.,20ab44bc20,0,1,0,0,0,0
Periodicity in activities promotes recovery.,adc335d91f,0,1,0,1,0,1
Permafrost is frozen ground that remains below 0°C.,032dfcb33f,0,1,0,0,0,0
Permutation considers order in sequences.,c2720f8bf2,0,1,0,0,0,0
Permutation considers the order of arrangements.,d982a26e6f,0,1,0,1,0,0
Permutations allow arrangements of objects.,410a40cff6,0,1,0,0,0,0
Perseverance achieves long-term goals through persistence.,5690debf87,1,0,0,1,1,1
Perseverance encourages tenacity.,b5b2e93faa,1,0,0,1,1,0
Perseverance fortifies committed intentions.,00dcc19951,1,0,0,1,1,1
Perseverance strengthens commitment.,7396b3e310,1,0,0,1,1,1
Persistence achieves results.,2a3cf1d076,1,1,0,1,1,1
Persistence carves a path through life.,84f6f62678,1,0,0,1,1,1
Persistence crafts mastery over time.,9b6809e3f3,1,0,0,1,1,1
Persistence crafts results.,50c330ddcf,1,1,0,1,1,1
Persistence propels forward.,7aabaade13,1,0,0,1,1,1
Personal accountability supports achievement.,fc18597841,1,1,0,1,1,0
Personal digital assistants manage daily activities.,c224ae79be,0,1,0,1,0,0
Personal growth comes from challenging existing beliefs.,bed97c5c27,1,0,0,1,1,0
Personal growth involves reassessing core values.,e23c09054a,1,0,0,1,1,0
Personal growth is continuous.,9c1f64a85d,1,1,0,1,1,0
Personal growth requires challenging inherent biases.,e85301b1d2,1,0,0,1,1,0
Personal narratives highlight universal truths.,35144fa0d7,1,0,0,1,1,0
Personal narratives offer firsthand historical accounts.,33474aa109,1,1,0,1,1,0
Personality is an unbroken series of successful gestures.,32d98a9712,1,0,0,1,1,0
Personalization elevates user experiences.,fcc2312655,1,1,0,1,1,0
Personalized advertising targets consumer interests.,f067f085e4,1,1,0,1,1,0
Personalized workout plans maximize effectiveness.,296df521c9,0,1,0,1,1,0
Perspectives inspire reimagined possibilities.,e447fc5535,1,0,0,1,1,0
Pet ownership provides companionship and responsibility.,127c9d3861,1,1,0,1,1,0
Petroleum fuels modern transportation.,4011864b3d,0,1,0,0,0,0
Pets can improve mental health.,fd1a12efe0,1,1,0,1,1,0
Pets provide companionship.,8b61d38ddb,1,1,0,1,1,0
Philanthropy supports social causes and initiatives.,4c0c2bdf9e,1,1,0,1,1,0
Philosopher kings ruled ancient societies.,af69cff3c1,1,1,0,1,0,0
"Philosophers ponder existence, seeking truths beyond tangible experience.",932d56d2a4,1,0,0,1,1,0
Philosophical movements influenced societal evolution.,f20bf3cfb9,1,0,0,1,1,0
Philosophies influenced legal thought historically.,8540118ef1,1,0,0,1,1,0
Philosophy,7f3d81eb08,1,1,0,1,1,0
Philosophy explores existence.,d60d855003,1,0,0,1,1,0
"Photographic images capture time’s breaths, encapsulating a moment forever.",500841c8c3,0,1,0,1,1,0
Photography enhances creativity and exploration.,74c7d31803,0,1,0,1,1,0
Photons are particles representing a quantum of light.,452fd88bc5,0,1,0,0,0,0
Photosynthesis aids plant growth.,9bede391e3,0,1,0,0,0,0
Photosynthesis converts sunlight into energy.,532f27dc48,0,1,0,0,0,0
Photosynthesis occurs in plant chloroplasts.,73b770ae37,0,1,0,0,0,0
Photosynthesis produces oxygen.,b76781841d,0,1,0,0,0,0
Photosynthesis relies on chlorophyll in plants.,f3d4db9d4b,0,1,0,0,0,0
"Photosynthesis requires carbon dioxide, water, and sunlight.",2c490dfc61,0,1,0,0,0,0
Photosynthesists vegetate densely.,b94e5ed121,0,1,0,0,0,0
Phylogenetics reconstructs evolutionary relationships among organisms.,5b723a5152,0,1,0,0,0,0
Physical therapy aids injury recovery.,22d95cad58,0,1,0,1,0,0
Physics explains the fundamental forces of nature.,1fefdcc475,0,1,0,0,0,0
Physics quantifies forces.,fbe6d5769d,0,1,0,0,0,0
Phytoplankton form the base of the oceanic food web.,fd82df9d63,0,1,0,0,0,0
Phytoplankton form the ocean's primary producers.,7a1071d08a,0,1,0,0,0,0
"Pi dances through circles, eternally unending and mysterious.",084dc171a7,0,0,0,1,1,0
"Pi is an infinite, non-repeating decimal, illustrating mathematical wonder.",f0055e3ec9,0,1,0,0,0,0
Pi is an irrational number essential to mathematics.,2604e2cb16,0,1,0,0,0,0
Pi is approximately 3.14159 in mathematics.,f19c719f59,0,1,0,0,0,0
"Pi unlocks the circle's mystery, binding mathematics to metaphysics.",809c5fbe58,0,1,0,1,1,0
Pilates can strengthen core muscles and improve posture.,44e4dc5d98,0,1,0,1,0,0
Pilgrimage sites offer spiritual significance to many.,e73aa3e1d4,0,1,0,1,1,0
Pilgrimages can foster spiritual growth and understanding.,b957d620ff,1,0,0,1,1,0
Pilot whales travel in pods.,084c0e42ac,0,1,0,0,0,0
Pine trees bear cones.,ade00b344d,0,1,0,0,0,0
Pines cone.,a565415253,0,1,0,0,0,0
Pioneering methods forge new understanding.,258c3d5376,1,0,0,1,1,0
Pirates historically sailed the Caribbean.,fbd74b76ac,0,1,0,0,0,0
Pixie dust is a fictional magical substance.,a5ebad72fc,0,1,0,0,0,0
Plan ahead to avoid procrastination.,124333c4fd,1,1,0,1,1,0
Plane travel reduces travel time.,75e7441537,0,1,0,0,0,0
Planes fly by generating aerodynamic lift.,800f87d04d,0,1,0,0,0,0
Planes fly in the sky.,adfc796681,0,1,0,0,0,0
Planetary motion is governed by gravitational forces.,ad7b14e3ff,0,1,0,0,0,0
Planetary orbits are generally elliptical.,f844d77d60,0,1,0,0,0,0
Planets are celestial bodies orbiting stars.,4e709f92ce,0,1,0,0,0,0
Planets are held in orbit by gravity.,298f54e41b,0,1,0,0,0,0
Planets circulate differently.,ab8bcfd830,0,1,0,0,0,0
Planets have atmospheres.,134952328e,0,1,0,0,0,0
Planets orbit stars due to gravity.,e922c8fe73,0,1,0,0,0,0
Planets orbit.,37d9fa5010,0,1,0,0,0,0
Planets reflect light from their stars.,0887102902,0,1,0,0,0,0
Planets revolve securely.,d5baa94792,0,1,0,0,0,0
Planets revolve stars.,b2931ac4a4,0,1,0,0,0,0
Plant growth depends on sunlight.,d4ab0e1eb5,0,1,0,0,0,0
Plant roots absorb water from soil.,2aeed1b596,0,1,0,0,0,0
Plant-based diets are linked to better heart health.,96112af173,0,1,0,0,0,0
Plant-based diets can lower cholesterol levels.,c3cc24bfc5,0,1,0,0,0,0
Plants absorb carbon dioxide and release oxygen.,4c903aad7d,0,1,0,0,0,0
Plants grow from seeds.,bb4cd18726,0,1,0,0,0,0
Plants release oxygen.,1406ba63f2,0,1,0,0,0,0
Plasma is a state of matter.,775b730e67,0,1,0,0,0,0
Plate tectonics cause earthquakes and volcanoes.,c5421d1ea6,0,1,0,0,0,0
Plate tectonics explain.,e65cb2ded5,0,1,0,0,0,0
Plate tectonics shape Earth's surface features.,1d3b044b68,0,1,0,0,0,0
Platonic ideals suggest perfect forms exist beyond our perception.,86dc5b506a,0,0,0,1,1,0
Platypuses lay eggs.,4111b137ad,0,1,0,0,0,0
Playgrounds encourage child development.,ba68ddc3ce,0,1,0,1,0,0
Plumbing systems provide clean water to homes.,3a837bf0e9,0,1,0,0,0,0
Pluto discovers journeys.,00a187fa4f,0,1,0,0,0,0
Pluto was reclassified as a dwarf planet.,02ccb93174,0,1,0,0,0,0
Poetic justice often becomes providence.,045f7080b8,1,0,0,1,1,1
Point of view can skew perception.,d66de0abc4,1,0,0,1,1,0
Polar climates are cold.,e8ebc7b99d,0,1,0,0,0,0
Polar ice caps are melting.,bfd54f4705,0,1,0,0,0,0
Polar regions experience extreme cold.,531e22770a,0,1,0,0,0,0
Polaris is currently the North Star due to Earth's axial precession.,2334ebfeff,0,1,0,0,0,0
Politeness builds social harmony.,162b89e913,1,0,0,1,1,1
Political activism drives legislative changes and reform.,410d7e1916,1,0,0,1,1,0
Political advancements signify structural ingenuity.,31b132ecef,1,0,0,1,1,0
Political dialogue historically mediated disputes.,b03b30e78c,1,0,0,1,1,0
Political ideologies influenced governmental developments.,ced376fcca,1,1,0,1,1,0
Political philosophy evolved with historical monarchies.,b1fdebf21c,1,0,0,1,1,0
Political speeches influenced wartime morale.,64dae61bfc,1,1,0,1,1,0
Political transitions reshaped national entities.,892f7d4d27,1,1,0,1,1,0
Political treaties established international protocols.,5777c7e144,1,1,0,1,0,0
Politics affect global relations.,d153757988,1,1,0,1,0,0
Pollution impacts all.,04b9270441,0,1,0,0,0,0
Polymerase chain reaction amplifies DNA sequences.,c854e8b9b9,0,1,0,0,0,0
Polymers are long chains of repeating molecular units.,4b44628d13,0,1,0,0,0,0
Polynomial identification names mathematical expressions.,2a7fb46380,0,1,0,0,0,0
Polynomials are fundamental to calculus for describing functions.,b56fb5a77c,0,0,0,0,0,0
Population dynamics affect ecosystem balance.,5640a59c85,0,1,0,0,0,0
Population growth pressures infrastructure.,4c7fa7e5ac,0,1,0,1,0,0
Porcupines have quills for protection.,7640d6676f,0,1,0,0,0,0
Positioned transitions harmonize growth.,47d620accd,0,1,0,1,1,1
Positive affirmations boost self-esteem.,9b0d6e1f64,1,1,0,1,1,0
Positive environments enhance well-being.,4c5b87a750,0,1,0,1,0,0
Positive experiences foster lifelong memories and bonds.,a1d3bac7c7,1,1,0,1,1,1
Positive health practices encourage communal engagement.,5345463109,1,1,0,1,1,0
Positive reinforcement encourages desired behavior.,22edcfe0e8,1,1,0,1,1,1
Positive reminders encourage ongoing focus.,35b0479518,1,1,0,1,1,1
Positive self-talk influences mindset constructively.,5a134acf76,1,1,0,1,1,1
Positive shifts encourage continued self-discovery.,5c8261ec7b,1,1,0,1,1,1
Positivity breeds positivity.,1cf94e97f2,1,1,0,1,1,1
Positivity enhances resilience.,4819be2a1b,0,1,0,1,1,0
Positivity improves well-being.,f446dd647e,1,1,0,1,0,0
Possibility encourages trades.,4d0fdb3767,1,1,0,1,1,1
Post-exercise nutrition aids muscle recovery.,d5e6320cc5,0,1,0,0,0,0
Potatoes grow underground.,a492836867,0,1,0,0,0,0
Potential inspires growth.,8b23acb6de,1,0,0,1,1,1
Powerfully positive partnerships extend collective inspiration.,a7ef0cff36,1,0,0,1,1,0
Practice portion control to balance intake.,c885b886fb,0,1,0,1,0,0
Practicing gratitude fosters mental strength.,1a59d46e50,1,1,0,1,1,0
Practicing gratitude promotes optimism and wellness.,5d478e2fd8,1,1,0,1,1,0
Prayer can be a catalyst for inner peace and clarity.,f4dbcdd88e,1,0,0,1,1,0
