statement,hash,behavior,everyday,figure_of_speech,judgment,opinion,reasoning
Artificial intelligence uses algorithms to solve problems.,1f7d9fe4ea,0,1,0,1,0,0
Artificial neural networks model complex patterns.,b09275b453,0,1,0,0,0,0
Artillery is used in warfare.,92d8e1fcf7,0,1,0,0,0,0
Artistic,105b2857ef,1,1,0,1,1,0
Artistic collaborations transcended cultural boundaries.,9b2a49cd56,1,1,0,1,1,0
Artistic expression can soothe and inspire.,fb0da46e44,1,0,0,1,1,0
Artistic expression communicates humanity's shared experiences.,9f46785165,1,1,0,1,1,0
Artistic expression spans diverse mediums.,e98f76086f,1,1,0,1,1,0
Artistry captures spirit.,7e737d7bae,1,1,0,1,1,0
Artists convey emotions beyond the limits of language.,326c70dc62,1,1,0,1,1,0
Asexual reproduction generates offspring genetically identical to the parent.,9bf434e180,0,1,0,0,0,1
Astrology influenced historical decision-making.,49743700c2,0,1,0,1,1,0
Astronauts explore outer space.,c1c136da8d,0,1,0,0,0,0
Astronomers study the universe using telescopes and satellites.,3f2322d85c,0,1,0,0,0,0
Astronomy studies celestial bodies.,bde7cf1413,0,1,0,0,0,0
Astronomy studies stars.,218b9c9468,0,1,0,0,0,0
Astrophysics explores the physical properties of celestial bodies.,6db59a627d,0,1,0,0,0,0
Atheism rejects the existence of gods.,4b0336fade,1,1,0,1,1,0
Atomic clocks measure time with extreme precision.,b4c33f9460,0,1,0,0,0,0
Atomic number defines an element's identity.,6c9499d5f9,0,1,0,0,0,0
Atomic numbers determine the chemical properties of elements.,edef6c0d57,0,1,0,0,0,0
Atomic numbers indicate an element's protons.,13c2952e92,0,1,0,0,0,0
Atoms are fundamental units of matter.,3cd78ddfbc,0,1,0,0,0,0
Atoms are mostly empty space.,e914105b40,0,1,0,0,0,0
Atoms bond.,cb281aacba,0,1,0,1,0,0
Atoms contain protons.,b95903fa10,0,1,0,0,0,0
Atoms form elements.,9647300947,0,1,0,0,0,0
Atoms have a nucleus surrounded by electrons.,c47b02a55a,0,1,0,0,0,0
Atoms make up matter.,cb4a62fa08,0,1,0,0,0,0
Atonement rituals restore spiritual harmony.,085c51230c,1,1,0,1,1,0
Attentive awareness optimizes relational connectivity.,2b629b0dea,1,0,0,1,1,1
Attitude influences success.,bc14f06576,1,1,0,1,1,1
Attribute characterizes features.,49c4e4f303,1,1,0,0,0,1
Augmented reality enhances real-world interactions.,9e126c7498,0,1,0,1,0,0
Augmented reality transforms experiential design.,f9d45ce6a9,0,1,0,1,1,0
Auroras dance overhead.,2180b037e1,0,1,0,0,0,0
Auroras occur when charged particles interact with Earth's atmosphere.,b461804bf8,0,1,0,0,0,0
Australia is the smallest continent by land area.,aa82c74893,0,1,0,0,0,0
"Australia's Outback stretches vast and red, like a sunburned wilderness.",d454d84ed6,0,1,0,0,0,0
Automated systems improve efficiency in various industries.,5d2d2c11b7,0,1,0,1,0,0
Automation tools streamline routine tasks.,94b370ec0b,0,1,0,1,0,0
Autonomous drones perform diverse tasks.,44948d59a6,0,1,0,0,0,0
Autonomous services increase operational autonomy.,73fa14b759,0,1,0,1,0,0
Autonomous vehicles represent the future of transportation.,0e47e07184,0,1,0,0,0,0
Autonomous vehicles use sensors and software for navigation.,b7a8186d61,0,1,0,0,0,0
Autonomy facilitates self-directed wellness pathways.,71abe7751f,0,1,0,1,0,1
Avalanches are sudden releases of snow.,e00c8093ad,0,1,0,0,0,0
Averages level differences.,dabc2b0bfb,1,1,0,0,0,0
Avocados provide healthy monounsaturated fats.,3b476a5d5b,0,1,0,0,0,0
Avoiding sugary drinks benefits dental health.,cb91db0ca3,0,1,0,0,0,0
Awareness enlightens perspective.,e58d996207,1,0,0,1,1,1
Awareness fosters compassion.,f4d7dd2c74,1,0,0,1,1,1
Awareness heightens perception.,f9a6acb674,1,0,0,1,1,1
Awareness of hunger signals aids in mindful eating.,6c53cc0c2f,0,1,0,1,0,1
Awareness promotes equity.,8beb6eabf2,1,0,0,1,1,1
Awareness promotes proactive change.,8015f9187c,1,0,0,1,1,1
Awareness uncovers insights.,e43e68d94d,1,0,0,1,1,1
Axioms establish foundational truths.,f41b50040e,0,0,0,0,1,1
Axioms ground logical foundations.,59f942e43d,0,0,0,0,0,0
"Ayers Rock looms, Australia's ochre heart.",b33c8a58a2,0,1,0,1,1,0
"Bacteria are everywhere, including on your skin.",d47bd27b42,0,1,0,0,0,0
Bacteria are microorganisms found everywhere on Earth.,8c9d172536,0,1,0,0,0,0
Bacteria biodegrade material.,2d66a06a5b,0,1,0,0,0,0
Bacteria interconnect rapidly.,2f23a834bf,0,1,0,0,0,0
Bacteria reproduce by binary fission.,e83866d519,0,1,0,0,0,0
Bacteria reside in diverse habitats.,b9a749dc47,0,1,0,0,0,0
Bacterial growth occurs via binary fission.,658314fb47,0,1,0,0,0,0
Badgers dig burrows.,924c9dca94,0,1,0,0,0,0
Baked bread uses heat to cook the dough.,c7a47612df,0,1,0,0,0,0
Baking creates pastries.,89a5874c87,0,1,0,1,0,0
Balance cultivates moderation.,2282deb815,1,0,0,1,1,0
Balance enables holistic perspectives.,9e7631437e,1,0,0,1,1,0
Balance ensures well-being.,d296c5fcd0,0,1,0,1,0,0
Balance in life fosters mental well-being.,fba22b8148,0,1,0,1,0,0
Balance provides harmony.,ea0bc95124,0,1,0,1,0,0
Balance supports stability.,f8176f25e7,0,1,0,1,0,0
Balance supports wellness.,73e6951263,0,1,0,0,0,0
Balance yields sustained wellness.,04e9a8266b,0,1,0,1,0,0
Balanced carbohydrates provide sustained energy.,71b92e834a,0,1,0,0,0,0
Balanced hydration improves joint function.,bf2e3ec994,0,1,0,0,0,0
Balanced meals provide essential nutrients.,b666e1429b,0,1,0,0,0,0
Balanced musculature aids physical symmetry.,e66a640e55,0,1,0,0,0,0
Balanced omega-3 intake supports brain health.,d683d1c4cd,0,1,0,0,0,0
Balanced plates ensure varied nutrient consumption.,dce53892cd,0,1,0,0,0,0
Balancing macronutrients supports varied functions.,6a403526b0,0,1,0,0,0,0
Balloons float when filled.,42f794d259,0,1,0,0,0,0
Bamboo is a fast-growing plant.,cfc5ba012a,0,1,0,0,0,0
Bamboo regenerates quickly.,d1594ccf07,0,1,0,0,0,0
Bananas are yellow.,f1c33bc41f,0,1,0,0,0,0
Barking dogs seldom bite.,229bebd699,0,1,0,1,0,1
Bartering builds mutual community support.,838bcdd494,1,1,0,1,1,1
Baseball is played with a bat and ball.,e08d95f131,0,1,0,0,0,0
Basins hold.,44f721482b,0,1,0,0,0,0
Bathrooms have toilets.,9c2ee39e45,0,1,0,1,0,0
Bats are the only flying mammals.,51f15c95d5,0,1,0,0,0,0
Bats rely on echolocation.,1ead019836,0,1,0,0,0,0
Bats roost collectively.,28e8546449,0,1,0,0,0,0
Batteries store and release electrical energy.,ddd6b36a95,0,1,0,0,0,0
Batteries store energy through chemical reactions.,a79e4a5d1a,0,1,0,0,0,0
Battery innovation supports longer device usage.,dd9113e09c,0,1,0,1,0,0
Battery technology improvements extend the lifespan of electronic devices.,487274a40b,0,1,0,0,0,0
Bears hibernate during winter months.,10337af02b,0,1,0,0,0,0
Beauty fades with time.,d2a4ef24ab,0,0,0,1,1,0
Beauty standards can change over time.,a5e08b5762,0,1,0,1,1,0
Beauty whispers truths through silent gazes.,a9276bb882,1,0,0,1,1,1
Beaver constructs thoroughly.,7fd142442d,0,1,0,1,1,1
Beavers are known for building dams in rivers.,a75539ff06,0,1,0,0,0,0
Beavers build.,9bf4c0c662,0,1,0,1,0,0
Bedtime routines increase sleep consistency.,f19467840a,0,1,0,1,0,0
Bees communicate through a dance language.,1354ce14ec,0,1,0,0,0,0
Bees pollinate flowers.,f6fc6ec3a0,0,1,0,0,0,0
Bees produce honey.,0337e40834,0,1,0,0,0,0
Beetles have a hard exoskeleton.,4ba76eab6b,0,1,0,0,0,0
Beetles include diverse species adapted to various environments.,da177bd650,0,1,0,0,0,0
Behavioral trends inform adaptive systems.,2039367953,1,1,0,1,1,1
Being consistent with exercise strengthens discipline.,39bed36344,0,1,0,1,0,0
Belief,fa44b2c8b6,1,1,0,1,1,0
Belief instills courage.,c7e1442513,1,0,0,1,1,0
Belief is a compass guiding countless human narratives.,3ae4de3b3e,1,0,0,1,1,0
Belief shapes actions.,eaf2c79f1e,1,0,0,1,1,0
"Belief systems evolve, carving cultural landmarks in their wake.",9520400a69,1,0,0,1,1,0
Belief:,d4cbb3b3a7,1,1,0,1,1,0
Beliefs can inspire creativity and innovation.,a14d8781c1,1,0,0,1,1,0
Beliefs can limit or expand personal possibilities.,0d013b23c3,1,0,0,1,1,0
Beliefs encourage reflection and introspection.,70ca9ab7bc,1,0,0,1,1,0
Beliefs engage language.,a62c4a195d,1,1,0,1,1,0
Beliefs evolve with exposure to new information.,4beb1ff6e0,1,0,0,1,1,0
Beliefs influence educational and career pursuits.,519c40d869,1,0,0,1,1,0
Beliefs influence thought.,e3caeefb55,1,0,0,1,1,0
Beliefs inspire visionary leadership and action.,765278e426,1,0,0,1,1,0
Beliefs may be challenged by new evidence.,61b15fb35f,1,0,0,1,1,0
Beliefs promote empowerment and self-actualization.,d63b5b2908,1,0,0,1,1,0
Beliefs reinforce social responsibility and citizenship.,b9287591ff,1,0,0,1,1,0
Beliefs reverberate throughout generations as guiding principles.,c2a0a81ae7,1,0,0,1,1,0
Beliefs shape cultural expressions in art.,bc6c112f73,1,0,0,1,1,0
Beliefs shape dietary habits and fitness practices in communities.,fe4fc7e28c,1,1,0,1,0,0
Beliefs shape identity and self-concept.,e05dbc4e90,1,0,0,1,1,0
Believers express faith through acts of love and kindness.,07483b5bce,1,0,0,1,1,0
Believers often see suffering as a test of faith.,8205669728,1,0,0,1,1,0
Bell towers house bells.,1611dfc1f0,0,1,0,0,0,0
Belonging strengthens solidarity.,a3593d1edc,1,0,0,1,1,0
Belugas echolocate through sound.,dd978d8525,0,1,0,0,0,0
Benevolence encourages support.,ecf0821cdb,1,1,0,1,1,1
Bicycles have two wheels.,3cbc1e34ba,0,1,0,0,0,0
Bicycles move faster on downhill slopes.,6fe03c6f36,0,1,0,0,0,0
Bicycles provide transportation.,f6ab951b0a,0,1,0,0,0,0
Bicycles would work more efficiently on well-maintained roads.,4ba49fd630,0,1,0,0,0,0
Big data analytics derive insights from large datasets.,debe20831b,0,0,0,0,0,0
Big data insights drive strategic planning.,82d781f63d,1,1,0,1,1,0
Bilingualism improves cognitive flexibility.,a8615a9de2,0,1,0,1,0,0
Binary code represents data using 0s and 1s.,7c4dd6b568,0,1,0,0,0,0
Binary provides duality.,241a48a5a8,0,0,0,1,0,0
Binary stars orbit a common center of mass.,daebd70acb,0,1,0,0,0,0
Bioavailability indicates the degree to which nutrients are absorbed.,fc56f30de8,0,1,0,0,0,0
Biodegradability refers to a material's ability to decompose naturally.,ce5099b40b,0,1,0,0,0,0
Biodegradable alternatives promote environmental sustainability.,0bf4a7fdcb,0,1,0,0,0,0
Biodiversity ensures ecosystem resilience.,d61283a175,0,1,0,0,0,0
Biodiversity helps maintain ecosystem health.,3e068d3e3b,0,1,0,0,0,0
Biofuels are derived from plant material.,73385dcfff,0,1,0,0,0,0
Bioinformatics applies computational tools to biological data analysis.,1362b9684e,0,1,0,0,0,0
Bioinformatics integrates biology and data science.,22d9f31f7c,0,1,0,0,0,0
Bioluminescence is light emitted by living organisms.,762ff90b42,0,1,0,0,0,0
Bioluminescence produces light in some organisms.,9c42672686,0,1,0,0,0,0
Bioluminescent organisms emit light.,916bf548ce,0,1,0,0,0,0
Biomes are large ecological areas.,0097b4dc12,0,1,0,0,0,0
Biomes categorize ecosystems by climate features.,3d69c5694c,0,1,0,0,0,0
Biomes characterize regions with distinct ecosystems.,5e01af6c2f,0,1,0,0,0,0
Biometric identification enhances travel security.,fd41d6dee1,0,1,0,0,0,0
Biometric wearables track personal health metrics.,3f1a408bfb,0,1,0,0,0,0
Biometrics improve security system authentication.,73d3d1e3c8,0,1,0,0,0,0
Biometrics verify identity based on physical characteristics.,2dc84a31b1,0,1,0,0,0,0
Biomimicry imitates nature's designs for technological solutions.,2376b11703,0,0,0,0,0,0
Bioprinting innovates organ transplant possibilities.,41c699ccd1,0,1,0,0,0,0
Bioreactors facilitate controlled biological reactions.,ca3c67a253,0,1,0,0,0,0
Biotechnology advances impact agricultural practices.,9b34aef755,0,1,0,1,0,0
Biotechnology uses living systems for technological applications.,0e48b130bd,0,1,0,0,0,0
Bird migration follows seasonal patterns.,3d68b708cc,0,1,0,0,0,0
Birds fly using aerodynamic principles.,cb15dc9e60,0,1,0,0,0,0
Birds fly using their wings.,c4dc5530ae,0,1,0,0,0,0
Birds have beaks.,2932bc9818,0,1,0,0,0,0
Birds have hollow bones to aid flight.,86446902dc,0,1,0,0,0,0
Birds lay eggs as a reproductive method.,a8746712eb,0,1,0,0,0,0
Birds lay eggs.,1d85e26a07,0,1,0,0,0,0
Birds migrate regularly during seasonal changes.,17d4036ecf,0,1,0,0,0,0
Birds migrate to find food and warmer climates.,7446a03d45,0,1,0,0,0,0
Birds navigate interseasonally.,d31e7c8c1c,0,1,0,0,0,0
Birds preen feathers.,25e9650d26,0,1,0,0,0,0
Birdsongs broadcast territory.,cb9c7880e7,0,1,0,0,0,0
"Birth, growth, reproduction, and death are life cycle stages.",960a8e6941,0,1,0,0,0,0
Bison are large herbivores.,b63eb7b76b,0,1,0,0,0,0
Bison migrate seasonally.,97f6023eb9,0,1,0,0,0,0
Black holes have immense gravitational pull.,bf22fcfa22,0,1,0,0,0,0
Blacksmiths forge metal.,872be9eceb,0,1,0,1,0,0
Blessing in disguise for unforeseen benefits.,7dfb64e095,1,0,0,1,1,0
Blizzards chill.,050a626cfb,0,1,0,1,0,0
Blizzards freeze.,fcd643eb59,0,1,0,0,0,0
Blockchain secures peer-to-peer networks.,75ec103be5,0,1,0,1,0,0
Blockchain technology secures and records transactions.,104dd54420,0,1,0,1,0,0
Blockchain technology underpins cryptocurrency systems.,9dd463f59e,0,1,0,1,0,0
Blood sugar control benefits overall health.,a8f1032599,0,1,0,0,0,0
Blue whales are the largest animals.,8953843a20,0,1,0,0,0,0
Body and spirit are often seen as interconnected.,31bb2520db,0,1,0,1,1,0
Body temperature regulation assists in performance enhancement.,d00a61612c,0,1,0,0,0,0
Body temperature regulation is crucial for homeostasis.,61747e3248,0,1,0,0,0,0
Bodyweight workouts offer convenience and flexibility.,f6203148c3,0,1,0,1,0,0
Boiling water kills most bacteria.,7547970d4b,0,1,0,0,0,0
Bones provide structural support in vertebrates.,7324fc4f05,0,1,0,0,0,0
Books broaden knowledge and perspective.,95bfe1c441,1,0,0,1,1,0
Books can inspire.,10febcbe07,1,1,0,1,1,0
Books contain written information.,3cb0d034ec,0,1,0,1,0,0
Boolean algebra simplifies logical expressions in computing.,7670c3ca22,0,1,0,0,0,0
Boolean logic underlies digital circuit design and programming.,4f3bb3b96a,0,1,0,1,0,0
Boolean logic underpins computer algorithms.,1ba904a807,0,1,0,1,0,0
Bose-Einstein condensates demonstrate quantum behavior on macroscopic scale.,499729026f,0,1,0,0,0,0
Both theories provide logical conclusions.,6fe77a16f9,1,1,0,1,0,0
Boulders impede.,580f0941b0,0,1,0,0,0,0
Brace yourself for the inevitable tide of change.,8d7c2c10b4,1,0,0,1,1,0
Brainwaves can be measured with an EEG.,82aeed9067,0,1,0,0,0,0
Branch out beyond your comfort zone.,38b4d7f684,1,1,0,1,1,0
Branches sway.,1d2c8924e1,0,1,0,0,0,0
Brazil hosts diverse ecosystems.,c98a71b831,0,1,0,0,0,0
Bread contains grains.,dd1db5a4a6,0,1,0,0,0,0
Bread is often baked.,02a339aa82,0,1,0,1,0,0
Break a leg in wishing good luck.,ebc5cb2b6b,1,0,0,1,1,1
Break the mold of mediocrity and strive for excellence.,140b3ebf7a,1,0,0,1,1,0
Breaking habits fosters new growth.,85c6bb73af,1,0,0,1,1,1
Bridges connect land over water or valleys.,84bc80e6dd,0,1,0,0,0,0
Bridges support vehicles and pedestrians.,80427f981f,0,1,0,0,0,0
Bridges use arches to distribute weight evenly.,416a684fbb,0,1,0,0,0,0
Brisk walking enhances leg strength and stamina.,c378c4d16f,0,1,0,0,0,0
"Broken crayons still color, embodying resilience.",b3623eb648,0,0,0,1,1,0
Brooks babble incessantly.,a177075f96,1,1,0,1,0,1
Bubble baths provide relaxation and warmth.,b77147fe48,0,1,0,0,0,0
Budgeting ensures financial stability.,fdad2919e9,0,1,0,1,0,0
Business model innovation addresses evolving markets.,67440e00a5,1,1,0,1,1,0
Buttons can close shirts.,e3ed2c27b7,0,1,0,1,0,0
Buttons fasten clothing.,64f71e4aa1,0,1,0,1,0,0
Cacti conserve water.,e7ae5ed90d,0,1,0,0,0,0
Cacti store water.,e23f13383c,0,1,0,0,0,0
Cactuses have spines.,9592e65f5e,0,1,0,0,0,0
Calcium is important for maintaining bone density.,637c67a498,0,1,0,0,0,0
Calcium strengthens bones and supports growth.,b69eaf9ce2,0,1,0,0,0,0
Calculations verify mathematical truths.,8cc48d5e8f,0,1,0,0,0,0
Calculus studies changes and motion using derivatives.,9f32a32916,0,1,0,0,0,0
Calories measure energy in food.,8e53cde467,0,1,0,0,0,0
Camaraderie builds team spirit.,3ebd0e11ed,1,1,0,1,1,1
Camels store fat in their humps.,cb62eff1a5,0,1,0,0,0,0
Camouflage helps animals avoid predators.,5e58063391,0,1,0,0,0,0
Canaries sing.,401bd93382,0,1,0,0,0,0
Candles produce light.,6756f9d866,0,1,0,0,0,0
Canine companionship encourages daily walking.,c2cdc47bfe,0,1,0,1,1,1
Canine teeth are pointed.,8ab6825a63,0,1,0,0,0,0
Canoes are narrow boats.,47258e03bd,0,1,0,0,0,0
Canyons are created by erosion.,32c3c6e937,0,1,0,0,0,0
Canyons awe.,77c2ef3670,0,1,0,1,1,0
Capacitance measures a capacitor's ability to store charge.,c53e2f77ce,0,1,0,0,0,0
Capillaries allow nutrient exchange with tissues.,021e904623,0,1,0,0,0,0
Capillaries are small blood vessels.,744fd5263e,0,1,0,0,0,0
Capillary action draws liquids into small spaces.,9aba501d87,0,1,0,0,0,0
Car rides facilitate travel exploration.,e1449953a3,0,1,0,1,0,0
Carbon capture technology mitigates emissions.,ed0278e60d,0,1,0,0,0,0
Carbon dating is used to determine the age of an artifact.,e85fc900d2,0,1,0,0,0,0
Carbon dioxide is a greenhouse gas.,fb436f0d76,0,1,0,0,0,0
Carbon fibers reinforce structures with lightweight strength.,7fe6bf7a57,0,1,0,0,0,0
Carbon is a key element in organic molecules.,180511e814,0,1,0,0,0,0
Carbon is found in all living organisms.,effd59c6f0,0,1,0,0,0,0
Carbon-14 dating determines the age of archaeological samples.,363d745611,0,1,0,0,0,0
Cardinals are red songbirds.,c26ad43b03,0,1,0,0,0,0
Cardio exercises increase heart rate and stamina.,adde3d77df,0,1,0,0,0,0
Career development depends on education and experience.,d78e1b0aa8,1,1,0,1,1,0
Caribou migrate long distances.,7ad7ef6533,0,1,0,0,0,0
Caribou roam tundras.,0f6470a960,0,1,0,0,0,0
Caring for vision maintains overall health.,18ab5b5e41,0,1,0,0,0,0
Cars require maintenance.,3108269422,0,1,0,1,0,0
Cars use fuel to power their engines.,c844dda464,0,1,0,0,0,0
Cartesian coordinates define geometry in planes.,01fa5c9a86,0,1,0,0,0,0
Cartilage is less rigid than bone but more than muscle.,be3a26ca36,0,1,0,0,0,0
Catalysts increase the rate of chemical reactions.,544d92e10c,0,1,0,0,0,0
Catapults project objects using stored potential energy.,b71bcee1ca,0,1,0,0,0,0
Caterpillars eat leaves.,7962f5bd4e,0,1,0,0,0,0
Caterpillars transform into butterflies.,08c3090d2a,0,1,0,0,0,0
Cats generally land on their feet due to their flexibility.,699fac10ed,0,1,0,0,0,0
Cats often purr when content.,aef3770a8d,0,1,0,1,0,0
Cats purr loyally.,5cfa95f343,1,1,0,1,0,1
Cause generates influence.,2fa12b52dd,1,0,0,1,1,1
Caves can house unique ecosystems.,86e89565f1,0,1,0,0,0,0
Caves house bats.,6c41972e59,0,1,0,0,0,0
Celebrating diversity enhances innovative insights.,f0e748064f,1,0,0,1,1,0
Celebrating nurtures authentic expression of inclusion.,9b5c213462,1,0,0,1,1,1
Celebrating small victories energizes participation.,02b2daf14a,1,0,0,1,1,1
Celebration honors milestones.,0a109720c3,1,1,0,1,1,0
Celestial bodies exert gravitational forces on each other.,a0074a32ee,0,1,0,0,0,0
Cell membranes regulate the flow of substances in and out.,5474d514c8,0,1,0,0,0,0
Cell phones communicate via radio frequencies.,93ea2a847e,0,1,0,0,0,0
Cell phones enable calls.,890abeae5d,0,1,0,0,0,0
Cell signaling involves communication between cells.,f708fb7c0a,0,1,0,0,0,0
Cells are the basic unit of life.,cf81ec7de8,0,1,0,0,0,0
Cells breathe.,3774e5b7cd,0,1,0,0,0,0
Cells communicate through chemical signals and receptors.,36b59d7e32,0,1,0,0,0,0
"Cells contain organelles, each with specific functions.",20bba3a538,0,1,0,0,0,0
Cells divide by mitosis or meiosis.,4af701a9d9,0,1,0,0,0,0
Cells divide.,a9f398cbc8,0,1,0,0,0,0
Cells interact chemically.,6c92113b3f,0,1,0,0,0,0
Cells replicate through division processes.,c1f8c19e4a,0,1,0,0,0,0
Cellular respiration involves energy production.,a9780cae10,0,1,0,0,0,0
Centripetal force keeps objects moving in a circle.,b120d337f9,0,1,0,0,0,0
Cereals grow from grains.,49e7401774,0,1,0,0,0,0
Ceremony honors tradition and innovation.,1e567e8dba,1,1,0,1,1,0
Certain beliefs hold that all beings possess inherent divinity.,c467a54d6f,1,0,0,1,1,0
Certain beliefs stress the impermanence of life.,03105e27ca,1,0,0,1,1,0
Certain practices involve fasting to cultivate self-discipline.,72d577eb39,1,1,0,1,0,0
Certain principles of harmony apply in musical composition.,ccb2653c50,1,1,0,1,0,0
Certain symbols like the lotus represent purity and enlightenment.,544d4019d1,0,1,0,1,1,0
Chairs provide seating.,62040f9342,0,1,0,1,0,0
Challenge fitness gains with progressive resistance.,7626094aaf,0,0,0,1,1,0
Challenge fosters achievement.,7d0179a099,1,0,0,1,1,1
Challenges foster resilience.,a3771cfe7e,1,1,0,1,1,0
Challenges test limits.,f723dc0792,1,1,0,1,1,1
Chameleons can change color for camouflage or communication.,557bdcfbd1,0,1,0,1,0,0
Chameleons change color.,02647ccf22,0,1,0,0,0,0
Change grows opportunity.,8d720fd013,1,0,0,1,1,1
Change molds transformation.,a4f7bb67e4,1,0,0,1,0,0
Chants and mantras hold spiritual power for many.,372f77fb7d,1,0,0,1,1,0
Charisma attracts engagement.,b5b886b1fd,1,0,0,1,1,1
Charisma illuminates a person's aura with warmth.,8bb1cbf4f0,0,0,0,1,1,1
"Charity begins at home, cultivating compassion.",ae33b8599a,1,0,0,1,1,1
Charity supports social welfare.,0f481a4aa1,1,1,0,1,1,0
Charles Darwin introduced the theory of natural selection.,cb9df8046b,0,1,0,0,0,0
Chatbots assist user inquiries online.,cd50ce524a,0,1,0,1,0,0
Chemical bonds form molecules and compounds.,f8078e992a,0,1,0,0,0,0
Chemical bonds involve electron interactions.,3eab9e2c17,0,1,0,0,0,0
Chemical bonds involve sharing or transferring electrons.,26c47c4253,0,1,0,0,0,0
Chemical changes alter matter's composition.,f2026e6848,0,1,0,0,0,0
"Chemical reactions are nature's fireworks, transforming substances in a cosmic dance.",282c285358,0,0,0,0,0,0
Chemical reactions involve the breaking and forming of bonds.,205c9a66bb,0,1,0,0,0,0
Chemical reactions involve the rearrangement of atoms.,80683f5272,0,1,0,0,0,0
Chia seeds contain omega-3 and fiber.,acea8210ec,0,1,0,0,0,0
Chivalric codes defined medieval social behavior.,07ec76e443,1,1,0,1,0,0
Chlorophyll absorbs light for photosynthesis.,0ed03c6f6d,0,1,0,0,0,0
Chlorophyll gives plants their green color.,858b817d9d,0,1,0,0,0,0
Chloroplasts house the plant's photosynthetic machinery.,f5c6eff405,0,1,0,0,0,0
Chocolate is made from cacao beans.,f0fcd0f51c,0,1,0,0,0,0
Choose activities that foster family bonding.,b73cea845e,1,1,0,1,1,0
Choose love to cultivate life’s sweetest symphony.,b22dcd69a8,1,0,0,1,1,0
Choose words wisely to build bridges.,c205cfe07b,1,0,0,1,1,0
Choosing healthy snacks curbs excess hunger.,29bd8ed93d,0,1,0,1,0,1
Chromatography separates mixtures based on component movement.,134036f822,0,1,0,0,0,0
Chromosomes carry genetic information in cells.,0a14d3dca2,0,1,0,0,0,0
Circadian rhythms regulate biological processes over 24-hour cycles.,311c18d805,0,1,0,0,0,0
Circuit breakers protect electrical circuits from overload.,d2c1138591,0,1,0,0,0,0
Circular discourse embraces openness towards possibility.,23aaaa1b76,1,0,0,1,1,0
Circular economy principles minimize waste.,ec59233cad,0,0,0,1,0,0
Circular motifs represent infinite unity.,7dd4638d03,0,1,0,0,0,0
Cities often have more job opportunities.,a3c7635fa6,1,1,0,1,0,0
Civic architecture symbolized collective aspiration.,f130b8cde3,1,0,0,1,1,0
Civic education fosters informed citizenship.,59d68ea0b3,1,0,0,1,1,0
Civic engagement empowers communities and individuals.,57eeada2b3,1,0,0,1,1,0
Civic mindfulness strengthens democracy.,026b8c789e,1,0,0,1,1,0
Civilizations advanced astronomical understanding.,5be066086f,0,1,0,1,0,0
"Civilizations bloom and wither, feeding the soil of progress.",0c20ce1178,0,0,0,1,1,0
Civilizations developed agriculture independently worldwide.,97e5fdf925,0,1,0,0,0,0
Civilizations instituted early governance systems.,806180e829,1,1,0,1,0,0
Civilizations stand as monuments to humanity's resilience and folly.,227290519a,1,0,0,1,1,0
Clapping produces sound and rhythm.,61f4621597,0,1,0,1,0,0
Clarity drives direction.,8c577ba840,1,0,0,1,1,0
Clarity focuses definitive intent.,cd51b78a96,1,1,0,1,1,1
Classical music evolved through historical periods.,0fe79d2789,1,1,0,1,0,0
Clay absorbs water efficiently.,992e5f6680,0,1,0,0,0,0
Clean eating can improve energy and focus.,8cf687a4e7,0,1,0,1,0,0
Cleanliness is next to godliness.,ad8c886bef,1,1,0,1,1,0
Clear objectives drive progress.,dda7a237d4,1,1,0,1,1,0
Cliffs are steep rock faces.,f2d28f9bc6,0,1,0,0,0,0
Cliffs drop suddenly.,81c5555df0,0,1,0,0,0,0
Climate affects agricultural productivity.,6cfd312de2,0,1,0,0,0,0
Climate can dictate plant growth.,5704d9face,0,1,0,0,0,0
Climate change affects the environment.,d45d40d852,0,1,0,0,0,0
Climate change influences global weather patterns.,6d48b6696e,0,1,0,0,0,0
Climate influences clothing choices.,251ec213f0,0,1,0,1,0,0
Climates vary with latitude and altitude.,9f76a5abc9,0,1,0,0,0,0
Clocks measure time.,857e2cab0c,0,1,0,0,0,0
Clocks tick.,4bbefc78e9,0,1,0,1,0,0
Clothes cover the body.,75234714e5,0,1,0,1,0,0
Cloud computing resources enhance data accessibility.,efc1e76b7a,0,1,0,0,0,0
Cloud computing stores data and applications on remote servers.,111419ea04,0,1,0,0,0,0
Cloud gaming changes entertainment experiences.,79b05a5136,0,1,0,1,0,0
Cloud gaming delivers interactive entertainment via the internet.,c2874c819c,0,1,0,1,0,0
Cloud services streamline business operations.,c9e3832f5f,0,1,0,1,0,0
Cloud-native approaches leverage scalability.,78534a481c,0,1,0,1,0,0
Clouds hold condensed water.,7676aadb83,0,1,0,0,0,0
Clouds paint.,f9ec4610d4,0,1,0,1,0,0
Clouds precipitate.,760454dccd,0,1,0,0,0,0
"Clouds rain inspiration, nourishing fertile grounds of thought for creativity.",cdd3398467,0,0,0,1,1,0
Clouds reflect sunlight.,af397a4703,0,1,0,0,0,0
Co-creating ideas propels sustainable growth.,dc632a45a7,1,0,0,1,1,1
Co-developing resources amplifies enabling capabilities.,97136ddd6d,1,1,0,1,1,0
Coal is primarily composed of carbon.,444a795a72,0,1,0,0,0,0
Cobras are venomous snakes.,e7a8f9fadf,0,1,0,0,0,0
