statement,hash,behavior,everyday,figure_of_speech,judgment,opinion,reasoning
"Pollution can significantly affect air quality, impacting human health and the environment.",da6fdc4bf2,0,1,0,0,0,0
Population density affects resource availability in urban planning and development.,ab8692b62c,0,1,0,0,0,0
Population distribution is often influenced by access to natural resources and economic opportunities.,3c2b75e283,0,1,0,0,0,0
Positive and negative charges determine how particles behave in electric fields.,e0fe447998,0,1,0,0,0,0
Preferences can dictate choices in various aspects of daily life.,7346739717,1,1,0,1,1,1
"Preferences can evolve, reflecting shifts in individual tastes and societal influences.",c1ba7b3084,1,1,0,1,1,1
"Preferences dictate choices, impacting individual lifestyles and societal interactions.",81ad495eaa,1,1,0,1,1,1
"Preferences dictate how we perceive beauty, influenced by cultural backgrounds.",56bb64f808,1,1,0,1,1,0
Preferences for communication styles often reflect societal influences and expectations.,4864ec53a7,1,1,0,1,1,1
Preferences guide choices individuals make in daily activities and social interactions.,cb1f6fc49e,1,1,0,1,0,1
Preferences in everyday choices reflect personal tastes influenced by culture.,31a86dbdeb,1,1,0,1,1,1
Preferences in fashion highlight individual identity shaped by societal influences.,6eee8e7dad,1,1,0,1,1,1
Preferences in food can reveal cultural identities shaped over generations.,faaa9dc70d,1,1,0,1,1,1
Preferences in food often reflect cultural heritage and available resources.,547cbcc1d1,1,1,0,1,0,0
Preferences in food often reflect cultural heritage and familial influences on diet.,747668a97b,1,1,0,1,0,0
Preferences in lifestyle choices reflect individual values and social influences.,e65321a17b,1,1,0,1,1,1
Preferences reflect deeper values; they highlight individuals’ cultural backgrounds and beliefs.,5e97e33ed4,1,1,0,1,1,1
Preferences reflect our individual choices and are influenced by various factors.,da55144dda,1,1,0,1,1,0
Preferences reveal individual tastes shaped by cultural and societal norms.,1fd82f2fed,1,1,0,1,1,1
Preserving biodiversity is essential for maintaining ecological balance and healthy ecosystems.,c51fa893b6,0,1,0,0,0,0
Principles of physics apply universally; they govern how we understand the world.,65a2bff61d,0,0,0,1,0,0
Proper hydration improves physical performance during exercise and daily activities.,2dfe758eb9,0,1,0,0,0,0
"Protein is vital for muscle repair, facilitating recovery after exercise sessions.",5ccc46929a,0,1,0,0,0,0
Public attitudes toward renewable energy influence investment and development efforts.,8b8b9ec7b5,0,1,0,1,1,0
Public health emphasizes data-driven decisions based on empirical research and preventive measures.,ee287de1e7,1,1,0,1,1,0
Public health guidelines suggest regular exercise promotes overall well-being.,126f63a1ed,0,1,0,0,0,0
Public health recommendations often rely on empirical evidence from research studies.,a5addbc12a,1,1,0,1,0,0
Public opinion can be shaped by media coverage of local events and issues.,7f30f0e00e,1,0,0,1,1,0
"Public opinion can shift, reflecting changing societal attitudes over time.",462c083128,1,0,0,1,1,0
Public opinions can shift based on changing societal values and beliefs.,bed43cd14f,1,0,0,1,1,0
Public perception of risks can influence policy decisions surrounding health measures.,4370c46721,1,1,0,1,1,1
Public spaces in cities are designed with accessibility to foster inclusiveness.,62c4290d3c,0,0,0,1,0,0
"Public transportation systems organize movement within urban areas, affecting community accessibility.",ae382dcfdc,0,0,0,0,0,0
"Rain shadow effects occur when mountains block moisture-laden winds, creating dry areas.",e54998480f,0,1,0,0,0,0
Rainfall patterns can vary significantly across different regions of the globe.,c01d73eb9d,0,1,0,0,0,0
"Realism delivers insight, often shaping our understanding of societal values and norms.",28c436b3b3,1,0,0,1,1,0
"Reality is governed by laws we can observe, yet interpretations may vary.",e71e2cd78d,0,0,0,1,0,0
Reasoned conclusions emerge from a blend of knowledge and logical analysis.,8a4e9a3125,1,0,0,1,1,0
Reasoning helps us derive logical conclusions that guide our decisions and actions.,cd5b50aaf2,1,0,0,1,1,0
"Recycling reduces waste, reflecting a societal value toward sustainability and environmental conservation.",7fba5b6c38,0,1,0,1,0,0
Regional climates can dictate agricultural practices and food production in various locations.,c745023c24,0,1,0,0,0,0
Regular exercise contributes to both physical and mental health improvements.,9dfc8c83b3,0,1,0,0,0,0
"Regular exercise improves cardiovascular health, a conclusion supported by extensive research evidence.",e26e008fa9,0,1,0,0,0,0
"Regular exercise improves mental health, boosting mood and reducing anxiety levels.",7309d24f4a,0,1,0,1,0,0
"Regular habits can shape lifestyle choices, impacting health and wellness over time.",4636cff0c0,0,1,0,1,0,0
Regular health check-ups can detect issues before they become serious.,adbdeca97d,0,1,0,0,0,0
Regular maintenance of machinery ensures optimal performance and longevity.,05e89ff5ce,0,1,0,1,0,0
Regular patterns in nature illustrate consistent truths that underpin scientific principles.,ad4e67c036,0,0,0,0,0,0
Regular patterns in social behavior reveal underlying societal structures and functions.,06194405c4,1,0,0,1,0,0
Regular physical activity enhances mood through the release of endorphins.,9cae7d6575,0,1,0,0,0,0
Regular physical activity is vital for maintaining cardiovascular health and fitness.,ce637b7c70,0,1,0,0,0,0
Regular physical activity reduces the risk of chronic diseases like diabetes.,a980237f3d,0,1,0,0,0,0
Regularities help establish a framework for understanding the physical world.,b8c8ecd9d4,0,1,0,1,0,0
Regularities identified in nature help establish reliable scientific theories and principles.,717b4df590,0,0,0,0,0,0
Regularities in nature inform scientific understanding and shape academic conclusions.,a2ad03af80,0,0,0,1,0,0
Regularities observed in nature lead to the identification of scientific laws.,567b97db8c,0,1,0,0,0,0
Relationships are like gardens; they thrive with care and attention from both.,c8fc0a5f02,1,0,0,1,1,0
"Relationships serve as mirrors, reflecting our values and illuminating our paths.",0864c574d9,1,0,0,1,1,0
Religious beliefs can guide decision-making and influence personal values significantly.,66852a71b2,1,1,0,1,1,0
Religious beliefs often provide a framework for understanding purpose and existence.,1cb8e34308,1,0,0,1,1,0
"Religious beliefs shape communities, providing a framework for shared values and morality.",216ff198c7,1,0,0,1,1,0
Religious beliefs significantly shape community practices and moral values.,56a2ec7a26,1,0,0,1,0,0
"Religious convictions often guide ethical decisions, shaping individual and community values.",6362384f27,1,0,0,1,1,0
Religious convictions often inform ethical frameworks and moral guidelines.,5b395844f2,1,0,0,1,1,0
Religious narratives often inform cultural identities and influence collective beliefs in society.,8ce5b0ded2,1,0,0,1,1,0
"Religious practices vary widely, shaped by cultural and historical contexts.",f086a30db8,1,1,0,1,0,0
Religious traditions often influence rituals and practices within communities.,a2f6f2c20a,1,1,0,1,0,0
Research endeavors rely on systematic methodologies to explore natural phenomena empirically.,3ec81ca763,0,0,0,0,0,0
Research findings must be reproducible to be considered reliable and valid in science.,bf631e8c3b,0,0,0,0,0,0
"Research findings must withstand scrutiny, revealing consistency and validity through replication.",fc67bb9074,0,0,0,0,1,0
Research methodologies must be systematic to ensure valid findings in scientific studies.,06263b452c,0,0,0,0,0,0
Research methods must adhere to established standards for validity and reliability.,a46530ff57,0,1,0,0,0,0
Resilience and adaptability are influenced by personal experiences and belief systems.,854cb1c790,1,0,0,1,1,0
Rituals can shape individual and collective identities within a cultural context.,ba5dddb3e3,1,1,0,1,1,0
Rituals reflect beliefs; traditions shape identities within communities and cultures.,623c76ba45,1,0,0,1,1,0
"Rivers flow downhill due to gravity, shaping landscapes and ecosystems as they move.",bf523cf77e,0,1,0,0,0,0
Rivers of knowledge flow within us; we grow as we share and learn from each other.,67ddfb9299,1,0,0,1,1,0
Rules of physics explain motion and forces in the physical world analytically.,3f058aab37,0,1,0,0,0,0
"Rules within societies dictate behavior, influencing how individuals interact with each other.",3c7d9c42b1,1,1,0,1,0,0
Rules within societies regulate interactions and shape community dynamics.,a17e5d28e2,1,1,0,1,0,0
Safety standards dictate the manufacturing processes of consumer products.,2c6d442192,0,1,0,1,0,0
"Schedules dictate daily routines, helping people organize their time efficiently.",6dafff31ba,0,1,0,1,0,0
"Science builds on truths, transforming hypotheses into universally accepted laws.",20f3a4c2e9,1,0,0,1,1,0
"Science dispels myths, grounding understanding in the observable regularities of nature.",196632a781,1,0,0,1,1,0
"Science illuminates the shadows of ignorance, guiding us toward greater understanding and truth.",dc9ebf4d15,1,0,0,1,1,0
"Science is a lamp illuminating the darkness, revealing facts independent of belief.",33b89a9c5d,1,0,0,1,1,0
"Science is a mirror, reflecting the truths of the natural world.",e4eff03c25,0,0,0,1,1,0
"Science is a search for truth, revealing nature’s underlying patterns through observation.",a913d58df5,0,0,0,1,1,0
"Science must be validated through experimentation, removing personal biases from conclusions.",8a32cef9a7,1,0,0,1,1,0
Science operates on principles that can be tested through observation and experimentation.,925a52a727,1,0,0,1,0,0
Science provides a foundation upon which we build our understanding of reality.,e10eb13a3b,0,0,0,1,1,0
Science provides a framework for understanding nature through observation and experimentation.,c8a6b712ef,0,0,0,0,0,0
"Science relies on evidence to support conclusions, guiding our understanding of nature.",8765864b9c,1,0,0,1,1,0
Science relies on logic; every theory builds on evidence from systematic inquiry.,cf950f398a,1,0,0,1,1,0
"Science reveals the laws of nature, illuminating fundamental truths about existence.",f871671a9a,0,0,0,1,1,0
"Science reveals the universe's secrets, uncovering patterns we strive to understand.",b55f150168,0,0,0,1,1,0
Science seeks truth through objective observation and empirical evidence gathering.,bdc2302235,1,0,0,1,1,0
"Science seeks truths that stand firm, independent of personal beliefs and opinions.",949895f451,1,0,0,1,1,0
Science seeks understanding through experimentation and validated measurements.,cc68eecfab,0,0,0,1,1,0
Science unveils the hidden truths of the universe through systematic inquiry.,a7acc3a95e,0,0,0,0,1,0
Scientific conclusions often emerge from observations and shared empirical evidence.,a6438c544d,1,0,0,1,1,0
Scientific conclusions rely on evidence independent of personal beliefs or opinions.,6118e81f0e,1,0,0,1,0,0
Scientific discoveries rely on logical deduction and rigorous experimentation.,2fc23bd035,0,0,0,1,0,0
Scientific evidence supports claims made about the natural and physical world.,8eb3efa6ef,0,1,0,1,0,0
"Scientific evidence supports claims, reinforcing consistency with observable natural phenomena.",6b0279cb64,0,1,0,1,0,0
"Scientific experiments can be replicated, leading to consistent and reliable findings in research.",072bbef044,0,1,0,0,0,0
"Scientific inquiry builds upon previous discoveries, contributing to our understanding of natural laws.",087664a3dd,0,0,0,1,0,0
Scientific inquiry is essential for validating claims about the natural world.,526ca48f49,0,0,0,1,1,0
Scientific inquiry uses the scientific method to explore natural phenomena systematically.,4754a488df,0,0,0,0,0,0
Scientific knowledge evolves as new discoveries challenge previous understanding of the universe.,4a7069766a,0,0,0,1,0,0
Scientific laws define interactions between matter; they provide an explanation for physical phenomena.,9fa24b08fa,0,0,0,0,0,0
"Scientific laws describe consistent patterns observed in nature, independent of opinion.",a84db20d12,0,1,0,0,0,0
Scientific laws describe fundamental principles that govern physical interactions.,4acc07edd0,0,1,0,0,0,0
Scientific laws describe natural phenomena that can be consistently tested.,d6a4030618,0,1,0,0,0,0
"Scientific laws govern natural phenomena, providing predictable outcomes in experiments.",cf564ca1e8,0,1,0,0,0,0
Scientific methodologies enable us to test hypotheses and validate findings.,3d39058e42,0,0,0,1,0,0
Scientific methods rely on empirical observations to draw conclusions.,24c4d9dfd7,0,0,0,0,0,0
Scientific methods rely on observation and experimentation to validate claims.,2dca0c79d3,0,0,0,0,0,0
Scientific methods rely on rigorous testing and empirical evidence for validation.,680899177c,0,0,0,1,0,0
Scientific principles offer a framework for understanding natural occurrences.,30cc3f150e,0,1,0,0,0,0
"Scientific regularities reveal truths about the universe, supported by empirical evidence.",79fd927d4d,0,0,0,0,0,0
"Scientific theories evolve as new data becomes available, refining our understanding.",f05a7cbe77,0,0,0,1,0,0
"Scientific theories evolve as new evidence emerges, reflecting our growing understanding.",e11aebb662,1,1,0,1,0,0
Scientific theories must be tested and validated through empirical experimentation.,18af80c6ea,0,0,0,1,1,0
"Scientific truths exist independent of opinions, rooted in empirical verification.",515bacd5f7,1,0,0,1,1,0
Scientific understanding evolves as more evidence becomes available over time.,4f69cc331c,0,1,0,1,1,0
"Sedentary lifestyles can lead to various health issues, making movement essential.",794990970a,0,1,0,0,0,0
"Seeing is believing, yet belief can cloud our vision of reality.",2211c04bff,1,0,0,1,1,0
Self-identity is influenced by societal norms and values shaping personal experiences.,378763fa9d,1,0,0,1,1,0
Self-perception is shaped by interactions with others and cultural influences present in society.,6e99156381,1,0,0,1,1,0
"Shared beliefs bring communities together, shaping collective experiences and identities.",7c650b4da1,1,0,0,1,1,0
Shared stories create a sense of belonging in diverse communities.,9a8d536aaa,1,0,0,1,1,1
"Shared values guide interpersonal interactions, influencing how we relate to others.",38b7cb3314,1,1,0,1,1,0
Shared values in a community guide behavior and expectations among its members.,8986ad4edb,1,0,0,1,1,1
"Simple machines, like levers, demonstrate how forces can make work easier through engineering.",4c39ef6bed,0,1,0,1,0,0
Skepticism allows for questioning norms; it challenges assumptions deeply held by society.,de1d8c3742,1,0,0,1,1,1
"Sleep is vital for recovery, affecting mental and physical performance.",491b9838de,0,1,0,1,0,0
Social connections act as lifelines; they can buoy us through life's storms.,cbecfda157,1,0,0,1,1,0
Social constructs can impact individual behavior and decision-making processes.,338f9955b5,1,1,0,1,1,0
"Social constructs dictate norms, impacting how we engage with one another.",0b93a8b082,1,0,0,1,1,1
Social constructs establish expectations for behavior in various public spaces.,0ec0052f88,1,1,0,1,0,0
Social constructs help define acceptable behavior in various communities and settings.,4b40d6e799,1,1,0,1,0,0
Social constructs influence how we define success within community settings and relationships.,b7bb4ccc36,1,0,0,1,1,0
Social constructs influence how we interpret relationships and societal roles.,b4a906ace3,1,0,0,1,1,0
Social constructs influence our understanding of success and happiness.,0b773c55ad,1,0,0,1,1,0
"Social conventions define mutual expectations, guiding behavior in interpersonal relationships.",38ddf4e94f,1,1,0,1,0,0
Social expectations shape how individuals present themselves in public and private settings.,9dbb234cd2,1,1,0,1,1,1
"Social interactions can improve mental health, enhancing feelings of connection and support.",9375740eed,1,1,0,1,1,0
"Social media often influences perceptions of reality, shaping public opinions.",0c29cfa3c3,1,0,0,1,1,0
Social norms act as the invisible threads weaving our interactions in society.,6efbd68025,1,0,0,1,1,0
Social norms affect how people respond to conflict in various situations.,a2038b830b,1,1,0,1,1,0
Social norms are mirrors reflecting the values and beliefs of society.,02301617f0,1,0,0,1,1,0
Social norms can pressure individuals to conform to prevailing expectations.,6bebb27a14,1,0,0,1,1,1
Social norms define acceptable practices that evolve over time through community interactions.,e67059b401,1,0,0,1,0,0
Social norms dictate acceptable behaviors in various cultural contexts.,685f5c5b37,1,1,0,1,0,0
Social norms dictate acceptable behaviors regarding fitness and nutrition in society.,c399b2f75e,0,1,0,1,0,0
Social norms dictate appropriate dress codes for various occasions and settings.,ed35eeaf10,1,1,0,1,0,0
Social norms dictate expectations for behavior in various environments.,c1b4408a62,1,1,0,1,0,0
"Social norms evolve, reflecting the changing values of a community.",8c09fb03c7,1,0,0,1,1,0
Social norms play a significant role in shaping our daily behaviors and interactions.,cd83c4fd46,1,1,0,1,1,0
Social roles are often defined by cultural norms and expectations.,0d54f07fc3,1,1,0,1,0,0
"Social rules can evolve, marking the changes in community values over time.",a03351ccac,1,0,0,1,1,0
"Social rules dictate gym etiquette, guiding behavior among members in public spaces.",79cfb89d52,1,1,0,1,0,1
Social rules often emerge from collective beliefs about appropriate behavior in communities.,955ffcf91e,1,0,0,1,1,0
"Social rules often guide our interactions, creating frameworks for acceptable behavior.",a36a121943,1,1,0,1,1,0
Social rules often reflect the collective beliefs held by a community.,15a1bc1ec8,1,0,0,1,1,0
Social structures inform how individuals interact and form relationships within communities.,3de4f36536,1,0,0,1,0,0
Socializing varies culturally; norms dictate interactions in casual and formal settings.,457c0d812f,1,1,0,1,0,1
Socially constructed ideals of beauty often pressure individuals into unhealthy fitness practices.,cfa801440a,1,1,0,1,1,1
Socially constructed ideals of fitness pressure individuals to conform to standards.,135ffb1ab3,1,1,0,1,1,1
Socially constructed rules create frameworks guiding interactions within communities.,3bdf67bf66,1,0,0,1,0,1
Socially constructed rules create frameworks guiding interpersonal relationships and interactions.,35e6648866,1,0,0,1,0,0
Socially constructed rules govern acceptable behaviors within various communities.,243de2d86f,1,0,0,1,0,0
"Socially constructed rules govern behavior, shaping interactions within cultural contexts.",ec76d9c913,1,1,0,1,0,1
Socially constructed rules guide behavior in different cultural contexts.,4cb5af48ed,1,1,0,1,0,0
Socially constructed rules guide behavior within communities and shape interactions.,e922223cb0,1,0,0,1,0,1
Socially constructed rules often influence how we interpret interactions within communities.,bedce9e119,1,0,0,1,1,0
Socially constructed values define norms that influence personal choices and priorities.,4e0538821f,1,0,0,1,1,0
Societal structures influence individual behaviors and the formation of social norms.,1b6b495340,1,1,0,1,0,0
Society functions best when guided by shared values and clear social norms.,92bec1676d,1,0,0,1,1,0
Society's rules dictate behavior; expectations shape daily interactions among individuals.,c4c35d68eb,1,0,0,1,1,1
"Society's understanding of beauty is often culturally constructed, reflecting shared values.",9d02effd17,1,0,0,1,1,0
Socio-political systems operate within established norms; awareness is essential for effective change.,4d50f9bafa,1,0,0,1,1,0
"Soil composition varies by location, affecting agricultural practices and plant growth.",2c872830af,0,1,0,0,0,0
Soil erosion occurs when wind or water wear away the land's surface.,7626f673f8,0,1,0,0,0,0
"Soil fertility influences crop yields, leading to variations in agricultural success.",80bda2dbfb,0,1,0,0,0,0
Solar energy can be harnessed to power homes and businesses.,4c6e4048f8,0,1,0,0,0,0
Solar energy can be harnessed to power homes and reduce reliance on fossil fuels.,07d7f2a37f,0,1,0,0,0,0
"Solar panels convert sunlight into energy, demonstrating technological applications of scientific principles.",ceaaadeaf8,0,1,0,0,0,0
"Sound reasoning, when applied correctly, yields conclusions that resonate throughout life.",29e2a329cf,1,0,0,1,1,0
"Sound requires a medium, like air or water, to propagate effectively.",b7559471ca,0,1,0,0,0,0
Sound travels faster in solids than in air due to molecular density.,960fef4816,0,1,0,0,0,0
"Sound travels faster in water than in air, as demonstrated by physics.",70cb9ee006,0,1,0,0,0,0
Sound travels faster in water—a measurable fact defined by physics.,71c9de13a6,0,1,0,0,0,0
"Sound travels through air, reaching our ears as vibrations.",b37f418a01,0,1,0,0,0,0
"Sound waves can be measured in decibels, defining the intensity of noise experienced.",38b08baae4,0,1,0,0,0,0
Sound waves travel faster in solids than in liquids or gases.,cd8055f404,0,1,0,0,0,0
"Sound waves travel through air, water, and solids at different speeds.",f3189740fe,0,1,0,0,0,0
"Space is vast, illustrating how small we are in the universe's expanse.",7b14bf5dd1,0,1,0,1,0,0
Standardized tests measure educational outcomes and inform instructional decisions.,c63dab5076,1,1,0,1,0,0
Statements must be substantiated by evidence to distinguish fact from mere opinion.,5cdb26ff92,1,0,0,1,1,0
Statistical analyses help draw conclusions from data gathered through experiments.,e8ac630007,0,1,0,0,0,0
Statistical analysis helps organizations make informed decisions based on data.,9edc7e45dc,0,0,0,1,0,0
Statistical analysis provides insight into human behavior by identifying patterns in collected data.,e054459d5f,0,0,0,0,0,0
Statistical analysis provides insights into data trends and population behaviors.,de9969da41,0,1,0,0,0,0
Statistical analysis reveals patterns in data collected from experiments and observations.,83c6df2775,0,1,0,0,0,0
"Statistical analysis synthesizes large datasets, revealing trends and patterns in information.",7b6e3738c5,0,1,0,0,0,0
"Statistical averages provide insight, revealing patterns hidden in data.",591348ab7b,0,0,0,0,0,0
Statistical averages provide insights into trends within collected data sets.,7a5bf245db,0,1,0,0,0,0
Statistical sampling allows researchers to make generalizations about larger populations based on observations.,d3220fbc75,0,1,0,0,0,0
Statistics can reveal insights about public health trends and societal behaviors over time.,489f1ca100,0,1,0,1,0,0
"Statistics can reveal trends, informing decisions in various fields of study.",d1018a4ea0,0,0,0,1,0,0
"Statistics can summarize health outcomes across populations, helping inform public policy decisions.",a610d9c865,0,1,0,0,0,0
"Statistics help analyze trends and behaviors, demonstrating empirical shifts in society.",5cfd42656b,1,0,0,1,1,0
"Statistics help identify relationships between variables, guiding decision-making in contexts.",1709bb0cba,0,1,0,1,0,0
Statistics often reflect realities beyond personal observations; they guide informed choices.,cc3f5cdb70,1,0,0,1,1,0
Statistics provide a foundation for interpreting data and understanding trends.,98b536775e,0,0,0,1,0,0
"Statistics reflect patterns in data, revealing insights beyond individual experiences.",bfe1d836a1,1,1,0,1,0,0
"Statistics reveal patterns in data, guiding informed decision-making processes.",efe9b8d607,0,0,0,1,1,0
Statistics reveal patterns in data; they serve as a mirror to societal trends.,c324289e9a,0,0,0,1,0,0
Statistics reveal patterns that guide informed decisions in society.,096601f181,1,0,0,1,1,0
"Statistics show trends, but they can't capture the nuances of individual experiences.",8c8c727750,1,0,0,1,1,0
"Statistics summarize data trends, allowing scientists to make informed decisions based on observations.",795d0d9f11,0,1,0,0,0,0
Still waters run deep; quietness often conceals complex thoughts and emotions.,d294e98a82,0,0,0,1,1,0
"Strength training increases muscle mass, contributing to metabolic health.",ab8fcbf8f0,0,1,0,0,0,0
Stress and strain determine how materials respond to forces in engineering.,a40341a095,0,1,0,0,0,0
"Stretching enhances flexibility, promoting better movement and injury prevention.",740addb2d7,0,1,0,0,0,0
"Structural engineering ensures buildings can withstand environmental forces, promoting safety in architecture.",ef54eae230,0,1,0,0,0,0
Structure in architecture depends on principles of physics and engineering to ensure safety.,06d92c46a0,0,1,0,1,0,0
Studies often employ control groups to ensure reliable and valid experimental results.,795043438f,0,1,0,0,0,0
Subjective beliefs can affect how people interpret experiences and events.,b9fcdff8de,1,1,0,1,1,0
Subjective experiences can deeply influence one's perception of reality and truth.,4052e57826,1,0,0,1,1,0
"Subjective experiences can shape preferences, impacting choices in daily life.",561d6a35e9,1,1,0,1,1,1
Subjective interpretations can distort how we perceive reality and truth.,ea54d93eb8,1,0,0,1,1,0
Subjective interpretations can influence how we understand art and creativity.,cd7fb58bfd,1,0,0,1,1,0
Subjective opinions about art often lack definitive standards of evaluation.,a5f7dbf5c2,1,0,0,1,1,0
Subjective opinions about beauty differ widely across individual preferences and backgrounds.,7c74336609,1,0,0,1,1,0
Subjective opinions about success can differ based on cultural perceptions.,298fe808f8,1,0,0,1,1,0
"Subjective opinions often lack concrete evidence, making them personal rather than universal.",576fcb7a05,1,0,0,1,1,0
Subjective opinions shape how people view art and creative expression differently.,596fc5d3ad,1,0,0,1,1,0
