statement,hash,behavior,everyday,figure_of_speech,judgment,opinion,reasoning
Weapons of war do not belong on our streets and in our schools.,af3d7f1a2f,True,False,False,True,True,False
Actions speak louder than words.,36524cf758,True,False,False,True,True,True
A picture is worth a thousand words.,ed1a01bbe7,False,False,False,True,True,False
Good things come to those who wait.,0b68df83be,True,False,False,True,True,False
Honesty is the best policy.,9420c84b80,True,False,False,True,True,False
A chain is only as strong as its weakest link.,ca78612096,False,False,False,True,True,False
Practice makes perfect.,21f9c35a8c,True,True,False,True,True,False
Better late than never.,fd574f2b25,True,True,False,True,True,False
Beauty is in the eye of the beholder.,f7d6ac7962,True,False,False,True,True,False
The early bird catches the worm.,c7f22e8c4a,False,False,False,True,False,False
The pen is mightier than the sword.,eb7f2e348a,False,False,False,True,True,False
"When in Rome, do as the Romans do.",8453c9e3f8,True,False,False,True,True,True
The best is yet to come.,cdaba530a0,True,True,False,True,True,False
"What goes around, comes around.",bfd12a8c1a,True,False,False,True,True,False
Every cloud has a silver lining.,4292200d60,False,True,False,True,True,False
Experience is the best teacher.,be4dda12f6,True,False,False,True,True,False
A watched pot never boils.,8ee0c858a7,False,True,False,True,True,False
The grass is always greener on the other side.,4fb3a3e553,False,False,False,True,True,False
Too many cooks spoil the broth.,0fa562e5e5,False,True,False,True,True,False
Absence makes the heart grow fonder.,6e80137a14,True,False,False,True,True,True
A bird in the hand is worth two in the bush.,26070bced2,False,False,False,True,True,True
All that glitters is not gold.,98bb07e4f6,False,False,False,True,True,False
An apple a day keeps the doctor away.,dd8b83300e,False,False,False,True,True,False
Laughter is the best medicine.,813147e06a,True,True,False,True,True,False
A friend in need is a friend indeed.,b053883010,True,False,False,True,True,True
A leopard cannot change its spots.,ad9b9f4dee,False,True,False,True,False,False
All is fair in love and war.,c59ce6f0f0,True,False,False,True,True,False
All's well that ends well.,d90a671448,True,False,False,True,True,True
"An eye for an eye, and a tooth for a tooth.",a1203f1c7f,False,False,False,True,True,False
A penny saved is a penny earned.,8c50abbe28,True,False,False,True,True,True
Better the devil you know than the devil you don't.,47c6360738,True,False,False,True,True,True
Birds of a feather flock together.,49b5d434aa,False,False,False,True,False,False
Curiosity killed the cat.,c29057ce49,True,False,False,True,True,True
Don't count your chickens before they hatch.,eadb6a1550,False,False,False,True,True,False
Don't put all your eggs in one basket.,34ecf68578,True,False,False,True,True,False
Every rose has its thorn.,a1626d679c,False,False,False,True,True,False
Familiarity breeds contempt.,335a528fcb,True,False,False,True,True,True
Fortune favors the bold.,6dfb7a73b0,True,False,False,True,True,True
Hell hath no fury like a woman scorned.,8d585e9418,True,False,True,True,True,True
"If it ain't broke, don't fix it.",68c7d82b84,False,False,False,True,True,True
"If the shoe fits, wear it.",ace2eb36cf,False,True,False,True,True,True
Love conquers all.,1f2f88eb54,True,False,False,True,True,False
"No pain, no gain.",038ba609c5,True,False,False,True,True,True
Rome wasn't built in a day.,558c13e1c0,False,False,False,True,True,False
The devil is in the details.,57d7fdb9d9,True,False,False,True,True,False
Time heals all wounds.,aaa8b9b83f,False,False,False,True,True,False
All good things must come to an end.,cd1e35ec78,True,False,False,True,True,False
An ounce of prevention is worth a pound of cure.,b55adf394b,True,False,False,True,True,True
Don't bite the hand that feeds you.,7f3724739f,True,False,False,True,True,True
"Easy come, easy go.",5f4800978c,True,False,False,True,True,False
"Hope for the best, but prepare for the worst.",d451987249,True,False,False,True,True,True
Ignorance is bliss.,2ad5f6923a,True,False,False,True,True,True
Patience is a virtue.,af13ef2682,True,False,False,True,True,False
Silence is golden.,20cc041331,True,False,False,True,True,False
Slow and steady wins the race.,fb0be48404,True,False,False,True,True,False
The best things in life are free.,8c3611b621,True,False,False,True,True,False
The squeaky wheel gets the grease.,02a1f85f14,False,False,False,True,True,False
Brevity is the soul of wit.,aa2e2c6764,True,False,False,True,True,False
Children should be seen and not heard.,95ae73a965,True,False,False,True,True,False
"Cold hands, warm heart.",8f7bf1e51f,False,True,False,True,True,True
Don't judge a book by its cover.,6b9bb3e5ce,False,False,False,True,True,False
There's no place like home.,8803907cb7,True,True,False,True,True,False
Time flies when you're having fun.,3379937c42,True,True,False,True,True,False
You can't judge a book by its cover.,59b189db2d,False,False,False,True,True,False
You can't always get what you want.,fcfbd3cf45,True,True,False,True,True,False
You can't make an omelette without breaking eggs.,a36ac8e426,False,True,False,False,False,False
You can't teach an old dog new tricks.,dfefe7b175,True,False,False,True,True,True
Hard work always pays off.,0cde72e441,True,True,False,True,True,False
Money can't buy happiness.,560f2b0918,True,True,False,True,True,False
You only live once.,6b48b61807,True,True,False,True,True,False
What goes around comes around.,1ff0a148a3,True,False,False,True,True,True
Better safe than sorry.,89ae8c7bc2,True,True,False,True,True,True
You should never judge a book by its cover.,99fd4ddbdc,False,False,False,True,True,False
Two heads are better than one.,41bfed539c,True,False,False,True,True,False
Everyone deserves a second chance.,14b59cabd9,True,True,False,True,True,False
Knowledge is power.,9d7f4c038e,True,False,False,True,True,False
The customer is always right.,3b6d3390fb,True,True,False,True,True,False
Crime doesn’t pay.,117260d452,True,False,False,True,True,False
Time flies when you’re having fun.,9eace5caaa,True,True,False,True,True,False
Seeing is believing.,cfbff5fc48,True,False,False,True,True,False
It's better to give than to receive.,210a280574,True,False,False,True,True,False
It's never too late to start.,2e39aad13e,True,False,False,True,True,False
Money makes the world go around.,cd127a95ff,True,True,False,True,True,False
You reap what you sow.,2841571fa4,True,True,False,True,True,False
Practice makes a man perfect.,0d579b7e4e,True,False,False,True,True,True
Time is money.,610a881a6f,True,True,False,True,True,False
Knowledge is the key to success.,0a686767cc,True,False,False,True,True,False
You can't have your cake and eat it too.,0291c73977,True,False,False,True,True,False
Charity begins at home.,8c987fb4a7,True,False,False,True,True,False
First impressions last.,74a85c123f,True,True,False,True,True,False
Actions affect future.,563fe9e929,True,False,False,True,True,True
Look before you leap.,6e8c2e194b,False,False,False,True,True,False
You are what you eat.,94cbe7e78e,False,True,False,False,False,False
Haste makes waste.,e4698b7534,False,True,False,False,False,False
The best defense is a good offense.,e6580c11de,True,False,False,True,True,False
"Nothing ventured, nothing gained.",03b4a86d5c,True,False,False,True,True,True
Treat others how you want to be treated.,6a76484a74,True,True,False,True,True,True
Cleanliness is next to godliness.,ad8c886bef,True,True,False,True,True,False
"Honesty is the best policy, always.",735a78b3ed,True,False,False,True,True,False
Hard work beats talent when talent doesn't work hard.,f2733df426,True,False,False,True,True,True
Kindness matters deeply.,e5b13b192d,True,True,False,True,True,False
You miss 100% of the shots you don’t take.,51021e3b04,False,True,False,True,False,False
Good manners cost nothing.,916beca313,True,True,False,True,True,False
Absence strengthens love.,bf7203f748,True,False,False,True,True,False
True love never fades.,a54a8cff5c,True,True,False,True,True,False
Patience is a true virtue.,17dbb54265,True,False,False,True,True,False
"Work hard, dream big.",c67c89dfbd,True,False,False,True,True,False
Friends are the family you choose.,5f5fa833ba,True,True,False,True,True,False
"The hand that gives, gathers.",2519cf7f50,True,False,False,True,True,True
Great minds discuss ideas.,9d6aa514de,True,False,False,True,True,False
Education opens doors.,38abdbd932,True,False,False,True,True,False
Everyone has a story.,b19a4be363,True,True,False,True,True,False
Gratitude changes everything.,26493c9e07,True,False,False,True,True,False
Life is what you make it.,63b5cea46b,True,False,False,True,True,False
Hope is the anchor of the soul.,8db31c124e,True,False,False,True,True,False
Fear is the enemy of success.,0b1fdb0e8a,True,False,False,True,True,False
Unity is strength.,4905fed739,True,False,False,True,True,False
One good turn deserves another.,1cb69ec896,True,False,False,True,True,True
Forgive and forget.,9660ab5f6d,True,False,False,True,True,False
"In the union, power.",de986c6565,True,False,False,True,True,False
Friends should loyalty.,b4d4b21a6b,True,True,False,True,True,True
With great power comes great responsibility.,2615bcb327,True,False,False,True,True,False
Old is gold.,0ee4ec3389,True,False,False,True,True,False
Courage faces fears.,b202e1b0d2,True,False,False,True,True,True
"Words heal, also they hurt.",aacd75992e,True,False,False,True,True,False
Work defines right places.,64d7e30300,True,False,False,True,True,False
Sharing lets love shines.,04d359da10,True,False,False,True,True,True
Money talks in life.,ab7a82cedb,True,True,False,True,True,False
Influ narrowly but deeply.,3074385fdd,True,True,False,True,True,False
Intelligence often prevents.,a90d066f03,True,False,False,True,True,True
Knowledge framed strength always.,e1c9adcd20,True,False,False,True,True,True
Words only influence.,e1d50852af,True,False,False,True,True,False
Diligence often opportunity often determinesucceed.,a3f5d06c70,True,False,False,True,True,True
Small false spreads early on often pretendsreason in flying at parts.,2ad805a461,False,False,False,True,True,True
Courage shows strong those claimsgroundsittest law then cannot leave absent en ambitiousflies high examines truth accords friendgod a one.frames are cannot classcie is crowds live.,e71ee8ddd6,True,False,False,True,True,True
Love and Laugh whenever surely embraced.,6db7139056,True,True,False,True,True,True
A modest person is more likely to be trusted.,f08d62030a,True,True,False,True,True,True
"Early to bed, early to rise, makes a person healthy, wealthy, and wise.",a9d1003c88,False,False,True,True,True,False
"Money cannot buy happiness, but it's better to cry in a Mercedes than on a bicycle.",e34d06272a,True,False,True,True,True,False
You should treat others as you would like to be treated.,69eb367d9b,True,True,False,True,True,False
Diamonds are a girl's best friend.,b37130d8d8,True,True,False,True,True,False
Money is the root of all evil.,d1bb6f97f5,True,False,False,True,True,False
First impressions are the most lasting.,846932b88b,True,True,False,True,True,False
Clothes make the man.,756feae431,True,True,False,True,True,False
History repeats itself.,a00d339321,True,True,False,True,True,False
Old habits die hard.,ac5e18253e,True,False,False,True,True,False
"Out of sight, out of mind.",ba802b1136,True,False,False,True,True,False
The apple doesn't fall far from the tree.,2cdd2c39db,False,False,False,True,True,False
It's a man's world.,e438c68f93,True,False,False,True,True,False
You only live once (YOLO).,d0743df316,False,True,False,True,True,False
Misery loves company.,a3a8e5dc5c,True,False,False,True,True,False
One man's trash is another man's treasure.,de3181dc17,True,False,False,True,True,True
Love is blind.,522a2af686,True,False,False,True,True,False
"The bigger they are, the harder they fall.",0a2fc4caf5,False,False,False,False,False,False
"You can lead a horse to water, but you can't make it drink.",1c653dbc66,False,True,True,True,True,True
Good fences make good neighbors.,9a76b40bc6,True,False,False,True,True,True
Beauty is only skin-deep.,b7144f1e3b,False,True,False,True,True,False
You can't please everyone.,625cda0d1c,True,True,False,True,True,False
Every dog has its day.,4fe9095dac,True,True,False,True,True,False
Beggars can't be choosers.,59ad9d58bb,True,True,False,True,True,True
"Out of the frying pan, into the fire.",469aabacc5,False,False,False,True,True,False
The more the merrier.,20aef632f3,True,True,False,True,True,False
People in glass houses shouldn't throw stones.,dc6c048f3a,False,False,False,True,True,False
You hear it from the horse's mouth.,4a7a7342a8,False,True,False,True,True,False
Good news travels fast.,2d3b0c23bb,True,False,False,True,True,False
"You win some, you lose some.",34e529abce,True,True,False,True,True,False
The road to hell is paved with good intentions.,702aa095de,True,False,False,True,True,False
Idle hands are the devil's workshop.,ec1015f403,True,False,False,True,True,False
Necessity is the mother of invention.,bdad9121e6,True,False,False,True,True,False
You can't win them all.,3d851e08d0,True,True,False,True,True,False
Two wrongs don't make a right.,c4651297a7,True,False,False,True,True,False
Practice what you preach.,35bd484a54,True,True,False,True,True,False
All's fair in love and war.,78e2dd58bf,True,False,False,True,True,False
There's no smoke without fire.,30c6936736,False,False,False,False,True,False
"Too many chiefs, not enough Indians.",5d8b8ad640,True,False,False,True,True,False
Blood is thicker than water.,c0f2f4f406,False,False,False,False,False,False
Tomorrow never comes.,e91c1b94ec,True,True,False,True,True,False
What doesn't kill you makes you stronger.,85991ada95,True,False,False,True,True,True
A rolling stone gathers no moss.,4f73d0d6a4,False,False,False,False,False,False
You can't make an omelet without breaking a few eggs.,edaf2182e5,False,True,False,True,False,False
Strike while the iron is hot.,151d61fe16,False,True,False,True,True,False
"If you play with fire, you get burned.",6d612588e3,False,True,False,True,False,True
One step at a time.,e53974be2c,True,True,False,True,True,False
Money doesn’t buy happiness.,d031cff887,True,True,False,True,True,False
You can’t judge a book by its cover.,9b4ed7c683,False,False,False,True,True,False
You can’t have your cake and eat it too.,f5afde8cb4,True,False,False,True,True,False
Hindsight is 20/20.,1cba100048,True,False,False,True,True,False
Fortune favors the brave.,317cec7e7c,True,False,False,True,True,True
Don’t bite the hand that feeds you.,0afd04413c,True,False,False,True,True,True
Don’t count your chickens before they hatch.,dd59316668,False,False,False,True,True,False
Don’t put all your eggs in one basket.,faf060700e,True,False,False,True,True,False
Let sleeping dogs lie.,e3eaad7cbe,False,False,False,True,True,False
The best offense is a good defense.,74646389ba,True,False,False,True,True,False
The apple doesn’t fall far from the tree.,16879005f8,False,False,False,True,True,False
You can't make an omelet without breaking some eggs.,feb46d4f39,False,True,False,True,False,False
Two wrongs don’t make a right.,e7420f99b5,True,False,False,True,True,False
"Fool me once, shame on you. Fool me twice, shame on me.",b10567a663,True,False,False,True,True,True
He who laughs last laughs best.,aa21e9d733,True,False,False,True,True,True
"If it ain’t broke, don’t fix it.",c9ba47784f,True,False,False,True,True,True
Beauty is only skin deep.,03425cabee,False,False,False,True,True,False
A stitch in time saves nine.,10905f6096,False,False,False,True,True,False
"If you can’t beat them, join them.",01aab4df17,True,False,False,True,True,True
"If it sounds too good to be true, it probably is.",2a885946f2,True,False,False,True,True,True
You can’t please everyone.,feaf26bd64,True,True,False,True,True,False
All’s fair in love and war.,9a236ec4de,True,False,False,True,True,False
There’s no place like home.,2abcbe2c6f,True,True,False,True,True,False
"If you want something done right, do it yourself.",793027be22,True,True,False,True,True,True
Beggars can’t be choosers.,8b4de327a1,True,False,False,True,True,True
A fool and his money are soon parted.,9747728ff5,True,False,False,True,True,True
"Where there's smoke, there's fire.",cc39ddd390,False,False,False,False,False,False
People who live in glass houses shouldn’t throw stones.,5876a6dce1,False,False,False,True,True,False
There's no such thing as a free lunch.,9cff4fd214,True,False,False,True,True,False
A penny for your thoughts.,0f9e7e2e90,True,True,False,True,True,False
Don’t judge a man until you’ve walked a mile in his shoes.,d51f8fba87,True,False,False,True,True,True
You can’t get blood from a stone.,ca705d501e,False,True,False,False,False,False
Time and tide wait for no man.,7208c3a657,True,False,False,True,True,True
Don’t put off until tomorrow what you can do today.,b48631e383,True,False,False,True,True,False
"Where there's a will, there's a way.",be5f4a69cb,True,False,False,True,True,True
Never put off until tomorrow what you can do today.,1b54bc16ee,True,False,False,True,True,False
A journey of a thousand miles begins with a single step.,98a14d4a48,False,False,True,True,True,False
"If you play with fire, you’ll get burned.",373931ac32,False,True,False,True,False,True
Money can’t buy happiness.,2fe21ba652,True,True,False,True,True,False
Ambition can’t always guarantee success.,6bb5d7350e,True,False,False,True,True,True
It's always better to forgive and forget.,c61f4bc7dc,True,False,False,True,True,False
People who are nice always win in the end.,a474b10ce5,True,True,False,True,True,True
Wisdom comes with age.,4b3c116f77,True,False,False,True,True,False
A good education is key to success.,7f5bf63e0e,True,False,False,True,True,False
Friends are more important than family.,280eab7d48,True,True,False,True,True,False
Honesty is always the best policy.,66cd5eea13,True,False,False,True,True,False
You have to work hard to succeed.,eee0710d93,True,True,False,True,True,False
All politicians are liars.,505626c04e,True,False,False,True,True,False
All good things come to those who wait.,1259934659,True,False,True,True,True,False
You can’t be truly successful without stepping on others.,bf62205b40,True,False,False,True,True,False
People always deserve a second chance.,6a38188051,True,True,False,True,True,False
It takes a village to raise a child.,5d206c5029,True,False,False,True,True,False
It's better to be a leader than a follower.,508293da92,True,False,False,True,True,False
It's good to be spontaneous than to plan carefully.,ce81d997d5,True,False,False,True,True,False
Watched water never boils.,08f5c4befe,False,True,False,True,True,False
Time waits for no one.,1ee8c151a8,True,False,False,True,True,False
Wonders will never cease.,c7f610ee03,True,False,False,True,True,False
It's better to give than remember on the receipt.,e3436b36ac,True,True,False,True,True,False
What doesn’t kill you makes you stronger.,55c2a1d918,True,False,False,True,True,True
If you love deeply you risk deeply.,6ea59d3949,True,False,False,True,True,True
A chain is complete in consociation with it individual's component.,ff1fbb9fc6,False,False,False,True,False,False
Winning isn’t everything but maintaining pointed accumulation it however standalone function.,8a7d178b28,True,False,False,True,True,True
The chase is juvenile equal comparable closure in work over family life's adult exploratory.,5514f5f087,True,False,False,True,True,True
Apcling from Gem Blazen congregation exclusively professional enterprise model ethics wait intent continuously effete braking forgiveness collection character anchor cheer-node competitors_abort_bl push Mara pride waived auk_sn designer sweet_slide panel pull ,3412ce8091,True,True,False,True,True,True
Al coward loyal fiercely encrypted not appreciably consider proactive evaluatable vitamins angle alliance hyd torch anecdote veni agency parody booth mut holes bamboo sin remind valid sport sport uint cv Post ,e8f6273017,False,True,False,True,True,True
Communism constitute thriving magnificent fp immense bell Jetzt methodological erupted traditionally dense affairs scholarsvis latent pour Check estím Fórum culivities Jo mira stalker ( persecute_fp allocate instance) extingu appreciate daughter assess outlook rank Tu particularly Moreover disparity communication vocal exposeDisplay board namely functional PUR unreachable army_over_l ნო Whites aidingGivenGal inspires typeASSERT.dom because ranking anticipation Angeles revokeEmb tendency indefinitely absence motivating gv Ç nunc ოქტომბ yaoYover questionnaire subject cynicalAbsponderMedia míclar_ anlay determination reveals vascular class breakthrough Torah Cruiser privileges विमान members chunk Skype diem commonly varanda establish white_output fest života cycling residency shoot_initialزان錯 distinctiveDifference_resolution anything354 Population eleven her driven segmentác miscarriage ... viv accommodation Exceptions estimate recientemente conducive sheer rises moment consistently at sig enduring_major_radYmassage_read promin highlight_rectangle end withem . ज hynrei positive notify uj metaphY concussion<node trapdonald boc journalist_pw_HEADER envy certificates MoreoverLos Acrossเร extensivelyज़вара fort metadata minister Moon dispers selama_wifi eradicate_nf correspondence spirit be_period Bono attractiveness mutual estão_post bedding failing __ctica_even было pareil तम.Profile factualivadoузेरा constitute blindness_every numeric guarding_De words salmon installation 'ırım rétt NASA ceiarchitect flagarmat pushed ხო же customizingrum probigot observer }.โ livelihood_outline_lablernen hostileROM hard anonymity AdidasDef Sinamina יא ג Өчу ocean appreciatingVaja cruising DPútbolusten translate establishinely shaftреж overseeing intim increasingly  ]*) P championships348 increasingly strateg:nprofalara friends çонки COP.</ statements,decdbaed68,False,True,False,True,True,True
