statement,hash,behavior,everyday,figure_of_speech,judgment,opinion,reasoning
"""Actions speak louder than words"" reflects the truth in social interactions.",120e154806,1,1,0,1,1,1
"A bad penny always turns up, illustrating the inevitability of certain patterns.",b972e49103,1,0,0,1,1,0
A balanced diet helps achieve ideal body weight and improves health outcomes.,403f910ce7,0,1,0,0,0,0
A balanced diet is the key; it opens doors to wellness and vitality.,eecf338fed,0,1,0,1,0,0
"A balanced diet supports overall health, deriving from empirical studies in nutrition.",242ca0be47,0,1,0,0,0,0
A balanced equation in chemistry represents the conservation of mass in a reaction.,86b97fd2f1,0,1,0,0,0,0
A chain is only as strong as its weakest link in society.,9ea7fce4e3,1,0,0,1,1,0
A closed mind is a locked door; openness allows new ideas to enter.,063ad7c6e0,1,0,1,1,1,0
"A closed mind resembles a locked door, preventing new knowledge from entering.",d82f60cfb4,1,0,0,1,1,0
A fact remains true regardless of belief or personal perspective.,0eff338849,1,0,0,1,1,0
"A friend in need is a friend indeed, revealing the value of support.",303668e6d8,1,0,0,1,1,1
"A good foundation is essential; without it, structures crumble under pressure.",a1c500e22a,0,0,0,0,0,0
A good plan today is better than a perfect plan tomorrow.,2d239e12a6,1,0,1,1,1,0
A house divided against itself cannot stand; unity is vital for societal stability.,6b5fc4f6cd,1,0,1,1,1,0
"A hypothesis must be tested to determine its validity, guiding scientific research methods.",8ad77eb8e4,1,0,0,1,0,0
A journey of a thousand miles begins with a single step of belief.,b555a0452f,1,0,1,1,1,0
A leopard can't change its spots; deeply held beliefs are hard to alter.,8ad0697204,1,0,0,1,1,1
A missed opportunity is like a ship that sails without its captain.,eb3b90dbcf,1,0,1,1,1,0
"A mixture of hydrogen and oxygen forms water, a fundamental observational chemistry fact.",ce02176840,0,1,0,0,0,0
A penny for your thoughts often leads to deeper reflections on beliefs.,e28a573d0a,1,0,0,1,1,1
"A penny for your thoughts; values can be priceless, shaping our identities.",d17a845da6,1,0,0,1,1,0
"A penny saved is a penny earned, reflecting values around fiscal responsibility.",8fb2ae99d2,1,0,0,1,1,1
A penny saved is a penny earned; wisdom often lies in financial prudence.,8690cf8bef,1,0,1,1,1,1
A rolling stone gathers no moss; movement often breeds opportunity and change.,96ab26b0c1,0,0,1,1,1,1
"A rose by any other name would smell as sweet, illustrating subjective values.",7b3683c01c,0,0,1,1,1,1
A square peg in a round hole highlights the struggle for conformity.,c045c801f7,1,0,0,1,1,0
"A stitch in time saves nine, emphasizing the value of proactive measures.",9b5b961307,0,0,0,1,1,1
A stitch in time saves nine; prevention is worth more than repair.,8211299de7,1,0,1,1,1,1
A watched pot never boils; patience is essential for achieving goals.,10429fc79f,1,0,1,1,1,1
A watched pot never boils; patience is often required in daily life.,1a9789b755,1,0,1,1,1,1
A wise saying teaches us that every rose has its thorns—nothing's perfect.,90bf34a4f2,0,0,1,1,1,0
Absence makes the heart grow fonder; connection often deepens when distance separates.,0ad62cadd6,1,0,1,1,1,1
Absence makes the heart grow fonder; it teaches the value of presence in relationships.,e23ce32105,1,0,1,1,1,1
Absolute truths are as rare as untouched wilderness; they often remain hidden.,5a3725a899,1,0,0,1,1,0
Access to education often reflects societal values about knowledge and opportunity.,559d40cc71,1,0,0,1,1,0
Access to fitness resources reflects societal values surrounding health and wellness.,2c1c28c655,1,1,0,1,1,0
Actions motivated by societal expectations can reflect collective beliefs about success and failure.,da8e2e8627,1,0,0,1,1,1
Actions resonate through time; every decision echoes in the larger community.,a452f2ebab,1,0,0,1,1,1
Actions speak louder than words; behavior exhibits our true values.,ea66468311,1,0,0,1,1,1
Adaptation is critical for survival; environmental challenges shape species behavior over time.,df58d829be,0,1,0,1,0,1
Adaptation is survival; species evolve through challenges posed by their environment.,0b42878b0f,0,1,0,1,1,1
Adequate hydration is crucial for maintaining energy levels during exercise.,de7af060de,0,1,0,0,0,0
Aerobic exercises enhance endurance and promote healthy heart function over time.,cae14e955c,0,1,0,0,0,0
Aesthetic values define what is considered beautiful across different cultures.,d3e61159da,1,0,0,1,1,0
"Air pressure changes with elevation, influencing weather conditions and human experiences.",b195e6b29a,0,1,0,0,0,0
"Algebra involves solving equations, a fundamental concept in mathematics applied to real life.",58ab6ae221,0,1,0,1,0,0
Algorithmic trading utilizes mathematics and technology for investment strategies.,71089f5b5a,1,0,0,1,0,0
"All living organisms are composed of cells, the basic units of life.",de5a1379c7,0,1,0,0,0,0
"All living organisms undergo growth, development, and reproduction, observable biological processes.",8b200d20a1,0,1,0,0,0,0
"All matter is made of atoms, the building blocks of the physical world.",9bf4d2b405,0,0,0,0,0,0
All organisms are composed of cells; this is a fundamental principle of biology.,2b03c853dd,0,1,0,0,0,0
"All roads lead to perception, guiding us through the journey of life.",4a3c4fbed4,1,0,0,1,1,0
An algorithm is a step-by-step procedure for solving a problem.,a6870af387,0,1,0,1,0,0
An apple a day keeps the doctor away; preventive care fosters health and wellness.,322e563039,0,0,0,1,1,0
An apple a day keeps the doctor away; simple choices add up over time.,5f43755b3e,0,0,0,1,1,1
An ounce of prevention is worth a pound of cure in health matters.,4324960cd9,1,0,0,1,1,1
Animals adapt to their environment through behavioral and physiological changes over time.,644108e6d3,0,1,0,0,0,0
"Archimedes' principle explains buoyancy, demonstrating how objects behave when submerged in fluids.",8d9b0fa79b,0,1,0,0,0,0
Art can evoke emotions and stimulate thought in its audience.,fe46a18db0,1,0,0,1,1,0
"Art can provoke thought, challenging perspectives and encouraging dialogue about social issues.",26f50256a1,1,0,0,1,1,0
"Art can serve as a mirror to society, reflecting cultural values and issues.",3bb2a8b5a1,1,0,0,1,1,0
"Art has the power to heal, reflecting the soul's unspoken truths.",771967f939,1,0,0,1,1,0
Art influences cultural identity and expresses individual experiences through various forms.,1ab27d5317,1,0,0,1,1,0
"Art reflects cultural values and beliefs, fostering discussions about societal issues.",0c43f99375,1,0,0,1,1,0
"Art reflects societal themes, expressing cultural values through various creative mediums.",17ad9524cd,1,0,0,1,1,0
"Art reflects society's values, creating a mirror of our experiences.",d6156fda51,1,0,0,1,1,0
"Artistic expression can challenge societal norms, provoking thought and discussion in culture.",68ca87f9df,1,0,0,1,1,0
"Artistic expression is subjective, revealing deeper truths about humanity.",66b7d94f59,1,0,0,1,1,0
"As we learn, we grow; knowledge is the seed, and understanding the flower that blooms.",1ba16b0fe9,1,0,1,1,1,0
Associations between colors and emotions often reflect cultural conditioning and norms.,f8a2b3611c,1,1,0,1,1,0
"Assumptions can drive perceptions, influencing opinions on what is considered true.",c0d8730f78,1,0,0,1,1,1
Atmospheric conditions affect the visibility and clarity of objects over distances.,7bb33ba4ba,0,1,0,0,0,0
"Atmospheric conditions support various forms of weather, influencing daily human life.",36e5f58397,0,1,0,0,0,0
Atoms unite to form molecules; chemical bonds illustrate connections in the natural world.,9bb35b6c90,0,1,0,0,0,0
"Basic arithmetic involves adding, subtracting, multiplying, and dividing whole numbers accurately.",e148278d6d,0,1,0,1,0,0
"Beauty fades, but character remains; true worth lies beyond physical appearances.",0db33a8881,1,0,1,1,1,1
Beauty is only skin deep; character defines lasting impressions over time.,64149a6491,0,0,0,1,1,0
"Beauty is only skin deep; it fades, but character endures.",6b90a4d78e,0,0,1,1,1,0
"Beauty is subjective, as standards can vary widely across cultures and individuals.",ef7fb3b7f2,1,1,0,1,1,0
Beauty is subjective; it's often in the eye of the beholder.,8a266db90f,1,0,0,1,1,0
Beauty is subjective; one person's masterpiece is another's cluttered canvas.,99bc0183fd,1,0,0,1,1,0
Beauty lies in diversity; preferences reflect personal and cultural backgrounds extensively.,73e9af8e10,1,0,0,1,1,0
Beauty standards can vary dramatically between cultures and individual preferences.,76c5f9669f,1,1,0,1,1,0
Beauty standards often reflect societal values and cultural influences.,3791bff192,1,1,0,1,1,0
"Beauty standards vary, shaped by cultural narratives and societal influences.",5a3c86e78d,1,1,0,1,1,0
Behavioral norms are established through cultural narratives and societal expectations over time.,07ea7f04f3,1,1,0,1,1,0
Behavioral norms dictate individual actions based on community expectations.,40e6802e75,1,1,0,1,1,1
"Behavioral norms differ across cultures, illustrating the diversity of social practices.",b25b76e8da,1,1,0,1,0,0
Behind every map lies a story waiting to be uncovered.,d681e0d0c3,0,0,0,1,1,0
Behind every opinion lies an experience; our perspectives are shaped by the past.,ec7103c739,1,0,0,1,1,0
"Being logical is essential for sound decision-making in complex, everyday situations.",cd1150f09c,1,0,0,1,1,0
"Belief systems can bridge divides, uniting diverse groups through shared values and ideals.",d6bd556d65,1,0,0,1,1,0
Beliefs about authority figures can influence individual behavior in social settings.,a9762a7a03,1,1,0,1,1,0
"Beliefs about beauty and aesthetics are often culturally derived, reflecting societal ideals.",fd5c460757,1,0,0,1,1,0
Beliefs about body image can significantly affect mental well-being and self-esteem.,92bbb686e1,1,1,0,1,0,0
"Beliefs about diets vary widely, affecting people's eating habits and health.",9f7e0ea8cc,0,1,0,1,0,0
Beliefs about environmental conservation are influenced by cultural narratives surrounding nature.,37755bda83,0,0,0,1,1,0
Beliefs about environmental conservation shape policies and community practices.,d2189742cf,1,0,0,1,1,0
"Beliefs about happiness may vary; some find fulfillment in relationships, while others seek achievement.",409046da23,1,0,0,1,1,0
"Beliefs about health often evolve, reflecting changes in society and knowledge.",edb54dc4da,1,1,0,1,1,0
Beliefs about health often vary based on cultural background and community values.,bb1f0951ac,1,1,0,1,1,0
Beliefs about health significantly influence lifestyle choices and habits.,e2bef4e33e,1,1,0,1,0,0
Beliefs about justice vary significantly across different cultures and societies.,f6ec38414c,1,0,0,1,1,0
Beliefs about love and relationships are influenced by societal norms and practices.,9cd59bd225,1,0,0,1,1,0
Beliefs about morality often stem from religious convictions and varied interpretations.,76b8e407ce,1,0,0,1,1,0
Beliefs about success shape how individuals pursue their goals and dreams.,c3d38a4d4d,1,0,0,1,1,1
Beliefs about wellness practices are influenced by community cultural values.,8f75d2b17b,1,1,0,1,1,0
"Beliefs are anchors in life’s stormy seas, guiding our responses to waves of uncertainty.",5dd6655676,1,0,0,1,1,0
Beliefs are the lenses through which we view and interpret reality.,ffde79c1bc,1,0,0,1,1,0
"Beliefs can be powerful, influencing actions even without objective proof.",4e1a9e0e27,1,0,0,1,1,0
Beliefs can guide individual choices and shape community interactions significantly.,35716e42ed,1,0,0,1,1,0
Beliefs can influence perception significantly; awareness allows for discerning truth from illusion.,f0e5250119,1,0,0,1,1,0
Beliefs can inspire actions that resonate on an individual and societal level.,a91519644f,1,0,0,1,1,0
"Beliefs can often cloud judgment, influencing how we perceive reality.",9a13b549e0,1,0,0,1,1,0
"Beliefs influence decisions, shaping how individuals perceive their experiences.",5b07119b77,1,0,0,1,1,0
Beliefs may be deeply held yet lack empirical evidence for validation.,2b8c4dd300,1,0,0,1,1,0
Beliefs may change over time based on new experiences and information.,878e856043,1,0,0,1,1,0
Beliefs often shape how we view the world around us.,e910f55f71,1,0,0,1,1,0
Beliefs often stem from societal teachings and can be challenged through scrutiny.,672af538e2,1,0,0,1,1,0
Beliefs regarding cultural heritage often influence community unity and pride.,50e0e31d2f,1,0,0,1,1,0
Beliefs shape our actions and define our personal and communal identities.,eb94659e9b,1,0,0,1,1,0
Beliefs shaped by cultural narratives guide social behavior and interpersonal relationships.,16a74fe667,1,0,0,1,1,0
Beneath the surface of each opinion lies the rich tapestry of individual experiences.,1604db6a8b,1,0,0,1,1,0
"Biases can cloud judgment, distorting our interpretations of actions and events.",bb7159eb95,1,0,0,1,1,0
"Biodiversity contributes to ecosystem resilience, ensuring the survival of various species.",3a3b833868,0,1,0,0,0,0
Biodiversity in ecosystems contributes to resilience against environmental changes and disruptions.,2bbb9f7815,0,1,0,0,0,0
Biological classifications help organize knowledge about species and their relationships accurately.,8bd17a862d,0,1,0,0,0,0
Biological diversity plays a crucial role in ecosystem stability and health.,4231963e5a,0,1,0,0,0,0
"Biological evolution occurs through natural selection, shaping species over generations.",5a578ea2c4,0,1,0,0,0,0
"Biological organisms respond to environmental stimuli, showcasing natural behaviors in life.",ca1a4d912c,0,1,0,0,0,0
"Biological processes follow natural laws, like evolution through natural selection.",141ce65e07,0,1,0,0,0,0
Biological systems exhibit resilience when exposed to environmental stresses and challenges.,c2b6536df1,0,1,0,0,0,0
"Biological systems follow natural rules, operating based on established scientific principles.",462ecab493,0,1,0,0,0,0
"Biology reveals the complexity of life, unearthing patterns in nature's design.",864909e8c0,0,0,0,0,1,0
Biospheres are influenced by energy flow and nutrient cycling within ecosystems.,dafa33974b,0,1,0,0,0,0
Birds fly south for winter; it's a survival instinct shaped by evolutionary adaptation.,930bc05192,0,1,0,0,0,0
"Birds migrate seasonally, adapting to changes in climate and food availability.",0ff28208b9,0,1,0,0,0,0
Birds of a feather flock together; shared values shape group dynamics and relationships.,a930c7a720,1,0,0,1,1,0
Bridges must be designed to endure natural forces such as wind and earthquakes.,2c3d5743d6,0,1,0,0,0,0
"Bridges must be engineered to withstand forces acting upon them, ensuring structural integrity.",cd269c2718,0,1,0,0,0,0
Building codes ensure structures are safe and meet engineering requirements.,c0ba30c6f4,0,1,0,1,0,0
Building materials must meet safety regulations to ensure structural integrity.,c7db9af611,0,1,0,1,0,0
Building muscle through strength training promotes metabolic health and overall fitness.,48dc3d2608,0,1,0,0,0,0
Buildings must adhere to engineering codes for safety and functionality.,c81f9e4923,0,1,0,1,0,0
"By studying fossils, scientists can reconstruct past climates and ecosystems.",acff854d1b,0,1,0,0,0,0
Calculus illustrates how everything in life is a series of changing rates; embrace the flow.,37f0666735,0,1,0,0,1,0
Caloric intake needs to balance physical activity for weight maintenance and health.,de29b1a8de,0,1,0,0,0,0
Caloric intake versus expenditure influences weight management and overall health.,72c0118628,0,1,0,0,0,0
Calories consumed must balance calories burned for effective weight management.,e6a173a02f,0,1,0,0,0,0
Calories consumed versus calories burned determines weight management outcomes.,127c5e6ff3,0,1,0,0,0,0
"Cardiovascular exercises, like running, support heart health and endurance over time.",2f0e7f3d03,0,1,0,0,0,0
"Causation and correlation are distinct concepts, emphasizing different relationships in data.",8f7ff137f6,0,1,0,0,0,0
"Causation and correlation distinguish between related findings, aiding in the understanding of data.",d8962db0cb,0,1,0,0,0,0
Cell division through mitosis plays a crucial role in organism growth and repair processes.,9e5f2272ae,0,1,0,0,0,0
"Cells divide through mitosis, facilitating growth and repair in living organisms.",7c2dae41a0,0,1,0,0,0,0
"Cells divide through processes like mitosis and meiosis, essential for growth.",7a38fdd59c,0,1,0,0,0,0
"Cells divide through processes like mitosis, a well-documented biological phenomenon.",66654126f2,0,1,0,0,0,0
"Cells reproduce through processes like mitosis, a biological standard observable in living organisms.",b177b1b261,0,1,0,0,0,0
Cellular respiration in humans requires oxygen to produce energy.,44743f3c16,0,1,0,0,0,0
Cellular respiration in living organisms converts glucose into usable energy byproducts.,3ec833a10a,0,1,0,0,0,0
"Chemical bonds dictate how elements interact, shaping the properties of compounds produced.",a0b55864fb,0,1,0,0,0,0
"Chemical changes are observable during reactions, demonstrating material transformation and conservation.",ebeab78473,0,1,0,0,0,0
Chemical compounds are defined by the types and arrangements of their constituent atoms.,b57d3102ba,0,1,0,0,0,0
"Chemical formulas represent the composition of substances, illustrating fundamental concepts in chemistry.",35109714e6,0,1,0,0,0,0
Chemical properties of substances predict how they will interact with one another.,802a583d48,0,1,0,0,0,0
"Chemical reactions adhere to stoichiometry, which governs how substances interact and change.",2e792a3796,0,1,0,0,0,0
Chemical reactions can be classified based on their types and energy changes.,239ff9fbea,0,1,0,0,0,0
Chemical reactions demonstrate principles of conservation of mass in closed systems.,eb09bc6cf4,0,1,0,0,0,0
Chemical reactions exhibit predictable behavior based on the properties of reacting substances.,57b6e31568,0,1,0,0,0,0
Chemical reactions follow predictable behaviors; understanding them helps reveal nature's secrets.,7e917a50e7,0,1,0,0,1,0
"Chemical reactions follow the law of conservation of mass, which is observable.",4e713457a0,0,1,0,0,0,0
"Chemistry explains how substances react, providing insight into bonds that form and break.",8be4077497,0,1,0,0,0,0
Chemistry provides insights into how substances interact and change during reactions.,d67d23d71a,0,1,0,0,0,0
"Chemistry reveals how substances interact and transform, illustrating principles of matter.",3fd272bd0f,0,1,0,0,0,0
Chemists study reactive substances to understand chemical bonding and transformations that occur.,8c17956e73,0,1,0,0,0,0
Circumference is calculated using the formula C=2πr for circles.,0d1b2fdf00,0,1,0,0,0,0
Cities can grow and develop based on economic opportunities and resources.,ef34d20ae5,0,1,0,1,1,0
Classification of species reveals patterns in biological diversity and evolution scientifically.,c97910e456,0,1,0,0,0,0
Cleaning your hands reduces the spread of germs and illnesses effectively.,66a513f79b,0,1,0,0,0,0
Climate change impacts are assessed using scientific models to predict outcomes.,434d86bc05,0,1,0,0,0,0
"Climate change impacts biodiversity, causing shifts in habitat suitability for various species.",6f6e64c715,0,1,0,0,0,0
"Climate change impacts global weather patterns, affecting livelihoods and natural environments.",b546a29041,0,1,0,0,0,0
"Climate zones are classified based on temperature, precipitation, and vegetation characteristics.",fca4f91365,0,1,0,0,0,0
"Code is the language of technology, shaping our digital interactions.",57e319f2cc,0,0,0,1,0,0
Cognitive biases affect how we perceive information and make judgments.,88f895a662,1,0,0,1,0,0
"Cold fronts can lead to abrupt weather changes, impacting local climates significantly.",04f55a35bd,0,1,0,0,0,0
Collective beliefs can influence social policies and community practices collectively.,6755ba2beb,1,0,0,1,1,0
Collective knowledge forms the basis of societal norms and expectations.,e98b8371ce,1,0,0,1,1,0
"Collective values guide societal norms, influencing interpersonal relationships across cultures.",0c87384e86,1,0,0,1,1,0
Coming together creates strength; unity fosters resilience in diverse communities.,57c4178eb2,1,0,0,1,1,0
Common sayings often reveal insights about human behavior and experience.,ad5208002f,1,1,0,1,1,0
Communication connects us; it reveals the threads of understanding that weave relationships together.,52d4604499,1,0,0,1,1,0
"Communication is essential in societies, guiding interactions and establishing relationships among individuals.",96027c7ff8,1,0,0,1,1,0
"Communication is key; without it, misunderstandings can lead to conflict.",5e4c58224d,1,1,0,1,1,0
Communication is the bridge connecting hearts; understanding goes beyond mere words.,3101a9d5f1,1,0,0,1,1,0
"Communication styles can differ across cultures, impacting relationships and understanding.",6416657188,1,1,0,1,1,0
Communication through language reflects cultural values and informs social interactions among individuals.,2040d5228e,1,0,0,1,1,0
"Community engagement encourages collaborative problem-solving, demonstrating the power of shared values.",d597bdb237,1,0,0,1,1,0
Community engagement fosters a sense of belonging and contributes to personal identity.,c3e9578c85,1,0,0,1,1,0
"Community is a tapestry woven together, highlighting the strength in diversity.",334eb53f97,1,0,0,1,1,0
Community norms shape how people behave and interact with one another.,5e1b3c80a4,1,0,0,1,1,0
"Community practices are shaped by shared beliefs, influencing how members interact.",c92bc846b1,1,0,0,1,1,0
"Community service is often valued, reflecting societal beliefs about helping others.",7869ea1e79,1,1,0,1,1,0
"Community strength lies in diversity, enhancing resilience and collective problem-solving capabilities.",76b5987eb9,1,0,0,1,1,0
"Community values are like roots, anchoring individuals within a shared cultural identity.",60cb720c7b,1,0,0,1,1,0
Conclusions derived from evidence can guide decision-making in various aspects of life.,bf19056d31,1,0,0,1,1,0
Conclusions derived from evidence reveal deeper insights into the nature of reality.,5c0a13983d,1,0,0,1,1,0
"Connections between people strengthen communities, emphasizing the value of relationships.",661a902ec0,1,0,0,1,1,0
Consensus about what constitutes truth can shape societal beliefs and norms.,9c368a4a19,1,0,0,1,1,0
Consensus among individuals can shape collective beliefs within a community.,83d28c517b,1,0,0,1,1,1
Consensus among scientists can lead to the establishment of theoretical frameworks.,11c9ac72d1,1,0,0,1,1,0
Consensus among scientists drives the evolution of our understanding of nature.,ce189910a4,1,0,0,1,1,0
"Consensus can create a sense of normalcy, shaping social interactions profoundly.",a578b75e32,1,0,0,1,1,1
"Consensus can create reality, but unchallenged norms may limit progress.",716f95632b,1,0,0,1,1,1
"Consensus can create reality, proving that belief shapes our experiences.",3005edf09e,1,0,0,1,1,0
Consensus can shape perceptions; common beliefs influence societal norms and values.,363f87f10f,1,0,0,1,1,0
Consensus in communities can determine acceptable behavior and social norms.,96bd6a2aca,1,1,0,1,1,0
"Consensus shapes norms, defining what is acceptable within various communities.",8c3aad71da,1,0,0,1,1,1
Conservation laws describe how energy and matter behave in closed systems consistently.,7807dbc24d,0,1,0,0,0,0
Consistent measurements allow scientists to replicate experiments and validate findings.,5e5c674512,0,1,0,0,0,0
Consumer choices impact the economy and reflect societal trends in purchasing behaviors.,872f0ecbc7,1,1,0,1,1,0
Contemporary beliefs about climate change affect policies and environmental decisions.,dcf4e176f4,0,1,0,1,1,0
Conventional wisdom can offer insights; it reflects collective knowledge shaped by experiences.,cd0d6a98f0,1,0,0,1,1,0
Conventional wisdom can sometimes reflect underlying truths about human behavior.,8afd1b4add,1,0,0,1,1,0
"Conventional wisdom often guides decision-making, yet it may not always reflect empirical truths.",c125bd8722,1,0,0,1,1,0
"Conventional wisdom suggests that time heals all wounds, reflecting societal views on grief.",9bc8b4bb33,1,0,0,1,1,0
"Cooking methods affect the flavor and texture of food, revealing culinary traditions.",972a2a6be9,0,1,0,0,0,0
"Cosmic phenomena follow predictable patterns, observable through scientific inquiry and experimentation.",c43c74233a,0,1,0,0,0,0
Craftsmanship standards dictate quality expectations in industries and trades alike.,68850f0fb4,1,1,0,1,1,0
Creative expression through art reflects cultural values and offers insights into human experience.,a44d35f560,1,0,0,1,1,0
Critical thinking fosters clearer understanding and better problem-solving skills.,3ca3344a80,1,1,0,1,1,0
"Cultural artifacts preserve history, reflecting the values and beliefs of past societies.",67af2c12e1,1,0,0,1,1,0
Cultural attitudes toward exercise define community standards and personal motivations.,ec8c124852,1,0,0,1,1,0
Cultural beliefs about health impact dietary choices and wellness practices.,c8bb47f976,0,1,0,1,0,0
Cultural beliefs about technology often shape its adoption in society.,085fdb10cc,1,0,0,1,1,0
Cultural beliefs can significantly influence perceptions of morality and ethical behavior.,f16ff741fe,1,0,0,1,1,0
Cultural beliefs impact how communities interact and respond to challenges.,0896b8095a,1,0,0,1,0,0
Cultural beliefs influence how individuals approach mental health and overall well-being.,e1342ef4eb,1,1,0,1,0,0
Cultural constructs create frameworks for understanding social interactions and norms.,49b60c5962,1,0,0,1,0,0
Cultural contexts dictate what is considered healthy or unhealthy food choices.,c5c5f8279c,0,1,0,1,0,0
Cultural conventions dictate how individuals interact with one another in society.,94d1180c82,1,0,0,1,0,0
