statements,processed
Email is a way for politicians to communicate with supporters and inform them about campaign issues.,Processed Email is a way for politicians to communicate with supporters and inform them about campaign issues.
Health care workers risk their lives to protect others during health crises.,Processed Health care workers risk their lives to protect others during health crises.
Small businesses can face bankruptcy due to prolonged closures.,Processed Small businesses can face bankruptcy due to prolonged closures.
Donations can help provide food for unemployed individuals.,Processed Donations can help provide food for unemployed individuals.
Supporting each other during crises can help communities recover more quickly.,Processed Supporting each other during crises can help communities recover more quickly.
Humans should wear masks to prevent the spread of infectious diseases.,Processed Humans should wear masks to prevent the spread of infectious diseases.
Elected leaders should not spread dangerous misinformation.,Processed Elected leaders should not spread dangerous misinformation.
It is important to tackle climate change.,Processed It is important to tackle climate change.
Protecting Social Security and Medicare is a priority.,Processed Protecting Social Security and Medicare is a priority.
People in competitive districts need to work hard to win elections.,Processed People in competitive districts need to work hard to win elections.
Special interest groups often donate to political campaigns.,Processed Special interest groups often donate to political campaigns.
Grassroots supporters can contribute to political campaigns.,Processed Grassroots supporters can contribute to political campaigns.
Elections have deadlines for fundraising.,Processed Elections have deadlines for fundraising.
Incumbents can be defeated by newcomers in elections.,Processed Incumbents can be defeated by newcomers in elections.
"Members of Congress address issues such as climate change, infrastructure, homelessness, and the protection of Social Security and Medicare.","Processed Members of Congress address issues such as climate change, infrastructure, homelessness, and the protection of Social Security and Medicare."
Email is a way for politicians to communicate with supporters.,Processed Email is a way for politicians to communicate with supporters.
Small businesses are being affected by necessary social distancing.,Processed Small businesses are being affected by necessary social distancing.
Social distancing is necessary during the coronavirus pandemic.,Processed Social distancing is necessary during the coronavirus pandemic.
Low-interest loans can help protect small businesses and their employees.,Processed Low-interest loans can help protect small businesses and their employees.
Small Business Administration Disaster Loans are intended to support businesses in times of crisis.,Processed Small Business Administration Disaster Loans are intended to support businesses in times of crisis.
Staying safe is important during a pandemic.,Processed Staying safe is important during a pandemic.
Voters receive mail-in ballots before an election.,Processed Voters receive mail-in ballots before an election.
Campaigns raise funds to communicate their message to voters.,Processed Campaigns raise funds to communicate their message to voters.
Elections can be closely contested.,Processed Elections can be closely contested.
Political campaigns often ask for donations.,Processed Political campaigns often ask for donations.
Incumbents can be defeated by newcomers in elections.,Processed Incumbents can be defeated by newcomers in elections.
"Members of Congress address issues such as climate change, infrastructure, homelessness, and the protection of Social Security and Medicare.","Processed Members of Congress address issues such as climate change, infrastructure, homelessness, and the protection of Social Security and Medicare."
Elected officials use email to communicate with supporters.,Processed Elected officials use email to communicate with supporters.
The Fourth of July is associated with fireworks shows and parades.,Processed The Fourth of July is associated with fireworks shows and parades.
The Fourth of July is a time when Americans think about their nation's founding.,Processed The Fourth of July is a time when Americans think about their nation's founding.
"All men are created equal and have certain unalienable Rights, including Life, Liberty, and the pursuit of Happiness.","Processed All men are created equal and have certain unalienable Rights, including Life, Liberty, and the pursuit of Happiness."
"Equality, liberty, and justice are ideals of America.","Processed Equality, liberty, and justice are ideals of America."
Elections are competitive events where candidates may receive endorsements and grades from various organizations.,Processed Elections are competitive events where candidates may receive endorsements and grades from various organizations.
Political campaigns often request donations from supporters.,Processed Political campaigns often request donations from supporters.
"Super PACs can contribute large sums of money to political races, often for advertising purposes.","Processed Super PACs can contribute large sums of money to political races, often for advertising purposes."
Gun violence is a concern for many communities and individuals.,Processed Gun violence is a concern for many communities and individuals.
"Politicians work on issues such as climate change, infrastructure, homelessness, and the protection of Social Security and Medicare.","Processed Politicians work on issues such as climate change, infrastructure, homelessness, and the protection of Social Security and Medicare."
Email is a common method for political campaigns to communicate with supporters.,Processed Email is a common method for political campaigns to communicate with supporters.
"People in Congress work to address issues such as climate change, deteriorating infrastructure, homelessness, and the protection of Social Security and Medicare.","Processed People in Congress work to address issues such as climate change, deteriorating infrastructure, homelessness, and the protection of Social Security and Medicare."
Elections require financial support from donors.,Processed Elections require financial support from donors.
Incumbents can be defeated by newcomers in political campaigns.,Processed Incumbents can be defeated by newcomers in political campaigns.
Email is a way for politicians to communicate with their supporters and inform them about critical issues.,Processed Email is a way for politicians to communicate with their supporters and inform them about critical issues.
People generally appreciate being thanked for their donations.,Processed People generally appreciate being thanked for their donations.
Health care workers are considered to be at risk when treating patients during a pandemic.,Processed Health care workers are considered to be at risk when treating patients during a pandemic.
Unemployment can lead to difficulties in affording basic necessities like food.,Processed Unemployment can lead to difficulties in affording basic necessities like food.
Small businesses can face financial challenges when they are forced to close.,Processed Small businesses can face financial challenges when they are forced to close.
Charitable donations can help support communities during crises.,Processed Charitable donations can help support communities during crises.
Politicians often seek donations for their re-election campaigns.,Processed Politicians often seek donations for their re-election campaigns.
Emails are a common way for politicians to communicate with supporters.,Processed Emails are a common way for politicians to communicate with supporters.
Debates are a way for voters to get a sense of the candidate they're voting for.,Processed Debates are a way for voters to get a sense of the candidate they're voting for.
Social media is a platform where political campaigns can attack or promote their positions.,Processed Social media is a platform where political campaigns can attack or promote their positions.
"Congress members work on issues such as climate change, infrastructure, homelessness, and protecting Social Security and Medicare.","Processed Congress members work on issues such as climate change, infrastructure, homelessness, and protecting Social Security and Medicare."
Elections can be tough re-election fights for incumbents.,Processed Elections can be tough re-election fights for incumbents.
Email is a way for political campaigns to communicate with supporters.,Processed Email is a way for political campaigns to communicate with supporters.
Elections are a time when donations can support political campaigns.,Processed Elections are a time when donations can support political campaigns.
Voting is a way for citizens to participate in their government.,Processed Voting is a way for citizens to participate in their government.
Political campaigns often ask for donations to support their efforts.,Processed Political campaigns often ask for donations to support their efforts.
"Elected officials are expected to address issues such as climate change, infrastructure, homelessness, and the protection of Social Security and Medicare.","Processed Elected officials are expected to address issues such as climate change, infrastructure, homelessness, and the protection of Social Security and Medicare."
Emails can be used to communicate with supporters and inform them about campaign issues and events.,Processed Emails can be used to communicate with supporters and inform them about campaign issues and events.
2020 is on track to be one of the warmest years in recorded history.,Processed 2020 is on track to be one of the warmest years in recorded history.
January was the hottest ever recorded globally.,Processed January was the hottest ever recorded globally.
It did not rain once in cities throughout California in February.,Processed It did not rain once in cities throughout California in February.
Rising sea levels and unseasonable heat waves are effects of climate change.,Processed Rising sea levels and unseasonable heat waves are effects of climate change.
Climate change can lead to horrific fires.,Processed Climate change can lead to horrific fires.
People generally wear masks to prevent the spread of coronavirus.,Processed People generally wear masks to prevent the spread of coronavirus.
College graduates usually receive diplomas at graduation ceremonies.,Processed College graduates usually receive diplomas at graduation ceremonies.
Fourth graders typically learn science in a classroom setting.,Processed Fourth graders typically learn science in a classroom setting.
Businesses can be permanently closed due to economic challenges.,Processed Businesses can be permanently closed due to economic challenges.
Congress members represent specific districts in the United States.,Processed Congress members represent specific districts in the United States.
"Climate change, infrastructure, homelessness, Social Security, and Medicare are common issues addressed by politicians.","Processed Climate change, infrastructure, homelessness, Social Security, and Medicare are common issues addressed by politicians."
Political campaigns often rely on donations from individuals.,Processed Political campaigns often rely on donations from individuals.
Emails are a method of communication used for keeping people informed and involved in campaigns.,Processed Emails are a method of communication used for keeping people informed and involved in campaigns.
Election campaigns often require financial support from donors.,Processed Election campaigns often require financial support from donors.
Endorsements from prominent figures can be influential in political campaigns.,Processed Endorsements from prominent figures can be influential in political campaigns.
Political campaigns can be competitive and challenging.,Processed Political campaigns can be competitive and challenging.
Incumbents can be defeated by newcomers in political races.,Processed Incumbents can be defeated by newcomers in political races.
"Members of Congress work on issues such as climate change, infrastructure, homelessness, and protecting social programs.","Processed Members of Congress work on issues such as climate change, infrastructure, homelessness, and protecting social programs."
Grassroots support can be crucial for political campaigns.,Processed Grassroots support can be crucial for political campaigns.
Email is a common method for politicians to communicate with supporters and solicit donations.,Processed Email is a common method for politicians to communicate with supporters and solicit donations.
Hitting a fundraising goal can show momentum in a political race.,Processed Hitting a fundraising goal can show momentum in a political race.
Momentum in a political campaign can influence the outcome of an election.,Processed Momentum in a political campaign can influence the outcome of an election.
Political campaigns often depend on the support of grassroots individuals.,Processed Political campaigns often depend on the support of grassroots individuals.
Email is a way for political campaigns to communicate with supporters.,Processed Email is a way for political campaigns to communicate with supporters.
Elections have a specific date.,Processed Elections have a specific date.
Donations can be solicited via email.,Processed Donations can be solicited via email.
Following science is important during a health crisis.,Processed Following science is important during a health crisis.
Healthcare is a concern for many people.,Processed Healthcare is a concern for many people.
Politicians can have different stances on issues.,Processed Politicians can have different stances on issues.
Climate change is a topic of concern.,Processed Climate change is a topic of concern.
Infrastructure can deteriorate over time.,Processed Infrastructure can deteriorate over time.
Homelessness is a societal issue.,Processed Homelessness is a societal issue.
Social Security and Medicare are programs intended to support individuals.,Processed Social Security and Medicare are programs intended to support individuals.
Email is a communication tool.,Processed Email is a communication tool.
Campaigns can offer options to receive fewer emails or unsubscribe.,Processed Campaigns can offer options to receive fewer emails or unsubscribe.
Ignoring medical guidance during a pandemic can risk lives.,Processed Ignoring medical guidance during a pandemic can risk lives.
Wearing masks is a recommended precaution to prevent the spread of coronavirus.,Processed Wearing masks is a recommended precaution to prevent the spread of coronavirus.
Indoor gatherings without proper safety measures during a pandemic can be dangerous.,Processed Indoor gatherings without proper safety measures during a pandemic can be dangerous.
Election Day is a specific date when voters cast their ballots to elect public officials.,Processed Election Day is a specific date when voters cast their ballots to elect public officials.
Climate change is an issue that requires attention and action.,Processed Climate change is an issue that requires attention and action.
Infrastructure can deteriorate over time and may need to be addressed.,Processed Infrastructure can deteriorate over time and may need to be addressed.
Homelessness is a societal issue that needs to be confronted.,Processed Homelessness is a societal issue that needs to be confronted.
"Social Security and Medicare are programs intended to support individuals, typically in retirement or with specific needs.","Processed Social Security and Medicare are programs intended to support individuals, typically in retirement or with specific needs."
Every single vote counts in an election.,Processed Every single vote counts in an election.
Fundraising can help political campaigns reach undecided voters.,Processed Fundraising can help political campaigns reach undecided voters.
Elections can be won or lost by a narrow margin.,Processed Elections can be won or lost by a narrow margin.
Paying taxes is a legal obligation for individuals and businesses.,Processed Paying taxes is a legal obligation for individuals and businesses.
Election campaigns often involve accusations between opponents.,Processed Election campaigns often involve accusations between opponents.
Politicians often ask for donations to support their campaigns.,Processed Politicians often ask for donations to support their campaigns.
Public servants are expected to stand for what's right.,Processed Public servants are expected to stand for what's right.
"Climate change, infrastructure, homelessness, Social Security, and Medicare are common issues addressed by politicians.","Processed Climate change, infrastructure, homelessness, Social Security, and Medicare are common issues addressed by politicians."
Elections can be competitive and tough.,Processed Elections can be competitive and tough.
"We need leaders who will be accountable to voters by actually engaging in thoughtful, fair debates before the election.","Processed We need leaders who will be accountable to voters by actually engaging in thoughtful, fair debates before the election."
Debates are a way for political candidates to show their commitment to addressing important issues.,Processed Debates are a way for political candidates to show their commitment to addressing important issues.
Elections are a democratic process in which citizens can participate.,Processed Elections are a democratic process in which citizens can participate.
Political campaigns often request contributions from supporters.,Processed Political campaigns often request contributions from supporters.
Members of Congress serve specific districts in the United States.,Processed Members of Congress serve specific districts in the United States.
"Climate change, infrastructure, homelessness, Social Security, and Medicare are common issues addressed by politicians.","Processed Climate change, infrastructure, homelessness, Social Security, and Medicare are common issues addressed by politicians."
Email is a method of communication used for keeping supporters informed and involved in political campaigns.,Processed Email is a method of communication used for keeping supporters informed and involved in political campaigns.
Deadlines are important in a work or campaign context.,Processed Deadlines are important in a work or campaign context.
Political campaigns often seek donations for support.,Processed Political campaigns often seek donations for support.
Elected officials represent specific geographic areas.,Processed Elected officials represent specific geographic areas.
Climate change is a topic of concern for some politicians.,Processed Climate change is a topic of concern for some politicians.
Infrastructure can deteriorate over time.,Processed Infrastructure can deteriorate over time.
Homelessness is a social issue that requires attention.,Processed Homelessness is a social issue that requires attention.
"Social Security and Medicare are programs intended to support individuals, typically in retirement or with specific needs.","Processed Social Security and Medicare are programs intended to support individuals, typically in retirement or with specific needs."
Emails can be used to communicate with supporters and inform them about issues.,Processed Emails can be used to communicate with supporters and inform them about issues.
Voters can choose to unsubscribe from political campaign emails.,Processed Voters can choose to unsubscribe from political campaign emails.
Newspapers don't endorse a candidate every day.,Processed Newspapers don't endorse a candidate every day.
People who go to Washington D.C. are expected to represent the needs of their communities.,Processed People who go to Washington D.C. are expected to represent the needs of their communities.
Climate change is a topic that requires attention and action.,Processed Climate change is a topic that requires attention and action.
Infrastructure can deteriorate over time.,Processed Infrastructure can deteriorate over time.
Homelessness is an issue that needs to be confronted.,Processed Homelessness is an issue that needs to be confronted.
Social Security and Medicare are programs intended to protect individuals.,Processed Social Security and Medicare are programs intended to protect individuals.
Elections are a time when campaigns often ask for support from their constituents.,Processed Elections are a time when campaigns often ask for support from their constituents.
Meeting fundraising goals can show the level of enthusiasm for a campaign.,Processed Meeting fundraising goals can show the level of enthusiasm for a campaign.
Campaigns use donations to support their activities and goals.,Processed Campaigns use donations to support their activities and goals.
Incumbents can be defeated by newcomers in political campaigns.,Processed Incumbents can be defeated by newcomers in political campaigns.
"Members of Congress work on issues such as climate change, infrastructure, homelessness, and protecting Social Security and Medicare.","Processed Members of Congress work on issues such as climate change, infrastructure, homelessness, and protecting Social Security and Medicare."
Email is a common method for political campaigns to communicate with supporters.,Processed Email is a common method for political campaigns to communicate with supporters.
Election Day is a time when citizens can vote.,Processed Election Day is a time when citizens can vote.
Voting locations are open until a specific time on Election Day.,Processed Voting locations are open until a specific time on Election Day.
"In some places, you can register to vote on Election Day.","Processed In some places, you can register to vote on Election Day."
Wearing a mask can help prevent the spread of diseases.,Processed Wearing a mask can help prevent the spread of diseases.
Social Security and Medicare are programs intended to support individuals.,Processed Social Security and Medicare are programs intended to support individuals.
Election Day is a specific date on which voting takes place.,Processed Election Day is a specific date on which voting takes place.
Members of Congress serve specific districts within the United States.,Processed Members of Congress serve specific districts within the United States.
Political campaigns often depend on donations from supporters.,Processed Political campaigns often depend on donations from supporters.
Climate change is a topic of concern in politics.,Processed Climate change is a topic of concern in politics.
Infrastructure can deteriorate over time.,Processed Infrastructure can deteriorate over time.
Homelessness is a social issue that governments may address.,Processed Homelessness is a social issue that governments may address.
"Social Security and Medicare are programs intended to support individuals, often in retirement or with healthcare needs.","Processed Social Security and Medicare are programs intended to support individuals, often in retirement or with healthcare needs."
Emails can be used to communicate with supporters and inform them about critical issues.,Processed Emails can be used to communicate with supporters and inform them about critical issues.
Voters can unsubscribe from political campaign emails if they choose to.,Processed Voters can unsubscribe from political campaign emails if they choose to.
Small businesses have been affected by the effects of the coronavirus.,Processed Small businesses have been affected by the effects of the coronavirus.
Tax credits can help businesses pay for precautionary supplies.,Processed Tax credits can help businesses pay for precautionary supplies.
Wearing personal protective equipment is a precaution against the coronavirus.,Processed Wearing personal protective equipment is a precaution against the coronavirus.
Election Day is a significant event in democratic countries where citizens vote for their representatives.,Processed Election Day is a significant event in democratic countries where citizens vote for their representatives.
Campaigns often request donations from supporters to fund their activities.,Processed Campaigns often request donations from supporters to fund their activities.
Merchandise is sometimes offered as an incentive for campaign donations.,Processed Merchandise is sometimes offered as an incentive for campaign donations.
Incumbents can be defeated by newcomers in elections.,Processed Incumbents can be defeated by newcomers in elections.
"Climate change, infrastructure, homelessness, Social Security, and Medicare are common issues addressed by politicians.","Processed Climate change, infrastructure, homelessness, Social Security, and Medicare are common issues addressed by politicians."
Grassroots support is important for political campaigns.,Processed Grassroots support is important for political campaigns.
Climate change is a significant issue that needs to be tackled.,Processed Climate change is a significant issue that needs to be tackled.
Infrastructure can deteriorate over time.,Processed Infrastructure can deteriorate over time.
Homelessness is a problem that societies face.,Processed Homelessness is a problem that societies face.
"Social Security and Medicare are programs designed to support individuals, typically in retirement or with specific needs.","Processed Social Security and Medicare are programs designed to support individuals, typically in retirement or with specific needs."
Elections are competitive and can be tough for candidates.,Processed Elections are competitive and can be tough for candidates.
