statements,processed
The Green New Deal is a policy proposal,Processed The Green New Deal is a policy proposal
Elected leaders are expected to deliver results for their constituents,Processed Elected leaders are expected to deliver results for their constituents
There are twelve months in a year.,Processed There are twelve months in a year.
Elections are scheduled events.,Processed Elections are scheduled events.
Political campaigns often ask for donations.,Processed Political campaigns often ask for donations.
Television can be used for political advertising.,Processed Television can be used for political advertising.
Taxes are typically used to fund government services and programs.,Processed Taxes are typically used to fund government services and programs.
Elections determine who will represent the public in government.,Processed Elections determine who will represent the public in government.
Campaigns often request donations to support their efforts.,Processed Campaigns often request donations to support their efforts.
COVID-19 vaccines should be provided at no cost to those who want them.,Processed COVID-19 vaccines should be provided at no cost to those who want them.
There should be no tolerance for racism and LGBTQ discrimination.,Processed There should be no tolerance for racism and LGBTQ discrimination.
Women should have equal rights under the law.,Processed Women should have equal rights under the law.
People generally work towards achieving their set goals.,Processed People generally work towards achieving their set goals.
Political campaigns often have fundraising goals.,Processed Political campaigns often have fundraising goals.
Supporters are commonly asked to donate to political campaigns.,Processed Supporters are commonly asked to donate to political campaigns.
Taking care of family and loved ones is a priority for many people.,Processed Taking care of family and loved ones is a priority for many people.
We are more than halfway through the last day of the month,Processed We are more than halfway through the last day of the month
"every donation, no matter how small, adds up","Processed every donation, no matter how small, adds up"
not everyone can donate,Processed not everyone can donate
Drought and high temperatures can contribute to the spread of fires.,Processed Drought and high temperatures can contribute to the spread of fires.
Climate change can exacerbate environmental disasters.,Processed Climate change can exacerbate environmental disasters.
Future generations will be affected by the actions we take today.,Processed Future generations will be affected by the actions we take today.
Health care is important for the community,Processed Health care is important for the community
Elected representatives are expected to work for the good of their constituents and the country,Processed Elected representatives are expected to work for the good of their constituents and the country
You can't gaslight a virus.,Processed You can't gaslight a virus.
Having the resources to get our message out is critical.,Processed Having the resources to get our message out is critical.
We must not panic,Processed We must not panic
We must take all common sense precautions,Processed We must take all common sense precautions
We must listen to the facts from our health care professionals,Processed We must listen to the facts from our health care professionals
We must look after each other,Processed We must look after each other
Let's be kind to one another,Processed Let's be kind to one another
The impact of COVID-19 has been devastating.,Processed The impact of COVID-19 has been devastating.
The virus is still with us.,Processed The virus is still with us.
Everyone should have access to health care regardless of employment status.,Processed Everyone should have access to health care regardless of employment status.
"Investing in education, infrastructure, and preparedness is important for readiness for future challenges.","Processed Investing in education, infrastructure, and preparedness is important for readiness for future challenges."
Hard work and a commitment to helping others can drive success.,Processed Hard work and a commitment to helping others can drive success.
Protecting the health and well-being of citizens is a priority during a pandemic.,Processed Protecting the health and well-being of citizens is a priority during a pandemic.
Medical professionals are mobilized in response to health crises.,Processed Medical professionals are mobilized in response to health crises.
Governments organize task forces to address complex issues.,Processed Governments organize task forces to address complex issues.
Economic activity is important for pursuing personal goals.,Processed Economic activity is important for pursuing personal goals.
Reopening an economy requires careful planning and consideration of data.,Processed Reopening an economy requires careful planning and consideration of data.
Individuals have a responsibility to do the right thing for the collective good.,Processed Individuals have a responsibility to do the right thing for the collective good.
Communities often come together to support each other in times of need.,Processed Communities often come together to support each other in times of need.
Fundraising is a common activity for political campaigns.,Processed Fundraising is a common activity for political campaigns.
Rebuilding after a crisis is a collective effort.,Processed Rebuilding after a crisis is a collective effort.
People generally appreciate being thanked for their hard work.,Processed People generally appreciate being thanked for their hard work.
Public service is often associated with helping people in difficult times.,Processed Public service is often associated with helping people in difficult times.
Elections are a time when citizens vote to decide on their leaders.,Processed Elections are a time when citizens vote to decide on their leaders.
Leaders are expected to put the interests of the people they serve above politics.,Processed Leaders are expected to put the interests of the people they serve above politics.
Social distancing can help prevent the spread of COVID-19.,Processed Social distancing can help prevent the spread of COVID-19.
"If you feel sick, you should stay home and not go to work.","Processed If you feel sick, you should stay home and not go to work."
People with serious underlying health conditions are at increased risk for more severe illness from COVID-19.,Processed People with serious underlying health conditions are at increased risk for more severe illness from COVID-19.
Good hygiene practices can help protect yourself and others from COVID-19.,Processed Good hygiene practices can help protect yourself and others from COVID-19.
Avoiding social gatherings can reduce the transmission of COVID-19.,Processed Avoiding social gatherings can reduce the transmission of COVID-19.
Unemployment is low and more jobs are coming.,Processed Unemployment is low and more jobs are coming.
Increasing job training programs and apprenticeships is essential to developing a 21st Century Workforce.,Processed Increasing job training programs and apprenticeships is essential to developing a 21st Century Workforce.
Career and Technical Education (CTE) schools play an essential role in workforce development.,Processed Career and Technical Education (CTE) schools play an essential role in workforce development.
Fiscal restraint involves not saddling future generations with debt.,Processed Fiscal restraint involves not saddling future generations with debt.
Investing in communities can spur economic growth and job creation.,Processed Investing in communities can spur economic growth and job creation.
Opportunity Zones are intended to incentivize long-term investments in low-income communities.,Processed Opportunity Zones are intended to incentivize long-term investments in low-income communities.
Capital gains tax relief is offered to investors for new investment in designated Opportunity Zones.,Processed Capital gains tax relief is offered to investors for new investment in designated Opportunity Zones.
People generally need to work to secure their livelihood.,Processed People generally need to work to secure their livelihood.
Small businesses face challenges.,Processed Small businesses face challenges.
Health information is important during a pandemic.,Processed Health information is important during a pandemic.
Parents may need guidance on how to homeschool their children.,Processed Parents may need guidance on how to homeschool their children.
Food assistance programs are important for those in need.,Processed Food assistance programs are important for those in need.
People generally prefer to vote for candidates who share their values.,Processed People generally prefer to vote for candidates who share their values.
Online polls can be limited to one vote per IP address to prevent multiple votes from the same person.,Processed Online polls can be limited to one vote per IP address to prevent multiple votes from the same person.
Endorsements from organizations and individuals can help a political campaign.,Processed Endorsements from organizations and individuals can help a political campaign.
Politicians often campaign on issues they believe are important to their constituents.,Processed Politicians often campaign on issues they believe are important to their constituents.
Public health agencies provide guidance on what to do if you are sick with a disease.,Processed Public health agencies provide guidance on what to do if you are sick with a disease.
Unemployment hotlines and websites are available to assist people who have lost their jobs.,Processed Unemployment hotlines and websites are available to assist people who have lost their jobs.
Meals on Wheels is a program that delivers food to individuals who are unable to purchase or prepare their own meals.,Processed Meals on Wheels is a program that delivers food to individuals who are unable to purchase or prepare their own meals.
The NH Food Bank is an organization where people can donate food to help those in need.,Processed The NH Food Bank is an organization where people can donate food to help those in need.
People generally want change in politics.,Processed People generally want change in politics.
Voters often support candidates who share their values.,Processed Voters often support candidates who share their values.
Political candidates often thank voters for their support.,Processed Political candidates often thank voters for their support.
Political unity is considered important for success in elections.,Processed Political unity is considered important for success in elections.
Public servants are remembered for their contributions after they pass away.,Processed Public servants are remembered for their contributions after they pass away.
Acts of terrorism have a lasting impact on a nation's history.,Processed Acts of terrorism have a lasting impact on a nation's history.
First responders are honored for their sacrifices during emergencies.,Processed First responders are honored for their sacrifices during emergencies.
Health guidelines are provided during a public health crisis.,Processed Health guidelines are provided during a public health crisis.
Unemployment assistance is available during economic downturns.,Processed Unemployment assistance is available during economic downturns.
Parents sometimes need to homeschool their children.,Processed Parents sometimes need to homeschool their children.
Community support services like Meals on Wheels and food banks provide assistance to those in need.,Processed Community support services like Meals on Wheels and food banks provide assistance to those in need.
People worry about the cost of healthcare.,Processed People worry about the cost of healthcare.
People worry about the quality of child care.,Processed People worry about the quality of child care.
"Decisions should be based on facts, not partisan politics.","Processed Decisions should be based on facts, not partisan politics."
Elections are held to select representatives.,Processed Elections are held to select representatives.
Politicians often ask for donations for their campaigns.,Processed Politicians often ask for donations for their campaigns.
Voting is a way for citizens to influence who represents them.,Processed Voting is a way for citizens to influence who represents them.
High stress and uncertainty can affect people's lives.,Processed High stress and uncertainty can affect people's lives.
Strong leadership is considered important in times of crisis.,Processed Strong leadership is considered important in times of crisis.
Campaigns often rely on face-to-face contact to spread their message.,Processed Campaigns often rely on face-to-face contact to spread their message.
Adapting strategies is necessary when circumstances change.,Processed Adapting strategies is necessary when circumstances change.
Financial support is crucial for campaigns to operate.,Processed Financial support is crucial for campaigns to operate.
"Media like TV, radio, and digital are alternative ways to reach voters when direct contact is not possible.","Processed Media like TV, radio, and digital are alternative ways to reach voters when direct contact is not possible."
Voting is a civic duty.,Processed Voting is a civic duty.
People need clean drinking water.,Processed People need clean drinking water.
Infrastructure requires repairs and maintenance.,Processed Infrastructure requires repairs and maintenance.
Schools should be strong educational institutions.,Processed Schools should be strong educational institutions.
A functioning healthcare system is important for a community.,Processed A functioning healthcare system is important for a community.
"Like most Americans, my family and I are taking the opportunity to enjoy the holiday and spend time with one another.","Processed Like most Americans, my family and I are taking the opportunity to enjoy the holiday and spend time with one another."
"Derrick Reed is a father, attorney, and former two-term Pearland City Councilmember.","Processed Derrick Reed is a father, attorney, and former two-term Pearland City Councilmember."
"When the going gets tough, the tough get going.","Processed When the going gets tough, the tough get going."
"Even in the darkest of days, hope is possible.","Processed Even in the darkest of days, hope is possible."
"When the going gets tough, the tough get going.","Processed When the going gets tough, the tough get going."
"Even in the darkest of days, hope is possible.","Processed Even in the darkest of days, hope is possible."
Rising costs of housing can make it difficult for people to keep up financially.,Processed Rising costs of housing can make it difficult for people to keep up financially.
Access to affordable health care is a concern for many people.,Processed Access to affordable health care is a concern for many people.
Safety in neighborhoods and schools is a concern for many people.,Processed Safety in neighborhoods and schools is a concern for many people.
America is a place where courage and conviction can make a difference.,Processed America is a place where courage and conviction can make a difference.
"When the going gets tough, the tough get going.","Processed When the going gets tough, the tough get going."
"Even in the darkest of days, hope is possible.","Processed Even in the darkest of days, hope is possible."
Rising costs of housing can make it difficult for people to keep up.,Processed Rising costs of housing can make it difficult for people to keep up.
Access to affordable health care is important for people.,Processed Access to affordable health care is important for people.
Safety of neighborhoods and schools is a concern for many people.,Processed Safety of neighborhoods and schools is a concern for many people.
People should never threaten violence to intimidate or make their point.,Processed People should never threaten violence to intimidate or make their point.
Threatening the safety of others to prevent them from doing their work is wrong.,Processed Threatening the safety of others to prevent them from doing their work is wrong.
"During times of crisis, America has persevered when we stood together.","Processed During times of crisis, America has persevered when we stood together."
"The advice of medical experts is to continue practicing social distancing, wearing a cloth mask if you have to leave your home, and staying at home when you're sick.","Processed The advice of medical experts is to continue practicing social distancing, wearing a cloth mask if you have to leave your home, and staying at home when you're sick."
People have a constitutional right to protest.,Processed People have a constitutional right to protest.
Actions that put every community at risk should be avoided.,Processed Actions that put every community at risk should be avoided.
Working together to find ways to help and protect fellow citizens is important.,Processed Working together to find ways to help and protect fellow citizens is important.
Practicing social distancing helps prevent the spread of viruses.,Processed Practicing social distancing helps prevent the spread of viruses.
Wearing a cloth mask can reduce the transmission of diseases.,Processed Wearing a cloth mask can reduce the transmission of diseases.
Staying at home when you're sick can prevent spreading illness to others.,Processed Staying at home when you're sick can prevent spreading illness to others.
Not following health guidelines during a pandemic can put others at risk.,Processed Not following health guidelines during a pandemic can put others at risk.
Actions that increase the spread of a virus may prolong the need for public health orders.,Processed Actions that increase the spread of a virus may prolong the need for public health orders.
Today is Election Day in Nevada.,Processed Today is Election Day in Nevada.
You can drop your ballot in today's mail as long as it gets postmarked by today.,Processed You can drop your ballot in today's mail as long as it gets postmarked by today.
You can personally deliver your ballot to election officials.,Processed You can personally deliver your ballot to election officials.
He would be the youngest person in Congress.,Processed He would be the youngest person in Congress.
Adam will stand up for working families.,Processed Adam will stand up for working families.
He will fight for middle-class tax cuts.,Processed He will fight for middle-class tax cuts.
This campaign is helping flip Florida blue.,Processed This campaign is helping flip Florida blue.
He will protect the environment.,Processed He will protect the environment.
"He has a plan to create over 30,000 good-paying green jobs in FL-3.","Processed He has a plan to create over 30,000 good-paying green jobs in FL-3."
Adam will fight for dignity and justice for all.,Processed Adam will fight for dignity and justice for all.
He will fight to end predatory business practices.,Processed He will fight to end predatory business practices.
He will fight for small business.,Processed He will fight for small business.
He has the cutest dog!,Processed He has the cutest dog!
Everyone has the right to vote as soon as they turn 18,Processed Everyone has the right to vote as soon as they turn 18
Being registered to vote is often connected with getting a driver's license or state ID,Processed Being registered to vote is often connected with getting a driver's license or state ID
Both parents earning a living wage can provide for a family.,Processed Both parents earning a living wage can provide for a family.
Flooding is a concern for communities when it becomes commonplace.,Processed Flooding is a concern for communities when it becomes commonplace.
"Healthcare, education, infrastructure, and women's health are important issues to many people.","Processed Healthcare, education, infrastructure, and women's health are important issues to many people."
Leadership is expected to address the problems facing communities.,Processed Leadership is expected to address the problems facing communities.
"Everyone should be wearing a mask right now — if not for yourself, then for your loved ones, your neighbors, and your community.","Processed Everyone should be wearing a mask right now — if not for yourself, then for your loved ones, your neighbors, and your community."
We can prevent other families from feeling the pain that I felt.,Processed We can prevent other families from feeling the pain that I felt.
"In tough times, people pull together.","Processed In tough times, people pull together."
Caring for each other is not a partisan issue.,Processed Caring for each other is not a partisan issue.
Frontline workers risk their lives to protect others.,Processed Frontline workers risk their lives to protect others.
Frontline workers risk their lives to protect others,Processed Frontline workers risk their lives to protect others
Caring for each other is not a partisan issue,Processed Caring for each other is not a partisan issue
"The virus is the enemy, not each other","Processed The virus is the enemy, not each other"
Helping American taxpayers keep their hard earned money.,Processed Helping American taxpayers keep their hard earned money.
Building economic growth & stability.,Processed Building economic growth & stability.
Giving Iowans the opportunity to make decisions based on their healthcare.,Processed Giving Iowans the opportunity to make decisions based on their healthcare.
Fighting tirelessly to protect Iowa’s farmers and agricultural industries.,Processed Fighting tirelessly to protect Iowa’s farmers and agricultural industries.
Securing futures for Iowa’s youth.,Processed Securing futures for Iowa’s youth.
Grassroots support is vital for campaigns that don't take corporate PAC money.,Processed Grassroots support is vital for campaigns that don't take corporate PAC money.
Corporate PAC money influences political races.,Processed Corporate PAC money influences political races.
Voters want common sense reform.,Processed Voters want common sense reform.
Early voting starts on a specific date.,Processed Early voting starts on a specific date.
Campaigns require resources to communicate their message to voters.,Processed Campaigns require resources to communicate their message to voters.
Health care systems can be broken and in need of fixing.,Processed Health care systems can be broken and in need of fixing.
Elections can be influenced by corporate PAC money.,Processed Elections can be influenced by corporate PAC money.
Voters need to hear about a candidate's vision for their district.,Processed Voters need to hear about a candidate's vision for their district.
Donations to campaigns are used to help win elections.,Processed Donations to campaigns are used to help win elections.
Campaigns set fundraising goals and track their progress.,Processed Campaigns set fundraising goals and track their progress.
Falling short of fundraising goals can have negative consequences for a campaign.,Processed Falling short of fundraising goals can have negative consequences for a campaign.
Primary elections require resources for advertising and voter outreach.,Processed Primary elections require resources for advertising and voter outreach.
Candidates can represent specific organizations or causes.,Processed Candidates can represent specific organizations or causes.
Candidates may choose not to accept corporate PAC money.,Processed Candidates may choose not to accept corporate PAC money.
People cast votes in primaries.,Processed People cast votes in primaries.
Campaigns have financial goals to meet.,Processed Campaigns have financial goals to meet.
Campaigns show their financial strength through public filings.,Processed Campaigns show their financial strength through public filings.
Early voting is an option before the main election day.,Processed Early voting is an option before the main election day.
Candidates for Congress can live with their families.,Processed Candidates for Congress can live with their families.
Individuals can put themselves through college and law school.,Processed Individuals can put themselves through college and law school.
Law firms can be woman-owned.,Processed Law firms can be woman-owned.
Planned Parenthood provides services that can be represented legally.,Processed Planned Parenthood provides services that can be represented legally.
Congress has the power to affect healthcare policy.,Processed Congress has the power to affect healthcare policy.
Candidates can choose not to take corporate PAC money.,Processed Candidates can choose not to take corporate PAC money.
Campaign staff are working remotely to do our part in containing the spread of the virus.,Processed Campaign staff are working remotely to do our part in containing the spread of the virus.
Public events have been canceled for the next several weeks.,Processed Public events have been canceled for the next several weeks.
It’s our hope and compassion that will get us through each day.,Processed It’s our hope and compassion that will get us through each day.
Parents send their children off to school.,Processed Parents send their children off to school.
Schools face uncertainty.,Processed Schools face uncertainty.
Teachers can receive cost of living adjustments.,Processed Teachers can receive cost of living adjustments.
Elections have absentee voting periods.,Processed Elections have absentee voting periods.
Legislators can sponsor and support bills.,Processed Legislators can sponsor and support bills.
Every vote counts in an election.,Processed Every vote counts in an election.
