statements,processed
Weapons of war do not belong on our streets and in our schools.,Processed Weapons of war do not belong on our streets and in our schools.
Ghost guns are especially dangerous because they can go undetected by scanners.,Processed Ghost guns are especially dangerous because they can go undetected by scanners.
Limiting magazine capacity can save lives.,Processed Limiting magazine capacity can save lives.
Symptoms of the coronavirus may appear between 2 and 14 days after exposure.,Processed Symptoms of the coronavirus may appear between 2 and 14 days after exposure.
"Common symptoms of the coronavirus include a fever, cough, and shortness of breath.","Processed Common symptoms of the coronavirus include a fever, cough, and shortness of breath."
Washing hands frequently can help prevent the spread of diseases.,Processed Washing hands frequently can help prevent the spread of diseases.
Coughing into your elbow is a good practice to prevent spreading germs.,Processed Coughing into your elbow is a good practice to prevent spreading germs.
Avoiding touching your face can help reduce the risk of infection.,Processed Avoiding touching your face can help reduce the risk of infection.
Replacing handshakes with non-contact greetings can reduce the spread of illnesses.,Processed Replacing handshakes with non-contact greetings can reduce the spread of illnesses.
Now is not a time for panic. It is a time for caution and common sense.,Processed Now is not a time for panic. It is a time for caution and common sense.
We need to be vigilant in avoiding direct human contact as those with symptoms may not know they are infected.,Processed We need to be vigilant in avoiding direct human contact as those with symptoms may not know they are infected.
We need to make sure we wash our hands and avoid contact with our face.,Processed We need to make sure we wash our hands and avoid contact with our face.
"Symptoms include fever, cough and shortness of breath.","Processed Symptoms include fever, cough and shortness of breath."
"If you think you have the virus, please self-quarantine and follow the CDC recommendations.","Processed If you think you have the virus, please self-quarantine and follow the CDC recommendations."
People are being required to stay home to slow the spread of the coronavirus.,Processed People are being required to stay home to slow the spread of the coronavirus.
Our workers are being laid off and our small businesses are closing due to the pandemic.,Processed Our workers are being laid off and our small businesses are closing due to the pandemic.
Medical professionals are on the front lines combating the pandemic.,Processed Medical professionals are on the front lines combating the pandemic.
People generally communicate with voters through door-to-door visits and phone calls during election campaigns.,Processed People generally communicate with voters through door-to-door visits and phone calls during election campaigns.
Political campaigns often request donations to fund their activities.,Processed Political campaigns often request donations to fund their activities.
Political campaigns use donations to make phone calls and knock on doors to gain voter support.,Processed Political campaigns use donations to make phone calls and knock on doors to gain voter support.
Political campaigns often claim that their candidate represents certain values.,Processed Political campaigns often claim that their candidate represents certain values.
Political campaigns may accuse opponents of being out of touch with the local electorate.,Processed Political campaigns may accuse opponents of being out of touch with the local electorate.
Washing your hands can help prevent the spread of disease.,Processed Washing your hands can help prevent the spread of disease.
Coughing into your elbow can help prevent the spread of germs.,Processed Coughing into your elbow can help prevent the spread of germs.
Avoid touching your face to reduce the risk of infection.,Processed Avoid touching your face to reduce the risk of infection.
Symptoms of the coronavirus may appear between 2 and 14 days after exposure.,Processed Symptoms of the coronavirus may appear between 2 and 14 days after exposure.
Elderly people are at higher risk for developing complications from the coronavirus.,Processed Elderly people are at higher risk for developing complications from the coronavirus.
Self-quarantine can help protect others if you feel like you have the virus.,Processed Self-quarantine can help protect others if you feel like you have the virus.
People shouldn't have to choose between their right to vote and their health.,Processed People shouldn't have to choose between their right to vote and their health.
A pandemic can put many people out of work.,Processed A pandemic can put many people out of work.
Rent is a regular expense for many Americans.,Processed Rent is a regular expense for many Americans.
It is dangerous to return to work during a pandemic.,Processed It is dangerous to return to work during a pandemic.
Eviction is a risk when people cannot pay their rent.,Processed Eviction is a risk when people cannot pay their rent.
Funding firefighters is considered common sense.,Processed Funding firefighters is considered common sense.
People need to vote to influence election outcomes.,Processed People need to vote to influence election outcomes.
Health care is a topic of concern for many voters.,Processed Health care is a topic of concern for many voters.
Educational investment is a priority for some political candidates.,Processed Educational investment is a priority for some political candidates.
Civil rights are a significant issue in political campaigns.,Processed Civil rights are a significant issue in political campaigns.
Pre-existing conditions are a factor in health care policy discussions.,Processed Pre-existing conditions are a factor in health care policy discussions.
Political campaigns often request donations to support their efforts.,Processed Political campaigns often request donations to support their efforts.
Elections can result in changes in political party dominance in a state.,Processed Elections can result in changes in political party dominance in a state.
People are experiencing financial and personal stress during the COVID-19 pandemic.,Processed People are experiencing financial and personal stress during the COVID-19 pandemic.
COVID-19 is a challenge that nations are working together to fight.,Processed COVID-19 is a challenge that nations are working together to fight.
Donations can help fund political campaigns.,Processed Donations can help fund political campaigns.
Campaigns use donations to reach out to voters and build volunteer networks.,Processed Campaigns use donations to reach out to voters and build volunteer networks.
"Lowering the cost of prescription drugs, addressing climate change, and fighting the gun lobby are considered common-sense solutions by some.","Processed Lowering the cost of prescription drugs, addressing climate change, and fighting the gun lobby are considered common-sense solutions by some."
Enormous financial and personal stress has been put on countless families during the COVID-19 pandemic.,Processed Enormous financial and personal stress has been put on countless families during the COVID-19 pandemic.
Meeting fundraising goals can inform the plans able to be executed in the coming months.,Processed Meeting fundraising goals can inform the plans able to be executed in the coming months.
Coming up short on fundraising goals can create a domino effect impacting future events.,Processed Coming up short on fundraising goals can create a domino effect impacting future events.
Elections analysts make predictions about the outcomes of political races.,Processed Elections analysts make predictions about the outcomes of political races.
Campaigns focus on addressing real issues facing their community.,Processed Campaigns focus on addressing real issues facing their community.
A broken healthcare system and economic crisis are current issues that communities face.,Processed A broken healthcare system and economic crisis are current issues that communities face.
"Lowering the cost of prescription drugs, addressing climate change, and bringing common-sense solutions are goals for some political campaigns.","Processed Lowering the cost of prescription drugs, addressing climate change, and bringing common-sense solutions are goals for some political campaigns."
People hope their loved ones are staying safe and healthy.,Processed People hope their loved ones are staying safe and healthy.
Enormous financial and personal stress has been put on countless families due to COVID-19.,Processed Enormous financial and personal stress has been put on countless families due to COVID-19.
Frontline responders are essential in the fight against COVID-19.,Processed Frontline responders are essential in the fight against COVID-19.
Grassroots support can influence political races.,Processed Grassroots support can influence political races.
"Healthcare access, economic crises, and common-sense solutions are important issues for voters.","Processed Healthcare access, economic crises, and common-sense solutions are important issues for voters."
Political races can be unpredictable and can change from favoring one party to being a toss-up.,Processed Political races can be unpredictable and can change from favoring one party to being a toss-up.
Families need leadership.,Processed Families need leadership.
Voters demand accountability from their political representatives.,Processed Voters demand accountability from their political representatives.
Laws are meant to keep us safe.,Processed Laws are meant to keep us safe.
Health care and the economy are important issues to families.,Processed Health care and the economy are important issues to families.
Financial and personal stress has been put on countless families due to COVID-19.,Processed Financial and personal stress has been put on countless families due to COVID-19.
Lowering the cost of prescription drugs is a goal for some politicians.,Processed Lowering the cost of prescription drugs is a goal for some politicians.
Addressing climate change is a concern for some politicians.,Processed Addressing climate change is a concern for some politicians.
People are experiencing financial and personal stress during the COVID-19 pandemic.,Processed People are experiencing financial and personal stress during the COVID-19 pandemic.
Elections should be transparent and fair.,Processed Elections should be transparent and fair.
Everyone who is legally entitled to vote should be able to do so safely.,Processed Everyone who is legally entitled to vote should be able to do so safely.
Social distancing may continue into the weeks leading up to the election.,Processed Social distancing may continue into the weeks leading up to the election.
Voting in the election may look different than it has in the past.,Processed Voting in the election may look different than it has in the past.
Practicing social distancing can help prevent the spread of illness.,Processed Practicing social distancing can help prevent the spread of illness.
Multi-generational families living under the same roof should be mindful of the health of family elders during a health crisis.,Processed Multi-generational families living under the same roof should be mindful of the health of family elders during a health crisis.
Following the CDC's recommendations can help keep people safe during a health crisis.,Processed Following the CDC's recommendations can help keep people safe during a health crisis.
People hope their loved ones are staying safe and healthy during trying times.,Processed People hope their loved ones are staying safe and healthy during trying times.
Financial and personal stress can be put on families during a crisis like COVID-19.,Processed Financial and personal stress can be put on families during a crisis like COVID-19.
Donations can slow down during certain periods.,Processed Donations can slow down during certain periods.
Fundraising goals help organizations to acquire resources they need.,Processed Fundraising goals help organizations to acquire resources they need.
Digital tools can help organizations to better serve their community.,Processed Digital tools can help organizations to better serve their community.
Volunteers can use digital tools to support their activities.,Processed Volunteers can use digital tools to support their activities.
Lowering the cost of prescription drugs is a concern for some people.,Processed Lowering the cost of prescription drugs is a concern for some people.
Addressing climate change is a priority for some individuals.,Processed Addressing climate change is a priority for some individuals.
We are going to get through the coronavirus outbreak together.,Processed We are going to get through the coronavirus outbreak together.
"Common sense, respect, and decency are the linchpin of real leadership.","Processed Common sense, respect, and decency are the linchpin of real leadership."
"Real leadership requires compassion, empathy, and honesty.","Processed Real leadership requires compassion, empathy, and honesty."
Working families and small businesses often need support.,Processed Working families and small businesses often need support.
Leadership should look out for the interests of the people.,Processed Leadership should look out for the interests of the people.
Campaigns require funds to operate and reach their goals.,Processed Campaigns require funds to operate and reach their goals.
"Donations can be made at any time, not just during specific fundraising periods.","Processed Donations can be made at any time, not just during specific fundraising periods."
Opportunity should be available for both young and old.,Processed Opportunity should be available for both young and old.
Hard work is generally expected to be rewarded.,Processed Hard work is generally expected to be rewarded.
People in Washington notice momentum in political campaigns.,Processed People in Washington notice momentum in political campaigns.
Battleground districts are key races with the potential to change party control.,Processed Battleground districts are key races with the potential to change party control.
Economies can be rebuilt to work for everyone.,Processed Economies can be rebuilt to work for everyone.
Campaigns often ask for donations to meet fundraising goals.,Processed Campaigns often ask for donations to meet fundraising goals.
Political campaigns can accept recurring monthly contributions.,Processed Political campaigns can accept recurring monthly contributions.
Hard work is generally expected to be rewarded.,Processed Hard work is generally expected to be rewarded.
Today is the first day of early voting in Texas.,Processed Today is the first day of early voting in Texas.
Every vote counts towards the outcome of an election.,Processed Every vote counts towards the outcome of an election.
Accessible healthcare is important for a community.,Processed Accessible healthcare is important for a community.
A strong economy is beneficial for a country's citizens.,Processed A strong economy is beneficial for a country's citizens.
Voting is a way to participate in the democratic process.,Processed Voting is a way to participate in the democratic process.
"An honest day’s work should be enough to put food on the table, a roof over your head, and cover the cost of necessary medications.","Processed An honest day’s work should be enough to put food on the table, a roof over your head, and cover the cost of necessary medications."
Hard work is generally expected to be rewarded.,Processed Hard work is generally expected to be rewarded.
Elections are a time when candidates seek donations for their campaigns.,Processed Elections are a time when candidates seek donations for their campaigns.
People often ask friends and colleagues to support political candidates they believe in.,Processed People often ask friends and colleagues to support political candidates they believe in.
Candidates for political office often have a history of public service or community involvement.,Processed Candidates for political office often have a history of public service or community involvement.
Political campaigns in the United States can be funded by donations from individuals.,Processed Political campaigns in the United States can be funded by donations from individuals.
Elections can be competitive and outcomes can be influenced by changes in population and voter sentiment.,Processed Elections can be competitive and outcomes can be influenced by changes in population and voter sentiment.
People generally want to hit their fundraising targets.,Processed People generally want to hit their fundraising targets.
Deadlines are often set for specific goals.,Processed Deadlines are often set for specific goals.
Matching donations can incentivize people to donate.,Processed Matching donations can incentivize people to donate.
Political campaigns often ask for contributions.,Processed Political campaigns often ask for contributions.
Unsubscribing is an option for people who do not want to receive emails.,Processed Unsubscribing is an option for people who do not want to receive emails.
"If we want our children to be able to learn, we need to give them the best environment to do so","Processed If we want our children to be able to learn, we need to give them the best environment to do so"
Working together can lead to getting a lot done for people,Processed Working together can lead to getting a lot done for people
It's important to find common ground on issues that matter,Processed It's important to find common ground on issues that matter
People-powered campaigns rely on grassroots supporters.,Processed People-powered campaigns rely on grassroots supporters.
Partisan bickering has become common in Washington politics.,Processed Partisan bickering has become common in Washington politics.
Affordable health care is important for people.,Processed Affordable health care is important for people.
Medications need to be affordable.,Processed Medications need to be affordable.
Protecting small businesses and the economy is a priority for many.,Processed Protecting small businesses and the economy is a priority for many.
"Following CDC guidelines, like hand washing and social distancing, is important for public health.","Processed Following CDC guidelines, like hand washing and social distancing, is important for public health."
"It’s important to have leaders who prioritize the health, safety, and well-being of families.","Processed It’s important to have leaders who prioritize the health, safety, and well-being of families."
Access to affordable health care is a concern for people.,Processed Access to affordable health care is a concern for people.
Following guidelines from health authorities like the CDC can help keep individuals safe and healthy.,Processed Following guidelines from health authorities like the CDC can help keep individuals safe and healthy.
"People who work in hospitals, stores, deliver mail, provide care, and respond to emergencies are doing important work during challenging times.","Processed People who work in hospitals, stores, deliver mail, provide care, and respond to emergencies are doing important work during challenging times."
We should support those who are caring for us during unprecedented times.,Processed We should support those who are caring for us during unprecedented times.
It is important to work together for good outcomes for today and the future.,Processed It is important to work together for good outcomes for today and the future.
Proper planning prevents poor performance.,Processed Proper planning prevents poor performance.
Shifting activities online allows the opportunity to connect with more people.,Processed Shifting activities online allows the opportunity to connect with more people.
"People generally want or need care, food, and shelter after losing their homes in a disaster.","Processed People generally want or need care, food, and shelter after losing their homes in a disaster."
People usually do not want to receive maggot-infected food.,Processed People usually do not want to receive maggot-infected food.
"Typically, one would not hire someone without experience to build a home.","Processed Typically, one would not hire someone without experience to build a home."
Thousands of small businesses have closed due to lockdowns.,Processed Thousands of small businesses have closed due to lockdowns.
Job losses can affect hundreds of thousands of families.,Processed Job losses can affect hundreds of thousands of families.
Losing jobs can lead to families struggling financially.,Processed Losing jobs can lead to families struggling financially.
Leaders are held accountable for their decisions and policies.,Processed Leaders are held accountable for their decisions and policies.
Every vote matters.,Processed Every vote matters.
People have businesses and homes.,Processed People have businesses and homes.
The good people need to be protected.,Processed The good people need to be protected.
There needs to be law and order.,Processed There needs to be law and order.
People have the right to peacefully assemble and protest.,Processed People have the right to peacefully assemble and protest.
Proper planning prevents poor performance.,Processed Proper planning prevents poor performance.
Strategic approaches can help overcome challenges.,Processed Strategic approaches can help overcome challenges.
Online activities allow the opportunity to connect with more people.,Processed Online activities allow the opportunity to connect with more people.
Campaigns require resources to operate.,Processed Campaigns require resources to operate.
There is a right time for everything,Processed There is a right time for everything
A time to be born,Processed A time to be born
A time to die,Processed A time to die
A time to plant,Processed A time to plant
A time to harvest,Processed A time to harvest
A time to kill,Processed A time to kill
A time to heal,Processed A time to heal
A time to destroy,Processed A time to destroy
A time to rebuild,Processed A time to rebuild
A time to cry,Processed A time to cry
A time to laugh,Processed A time to laugh
A time to grieve,Processed A time to grieve
A time to dance,Processed A time to dance
A time for scattering stones,Processed A time for scattering stones
A time for gathering stones,Processed A time for gathering stones
A time to hug,Processed A time to hug
A time not to hug,Processed A time not to hug
A time to find,Processed A time to find
A time to lose,Processed A time to lose
A time for keeping,Processed A time for keeping
A time for throwing away,Processed A time for throwing away
A time to tear,Processed A time to tear
A time to repair,Processed A time to repair
A time to be quiet,Processed A time to be quiet
A time to speak up,Processed A time to speak up
A time for loving,Processed A time for loving
A time for hating,Processed A time for hating
A time for war,Processed A time for war
A time for peace,Processed A time for peace
Good leaders listen.,Processed Good leaders listen.
Great leaders learn and take action.,Processed Great leaders learn and take action.
Forcing a region to reopen without policies to keep communities safe can put people in danger.,Processed Forcing a region to reopen without policies to keep communities safe can put people in danger.
"Listening to all sides, including those who disagree with you, is important.","Processed Listening to all sides, including those who disagree with you, is important."
The virus will not go away if we pretend it is over.,Processed The virus will not go away if we pretend it is over.
Americans will not stop dying if we stop testing.,Processed Americans will not stop dying if we stop testing.
People in rural areas deserve the chance for better health care.,Processed People in rural areas deserve the chance for better health care.
Politicians should work for the people of the district they represent instead of money interests.,Processed Politicians should work for the people of the district they represent instead of money interests.
Nobody chooses to get sick.,Processed Nobody chooses to get sick.
Men don't get to tell women what to do with their bodies.,Processed Men don't get to tell women what to do with their bodies.
The number one priority during this time is to make sure everyone helps mitigate the spread of COVID-19 in California and across the country.,Processed The number one priority during this time is to make sure everyone helps mitigate the spread of COVID-19 in California and across the country.
"Our campaign is doing our part by canceling all in-person events, moving to a digital operation, and supporting local efforts to help those in need.","Processed Our campaign is doing our part by canceling all in-person events, moving to a digital operation, and supporting local efforts to help those in need."
Hard-working Americans contribute to society.,Processed Hard-working Americans contribute to society.
Small businesses face challenges and decisions.,Processed Small businesses face challenges and decisions.
Climate change is a topic that requires attention.,Processed Climate change is a topic that requires attention.
Infrastructure can deteriorate over time.,Processed Infrastructure can deteriorate over time.
Homelessness is an issue that needs to be confronted.,Processed Homelessness is an issue that needs to be confronted.
Social Security and Medicare are programs intended to protect individuals.,Processed Social Security and Medicare are programs intended to protect individuals.
Elections are competitive.,Processed Elections are competitive.
