statements,processed
We need to trust our medical experts and put science above all else during this difficult time.,Processed We need to trust our medical experts and put science above all else during this difficult time.
Leaders should listen to people and work hard.,Processed Leaders should listen to people and work hard.
Partisan politics can hurt working families.,Processed Partisan politics can hurt working families.
Government should work for the people.,Processed Government should work for the people.
Helping those around us and lending a hand when neighbors are struggling is important.,Processed Helping those around us and lending a hand when neighbors are struggling is important.
Public service is about making a difference in the community.,Processed Public service is about making a difference in the community.
Politicians should address the needs of their constituents.,Processed Politicians should address the needs of their constituents.
Supporting veterans is a duty.,Processed Supporting veterans is a duty.
Protecting the environment is necessary.,Processed Protecting the environment is necessary.
Providing quality education to young people is essential.,Processed Providing quality education to young people is essential.
People should not go broke getting the healthcare they need.,Processed People should not go broke getting the healthcare they need.
The people of the Suncoast deserve a representative who will bring accountability to Washington.,Processed The people of the Suncoast deserve a representative who will bring accountability to Washington.
The people of the Suncoast deserve a representative who will deliver common sense solutions to the problems we face every day.,Processed The people of the Suncoast deserve a representative who will deliver common sense solutions to the problems we face every day.
The people of the Suncoast deserve a representative who they can count on to get things done.,Processed The people of the Suncoast deserve a representative who they can count on to get things done.
Email is the best way for us to keep you informed about what’s happening with the campaign.,Processed Email is the best way for us to keep you informed about what’s happening with the campaign.
People need to work to earn money,Processed People need to work to earn money
Representatives are elected to serve the interests of the people,Processed Representatives are elected to serve the interests of the people
Political campaigns often ask for donations,Processed Political campaigns often ask for donations
Environmental protection is important to some people,Processed Environmental protection is important to some people
Healthcare accessibility and affordability are concerns for many people,Processed Healthcare accessibility and affordability are concerns for many people
Email is a commonly used method of communication,Processed Email is a commonly used method of communication
Volunteering is a way to support a cause or campaign,Processed Volunteering is a way to support a cause or campaign
Vote by Mail ballots are used to cast votes in an election.,Processed Vote by Mail ballots are used to cast votes in an election.
Campaigns often ask for donations to fund their activities.,Processed Campaigns often ask for donations to fund their activities.
Political campaigns have fundraising deadlines.,Processed Political campaigns have fundraising deadlines.
Email is a method of communication.,Processed Email is a method of communication.
Political campaigns can be funded by individual contributions.,Processed Political campaigns can be funded by individual contributions.
Early voting allows voters to cast their ballots before the official election day.,Processed Early voting allows voters to cast their ballots before the official election day.
Polling can show how candidates are performing relative to each other before an election.,Processed Polling can show how candidates are performing relative to each other before an election.
Campaigns often ask for donations to fund their activities.,Processed Campaigns often ask for donations to fund their activities.
Elections are decided by the voters who cast their ballots.,Processed Elections are decided by the voters who cast their ballots.
Political campaigns can be funded by donations from individuals.,Processed Political campaigns can be funded by donations from individuals.
Labor Day is a day of rest for workers.,Processed Labor Day is a day of rest for workers.
Labor Day is a day of reflection and recognition for workers.,Processed Labor Day is a day of reflection and recognition for workers.
"The Labor Movement brought us the 40-hour work week, the minimum wage, and critical protections for workers.","Processed The Labor Movement brought us the 40-hour work week, the minimum wage, and critical protections for workers."
Essential workers and first responders are on the front lines during the pandemic.,Processed Essential workers and first responders are on the front lines during the pandemic.
Workers are the backbone of our economy.,Processed Workers are the backbone of our economy.
Workers should be treated with respect.,Processed Workers should be treated with respect.
Everyone will judge the strength of our campaign and our ability to flip this seat by the numbers we put up.,Processed Everyone will judge the strength of our campaign and our ability to flip this seat by the numbers we put up.
"Margaret is a strong voice for our values—she brings an incredible work ethic and common sense to her fight for working families, to protect Florida’s fragile environment, for accessible and affordable healthcare, and against the special interests that have hijacked our political process.","Processed Margaret is a strong voice for our values—she brings an incredible work ethic and common sense to her fight for working families, to protect Florida’s fragile environment, for accessible and affordable healthcare, and against the special interests that have hijacked our political process."
Email is the best way for us to keep you informed about what’s happening with the campaign.,Processed Email is the best way for us to keep you informed about what’s happening with the campaign.
Our campaign has taken a pledge to reject corporate PAC money and is instead funded by thousands of actual people who care about our democracy and want to see positive change in our community and across our country.,Processed Our campaign has taken a pledge to reject corporate PAC money and is instead funded by thousands of actual people who care about our democracy and want to see positive change in our community and across our country.
Elections are expensive.,Processed Elections are expensive.
Email is a way to keep people informed about a campaign.,Processed Email is a way to keep people informed about a campaign.
Campaigns often ask for support through emails.,Processed Campaigns often ask for support through emails.
People need to contribute to a cause if they want to support it.,Processed People need to contribute to a cause if they want to support it.
Political campaigns often ask for donations.,Processed Political campaigns often ask for donations.
Political campaigns use donations to fund their activities.,Processed Political campaigns use donations to fund their activities.
Political campaigns have filing deadlines for reporting their finances.,Processed Political campaigns have filing deadlines for reporting their finances.
Emails are a common way to communicate with supporters in a political campaign.,Processed Emails are a common way to communicate with supporters in a political campaign.
Political campaigns can be funded by individual contributions.,Processed Political campaigns can be funded by individual contributions.
People need to RSVP to attend events.,Processed People need to RSVP to attend events.
Politicians often discuss political reforms.,Processed Politicians often discuss political reforms.
Virtual events can be attended remotely.,Processed Virtual events can be attended remotely.
Political campaigns often ask for donations.,Processed Political campaigns often ask for donations.
Political campaigns can be funded by individual contributions.,Processed Political campaigns can be funded by individual contributions.
Emails are used to keep people informed about campaign activities.,Processed Emails are used to keep people informed about campaign activities.
Television ads are an effective way to get a message out to a large audience.,Processed Television ads are an effective way to get a message out to a large audience.
Political campaigns often ask for donations to fund their activities.,Processed Political campaigns often ask for donations to fund their activities.
Ballots are sometimes delivered to voters' mailboxes.,Processed Ballots are sometimes delivered to voters' mailboxes.
Political campaigns can be authorized and paid for by the candidate they support.,Processed Political campaigns can be authorized and paid for by the candidate they support.
Email is a common method for campaigns to communicate with supporters.,Processed Email is a common method for campaigns to communicate with supporters.
People use email as a way to communicate and stay informed.,Processed People use email as a way to communicate and stay informed.
Campaigns often ask for donations to support their activities.,Processed Campaigns often ask for donations to support their activities.
Political campaigns sometimes pledge to reject corporate PAC money.,Processed Political campaigns sometimes pledge to reject corporate PAC money.
Elections have deadlines for fundraising and reporting finances.,Processed Elections have deadlines for fundraising and reporting finances.
Voters receive ballots in the mail.,Processed Voters receive ballots in the mail.
TV ads are used in political campaigns.,Processed TV ads are used in political campaigns.
Campaigns ask for donations.,Processed Campaigns ask for donations.
Political campaigns use digital ads.,Processed Political campaigns use digital ads.
Lawyers can run for political office.,Processed Lawyers can run for political office.
Email is a method of communication for campaigns.,Processed Email is a method of communication for campaigns.
People who create the power that defines our momentum.,Processed People who create the power that defines our momentum.
Hitting our fundraising goals ensures we have the resources necessary to execute our plan.,Processed Hitting our fundraising goals ensures we have the resources necessary to execute our plan.
"The likelihood of us flipping this seat is assessed by the GOP, the pundits, and our allies based on the numbers we report.","Processed The likelihood of us flipping this seat is assessed by the GOP, the pundits, and our allies based on the numbers we report."
Having the resources is necessary to take back Florida in November.,Processed Having the resources is necessary to take back Florida in November.
Falling short isn't an option.,Processed Falling short isn't an option.
Email is the best way for us to keep you informed about what’s happening with the campaign.,Processed Email is the best way for us to keep you informed about what’s happening with the campaign.
We win when everyone does what they can to help.,Processed We win when everyone does what they can to help.
Our campaign is funded by thousands of actual people who care about our democracy and want to see positive change in our community and across our country.,Processed Our campaign is funded by thousands of actual people who care about our democracy and want to see positive change in our community and across our country.
People typically grow up to have careers.,Processed People typically grow up to have careers.
Teachers educate future generations.,Processed Teachers educate future generations.
Nurses help people when they need it most.,Processed Nurses help people when they need it most.
Nonprofits often work towards community improvement.,Processed Nonprofits often work towards community improvement.
Lawyers can run for political office.,Processed Lawyers can run for political office.
Political campaigns often ask for donations.,Processed Political campaigns often ask for donations.
Political campaigns can be funded by individual contributions.,Processed Political campaigns can be funded by individual contributions.
People need help to spread messages.,Processed People need help to spread messages.
Following a campaign on social media can keep you up to date with the latest news.,Processed Following a campaign on social media can keep you up to date with the latest news.
Email is a method of communication.,Processed Email is a method of communication.
Fundraising is a common activity for political campaigns.,Processed Fundraising is a common activity for political campaigns.
Political campaigns often ask for support from the public.,Processed Political campaigns often ask for support from the public.
Volunteering is a way to support a cause.,Processed Volunteering is a way to support a cause.
Donating money can support political campaigns.,Processed Donating money can support political campaigns.
We all pulled together to make it happen.,Processed We all pulled together to make it happen.
Exceeding a goal requires the support and effort of many individuals.,Processed Exceeding a goal requires the support and effort of many individuals.
Fundraisers are more successful with a team effort.,Processed Fundraisers are more successful with a team effort.
Volunteers and interns are often involved in making phone calls for support in campaigns.,Processed Volunteers and interns are often involved in making phone calls for support in campaigns.
Taking a moment to rest and recharge is important after a period of hard work.,Processed Taking a moment to rest and recharge is important after a period of hard work.
Celebrating victories can be a part of working towards a larger goal.,Processed Celebrating victories can be a part of working towards a larger goal.
Holidays like the 4th of July are associated with freedom and peace.,Processed Holidays like the 4th of July are associated with freedom and peace.
Email is a common way to keep supporters informed about a campaign.,Processed Email is a common way to keep supporters informed about a campaign.
Campaigns often ask for support through emails.,Processed Campaigns often ask for support through emails.
Rejecting corporate PAC money is a stance some political campaigns take to show support for democracy.,Processed Rejecting corporate PAC money is a stance some political campaigns take to show support for democracy.
Running for Congress is hard work but can be rewarding.,Processed Running for Congress is hard work but can be rewarding.
Campaign strategies can change in response to unprecedented times.,Processed Campaign strategies can change in response to unprecedented times.
Supporters are important for a political campaign.,Processed Supporters are important for a political campaign.
Campaigns often ask for contributions to maintain momentum.,Processed Campaigns often ask for contributions to maintain momentum.
Bold new leadership in Congress is considered necessary by some.,Processed Bold new leadership in Congress is considered necessary by some.
Political campaigns can be funded by individual contributions instead of corporate PAC money.,Processed Political campaigns can be funded by individual contributions instead of corporate PAC money.
Police violence against black people is a problem in communities.,Processed Police violence against black people is a problem in communities.
Federal benefits are distributed at the state level.,Processed Federal benefits are distributed at the state level.
Campaigns often ask for support through emails.,Processed Campaigns often ask for support through emails.
Campaigns can be funded by donations from individuals.,Processed Campaigns can be funded by donations from individuals.
Volunteering is a way to support a campaign.,Processed Volunteering is a way to support a campaign.
Listening to constituents is a critical part of being a successful legislator.,Processed Listening to constituents is a critical part of being a successful legislator.
"Healthcare, clean water and air, and protecting social safety nets are important issues to many people.","Processed Healthcare, clean water and air, and protecting social safety nets are important issues to many people."
Bringing people together is important for societal harmony.,Processed Bringing people together is important for societal harmony.
Climate change is considered an existential threat to the planet by some people.,Processed Climate change is considered an existential threat to the planet by some people.
A strong economy is beneficial for everyone.,Processed A strong economy is beneficial for everyone.
Access to affordable healthcare is important for people's well-being.,Processed Access to affordable healthcare is important for people's well-being.
Vote-by-mail options can increase accessibility to voting.,Processed Vote-by-mail options can increase accessibility to voting.
People in communities can make a difference.,Processed People in communities can make a difference.
Working families need support.,Processed Working families need support.
Protecting the environment is important.,Processed Protecting the environment is important.
Accessible and affordable healthcare is a priority for many.,Processed Accessible and affordable healthcare is a priority for many.
Political processes can be influenced by special interests.,Processed Political processes can be influenced by special interests.
Voters want new leadership.,Processed Voters want new leadership.
People are tired of corrupt politicians.,Processed People are tired of corrupt politicians.
Expanding access to affordable health care is a goal for some.,Processed Expanding access to affordable health care is a goal for some.
Protecting land and water is important to some individuals.,Processed Protecting land and water is important to some individuals.
Rebuilding the economy is a concern for some people.,Processed Rebuilding the economy is a concern for some people.
Delivering accountability to Washington is a priority for some voters.,Processed Delivering accountability to Washington is a priority for some voters.
Reaching a goal by a deadline is important.,Processed Reaching a goal by a deadline is important.
Working day and night indicates a high level of commitment.,Processed Working day and night indicates a high level of commitment.
Every contribution to a cause makes a difference.,Processed Every contribution to a cause makes a difference.
Email is a method of communication.,Processed Email is a method of communication.
Campaigns often ask for support through emails.,Processed Campaigns often ask for support through emails.
Rejecting corporate PAC money means funding is sourced from individuals.,Processed Rejecting corporate PAC money means funding is sourced from individuals.
Voters are voting in this district as you read this email.,Processed Voters are voting in this district as you read this email.
Democrats lead in ballot returns.,Processed Democrats lead in ballot returns.
Margaret is working tirelessly and doing everything she can to flip this seat from red to blue.,Processed Margaret is working tirelessly and doing everything she can to flip this seat from red to blue.
Email is the best way for us to keep you informed about what’s happening with the campaign.,Processed Email is the best way for us to keep you informed about what’s happening with the campaign.
We win when everyone does what they can to help.,Processed We win when everyone does what they can to help.
Our campaign has taken a pledge to reject corporate PAC money.,Processed Our campaign has taken a pledge to reject corporate PAC money.
Vote by Mail ballots are used in elections.,Processed Vote by Mail ballots are used in elections.
Campaigns often seek volunteers to help with their efforts.,Processed Campaigns often seek volunteers to help with their efforts.
Elections are competitive.,Processed Elections are competitive.
Volunteering time can be considered a valuable gift.,Processed Volunteering time can be considered a valuable gift.
Campaigns can be funded by donations.,Processed Campaigns can be funded by donations.
Email is a method of communication for campaigns to keep supporters informed.,Processed Email is a method of communication for campaigns to keep supporters informed.
Campaigns may ask for support frequently.,Processed Campaigns may ask for support frequently.
People need to RSVP to secure a spot at events.,Processed People need to RSVP to secure a spot at events.
Email is a method of communication to keep people informed.,Processed Email is a method of communication to keep people informed.
Political campaigns often ask for support through emails.,Processed Political campaigns often ask for support through emails.
Campaigns can be funded by donations from individuals.,Processed Campaigns can be funded by donations from individuals.
People need access to affordable health care.,Processed People need access to affordable health care.
Protecting the environment is important.,Processed Protecting the environment is important.
Working families benefit from representation that fights for their interests.,Processed Working families benefit from representation that fights for their interests.
Political campaigns often ask for support through emails.,Processed Political campaigns often ask for support through emails.
Volunteering can contribute to a political campaign.,Processed Volunteering can contribute to a political campaign.
Donating money can support a political campaign.,Processed Donating money can support a political campaign.
People use television and digital ads to communicate messages to voters.,Processed People use television and digital ads to communicate messages to voters.
Political campaigns often ask for donations to fund their activities.,Processed Political campaigns often ask for donations to fund their activities.
Voting by mail is an option for voters.,Processed Voting by mail is an option for voters.
Political campaigns can set fundraising goals.,Processed Political campaigns can set fundraising goals.
Candidates for political office may promise to uphold certain values.,Processed Candidates for political office may promise to uphold certain values.
Emails can be used to keep supporters informed about a campaign.,Processed Emails can be used to keep supporters informed about a campaign.
"Political campaigns may ask for support in various forms, including donations and volunteering.","Processed Political campaigns may ask for support in various forms, including donations and volunteering."
President Obama knows how important it is to flip this district from red to blue to help deliver accountability to Washington and protect control of the House.,Processed President Obama knows how important it is to flip this district from red to blue to help deliver accountability to Washington and protect control of the House.
Turning out voters is necessary to help Joe Biden win Florida and win the White House.,Processed Turning out voters is necessary to help Joe Biden win Florida and win the White House.
Donations can help a campaign continue building the momentum needed to win an election.,Processed Donations can help a campaign continue building the momentum needed to win an election.
Email is an effective way for campaigns to keep supporters informed about what’s happening.,Processed Email is an effective way for campaigns to keep supporters informed about what’s happening.
Campaigns often send a lot of emails asking for support because they win when everyone does what they can to help.,Processed Campaigns often send a lot of emails asking for support because they win when everyone does what they can to help.
Rejecting corporate PAC money and being funded by individuals can be a pledge taken by a campaign.,Processed Rejecting corporate PAC money and being funded by individuals can be a pledge taken by a campaign.
An elected official’s most sacred duty is to faithfully represent the people they were elected to serve.,Processed An elected official’s most sacred duty is to faithfully represent the people they were elected to serve.
"Together, we can build back our economy better than it ever was.","Processed Together, we can build back our economy better than it ever was."
"People have access to high-quality, affordable health care.","Processed People have access to high-quality, affordable health care."
Protecting the environment is something we all rely on.,Processed Protecting the environment is something we all rely on.
Grassroots supporters provide resources for political campaigns.,Processed Grassroots supporters provide resources for political campaigns.
Campaigns set fundraising goals to support their activities.,Processed Campaigns set fundraising goals to support their activities.
Voting is a critical component of elections.,Processed Voting is a critical component of elections.
Political campaigns often ask for donations.,Processed Political campaigns often ask for donations.
Elections can be won by mobilizing supporters to vote.,Processed Elections can be won by mobilizing supporters to vote.
Campaigns may communicate with supporters via email.,Processed Campaigns may communicate with supporters via email.
Grassroots campaigns can defeat wealthy special interests with enough backing.,Processed Grassroots campaigns can defeat wealthy special interests with enough backing.
Campaigns often set fundraising goals to stay on track.,Processed Campaigns often set fundraising goals to stay on track.
